anime_ID,Title,Japanese,English,Synopsis,Type,Episodes,Status,Start_Aired,End_Aired,Producers,Licensors,Studios,Source,Genres,Themes,Demographics,Duration_Minutes,Rating,Score,Scored_Users,Ranked,Popularity,Members,Favorites
15021,Yuki no Taiyou Pilot,ユキの太陽,Unknown,"This pilot is remembered, really, for one notable reason: this is Miyazaki's first time as a solo director. He teamed up with Takahata for the later episodes of the 1971-72 Lupin III series, but Yuki's Sun marked his first time solely in the captain's seat.

Yuki's Sun was based upon a popular shoujo manga (girls' comic) by Tetsuya Chiba which was serialized in 1963. It involves a 10-year-old orphan girl who is adopted into a family. The storyline is somewhat complex, and seems to play out like grand melodrama. Chiba's stories were more sophisticated and grown-up than, say, Osamu Tezuka, who of course was the godfather of postwar Japanese manga.

(Source: TheGhibliBlog)",Special,1.0,Finished Airing,1972-01-01,,Unknown,Unknown,"Tokyo Movie Shinsha, Tokyo Movie",Manga,Drama,Unknown,young girl,4.0,PG - Children,5.361,1532.0,115722.0,9050,2918,0
34528,Mukashi Mukashi Momotarou,むかしむかしももたろう,Unknown,A stop-motion film about the classic Japanese tale of Momotarou.,Movie,1.0,Finished Airing,1972-01-01,,Gakken,Unknown,Unknown,Other,Fantasy,"Historical, Mythology",Unknown,17.0,G - All Ages,,,136512.0,17294,214,0
30328,Head Spoon,ヘッド・スプーン,Unknown,Furukawa Taku film.,Movie,1.0,Finished Airing,1972-01-01,,Takun Manga Box,Unknown,Unknown,Original,Avant Garde,Unknown,Unknown,5.0,R+ - Mild Nudity,4.491,232.0,129072.0,14228,461,0
42585,Black Cat,Black Cat,Unknown,A short film by Keiichi Tanaami featuring the song Fushiawase to Iu Na no Neko by Maki Asakawa.,Movie,1.0,Finished Airing,1972-01-01,,Unknown,Unknown,Unknown,Original,Avant Garde,Music,Unknown,2.0,R - 17+ (violence & profanity),,,171072.0,16341,274,1
7025,Kiseichuu no Ichiya,寄生虫の一夜,Unknown,Short experimental animation from 1972 by Yoji Kuri.,Movie,1.0,Finished Airing,1972-01-01,,Unknown,Unknown,Unknown,Original,"Avant Garde, Horror",Unknown,Unknown,9.0,R - 17+ (violence & profanity),5.041,1332.0,123172.0,9498,2460,9
34458,Ousama to Nightingale,王様とナイチンゲール,Unknown,A stop-motion adaptation of Hans Christian Anderson's The Nightingale.,Movie,1.0,Finished Airing,1972-01-01,,Gakken,Unknown,Unknown,Book,Fantasy,Unknown,Kids,22.0,G - All Ages,,,141622.0,17731,188,0
16746,Goesu Daejeonjaeng,괴수대전쟁,Unknown,An animated Korean movie about a monster invasion.,Movie,1.0,Finished Airing,1972-01-01,,Unknown,Unknown,Unknown,Unknown,"Action, Supernatural",Unknown,young boy,66.0,None,,,180792.0,17382,209,0
7171,Oni,鬼,Unknown,"One morning, two brothers living in a hut with their mother set out for the mountains to set traps for deer. They move silently through the forest undergrowth until suddenly a demon's arm reaches out from the treetops and grabs the younger brother. The older brother aims carefully, calms the shaking of his hands and lets an arrow fly, thus saving his brother's life. The demon's arm is left behind and somehow it looks familiar. After returning home a horrible truth is revealed.... Drawing on an early medieval Japanese legend, the film is reminiscent of the horror psychodrama Kwaidan. The Demon (1972) took awards at many animation festivals. 

(Source: kviff.com)",Movie,1.0,Finished Airing,1972-01-01,,Unknown,Unknown,Unknown,Other,Supernatural,"Historical, Mythology",Unknown,7.0,PG-13 - Teens 13 or older,6.031,909.0,89322.0,10356,1828,3
43375,Fang Xue Yi Hou,放学以后,Unknown,Unknown,Movie,1.0,Finished Airing,1972-01-01,,Unknown,Unknown,Shanghai Animation Film Studio,Unknown,Unknown,Unknown,Kids,10.0,G - All Ages,,,178312.0,19984,52,0
29814,Ikiteirutte Subarashii!,生きているってすばらしい!,Unknown,A Toei film directed by Yabuki Kimio.,Movie,1.0,Finished Airing,1972-01-01,,Unknown,Unknown,Toei Animation,Original,Unknown,Unknown,Kids,20.0,G - All Ages,,,186512.0,16494,264,0
2574,Kashi no Ki Mokku,樫の木モック,Unknown,"This version of Pinocchio tells a story of an extremely gullible, naive and morally confused wooden doll brought to life by a mystical blue fairy. Pinocchio (Mokku) is characterized as having many character faults which he must learn to overcome in order to be worthy of being granted humanity. Some of these character faults include selfishness, rudeness, insensitivity, indolence, obstinacy, over- trusting, self-pity, stupidity, disobedience, compulsive lying, arrogance, greed, cowardice, recklessness, cruelty, foolishness and an inability to learn from mistakes.

Throughout the entire series Pinocchio (Mokku), partly due to his own delinquency and repetitive disobedience, must undergo other costly ordeals of hardship and pain in which he is continuously tormented, persecuted, bullied, humiliated, tricked, ridiculed, ostracised, beaten, downtrodden and subjected to degrading and inhumane treatment. Its plain depiction of the austere reality of what it would be like to be literally subhuman growing up in a world of danger and hardship, makes this another good example of traditional Japanese stories, which teach moral observance through tough endurance.

(Source: Wikipedia)",TV,52.0,Finished Airing,1972-01-04,1972-12-01,Unknown,Saban Entertainment,Tatsunoko Production,Unknown,"Adventure, Fantasy",Unknown,Unknown,24.0,G - All Ages,5.981,770.0,91772.0,10358,1826,4
8235,Muumin (1972),ムーミン,Unknown,A remake of the 1969-70 Moomin series.  This version is more closely based on the books by the Finnish illustrator and writer Tove Jansson.,TV,52.0,Finished Airing,1972-01-09,1972-12-31,Unknown,Unknown,Mushi Production,Book,"Adventure, Comedy, Fantasy, Slice of Life",Unknown,Unknown,25.0,G - All Ages,6.481,780.0,64712.0,9560,2424,7
4332,Seigi wo Aisuru Mono Gekkou Kamen,正義を愛する者、月光仮面,Unknown,"Moonlight Mask's identity has always been a mystery (which is why the Moonlight Mask persona is credited as being played by ""?"" in the original series).

Decked out in white tights, white & red cape, white scarf, yellow gloves & boots, dark glasses, face cloth and Indian-style turban (pinned with a ""moon"" ornament), Moonlight Mask is armed with a whip, two six-shooters, shuriken and moon-shaped boomerangs. He also rides a motorcycle.

However, only audiences know that Moonlight Mask could very well be detective Juurou Iwai who seems to disappear from his friends before the caped crusader rides to the rescue in his motorcycle! Even his comical assistant Gorohachi Fukuro, his friend Inspector Matsuda, and children Shigeru, Kaboko and Fujiko are oblivious to Iwai's secret identity.

(Source: Wikipedia)",TV,39.0,Finished Airing,1972-01-10,1972-10-02,Unknown,Unknown,Knack Productions,Unknown,"Action, Mystery",Unknown,Unknown,25.0,PG-13 - Teens 13 or older,6.621,244.0,57202.0,12228,902,4
52161,La Golondrina,ラ・ゴロンドリーナ,Unknown,A music video for the song La Golondrina by Bonny Jacks. Aired as part of NHK's Minna no Uta program from February to March 1972.,Music,1.0,Finished Airing,1972-02-01,,NHK,Unknown,Unknown,Original,Unknown,Music,Kids,2.0,G - All Ages,,,194732.0,20193,48,0
36809,Tanjoubi no Chachacha,誕生日のチャチャチャ,Unknown,"Japanese school children merrily sing about Happy Birthday songs, not ""the"" Happy Birthday song, but songs the children created specifically for the birthday person.",Music,1.0,Finished Airing,1972-02-01,,NHK,Unknown,Unknown,Original,Unknown,Music,Kids,2.0,G - All Ages,,,154322.0,18122,166,0
36400,Koinu no Blue,小犬のプルー,Unknown,A man plays with his puppy through the different seasons but the dog passes away. The man feels blue that he lost his best friend but doesn't regret the time he spent with it.,Music,1.0,Finished Airing,1972-02-04,,NHK,Unknown,Unknown,Original,Unknown,"Music, Pets",Kids,2.0,G - All Ages,,,192882.0,17673,193,0
49194,Yamakagashi,やまかがし,Unknown,"This work, the title of which refers to a species of venomous snake, focuses on interactions between troops and sex workers near Naval Air Facility Atsugi (Kanagawa Prefecture), animated from a child’s perspective. Aihara’s works of this period often incorporate a documentary viewpoint of Japanese society at the time of his childhood.

(Source: Collaborative Cataloging Japan)",Movie,1.0,Finished Airing,1972-03-01,,Unknown,Unknown,Unknown,Original,Avant Garde,Unknown,Unknown,5.0,R+ - Mild Nudity,,,163122.0,18956,111,0
5006,Nagagutsu Sanjuushi,ながぐつ三銃士,Return of Pero,"Once upon a time, near the ruins of an old castle, there lived the King of Cats. He was famous for his violent temper and now he is lashing out at his three gunmen, who had been ordered to bring back Pero, but had returned empty-handed. Pero, a former subject of the angry King, had lived in Cat Country once but he had dared to save a mouse from death. Now, as everyone knows, the mouse is the mortal enemy of all cats, so the King orders his three gunmen to go to the ends of the earth, if necessary, to find Pero. Pero is a happy-go-lucky sort of feline and very hip for a cat. 

Fleeing from the wrath of the King, he decides to seek his fortune in the wild and wooly west. On the way, he encounters the King’s gunmen hot on his trail but he foils them and blithely goes on his way. On the stagecoach to Go Go Town, he meets Annie, a pretty girl who is returning after finishing her education in the East, and Jimmy, a boy with sleepy eyes and slow movements. 

They are attacked suddenly by holdups who are after the new sheriff but since he does not seem to be on the coach, they ride off. Sad news awaits Annie in town. Her father had been killed by the Big Bad Boss for finding out about the bogus money he was making to get rich fast. The Big Bad Boss also kills each new sheriff who arrives to keep law and order in town. He is determined to keep the whole place under his thumb. The Big Bad Boss tries to scare Annie into leaving town but she is her father’s daughter and cannot be frightened away by threats. With the help of Pero and Jimmy, she opens a restaurant in the building her father owned. Once again, Pero happens to save a little Indian mouse caught in a trap. 

The little mouse’s father, the Chieftain of the Indian mice, promises to help Pero and Annie. The sleepy-eyed Jimmy is really the new sheriff. They all join forces and expose the Big Boss’ villainy and his secret bogus money factory. The Big Bad Boss gets his comeuppance and all ends well.

(Source: Toei Animation)",Movie,1.0,Finished Airing,1972-03-18,,Unknown,Unknown,Toei Animation,Original,"Adventure, Fantasy",Unknown,Kids,52.0,G - All Ages,6.071,608.0,86842.0,11338,1249,1
2718,Umi no Triton,海のトリトン,Triton of the Sea,"5000 years ago, the Triton Family was living peacefully in Atlantis until the Poseidon Family destroyed them all. Triton, of the Triton Family line, embarks on an adventurous life in the sea fighting the Poseidon Family.

(Source: AnimeNfo)",TV,27.0,Finished Airing,1972-04-01,1972-09-30,Unknown,Unknown,Animation Staff Room,Manga,"Adventure, Fantasy",Unknown,young boy,23.0,PG-13 - Teens 13 or older,6.371,631.0,71132.0,10204,1929,5
3845,Mahoutsukai Chappy,魔法使いチャッピー,Unknown,"Chappy's story is much like Mahou Tsukai Sally (Little Witch Sally). Chappy becoming sick of the old customs of her people, left the Land of Magic for the human world. Soon her family sees how much she has in the other realm that they decided to join her new home. Chappy is known for being the first witch to use a wand. Her special chant is ""Abura Mahariku Maharita Kabura. 

Mahou Tsukai Chappy is the fifth magical girl anime in history. 

(Source: Wikipedia)",TV,39.0,Finished Airing,1972-04-03,1972-12-25,Unknown,Unknown,Toei Animation,Unknown,Adventure,Mahou Shoujo,Kids,25.0,G - All Ages,6.261,202.0,76792.0,12702,767,2
11275,Akadou Suzunosuke,赤胴鈴之助,Unknown,"A young swordsman finds himself involved in a plot to overthrow the shogunate.

(Source: AniDB)",TV,52.0,Finished Airing,1972-04-05,1973-03-28,Tokyo Movie Shinsha,Unknown,Unknown,Unknown,Adventure,Historical,Unknown,24.0,PG-13 - Teens 13 or older,6.051,155.0,87962.0,12717,761,0
20237,Anime Document: München e no Michi,アニメドキュメント ミュンヘンへの道,Unknown,"A short series based on volleyball at the Munich Olympics. The series features a mix of live action blended with animation.

(Source: AniDB)",TV,16.0,Finished Airing,1972-04-23,1972-08-20,"TBS, Nippon Television Network",Unknown,Unknown,Unknown,Sports,Unknown,Unknown,25.0,G - All Ages,,,168222.0,14315,448,1
2252,Devilman,デビルマン,Unknown,"Devilman features Akira Fudo, a shy and timid teenager who has gone mountain climbing in the Himalayas with his father. While in the middle of the expedition, both father and son are killed in a tragic accident. Akira's body is found and possessed by the demon soldier Devilman, who uses his new human form as a disguise in order to fulfill his mission of causing chaos on Earth in order to pave the way for a demonic invasion of the planet.

Before his mission can begin in earnest, Devilman meets Akira's childhood friend Miki Makimura and quickly falls in love with her. Devilman resolves to protect Miki and humanity as a whole by battling against his fellow demons. Demon Tribe leader Zennon becomes greatly angered at Devilman's betrayal and is quick to send Devilman's former comrades to destroy him. The other demons soon learn that Miki is precious to Devilman and he must now work to protect her, as well as protect himself. Will the power of love be able to overcome that of true evil?",TV,39.0,Finished Airing,1972-07-08,1973-04-07,Dynamic Planning,Discotek Media,Toei Animation,Manga,"Action, Horror, Supernatural",Mythology,Unknown,25.0,R - 17+ (violence & profanity),6.481,6750.0,65122.0,3663,28487,96
11269,Maken Liner 0011 Henshin Seyo!,魔犬ライナー００１１変身せよ,Unknown,"A medium long anime movie (50 minutes) released as one of the programs of 'Toei Manga Festival', and screened with a live-action film ""Kamen Rider vs. Ambassador Hell"" and others. 

A near-future Sci-Fi mecha action film featuring four cyborg dogs. An original story based on the concept from Hiroshi Sasagawa's manga ""Maken Goro"" (serialized in the magazine ""Weekly Shonen King"" in 1963).

A boy named Tsutomu and four cyborg dogs (Queen, Ace, Jack and Joker who coalesce and transform into the spaceship ""Liner"") fight against aggression by insect-type aliens from the Planet Devil.

Directed by Takeshi Tamiya. Music by Takeo Yamashita.

(Source: AsianDVDClub)",Movie,1.0,Finished Airing,1972-07-16,,Unknown,Unknown,Toei Animation,Unknown,"Action, Sci-Fi",Mecha,Unknown,50.0,PG - Children,5.301,279.0,117292.0,12736,757,1
39876,Mori no Kuma-san,森の熊さん,Unknown,"The Japanese version of the traditional American camp song The Other Day I Met a Bear, composed in 1919 by Carey Morgan and Lee David. The video was animated by Yoji Kuri, accompanied by Japanese male chorus group Dark Ducks.",Music,1.0,Finished Airing,1972-07-30,,NHK,Unknown,Unknown,Music,Unknown,Music,Kids,2.0,G - All Ages,,,135952.0,17828,182,0
22893,Mon Cheri CoCo,モンシェリCOCO,My Dear Coco,"A young woman aims to become a famous fashion designer.

(Source: AniDB)",TV,13.0,Finished Airing,1972-08-27,1972-11-26,TBS,Unknown,Unknown,Manga,Romance,Unknown,young girl,25.0,G - All Ages,,,135782.0,11964,983,2
2389,Kagaku Ninja-tai Gatchaman,科学忍者隊ガッチャマン,Gatchaman,"Due to dangers of decreasing resources and growing pollution, the International Scientific Organization (ISO) is established to improve environmental conditions throughout the world. But an international criminal group, Gallactor, tries to achieve world domination by taking control of the ISO. Gallactor was created by a mysterious being from outer space known as Generalissimo X, who gives orders through its chief commander on Earth, the masked Berg Katse. To fight Gallactor and its robot monsters, the ISO's Dr. Nambu enlists five brave youths into a combat squad called Gatchaman,the Science Commandos. Special scientific powers and dramatic birdlike costumes make the Gatchaman Squad a match for Gallactor, wherever on Earth it may strike. Ken (the Eagle) is the wise leader, assisted by sometimes-foolhardy Joe (the Condor), pretty Jun (the Swan), eager little Jinpei (the Swallow), and strong Ryu (the Horned Owl). Each has individual scientific weapons, but their main power lies in their aircraft, the Phoenix, which can transform itself into a fiery arrow capable of piercing the most massive threats. GATCHAMAN is a series of dynamic action and tension as Ken, Joe, Jun, Jinpei, and Ryu hold themselves in constant readiness to meet each new threat by Gallactor to conquer the world.

(Source: Official Site)

About Battle of the Planets (U.S.)",TV,105.0,Finished Airing,1972-10-01,1974-09-29,Unknown,"ADV Films, Sentai Filmworks",Tatsunoko Production,Original,"Action, Adventure, Sci-Fi",Unknown,young boy,26.0,PG-13 - Teens 13 or older,6.931,3302.0,41912.0,5854,9427,56
5311,Astroganger,アストロガンガー,Unknown,"An alien woman named Maya crash-lands on Earth. Her homeworld was destroyed by the Blasters, a cruel alien race who steals the natural resources from other planets. She falls in love with a scientist and gives birth to a human boy named Kentaro. When the Blasters invade the Earth, Kentaro must defeat them by fighting with Astroganger, a robot made from living metal.

(Source: Wikipedia)",TV,26.0,Finished Airing,1972-10-04,1973-03-28,Knack Productions,Discotek Media,Toei Animation,Unknown,"Action, Sci-Fi",Mecha,Unknown,24.0,G - All Ages,6.251,506.0,77392.0,10982,1426,4
23015,Hazedon,ハゼドン,Chief Joker,"The series focused on a goby fish: Hazedon, who was the offspring of a mermaid and a blowfish. His goal was to travel the world on an adventure with his best friend, Puyang. 

(Source: GoBoiano)",TV,26.0,Finished Airing,1972-10-05,1973-03-29,Fuji TV,Unknown,Sunrise,Unknown,"Adventure, Comedy",Unknown,Kids,25.0,PG - Children,,,182952.0,16235,283,0
19087,Kaiketsu Tamagon,かいけつタマゴン,Unknown,"Tamagon is a cute monster who is fond of eggs. He acts as a counselor to those in trouble, asking only eggs in payment. He goes to work as soon as he has eaten his fee. However, despite his schemes, his service usually ends in total failure and he winds up being chased by his irate clients. Short as it is, this program is full of laughs and lively humour. 

(Source: AniDB)",TV,195.0,Finished Airing,1972-10-05,1973-09-28,Unknown,Saban Entertainment,Tatsunoko Production,Unknown,"Adventure, Comedy",Unknown,Kids,5.0,PG - Children,,,189302.0,14927,383,0
37070,Hoshi to Niji to,星と虹と,Unknown,Stars twinkling in the sky and a bright rainbow crossing the sky. There's no need for tears with a world so beautiful. The music video invokes these thoughts through stop-motion paper cut-outs with a shadow puppet flair.,Music,1.0,Finished Airing,1972-10-05,,NHK,Unknown,Unknown,Original,Unknown,Music,Kids,2.0,G - All Ages,,,184982.0,18215,161,0
5618,Dokonjou Gaeru,ど根性ガエル,Unknown,"When Hiroshi was fighting against his rival Gorillaimo, he stumbled over a stone and fell on to a frog. To be surprised, the frog was still alive and it named itself Pyonkichi.

(Source: AniDB)",TV,103.0,Finished Airing,1972-10-07,1974-09-28,Asahi Broadcasting,Unknown,Tokyo Movie Shinsha,Manga,"Comedy, Slice of Life",Unknown,young boy,25.0,G - All Ages,6.391,348.0,70182.0,10786,1545,5
8685,Ryuuichi Manga Gekijou Onbu Obake,おんぶおばけ,Unknown,"The mischievous antics of a ghost in an ancient village.

(Source: AniDB)",TV,52.0,Finished Airing,1972-10-07,1973-09-29,YTV,Unknown,Eiken,Original,Supernatural,Unknown,Unknown,25.0,G - All Ages,,,146182.0,14916,384,1
2253,Mazinger Z,マジンガーＺ,Mazinger Z,"The villainous Dr. Hell has amassed an army of mechanical beasts in his secret hideaway, the island of Bardos located in the Aegean Sea. He is capable of controlling mechanized beasts with his cane, and instructs them to unleash devastating attacks. However, Dr. Hell doesn't do all the dirty work by himself; he has his loyal henchman Baron Ashura to carry out his devilish plans.

There are also those that will see to it that evil does not prevail. Kouji Kabuto is the young and feisty teenager with a score to settle: his goal is avenging the murder of his grandfather by Dr. Hell. And he might just be able to pull it off, as he is the pilot of Mazinger Z, a mighty giant robot made out of an indestructible metal known as Super-Alloy Z.

Mazinger Z boasts several powerful special attacks. By channeling Photonic Energy through its eyes, and unleashing the Koushiryoku Beam, it can cause great destruction. But things get really cool when Mazinger Z launches its Rocket Punch attack. Dr. Hell and his minions might have just found their match!",TV,92.0,Finished Airing,1972-12-03,1974-09-01,Dynamic Planning,Discotek Media,Toei Animation,Manga,"Action, Drama, Sci-Fi",Mecha,young boy,25.0,PG-13 - Teens 13 or older,7.261,6168.0,26442.0,4736,16020,119
2611,Panda Kopanda,パンダ・コパンダ,Panda! Go Panda!,"Panda Kopanda (Panda! Go Panda!) is a 30 minute movie made in 1972. Miyazaki created the original idea, the script, the layouts, and did key animation, and Takahata directed the film. The story is about a little girl, Mimiko, who was left alone while her Grandma was away. A 1973 sequel, Panda Kopanda: Amefuri Saakasu no Maki (Panda! Go Panda! & the Rainy-day Circus), continues the story and was made by the same people who made the first movie. The literal translation of the title Panda Kopanda is ""Panda, Baby Panda"", but it`s been released in North America as Panda Go Panda.

(Source: AniDB)",Movie,2.0,Finished Airing,1972-12-17,1973-03-17,Unknown,"Discotek Media, GKIDS, Geneon Entertainment USA",Tokyo Movie Shinsha,Original,Comedy,Unknown,Kids,36.0,G - All Ages,6.741,5006.0,50802.0,5750,9799,24
39453,Tonbo ni Natta Yat-chan,トンボになったヤッちゃん,Unknown,"A traffic safety film for elementary schoolers. Yat-chan was a young boy who knew traffic rules but proceeded to not follow them because he thought playing in the street was more important. He gets into an accident and passes away. Miko is his childhood friend and classmate and is devastated at the loss. The film ends with her aggressively crying as the sun sets and a dragonfly passes by.

In a non-traditional manner of traffic safety films, the short film aims at an emotional tactic rather than teaching safety rules. As a way to guilt children into following traffic rules they already know because their death would rip apart those who love them. ",Movie,1.0,Finished Airing,1973-01-01,,Unknown,Unknown,Unknown,Original,Unknown,Unknown,Kids,15.0,G - All Ages,,,156492.0,19114,102,0
7258,Tabi,旅,Unknown,"Surreal cutout (kiri-gami) animation following a young girl's physical journey, which is also an inner voyage through which she will learn all the pain and joy of life. She travels to an anonymous Western city, a bizarre dreamscape cluttered with elements from works by Dali, Magritte, de Chirico and Escher. The journey will change her completely but when she returns she will be the only one who knows how she has changed.
(The poem in the film is by Su Tong-Po, a famous Chinese poet) 

-AniDB",Movie,1.0,Finished Airing,1973-01-01,,Unknown,Unknown,Unknown,Original,Fantasy,Psychological,Unknown,12.0,PG-13 - Teens 13 or older,5.331,537.0,116732.0,11458,1189,1
43378,Xiao Hao Shou,小号手,Unknown,Unknown,Movie,1.0,Finished Airing,1973-01-01,,Unknown,Unknown,Shanghai Animation Film Studio,Unknown,Unknown,Unknown,Kids,37.0,G - All Ages,,,160922.0,20243,47,0
34592,Fushigi Naido,ふしぎないど,Unknown,A stop-motion animation about sisters doing chores. One of them falls into a well and gets transported to a wonderland trying to retrieve a pail. There she helps the various creatures in wonderland and receives rewards. Upon returning home the other sister is jealous and tries the same but is rude and helps no one out of her selfishness.,Movie,1.0,Finished Airing,1973-01-01,,Gakken,Unknown,Unknown,Book,Fantasy,Historical,Kids,18.0,G - All Ages,,,179222.0,17671,193,0
43377,Bu Cha Ban Fen Hao,不差半分毫,Unknown,Unknown,Movie,1.0,Finished Airing,1973-01-01,,Unknown,Unknown,Unknown,Unknown,Unknown,Unknown,Kids,20.0,G - All Ages,,,171792.0,20273,46,0
29799,Tabi wa Michizure Yo wa Nasake,旅は道連れ世は情,Unknown,A short film by Okamoto Tadanari.,Movie,1.0,Finished Airing,1973-01-01,,Unknown,Unknown,Unknown,Original,Unknown,Unknown,Kids,2.0,G - All Ages,5.241,112.0,119052.0,16165,287,0
39451,Two-chan to Issho ni Miyou,ツーちゃんといっしょに見よう,Unknown,"A Zen-chan Two-chan OVA created in 1973 which contains 5 short stories as well as some live-action components. What makes this OVA unique is that the focus is Two-chan. Zen-chan does not make an appearance at all though there is a boy which a design similar to him in the final story.

The short OVA was re-shown at ""Planet Studyo +1"" in 2006. It is a theater dedicated to showing extremely old and obscure films from all across the globe and often has has themed weekend events. It is open to the general public and Two-chan to Issho ni Miyou was featured during the traffic safety event.",Movie,1.0,Finished Airing,1973-01-01,,Unknown,Unknown,Unknown,Original,Unknown,Unknown,Kids,15.0,G - All Ages,,,157602.0,19207,95,0
