anime_ID,Title,Japanese,English,Synopsis,Type,Episodes,Status,Start_Aired,End_Aired,Producers,Licensors,Studios,Source,Genres,Themes,Demographics,Duration_Minutes,Rating,Score,Scored_Users,Ranked,Popularity,Members,Favorites
3092,Junjou Romantica,純情ロマンチカ,Junjo Romantica,"High school student Misaki Takahashi returns home to see his older brother being fondled by an unknown man. Bewildered by such a sight, Misaki finds out that the stranger is actually Akihiko Usami, a popular novelist and his brother's best friend. With the two of them slowly becoming acquainted, Akihiko ends up as Misaki's private tutor. However, after stumbling upon the author's latest boys-love novel, Misaki becomes uncertain whether or not to trust Akihiko regarding his friendship with the student's brother.

Elsewhere, Hiroki Kamijou, a university teacher of classical literature and Akihiko's friend, is grieving a failed romance. While on the edge of a mental breakdown, he meets student Nowaki Kusama, who wants his help for an upcoming exam. Despite denying Nowaki's request numerous times, Hiroki eventually lends him a hand. As the two get closer, more revelations about the student are made.

Furthermore, when wealthy teenager Shinobu Takatsuki finds out that his older sister has divorced Hiroki's coworker You Miyagi, he immediately wants to date the same man—as he saved Shinobu from a robbery three years prior. Even so, You does not feel the same way and attempts to scare him off. However, the educator soon realizes that Shinobu will do anything for their destined romance.

Junjou Romantica collects three love stories, narrating every couple's romance.

[Written by MAL Rewrite]",TV,12.0,Finished Airing,2008-04-11,2008-06-27,"Frontier Works, Kadokawa Shoten, Memory-Tech, Romantica club !!",Nozomi Entertainment,Studio Deen,Manga,"Boys Love, Comedy, Drama, Romance",Unknown,Unknown,24.0,PG-13 - Teens 13 or older,7.521,138267.0,16142.0,852,240286,4353
4021,Seiyou Kottou Yougashiten: Antique,西洋骨董洋菓子店 ~アンティーク~,Antique Bakery,"A high school crush, a world-class pastry chef, a former middle-weight boxing champion... and a whole lot of cake!
Ono has come a long way since the agonizing day in high school when he confessed his love to handsome Tachibana. Now, some 14 years later Ono, a world-class pastry chef and gay playboy has it all. No man can resist Ono's charms (or his cooking skills!) but he has just found a new position under a man named Tachibana. Can this be the only man who resisted his charms, and if so, will the man who once snubbed the ""magically gay"" Ono get his just deserts? And how in the heck did a former middleweight boxing champion wind up as Ono's cake boy? 

(Source: DMP)",TV,12.0,Finished Airing,2008-07-04,2008-09-19,"Dentsu, Fuji TV, Asmik Ace, Sony Music Entertainment, Shinshokan",Nozomi Entertainment,"Nippon Animation, SynergySP, Shirogumi",Manga,"Boys Love, Comedy, Gourmet",Unknown,young girl,22.0,PG-13 - Teens 13 or older,7.021,14893.0,38212.0,3249,36053,102
4866,Pico x CoCo x Chico,ぴこ×CoCo×ちこ,Unknown,"The young couple Pico and Chico are out for a date in town when a chance encounter has them immediately seduced by the mysterious runaway named CoCo. Pico is instantly drawn in by CoCo's spiritual outlook and feminine charms, but little does he know that the swaying of his heart will fuel the sparks of jealousy, passion, and desperation between the trio, ready to engulf them in an inferno of arousal and anxiety at any moment. 

Two may be company, but is three really a crowd?

[Written by MAL Rewrite]",OVA,1.0,Finished Airing,2008-10-09,,Natural High,Unknown,"Sugar Boy, Blue Cat",Original,"Boys Love, Hentai",Unknown,Unknown,35.0,Rx - Hentai,4.331,41518.0,,2367,64156,316
4814,Junjou Romantica 2,純情ロマンチカ2(に),Junjo Romantica 2,The second part of Junjou Romantica continuing the story.,TV,12.0,Finished Airing,2008-10-12,2008-12-28,"Frontier Works, Kadokawa Shoten, Memory-Tech, Romantica club !!",Nozomi Entertainment,Studio Deen,Manga,"Boys Love, Comedy, Drama, Romance",Unknown,Unknown,24.0,PG-13 - Teens 13 or older,7.731,102514.0,10242.0,1186,171075,959
15291,Hyakujitsu no Bara: Jinginaki Nikukyuu-hen,百日の薔薇 仁義なき肉球編,Maiden Rose Specials,Specials included in the OVA of Hyakujitsu no Bara.,Special,2.0,Finished Airing,2009-05-29,2009-10-23,Unknown,Unknown,PrimeTime,Manga,"Boys Love, Erotica",Parody,Unknown,5.0,R+ - Mild Nudity,6.651,3873.0,,6277,7907,13
5902,Hyakujitsu no Bara,百日の薔薇,Maiden Rose,"Two soldiers from warring countries are bound by a pledge as master and servant. Taki Reizen is a Commander of sublime beauty, shouldering the fate of his nation. Called ""Mad Dog"" because of his rough temperament, Klaus has sworn his loyalty to him as a knight. Despite this, those around them are cold and disapproving, full of various misgivings. For all their genuine feelings, what will come of love made cruel by the violence of war? 
",OVA,2.0,Finished Airing,2009-05-29,2009-10-23,On-Lead,Unknown,PrimeTime,Manga,"Boys Love, Drama, Erotica",Unknown,Unknown,24.0,R+ - Mild Nudity,6.511,17815.0,,3423,32418,82
5774,Seitokaichou ni Chuukoku,生徒会長に忠告,"Hey, Class President!","Even as he tries to keep the student council president out of trouble, Vice President Chiga-kun finds himself being drawn to the president's strength and power. Chiga-kun wonders how he, being such an intelligent individual, can be so unwillingly taken with a boy who is so country and simple...

(Source: Aarinfantasy)",OVA,2.0,Finished Airing,2009-11-27,2010-04-18,On-Lead,Unknown,PrimeTime,Manga,"Boys Love, Comedy, Drama, Romance, Erotica",School,Unknown,30.0,R+ - Mild Nudity,6.941,25000.0,,2820,46489,108
5719,Sex Pistols,セックス・ピストルズ,Unknown,"An average boy named Norio is suddenly getting a lot of unwanted romantic attention. A fall down the stairs into the arms of a handsome stranger sets off the beginnings of an explanation, and it is one Norio never could have possibly imagined. Soon a whole new world opens up for Norio revealing a secret society of special people evolved from animals other than monkeys. Norio turns out to be a particularly rare breed and his DNA is in high demand. Now that he's suddenly the prey, it'll take much effort to survive in this modern jungle. 

This story revolves around a high school boy who discovers that he is part of a select group of humans who did not evolve from monkeys, but various animals such as leopards and black bears. 

(Source: ANN) ",OVA,2.0,Finished Airing,2010-03-26,2011-04-27,Frontier Works,Unknown,Twilight Town,Manga,"Boys Love, Comedy, Drama, Supernatural, Erotica",Unknown,Unknown,33.0,PG-13 - Teens 13 or older,6.541,15454.0,,3628,29053,81
8339,Kachou no Koi,課長の恋,Unknown,The story centers on a manager named Odakara Kazuhiko who has spent all 33 years of his life without a girlfriend. An encounter with a new employee named Harada makes Odakara realize that he is gay.,OVA,1.0,Finished Airing,2010-03-26,,DAX Production,Unknown,Panda Factory,Manga,"Boys Love, Comedy, Erotica",Unknown,Unknown,30.0,R+ - Mild Nudity,6.101,6180.0,,5137,13038,16
7058,Uragiri wa Boku no Namae wo Shitteiru,裏切りは僕の名前を知っている,The Betrayal Knows My Name,"Growing up as an orphan, Yuki Sakurai questions his reason for living and ability to see a person's painful memory by simply touching them. After receiving anonymous notes telling him to die, Yuki is unable to shake off the nagging feeling forming inside of him. Unbeknownst to him, he is being watched, both by people who want to harm him and those who want to protect him.

One foggy night, Yuki's life is saved by a beautiful man with silver eyes and jet black hair—a man he has never met before yet seems familiar. With the arrival of this mysterious stranger, Yuki's forgotten past has been awakened and the purpose of his existence has appeared before him.

Uragiri wa Boku no Namae wo Shitteiru tells the story of a teenage boy as he discovers who he is and where he comes from—all while making friends, experiencing betrayal, and slowly piecing together the puzzle of his past.

[Written by MAL Rewrite]",TV,24.0,Finished Airing,2010-04-12,2010-09-20,Unknown,Funimation,J.C.Staff,Manga,"Adventure, Boys Love, Drama, Fantasy",Reincarnation,young girl,23.0,R - 17+ (violence & profanity),7.221,36535.0,28832.0,1880,94437,948
9232,Yebisu Celebrities 1st,YEBISUセレブリティーズ1st,Unknown,"When Haruka Fujinami starts his job at Yebisu Graphics he takes an immediate dislike to his tyrannical boss, Mr. Daijou. Haruka is given the most menial tasks imaginable and is subjected to Daijou's verbal abuses as well, but oddly enough, he learns that his attraction to his boss grows with each new humiliation. Will Haruka finally stand up to Daijou and assert himself, or will he completely surrender his body and soul to the tall, dark stranger?",OVA,1.0,Finished Airing,2010-05-28,,Movic,Unknown,GARDEN LODGE,Manga,"Boys Love, Erotica",Unknown,Unknown,45.0,PG-13 - Teens 13 or older,5.901,4369.0,,5957,9052,7
8634,Koisuru Boukun,恋する暴君,The Tyrant Falls In Love,"Tetsuhiro Morinaga is in love with his upperclassman Souichi Tatsumi. He even manages to confess his love. Too bad it turns out that Tatsumi is an aggressive, self-centered, and outspoken homophobe.

Yet somehow Tetsuhiro managed to fall in love with Tatsumi, the “walking personality disorder,” who is the kind of man who declares that all gay men should be wiped off the face of the planet. 

An unfortunate accident with an aphrodisiac drug brings the two men physically together against Souichi’s will. The experience has a life-changing effect on both men. But will it ultimately bring them closer, or drive them apart?",OVA,2.0,Finished Airing,2010-06-25,2010-11-27,On-Lead,Unknown,PrimeTime,Manga,"Boys Love, Comedy, Erotica",Unknown,Unknown,29.0,R+ - Mild Nudity,6.961,37426.0,,2340,65395,310
12137,Robotica*Robotics,ロボティカ＊ロボティクス,Unknown,"Haru and Natsu are not human. They do not know what it means to be anything but a robot.

Abandoned by their previous owner, Haru and Natsu are taken in by a scientist named Masa. Haru wants to feel, wants to understand how to act human, and wants to know what it means to love. Natsu is just afraid that they will be abandoned again. With Haru striving for positivity, his companion is left alone to drown in his own negative thoughts. Over and over, they ask the same question: what is love?

[Written by MAL Rewrite]
",OVA,1.0,Finished Airing,2010-08-16,,Unknown,Sentai Filmworks,CoMix Wave Films,Original,"Boys Love, Sci-Fi, Slice of Life",Psychological,Unknown,10.0,PG-13 - Teens 13 or older,6.801,6583.0,48132.0,4954,14248,63
7110,Shounen Maid Kuuro-kun: Tenshi no Uta,少年メイドクーロ君 ~天使の歌~,Unknown,"Having accumulated a massive debt, Curo Kazamiya's father has gone into hiding to evade prosecution. Since his mother passed away several years prior, Curo is forced to sell himself into the service of Miisu Hakuryuuin, a wealthy landowner and businessman.

To the young boy's utmost surprise, his new owner turns out to be a benevolent master who seems to have no intention of punishing him for his father's sins. Instead, he offers Curo the opportunity to become his servant and gradually pay off the debt with his own labor. Curo is quick to agree, considering himself lucky to escape a far worse fate. However, little does he know that Miisu expects him to do tasks beyond the duties of a regular servant.

[Written by MAL Rewrite]
",OVA,1.0,Finished Airing,2010-09-23,,Natural High,Unknown,Zyc,Manga,"Boys Love, Hentai",Unknown,Unknown,33.0,Rx - Hentai,5.461,9568.0,,4287,20062,75
8449,Togainu no Chi,咎狗の血,Togainu no Chi,"In the wake of a third world war which left Japan in ruins, an organization known as Vischio seized control of Tokyo and renamed it Toshima. Taking place in its back alleys are battle games known as Igura, overseen by the Vischio, in which contestants battle and bathe in each other's blood to earn the chance to go up against its tournament's king, Il-re.

Igura is not the only fighting tournament around; Bl@ster is a similar yet vastly different game since it prohibits murder and the use of weapons. The only way to win is by knocking out the opponent. Akira, a young man isolated from his family, is known to be undefeatable at Bl@ster. However, his life on the top is shattered when he is accused of murder. Unable to prove his own innocence, all hope is seemingly lost... that is until a mysterious woman named Emma appears and offers him a chance. Now, to regain his freedom, Akira must participate in Igura and ultimately defeat Il-re.

[Written by MAL Rewrite]",TV,12.0,Finished Airing,2010-10-08,2010-12-23,"Aniplex, Picture Magic, Lantis, Mainichi Broadcasting System, Movic, Nitroplus",Aniplex of America,A-1 Pictures,Visual novel,"Action, Boys Love, Sci-Fi",Survival,Unknown,24.0,R - 17+ (violence & profanity),6.241,35251.0,78242.0,2014,84263,349
8063,Sekaiichi Hatsukoi OVA,世界一初恋 OVA,Unknown,"Two OVA episodes featuring additional stories. 

Episode 0: Ritsu and Takano used to date back in high school, but broke up due to a misunderstanding. This is that story. 

Episode 12.5: Hatori and Chiaki go to visit the latter's family. It's really awkward in many, many ways. ",OVA,2.0,Finished Airing,2011-03-22,2011-09-27,Kadokawa Shoten,Funimation,Studio Deen,Manga,"Boys Love, Comedy, Drama, Romance",Unknown,Unknown,21.0,PG-13 - Teens 13 or older,7.881,35769.0,7442.0,2295,67527,125
9926,Sekaiichi Hatsukoi,世界一初恋 TV,Sekai Ichi Hatsukoi - World's Greatest First Love,"After having to deal with jealousy from his co-workers for working under his father's name, prideful literary editor Ritsu Onodera is determined to establish himself in the industry. To accomplish this, he quits his job at his father's publishing company and transfers to Marukawa Publishing. But instead of being placed in their literary division, Ritsu finds himself working as the rookie manga editor for the Emerald editing department, a team that operates under extremely tight schedules in order to meet deadlines. There, Ritsu is introduced to the infamous editor-in-chief Masamune Takano, a persistent man who strives for results.

As it turns out, Takano is actually Ritsu's high school love, and it is the aftermath of that heartbreak has caused Ritsu's reluctance to fall in love again. Now with the two reunited after several years of separation, the reestablishment of their relationship is marked by Takano's vow to make Ritsu say that he loves him again.

Sekaiichi Hatsukoi follows three couples that are interconnected within the manga industry, with each being subject to the budding of first love. 

[Written by MAL Rewrite]",TV,12.0,Finished Airing,2011-04-09,2011-06-25,"Lantis, Kadokawa Shoten, AT-X, DAX Production, KlockWorx",Funimation,Studio Deen,Manga,"Boys Love, Comedy, Drama, Romance",Unknown,Unknown,23.0,PG-13 - Teens 13 or older,7.671,113411.0,11662.0,985,206101,3011
11123,Sekaiichi Hatsukoi 2,世界一初恋 2,Sekai Ichi Hatsukoi - World's Greatest First Love 2,"First loves are messy. While settling in as a shoujo manga editor at the famous Marukawa Publishing House, Ritsu Onodera is quite troubled. Working under the stern and superb Masamune Takano is hard enough as it is. However, Masamune is not only Ritsu's first love from middle school but he also suddenly declares that he will make Ritsu fall for him again.

Unknown to them, another editor in the department, Yoshiyuki Katori, is in a relationship with the popular manga artist Chiaki Yoshino. The carefree Chiaki fails to notice, however, that his high school friend—Yuu Yanase—thinks of him as more than a friend. The stoic but caring Hatori will not surrender his love so easily.

Falling in love for the first time when you are 30 is certainly troublesome. Shouta Kisa, yet another editor, is going out with 21-year-old Kou Yukina, an art student. Despite Yukina's assurances, Kisa cannot help but doubt whether someone like himself is truly worthy of his younger, ""sparkling"" boyfriend.

[Written by MAL Rewrite]",TV,12.0,Finished Airing,2011-10-08,2011-12-24,"Lantis, Kadokawa Shoten, AT-X, KlockWorx",Funimation,Studio Deen,Manga,"Boys Love, Comedy, Drama, Romance",Unknown,Unknown,24.0,PG-13 - Teens 13 or older,7.861,86176.0,7742.0,1329,148445,709
11355,"Kono Danshi, Uchuujin to Tatakaemasu.",この男子、宇宙人と戦えます。,This Boy Can Fight Aliens,"All hope seems lost when the world is suddenly invaded by aliens. Earth's only defense is a small three-person team known as the Special Counter-Aliens Task Force, consisting of an anonymous director, the tyrannical Shiro, and the easygoing Arikawa.

The luck of the Task Force improves when Arikawa finds a teenage boy lying alone on a hill. The boy, Kakashi, is humanity's only hope—he has power previously unbeknownst capable of defeating the aliens! However, without any memories and with no knowledge on how to use his power, Kakashi is left clinging to Arikawa and Shiro as well as the only remnant of his previous life: his broken cellphone.

Kakashi is conflicted by the fears and emotions clouding his mind and he calls his own motivations into question. Can he overcome his doubts and internal struggles and save the world? 

[Written by MAL Rewrite]
",OVA,1.0,Finished Airing,2011-10-10,,Unknown,Sentai Filmworks,CoMix Wave Films,Original,"Action, Boys Love, Fantasy, Supernatural",Super Power,Unknown,28.0,G - All Ages,6.781,11695.0,49282.0,3849,25578,72
5784,Ai no Kusabi (2012),間の楔,Unknown,"The story is set in the future on the planet named Amoi which is controlled by a supercomputer named Jupiter. Among the mostly male human population, the light-haired elite class is allowed to temporarily keep the dark-haired ""mongrels"" as pets. One elite member, Iason, encounters a mongrel named Riki in the slums and decides to take him in. However, Iason keeps Riki longer than it is socially approved, and rumors abound about their possible relationship.",OVA,4.0,Finished Airing,2012-01-18,2012-04-18,"Pony Canyon, KENMedia",Media Blasters,AIC,Light novel,"Boys Love, Drama, Sci-Fi, Erotica",Unknown,Unknown,25.0,R+ - Mild Nudity,6.571,14730.0,,3446,31871,106
9761,Finder Series,ファインダーシリーズ,You're My Love Prize,"Twenty-three-year old Takaba Akihito is a young freelance photographer who takes pride in his work and seeks to get a major ""scoop."" After he takes photographs of the business dealings of crime lord Asami Ryuichi, Asami kidnaps and rapes him, beginning a sadomasochistic relationship between them as they find themselves continually drawn to one another. Fei Long, a rival Chinese boss who blames Asami for his father's death, takes an interest in Takaba, as well, seeking a way to get revenge.

(Source: Wikipedia)",OVA,2.0,Finished Airing,2012-02-29,2015-08-28,"Movic, ANiMix Project",Unknown,GARDEN LODGE,Manga,"Action, Boys Love, Drama, Erotica",Unknown,Unknown,43.0,R - 17+ (violence & profanity),6.471,9152.0,,4350,19618,80
12695,Tight-rope,タイトロープ,Tight-rope,"Tightrope tells the tale of the reluctant heir of a yakuza family and his childhood friend, and follows their love relationship that started budding in their school days and keeps developing slowly but surely.

(Source: Simona's BL Research Lab)",OVA,2.0,Finished Airing,2012-05-30,2012-06-27,Unknown,Unknown,PrimeTime,Manga,"Boys Love, Romance",Unknown,Unknown,23.0,PG-13 - Teens 13 or older,7.001,24243.0,39502.0,2809,46787,105
15439,"Kono Danshi, Ningyo Hiroimashita.",この男子、人魚ひろいました。,This Boy Caught A Merman,"Shima Kawauchi was taken in by his kind grandfather following the divorce of his unloving parents. His grandfather passes away in due time, leaving Shima all alone. Consumed by grief, he cries by the oceanside at night when an accident causes him to fall into the water. Unable to swim, Shima nearly drowns but is saved by an incredibly handsome merman. Seeing Shima's emotional state, the merman—who Shima names Isaki—insists that Shima take him home until he fully recovers. However, as they settle into their space together, the two start to form a bond that transcends both species and gender.

[Written by MAL Rewrite]",OVA,1.0,Finished Airing,2012-11-09,,Unknown,Sentai Filmworks,CoMix Wave Films,Original,"Boys Love, Fantasy",Unknown,Unknown,29.0,PG-13 - Teens 13 or older,7.311,18439.0,24232.0,3218,36657,160
13767,Junjou Romantica OVA,純情ロマンチカ,Unknown,OVAs that come with the limited premium edition of volumes 16 and 20 of the manga series.,OVA,2.0,Finished Airing,2012-12-20,2015-12-01,"Kadokawa Shoten, Romantica club !!",Unknown,Studio Deen,Manga,"Boys Love, Comedy, Drama, Romance",Unknown,Unknown,22.0,PG-13 - Teens 13 or older,7.721,25047.0,10642.0,2660,52033,75
17371,Natsuyasumi.,ナツヤスミ.,Unknown,"Yuu and Natsuki met in the hot sun, during that unforgettable summer vacation... Was it a dream, or...? It was a bittersweet love story?

(Source: AniDB)",ONA,3.0,Finished Airing,2013-01-27,2013-07-11,"Studio Zealot, White Bear, Mediabank",Unknown,Studio 9 Maiami,Original,"Boys Love, Hentai",Unknown,Unknown,14.0,Rx - Hentai,5.771,5646.0,,5324,11910,88
15933,Vassalord.,Vassalord. (ヴァッサロード),Unknown,"Charley, a cyborg vampire who does the Vatican's dirty work, is the thrall of the local vampire playboy Johnny Rayflo. As the two fight crime—and each other—hilarity, violence and sacrilege ensue! But can Charley resist his own desperate cravings for blood? Find out as the devilish duo go up against a childlike vampire princess, a mysterious branch of the Unitarian Church...and one another. 

(Source: Tokyopop) ",OVA,1.0,Finished Airing,2013-03-15,,Mag Garden,Unknown,Production I.G,Manga,"Action, Boys Love, Comedy, Fantasy, Mystery, Supernatural",Vampire,Unknown,27.0,R - 17+ (violence & profanity),6.781,15724.0,49032.0,3409,32688,91
20371,Sekaiichi Hatsukoi Movie: Yokozawa Takafumi no Baai,劇場版 世界一初恋 横澤隆史の場合,Unknown,Movie adaptation of the Sekaiichi Hatsukoi: Yokozawa Takafumi no Baai BL light novel.,Movie,1.0,Finished Airing,2014-03-15,,Kadokawa Shoten,Unknown,Studio Deen,Light novel,"Boys Love, Comedy, Drama, Romance",Unknown,Unknown,50.0,PG-13 - Teens 13 or older,7.871,30170.0,7502.0,2415,61954,210
20815,Sekaiichi Hatsukoi: Valentine-hen,世界一初恋～バレンタイン編～,Unknown,"Animated short with an original story that was screened alongside ""Sekaiichi Hatsukoi Movie: Yokozawa Takafumi no Baai.""",Movie,1.0,Finished Airing,2014-03-15,,Kadokawa Shoten,Unknown,Studio Deen,Manga,"Boys Love, Comedy, Romance",Unknown,Unknown,15.0,PG-13 - Teens 13 or older,7.781,17454.0,9162.0,3139,38539,59
21105,Love Stage!!,LOVE STAGE!!,Love Stage!!,"With an actress mother, producer father, and rockstar brother, anyone would expect Izumi Sena to eventually enter showbiz himself. However, aside from a commercial for a wedding magazine when he was a child, Izumi has never been in the spotlight; instead, he aims to become a manga artist. 

But a decade after the shoot, the magazine calls for a 10th anniversary ad, requesting the original child actors for the project. This reunites Izumi with Ryouma Ichijou, now a popular actor who, much to Izumi's shock, has been in love with him ever since their first meeting! However, due to Izumi's feminine appearance and unisex name, Ryouma believed the boy was a girl and continues to do so to this day. Izumi's troubles are just beginning, because even after discovering the truth, Ryouma can't seem to shake off his feelings...

[Written by MAL Rewrite]",TV,10.0,Finished Airing,2014-07-10,2014-09-11,Kadokawa Shoten,Sentai Filmworks,J.C.Staff,Manga,"Boys Love, Comedy, Romance",Unknown,Unknown,23.0,PG-13 - Teens 13 or older,7.221,135569.0,28622.0,847,241583,1574
11135,Hybrid Child,ハイブリッド チャイルド,Unknown,"The skilled craftsman Kuroda created artificial humans called Hybrid Child—creatures who are neither machines nor dolls, but rather a reflection of the love shown to them. While they can feel human emotions and have their own consciousness, they are not real humans and require love to grow.

Kotarou Izumi is the young heir to the noble Izumi family, so it is frowned upon when he brings an abandoned Hybrid Child he found in the garbage into their household. His family even attempts to throw away Hazuki—Kotarou's name for the Hybrid Child—multiple times when he is not paying attention. But through overcoming these obstacles, their love and the bond connecting them grow stronger. However, ten years pass before a horrifying realization dawns on them: a Hybrid Child might not have an endless life span.

Hybrid Child is a collection of three short love stories, depicting the relationship between the artificial humans and their owners.

[Written by MAL Rewrite]",OVA,4.0,Finished Airing,2014-10-29,2015-01-28,Lantis,Unknown,Studio Deen,Manga,"Boys Love, Drama, Romance, Sci-Fi",Historical,Unknown,25.0,PG-13 - Teens 13 or older,7.551,36014.0,15212.0,2160,74389,477
23441,Love Stage!!: Chotto ja Nakutte,LOVE STAGE!! チョットジャナクッテ,Unknown,"Bundled with volume four of the manga series Love Stage!! written by Eiki Eiki. 

This OVA takes place right after the final episode of Love Stage!! the anime series, which is based on the manga volumes 1-3. ",OVA,1.0,Finished Airing,2014-11-22,,Kadokawa Shoten,Sentai Filmworks,J.C.Staff,Manga,"Boys Love, Comedy, Romance",Unknown,Unknown,23.0,PG-13 - Teens 13 or older,7.401,32230.0,20112.0,2442,61026,65
