anime_ID,Title,Japanese,English,Synopsis,Type,Episodes,Status,Start_Aired,End_Aired,Producers,Licensors,Studios,Source,Genres,Themes,Demographics,Duration_Minutes,Rating,Score,Scored_Users,Ranked,Popularity,Members,Favorites
734,Kizuna: Koi no kara Sawagi,絆 KIZUNA~恋のから騒ぎ~,Kizuna Much Ado About Nothing,"On his first day of junior high, Kei Enjoji fell in love at first sight. His heart was immediately captured by the gorgeous Ranmaru Samejima, a young kendo prodigy, and the two slowly formed a deep romantic bond. Now adults and living happily together as a couple, things seem to be going well for Ranmaru and Kei.

One morning, host Kei arrives home after a night out drinking with a client. A frequent occurrence, Ranmaru is initially unfazed by Kei's drunken state—until he notices three extremely suspicious things: Kei's clothing smells of makeup, his chest is stained with lipstick, and he is carrying matches branded with the name of a love hotel. To top it all off, a woman calls the apartment asking for ""Kei-chan,"" and at that, Ranmaru loses it.

Hurt by Kei's unfaithful actions, Ranmaru storms off. He spends the day reminiscing about years of precious memories, deciding to put them behind him for good—and when he is ""picked up"" by a woman on the streets, he comes to terms with reality. If this is what society wants, and if Kei has truly fallen for a woman, then who is he to stand in their way?

[Written by MAL Rewrite]",OVA,1.0,Finished Airing,2001-03-03,,Unknown,Media Blasters,Zexcs,Manga,"Boys Love, Drama, Romance, Erotica",Unknown,Unknown,44.0,R+ - Mild Nudity,6.621,3174.0,,6699,6766,7
1019,Honoo no Mirage,炎の蜃気楼 [ミラージュ],Mirage of Blaze,"Takaya Ougi is just a typical high school guy who wants nothing more than to protect his best friend and live a normal life. Enter Nobutsuna Naoe, an older man who informs Takaya that he is in fact the reincarnation of Lord Kagetora. Naoe, himself a possessor, awakens Takaya's abilities to exorcise evil spirits and fight the Fuedal Underworld. While most possessors remember their former lives before being reincarnated, Takaya does not. Naoe is thankful for this, considering his passionate and abusive past with his Lord Kagetora. As Takaya improves his abilities, he also begins to remember what Naoe did because of his love for him. Meanwhile the dark forces of the Hojo and Fuma clans begin their attack as the Fuedal Underworld descends upon the living world.

(Source: ANN)",TV,13.0,Finished Airing,2002-01-07,2002-04-08,"Aniplex, Shueisha",Media Blasters,Madhouse,Light novel,"Action, Boys Love, Drama, Romance, Supernatural","Historical, School",Unknown,24.0,PG-13 - Teens 13 or older,6.511,7752.0,63502.0,4102,22339,72
40104,Honoo no Mirage: Muyou no Michi,総集編 霧杳の途,Mirage of Blaze Recap,Recap of the first four episodes of Honoo no Mirage.,Special,1.0,Finished Airing,2002-02-04,,Unknown,Unknown,Madhouse,Light novel,"Action, Boys Love, Drama, Supernatural","Historical, School",Unknown,24.0,PG-13 - Teens 13 or older,6.121,258.0,84392.0,11128,1351,3
425,Shiritsu Araiso Koutougakkou Seitokai Shikkoubu,私立荒磯高等学校生徒会執行部,Araiso Private High School Student Council Executive Committee,"Kubota Makoto and Tokitoh Minoru (characters from Kazuya Minekura's manga Wild Adaptor—though no reference is made to the darker storyline of WA in this light-hearted anime)—are the muscle of their high school's all-powerful student council. They defend the student body from disorder—generated by both humans and demons—while avoiding their classes.

(Source: ANN)",OVA,2.0,Finished Airing,2002-03-29,2002-07-26,"Movic, Tokuma Shoten",Unknown,Nippon Animation,Manga,"Boys Love, Comedy, Sports",Unknown,Unknown,26.0,PG-13 - Teens 13 or older,6.381,2962.0,70902.0,6760,6608,10
724,Enzai,冤罪,Unknown,"The protagonist is Guys, a young boy from a poor family, who gets caught for stealing candy from a Paris store. 

However, after being railroaded by a city detective named Guildias, Guys finds himself accused, convicted, and sentenced to life imprisonment for the murder of a man he never met.

From that point on, most Enzai takes place inside a dark, claustrophobic, dirty prison, in there, Guys experiences humiliation and torture of various kinds, much of it involving sexual acts such as rape and forcible sodomy.",OVA,2.0,Finished Airing,2004-04-23,2004-10-22,Langmaor,Unknown,Anime Antenna Iinkai,Visual novel,"Boys Love, Drama, Horror, Hentai",Historical,Unknown,25.0,Rx - Hentai,5.181,11503.0,,4157,21624,42
1020,Honoo no Mirage: Minagiwa no Hangyakusha,炎の蜃気楼～みなぎわの反逆者～,Mirage of Blaze Rebels of the River Edge,"Takaya was sent to Kyoto to investigate the re-awakening of Ikko sect and Araki Murashige, a member of the Ikko sect who deserted the clan.With the help of his vassal Haruie, Takaya is finally successful in tracing Araki who hunts down a 400-years-old mandala (Buddhist artifact for meditating) that was made of the hair of the deceased Araki clansmen. Unfortunately, by the time they meet, Haruie recognizes Araki as Shintarou, her lover in her past-life. Takaya orders her to eliminate Araki, who is a threat, but will she be able to do it. Furthermore Takaya finally meets Naoe... 

(Source: ANN)",OVA,3.0,Finished Airing,2004-07-28,2004-11-26,Aniplex,Media Blasters,Madhouse,Light novel,"Action, Boys Love, Drama, Romance, Supernatural",Historical,young girl,30.0,R - 17+ (violence & profanity),6.821,3926.0,47112.0,5655,10192,24
600,Legend of Duo,LEGEND OF DUO,Unknown,"It is the early 21st century, and mankind is doomed. Due to a mysterious virus that steals the essence of human life, humanity has been pushed to the brink of extinction with only one hope for salvation: the blood of a vampire. Vampires have closely guarded the key to curing the virus for several years, which has led to an immense rift between them and humans and the world's descension into chaos.

A vampire named Duo, having leaked the secret to saving humanity, is now considered a traitor to his race, and the powerful vampire Zieg is on his trail. However, due to Zieg's sense of duty, his heart is torn: should he kill the man who betrayed his people, or will his personal history with Duo sway him to have a change of heart?

[Written by MAL Rewrite]",TV,12.0,Finished Airing,2004-10-27,2005-12-01,Unknown,Unknown,"Radix, Marine Entertainment",Original,"Boys Love, Drama, Supernatural",Vampire,Unknown,5.0,R - 17+ (violence & profanity),4.881,4667.0,125632.0,5434,11269,12
741,Sensitive Pornograph,センシティブ・ポルノグラフ,Unknown,"For four young men, love and intimacy are in the air, even though they may not be aware of it. Sensitive Pornograph holds within it two tales of sexual romance for two different couples of men. The first is a tale between two manga artists, Seiji Yamada and Sono Hanasaki. Both are familiar with each other's work, though upon meeting each other, Seiji is shocked to find out that Sono is actually a man, ten years his senior. Love quickly blossoms between the two, but will soon be tested when Seiji begins to hear rumors about Sono's past sexual exploits.

In the second tale, Koji Ueno is a part-time pet sitter, hired to take care of a rabbit named Aki for a new client. To Koji's complete surprise though, not only is there no rabbit in the house, but the only thing in the apartment is a bound and gagged man in the closet who says that he is Aki. More troubling than this is that Aki informs Koji that they are both in danger of upsetting the client, and the only way for Koji to get out safely is for them to make love together.

Two stories, four men, and the one emotion of love that unites them all in the new twists their lives have taken.",OVA,1.0,Finished Airing,2004-12-20,,Unknown,Media Blasters,Phoenix Entertainment,Manga,"Boys Love, Comedy, Drama, Romance, Hentai",Unknown,Unknown,30.0,Rx - Hentai,6.671,25758.0,,2899,44012,171
1532,Suki na Mono wa Suki Dakara Shou ga Nai!!,好きなものは好きだからしょうがない！！,Sukisho,"Hashiba Sora has fallen from a 4th story window and has lost all of his memories. When Fujimori Sunao comes to his school as his new room mate, Fujimori tells Hashiba that he is called Ran. Fujimori and Hashiba both have a split personality which they developed in their youth. Their split personalities, Yoru and Ran, are deeply in love. Even though it creeps Fujimori and Hashiba out what their other selves do with each other at night, they also start to fall for each other. Because of their relationship, Hashiba Sora finds out a lot of shocking facts about their youth.",TV,12.0,Finished Airing,2005-01-09,2005-03-27,"Bandai Visual, Lantis, Movic",Media Blasters,Zexcs,Visual novel,"Boys Love, Comedy, Drama, Romance, Slice of Life",Unknown,young girl,24.0,PG-13 - Teens 13 or older,6.651,22745.0,55862.0,2778,47794,225
747,Haru wo Daite Ita,春を抱いていた,Embracing Love,"The adorable and attractive main characters of Haru wo Daiteita are Kyousuke Iwaki and Youji Katou who are both in the film industry, having starred in various adult video films and are trying to climb the ladder of success and become greater actors. Iwaki is accepted to star in a popular movie, having beaten Katou in the auditions. During their time together, Katou believes he is in love with Iwaki-San, who on the contrary refuses to believe that he is in love. It is later on that another gay actor comes back to Japan and co-stars with Katou that problems starting arising. And it is from then on that the two realise where their hearts are set.

(Source: ANN)",OVA,2.0,Finished Airing,2005-03-31,2005-05-27,"Frontier Works, On-Lead","Media Blasters, Kitty Media",Trinet Entertainment,Manga,"Boys Love, Drama, Erotica",Unknown,Unknown,30.0,R+ - Mild Nudity,6.681,14325.0,,3884,25134,70
149,Loveless,LOVELESS,Loveless,"In the world of Loveless, each person is born with cat ears and a tail, which disappear only if that person engages in a sexual intercourse. Because of this, they have come to symbolize virginity and innocence. Additionally, fighting is only done by ""fighting pairs"" or couples, where one is known as the Sacrifice and the other as the Fighter. The first receives the damage while the latter attacks.

Ritsuka Aoyagi is a 12-year-old boy, who for some unknown reason suffers from amnesia. His brother got killed recently, and as if his life has not been hard enough lately, on his first day at the new school he gets approached by a stranger called Agatsuma Soubi, who claims to have known his late brother. Ritsuka finds out that Agatsuma and his brother used to be a fighting pair, and that Agatsuma has inherited Ritsuga now that his brother is gone. Together, they try to find the truth behind his brother's death and the organization known as the ""Seven Moons,"" which may have been responsible for it. All the while, it seems that Ritsuka and Agatsuma are becoming closer than they intended to be…",TV,12.0,Finished Airing,2005-04-07,2005-06-30,"Bandai Visual, TV Asahi, Movic",Media Blasters,J.C.Staff,Manga,"Action, Boys Love, Drama, Fantasy, Mystery, Romance, Supernatural",Unknown,female,24.0,PG-13 - Teens 13 or older,6.771,68163.0,49532.0,1427,134681,1301
1035,Patalliro Saiyuuki!,パタリロ西遊記！,Unknown,"Genjou Sanzou is a Buddhist monk who has been sent by the Emperor on a journey to find the sacred Buddhist scriptures. One day, Sanzou meets an Earth Deity who tells him that Buddha has sent him a disciple: the mischievous Monkey Deity Son Goku, who was sealed inside of a mountain for five hundred years after wreaking havoc in Heaven! Together with the alcohol-loving playboy Cho Hakkai; the heavenly army General Sagojyou; and their horse, the Dragon Crown Prince Ryuuba; there are plenty of adventures to be had from fighting off monsters to bishounen contests.

(Source: ANN and AniDB)",TV,26.0,Finished Airing,2005-06-06,2005-11-29,Unknown,Unknown,Magic Bus,Unknown,"Adventure, Boys Love, Comedy, Fantasy",Unknown,young girl,9.0,PG-13 - Teens 13 or older,6.501,1186.0,63672.0,8362,3780,3
32684,Suki na Mono wa Suki Dakara Shou ga Nai!!: Onsen ni Ikou!,好きなものは好きだからしょうがない!! 温泉に行こう!,Unknown,A bonus DVD only episode where the boys go to a hot spring.,Special,1.0,Finished Airing,2005-09-23,,"Bandai Visual, Lantis, Movic",Media Blasters,Zexcs,Visual novel,"Boys Love, Comedy, Slice of Life",School,young girl,25.0,PG-13 - Teens 13 or older,6.261,1545.0,77032.0,8294,3885,2
3057,Loveless Specials,LOVELESS おはよう ラブレスくーん,Unknown,DVD specials.,Special,6.0,Finished Airing,2005-11-01,2006-04-27,Unknown,Unknown,J.C.Staff,Manga,"Boys Love, Comedy, Fantasy, Romance, Supernatural",Unknown,female,2.0,PG-13 - Teens 13 or older,6.491,7567.0,64432.0,4501,18141,26
746,Papa to Kiss in the Dark,パパとKISS IN THE DARK,Papa to Kiss in the Dark,"Munakata Mira is in love with his father, the famous Hollywood actor Munakata Kyousuke. Unknown to the public, both of them are father and son as well as lovers. When Mira turns 15 and enters high school, he faces trouble with his childhood friend falling in love with him. Also, finding out he is adopted only distresses him further. Then there's the problem of Kyousuke probably marrying a famous actress, whose son seems to have an interest in Mira. 

(Source: ANN) ",OVA,2.0,Finished Airing,2005-11-23,2005-12-21,"Hakusensha, Three Fat Samurai, Sol Blade",Unknown,TNK,Light novel,"Boys Love, Comedy, Drama, Romance, Erotica",Unknown,Unknown,30.0,R+ - Mild Nudity,5.901,28311.0,,2776,47963,123
5085,Nakedyouth,Nakedyouth,Naked Youth,"In Nakedyouth, Shishido takes us on a journey through the uncertainty and excitement of young love and homoerotic love. These gentle films quiver with sexual tension, which is linked to the natural world: trees reflecting on the surface of a pond, butterflies fluttering in the breeze.",ONA,1.0,Finished Airing,2006-01-01,,Kojiro Shishido Animation Works,Unknown,Unknown,Original,"Boys Love, Romance, Slice of Life, Sports",Unknown,Unknown,9.0,R+ - Mild Nudity,5.721,3618.0,102592.0,6430,7475,11
22591,Patalliro Saiyuuki! Special,パタリロ西遊記！第27話,Unknown,Unaired episode 27 of Patalliro Saiyuuki! that was included in the 5th DVD volume.,Special,1.0,Finished Airing,2006-01-25,,Unknown,Unknown,Magic Bus,Unknown,"Adventure, Boys Love, Comedy, Fantasy",Unknown,young girl,9.0,PG-13 - Teens 13 or older,5.911,143.0,94762.0,12523,815,0
850,Gakuen Heaven,学園ヘヴン,Gakuen Heaven,"Itou Keita, an average guy, is shocked when he's invited to attend the elite institution, ""Bell Liberty Academy."" Unnerved by the mystery, he's further distracted by the school's social dynamics. In a sea of amazing young men, Keita struggles to find out what makes him unique, and how he can possibly deserve to be treated as an equal by the boys of BL. Lacking any particular ability, just why has Itou been welcomed into the privileged world of the talented and the beautiful? 

Along the way, he develops intense relationships with the almost everyone at school but he is terribly drawn to the friendly, over-caring but very mysterious classmate, Kazuki Endou.",TV,13.0,Finished Airing,2006-04-01,2006-06-24,"Geneon Universal Entertainment, Visual Arts",Media Blasters,Tokyo Kids,Visual novel,"Boys Love, Comedy, Drama, Romance","Harem, School",Unknown,26.0,PG-13 - Teens 13 or older,6.481,30426.0,65172.0,2370,64025,168
1640,Angel's Feather,エンジェルズフェザー Angel's Feather,Angel's Feather,"In the Binfield Kingdom Chronicle, it is said that there was once a small, peaceful country called the Kingdom of Winfield, whose king and royal family possessed great white wings.

Hamura Shou is newly enrolled at Yuusei Academy. After hearing about a student named Misonou Kai from the headmaster, Shou comes to believe that Kai is his younger twin brother, who he was separated from when he was younger. However, after a mysterious earthquake, Shou is suddenly carried into another world with two other students. It is in this new world that, after being attacked by a monster, Shou suddenly unleashes great, white wings.

[Written by MAL Rewrite]",OVA,2.0,Finished Airing,2006-04-28,2006-05-26,Unknown,Media Blasters,Venet,Visual novel,"Boys Love, Drama, Fantasy, Romance, Sci-Fi, Supernatural",Unknown,Unknown,29.0,PG-13 - Teens 13 or older,5.431,9968.0,113492.0,4311,19901,31
1639,Boku no Pico,ぼくのぴこ,Unknown,"Upbeat and effeminate Pico is working at his grandfather's coffee shop, Café Bebe, for the summer. Tamotsu is a white-collar worker looking for an escape from the mundanity of his everyday life. When they meet at the café, sparks of love and lust quickly draw the two together. Conventional notions of age, gender, and sexuality are broken down as the pair seeks carnal gratification in one another's company. But do the pleasures of flesh equate to a connection between hearts?

[Written by MAL Rewrite]",OVA,1.0,Finished Airing,2006-09-07,,Natural High,Unknown,"Sugar Boy, Blue Cat",Original,"Boys Love, Hentai",Unknown,Unknown,32.0,Rx - Hentai,4.241,117816.0,,1183,171354,1671
1912,Marginal Prince: Gekkeiju no Ouji-tachi,マージナルプリンス -月桂樹の王子達-,Unknown,"""Marginal Prince"" based off of the hit love simulation game series for girls! Yuta studies abroad in a tiny, far away island in the pacific ocean name Alphonso where he enters the all-dorm, all-male Alphonso Gakuen. However, the school is really a place for the children of the famous . . . and the school specializes in classes on empires and alchemy! And one day, after studying enough at the school, the students become known as ""Marginal Princes""! Learn about the stories of fate and trial as each of the students studies to become kings!

(Source: Crunchyroll)",TV,13.0,Finished Airing,2006-10-02,2006-12-25,"GDH, Sotsu Music Publishing",Unknown,Tokyo Kids,Visual novel,"Boys Love, Romance",School,Unknown,24.0,PG-13 - Teens 13 or older,5.821,4081.0,98682.0,5048,13530,17
30262,Okane ga Nai Specials,お金がないっ,No Money Omake episodes,Short specials included with the DVD's of Okane ga Nai series.,Special,4.0,Finished Airing,2007-02-09,2007-12-21,"KlockWorx, Happinet Pictures",Media Blasters,Lilix,Manga,"Boys Love, Comedy, Romance, Erotica",Unknown,Unknown,1.0,R+ - Mild Nudity,5.891,1828.0,,7741,4732,5
2148,Okane ga Nai,お金がないっ,No Money,"Yukiya Ayase is a gentle, kind hearted, and innocent university student. The only relative he has left, his cousin Tetsuo, betrays Ayase by selling him to the highest bidder in an auction with hopes of making an enormous profit to be able to pay off his debts. Somuku Kanou, a bad-tempered (though very rich) loan shark, comes to Ayase's rescue and buys Ayase for an impressive 1.2 billion. Kanou apparently knows Ayase from something that happened between them in the past, but Ayase cannot remember who Kanou is nor does he understand why he ""saved"" him. In a desperate effort to keep Ayase close to him, Kanou demands the debt be repaid in full and suggests the perfect way to do it: by selling his body to Kanou for 500,000 each time. Ayase is horrified in the beginning, but something soon begins to grow between them that can't be bought for any price.

(Source: ANN)",OVA,4.0,Finished Airing,2007-02-09,2007-12-21,"KlockWorx, Happinet Pictures",Media Blasters,Lilix,Manga,"Boys Love, Drama, Romance, Erotica",Unknown,Unknown,30.0,R+ - Mild Nudity,6.171,24966.0,,2909,43808,152
2238,Fuyu no Semi,冬の蝉,Embracing Love A Cicada in Winter,"If time did not allow ordinary things to be ordinary. How would you have lived?

It is the Bakumatsu and early Meiji Period. Akizuki Keiichirou and Kusaka Touma stand of opposite sides of the political scale of the time but still, something as fragile as the shell of a cicada binds these two men together in a tragic and cruel fate. A story of friendship, love and seperation as well as reunion and sacrifice.

(Source: AniDB)",OVA,3.0,Finished Airing,2007-02-23,2007-04-27,On-Lead,"Media Blasters, Kitty Media",Venet,Manga,"Boys Love, Drama, Romance, Erotica","Historical, Samurai",Unknown,32.0,R - 17+ (violence & profanity),7.471,10022.0,,4255,20333,141
2417,Saigo no Door wo Shimero!,最後のドアを閉めろ！,Unknown,"After being best man at his best friend's (Saitou Toshihisa) wedding, Nagai Atsushi realizes that he might have fallen for him. Nagai, drowning in his sorrows and hatred for the new bride then meets Honda Kenzou, another guest at the wedding. Honda takes care of Nagai when he was dead drunk and now Nagai can't stop thinking of both Honda and Saitou.

(Source: ANN)",OVA,1.0,Finished Airing,2007-03-23,,Unknown,Unknown,Phoenix Entertainment,Manga,"Boys Love, Comedy, Drama, Romance, Erotica",Unknown,Unknown,30.0,PG-13 - Teens 13 or older,6.531,7510.0,,5096,13277,14
5391,Pico to Chico,ぴことちこ,Unknown,"The crisp rays of summer sun find the effeminate Pico embroiled in yet another heated and lustful fling. While out biking, Pico meets and befriends Chico—a lively boy not much younger than him, but leagues behind in the affairs of the flesh. After the innocent Chico shows his sister in the midst of self-pleasure to Pico, Pico takes it upon himself to educate this confused youth.

[Written by MAL Rewrite]",OVA,1.0,Finished Airing,2007-04-19,,Natural High,Unknown,"Sugar Boy, Blue Cat",Original,"Boys Love, Hentai",Unknown,Unknown,36.0,Rx - Hentai,4.351,44657.0,,2278,68519,313
18729,Marginal Prince: Gekkeiju no Ouji-tachi - Tokyo Merry-Go-Round,マージナルプリンス -月桂樹の王子達- 第14話「TOKYOメリーゴーランド」,Unknown,"Keita and the other Marginal Prince are away from St. Alphonso Academy and meet each other in the city, where they meet Keita's sister.

Extra episode released with the 7th DVD volume.",Special,1.0,Finished Airing,2007-07-19,,GDH,Unknown,Tokyo Kids,Visual novel,"Boys Love, Romance",School,Unknown,24.0,PG-13 - Teens 13 or older,5.941,446.0,93292.0,9832,2191,1
3210,Ikoku Irokoi Romantan,異国色恋浪漫譚,A Foreign Love Affair,"Japanese yakuza clan heir Ranmaru just got married on a lavish cruise ship, but things aren't as they seem. The marriage is just for the appearances, and he ends up getting drunk and spending the night not with his bride but with the sexy ship captain. When the two men meet again in Italy, it is the start of a spectacular love story.

(Source: MU)",OVA,2.0,Finished Airing,2007-12-21,2008-10-24,"ANIK, On-Lead",Unknown,PrimeTime,Manga,"Boys Love, Comedy, Romance, Erotica",Unknown,Unknown,27.0,R+ - Mild Nudity,6.941,24005.0,,2960,42826,105
6553,Junjou Romantica Special,純情ロマンチカ,Unknown,Voice actors comment various scenes from the anime.,Special,1.0,Finished Airing,2008-01-01,,Kadokawa Shoten,Unknown,Studio Deen,Manga,"Boys Love, Comedy",Unknown,Unknown,16.0,PG-13 - Teens 13 or older,7.441,15634.0,18652.0,3349,34274,69
3375,Kirepapa.,キレパパ。,Unknown,"Chisato Takatsukasa, a 35-year-old author, has such a youthful appearance that anyone would think him to be in his early twenties. His work is inspired by his idol—the best-selling mystery author Saki Shunka, who is as much of an enigma herself as the plots of the books she writes.

Chisato is also the extremely overprotective father of 15-year old Riju, convinced that the ""friends"" his son constantly brings over are nothing but predators waiting for the perfect opportunity to defile his precious boy. As a result, Chisato will stop at nothing to ensure they never come over again, resorting to the most extreme of methods.

There is not a man he hates more, however, than Riju's rather persistent best friend Shunsuke Sakaki, who just won't go away regardless of what Chisato tries to do. But the motivations of these characters lie as secrets bubbling just below the surface. Why is Chisato so wary of Riju's friends, and what exactly does Shunsuke know about the mysterious author his friend's father idolizes?

[Written by MAL Rewrite]
",OVA,2.0,Finished Airing,2008-01-25,2008-11-28,"ANIK, On-Lead",Unknown,PrimeTime,Manga,"Boys Love, Comedy, Drama, Romance, Erotica",Unknown,Unknown,29.0,R+ - Mild Nudity,6.611,29714.0,,2678,51603,125
10048,Fuyu no Semi Special,冬の蝉 ~特別編集版~,Unknown,Summary of the Fuyu no Semi OVA with revised animation and some extra scenes.,OVA,1.0,Finished Airing,2008-03-26,,Unknown,Unknown,Venet,Manga,"Action, Boys Love, Drama, Erotica","Historical, Military, Samurai",Unknown,96.0,R - 17+ (violence & profanity),6.881,1677.0,,7626,4912,6
3656,Monochrome Factor,モノクローム･ファクター,Unknown,"The story revolves around high school student Akira Nikaido, a typical slacker living a normal life. That is, until he meets the mysterious Shirogane, a man who suddenly appears and tells him that they have a destiny together. When Akira hears this, he is shocked and doesn't believe a word of it. Aya, a friend of Akira, forgets something in the school one night, and asks Akira to help her and go find it. He agrees, and while there, he gets attacked by a shadow monster. Shirogane convinces him that the balance between the human world and the shadow world has been distorted and that Akira must become a ""shin""- a creature of the shadow world- in order to help restore the balance. The anime has shonen-ai themes which are completely absent from the manga.

(Source: Wikipedia)",TV,24.0,Finished Airing,2008-04-08,2008-09-30,"Sotsu, Genco",Maiden Japan,A.C.G.T.,Manga,"Action, Boys Love, Supernatural",Unknown,Unknown,24.0,PG-13 - Teens 13 or older,6.951,21640.0,41112.0,2525,57411,213
