anime_ID,Title,Japanese,English,Synopsis,Type,Episodes,Status,Start_Aired,End_Aired,Producers,Licensors,Studios,Source,Genres,Themes,Demographics,Duration_Minutes,Rating,Score,Scored_Users,Ranked,Popularity,Members,Favorites
25143,"Kono Danshi, Sekka ni Nayandemasu.",この男子、石化に悩んでます。,This Boy Suffers From Crystallization,"Ayumu Tamari suffers from a condition known as ""Crystallization Syndrome."" In moments of high stress, parts of his body begin to crystallize and become extremely difficult to move. Unfortunately, Ayumu's severe social anxiety makes him completely unable to speak to anyone in his class, and ultimately causes him to crystallize so frequently that he has to repeat a year in high school.

Ayumu's only solace is his homeroom teacher, Kouya Onihara, whom he affectionately refers to as ""Oni-chan Sensei."" Kouya collects and studies crystals, and he finds Ayumu's crystalline body both beautiful and fascinating. With his stress from school compounded by the complexities of a forbidden student-teacher relationship, Ayumu struggles to find normalcy in his life while managing his emotions and trying to prevent complete crystallization.

[Written by MAL Rewrite]",OVA,1.0,Finished Airing,2014-12-03,,Unknown,Kuma Holdings,CoMix Wave Films,Original,"Boys Love, Drama",School,Unknown,27.0,PG-13 - Teens 13 or older,6.851,10951.0,45722.0,4061,22910,46
25567,DRAMAtical Murder: Data_xx_Transitory,ドラマティカル マーダー OVA「Data_xx_Transitory」,Unknown,"Data xx Transitory is the thirteenth and bonus episode of the DRAMAtical Murder animation. It features all of the bad endings from the original game.

(Source: DRAMAtical Murder Wiki)",Special,1.0,Finished Airing,2014-12-24,,"Nitroplus, DIVE II Entertainment, Avex Pictures",Sentai Filmworks,NAZ,Visual novel,"Boys Love, Drama, Sci-Fi",Psychological,Unknown,24.0,R - 17+ (violence & profanity),6.051,14938.0,88092.0,3519,30695,52
25649,Junjou Romantica 3,純情ロマンチカ 3,Junjo Romantica 3,"After living together for three years, Misaki Takahashi and Akihiko ""Usagi"" Usami's relationship has been progressing smoothly. However, all great relationships have problems, and theirs is just beginning. With a new rival on the horizon, Usagi worries about Misaki's feelings towards him. 

Meanwhile, Ryuuichirou Isaka has always loved to intrude on Misaki and Usagi's love life, but his own love life hasn't been all smooth sailing—Isaka and his secretary Kaoru Asahina have been dating for a few years; however, Asahina prefers to keep their professional and private lives separate, often leading to troubled waters between them.

As for Nowaki Kusama and Hiroki Kamijou, now that their careers are finally taking off, they hardly see each other anymore. With the time they spend together lessening, doubts and insecurities threaten to creep in between them. On the other hand, the 17-year age gap between Shinobu Takatsuki and You Miyagi has been a constant barrier in their relationship, but as they learn more about each other, their self-consciousness continues to fade.

The beloved couples of Junjou Romantica, Junjou Egoist, and Junjou Terrorist are back again, this time with a new addition: Junjou Mistake!

[Written by MAL Rewrite]",TV,12.0,Finished Airing,2015-07-09,2015-09-24,"Frontier Works, Lantis, Kadokawa Shoten, Romantica club !!",Funimation,Studio Deen,Manga,"Boys Love, Comedy, Drama, Romance",Unknown,Unknown,24.0,PG-13 - Teens 13 or older,7.651,59292.0,12312.0,1630,113447,490
30531,Gakuen Handsome The Animation,学園ハンサム The Animation,Unknown,"The school love story is set at Baramon High School, a private boys' school for the prefecture's most elite. The protagonist is a seventeen year old boy who transfers into the school and meets various major players on campus, such as the outlaw teacher, the soccer captain, and a childhood friend whom the protagonist has not seen for seven years. The school presents opportunities for friendship, love and conflict, and changes are now bound to happen in the main character's life.

(Source: ANN)",OVA,1.0,Finished Airing,2015-08-28,,Unknown,Unknown,Team YokkyuFuman,Visual novel,"Boys Love, Comedy","Parody, School",Unknown,32.0,PG-13 - Teens 13 or older,6.291,1873.0,75672.0,7659,4854,10
31815,"Kono Danshi, Mahou ga Oshigoto Desu.",この男子、魔法がお仕事です。,This Boy is a Professional Wizard,"Chiharu Kashima, captain of the Wizard Bureau's Crisis Countermeasures Division, is among a handful of people who can use magic. While frequenting his favorite bar, he is approached by a friendly man named Toyohi Utsumi. Having always dreamt of being a wizard, Toyohi is enthralled by the idea of meeting one. Much to the young Captain's surprise, Toyohi confesses that he has fallen in love with Kashima. While little time as passed, the two begin to spend more time together. Not all is well, however, as Kashima fears that magic is all that he has and Toyohi is only in love with Kashima the Wizard.

[Written by MAL Rewrite]",TV,4.0,Finished Airing,2016-02-05,2016-02-26,Unknown,Kuma Holdings,CoMix Wave Films,Original,"Boys Love, Fantasy",Unknown,Unknown,7.0,PG-13 - Teens 13 or older,6.971,13139.0,40372.0,3783,26572,65
30346,Doukyuusei (Movie),同級生,Doukyusei -Classmates-,"Hikaru Kusakabe is a normal, carefree boy in a rock band who is always focused on the present. During the summer, his entire class is forced to participate in an upcoming chorus festival. By coincidence, he discovers his classmate Rihito Sajou—known for being an honor student with excellent grades—practicing his singing alone. Sajou just cannot seem to get their class' song right, and Kusakabe, delighted at seeing a new side of his straight-laced classmate, offers to help him prepare for the event.

Although their lives and personalities are total opposites, they begin to grow closer as time progresses. But with the pressure of an unknown future, what will become of them and their growing relationship?

[Written by MAL Rewrite]",Movie,1.0,Finished Airing,2016-02-20,,"Aniplex, Half H.P Studio",Aniplex of America,A-1 Pictures,Manga,"Boys Love, Romance, Slice of Life",School,Unknown,60.0,PG-13 - Teens 13 or older,8.301,128205.0,2382.0,859,237890,5534
36753,Kakushin,確信,Hunch,A musical anime promoting motivation for LGBT teens. The focus of the short is on a young man and his struggling affection towards his male classmates.,ONA,1.0,Finished Airing,2016-03-28,,Unknown,Unknown,Unknown,Original,Boys Love,Music,Unknown,3.0,PG - Children,5.891,571.0,95952.0,10867,1504,8
31680,Super Lovers,SUPER LOVERS（スーパーラヴァーズ）,Super Lovers,"Upon hearing news that his mother was on verge of death, Haru Kaidou—the eldest son of the family—flies all the way to Canada. The moment he arrives, he learns that not only did his mother fool him, but he is also supposed to take care of his adoptive brother, Ren Kaidou, an antisocial kid who feels more comfortable around dogs than people.

Due to his new brother's distrustful nature, Haru initially has a hard time reaching out to Ren but their relationship eventually grows. He makes a promise to Ren: they will live together in Japan after Haru graduates from high school. However, due to an unfortunate accident, Haru loses all memories of the summer they spent together, including the promise he made. Five years later, expecting Haru to keep his promise, Ren arrives in Tokyo; but to Haru, Ren is just a random boy claiming to be his brother.

[Written by MAL Rewrite]",TV,10.0,Finished Airing,2016-04-06,2016-06-08,"Kadokawa Shoten, DAX Production, Nippon Columbia","Funimation, Crunchyroll",Studio Deen,Manga,"Boys Love, Comedy, Drama, Romance, Slice of Life",Unknown,Unknown,24.0,PG-13 - Teens 13 or older,6.891,72434.0,43692.0,1428,134679,1049
33605,Ling Qi,灵契,Spiritpact,"Low on luck after a series of unfortunate events, You Keika works part-time to try bringing himself out of a life of poverty. After a strange encounter with a white-haired man in a junkyard, You wakes up to discover that he was killed in a sudden accident and has become a spirit. The man he had encountered, Tanmoku Ki, is revealed as the 13th Youmeshi of the Tanmoki, the highest-ranking exorcist family of China. Noticing the wandering spirit, he offers You the opportunity to form a pact: he will offer You protection from humans and in return, You will have to become his spirit shadow, keeping him safe and guarded at all times.

From then on, the two face untold challenges in the spiritual world, striving to keep those around them safe from harmful spirits. Along the way, the pact they formed grows into something more; a bond that neither of the two ever expected. Behind their roles as master and servant, a lingering admiration begins to emerge.

[Written by MAL Rewrite]",ONA,20.0,Finished Airing,2016-06-21,2016-11-01,Tencent Animation & Comics,Unknown,Haoliners Animation League,Web manga,"Action, Boys Love, Comedy, Supernatural",Unknown,Unknown,14.0,PG-13 - Teens 13 or older,7.181,29051.0,30982.0,2032,83426,440
33392,Gakuen Handsome,学園ハンサム,Gakuen Handsome,"High school student Yoshiki Maeda is starting a new year in the all-boys Baraman High School. On the first day, Yoshiki reconnects with his childhood friend, Takuya Saotome, and meets his odd and dramatic homeroom teacher, Teruhiko Saionji. Yoshiki's younger sister, Yuu, is aware of many of these handsome boys and seems to take pleasure in teasing her big brother about them.

Yoshiki soon discovers a number of stereotypical romance characters and has no choice but to deal with their outright ludicrous and nonsensical boys' love antics.

[Written by MAL Rewrite]",TV,12.0,Finished Airing,2016-10-04,2016-12-20,Unknown,Unknown,Team YokkyuFuman,Game,"Boys Love, Comedy","Parody, School",Unknown,3.0,PG-13 - Teens 13 or older,6.711,19934.0,52662.0,3129,38756,294
33457,Gakuen Handsome Special,学園ハンサム,Unknown,Unaired episode 12.5 included with the Blu-ray Disc/DVD release. ,Special,1.0,Finished Airing,2016-12-20,,Unknown,Unknown,Team YokkyuFuman,Game,"Boys Love, Comedy","Parody, School",Unknown,3.0,PG-13 - Teens 13 or older,5.511,596.0,110792.0,9538,2435,3
34659,Otokonoko ♂ Delivery,オトコのコ♂デリバリー,Unknown,Shuuji finds out his classmate takes on a job as a crossdresser and gets interested in joining him.,OVA,1.0,Finished Airing,2016-12-31,,Studio 9 Maiami,Unknown,Studio Zealot,Original,"Boys Love, Hentai",Unknown,Unknown,18.0,Rx - Hentai,5.771,5678.0,,5291,12112,77
33013,Super Lovers OVA,SUPER LOVERS（スーパーラヴァーズ）,Unknown,Bundled with manga's tenth and eleventh volume.,OVA,2.0,Finished Airing,2017-01-01,2017-09-01,Kadokawa Shoten,Funimation,Studio Deen,Manga,"Boys Love, Comedy, Drama, Romance, Slice of Life",Unknown,Unknown,23.0,PG-13 - Teens 13 or older,7.291,10739.0,25092.0,3607,29391,61
33417,Super Lovers 2,SUPER LOVERS（スーパーラヴァーズ） 2,Super Lovers 2,Second season of Super Lovers.,TV,10.0,Finished Airing,2017-01-12,2017-03-16,"Kadokawa Shoten, Movic, AT-X, DAX Production, Nippon Columbia, KlockWorx, Sony Music Communications, Tokyo MX, Lawson HMV Entertainment, TV Saitama",Unknown,Studio Deen,Manga,"Boys Love, Comedy, Drama, Romance, Slice of Life",Unknown,Unknown,24.0,PG-13 - Teens 13 or older,7.141,43537.0,32882.0,2028,83582,328
34535,Koisuru Shirokuma,恋するシロクマ,Koi Suru Shirokuma,"A polar bear falls in love with an earless seal, and he wants nothing else except to protect him, even though the seal constantly thinks the bear will eat him.

(Source: ANN)",Movie,21.0,Finished Airing,2017-03-04,2020-01-01,Unknown,Unknown,Gathering,Manga,"Boys Love, Comedy",Anthropomorphic,female,39.0,G - All Ages,6.621,1254.0,57032.0,6637,6892,20
51187,Wo Jia Yezhu Hui Zuo Yao,我家业主会作妖,My Handsome Fairy Manager,Unknown,ONA,6.0,Finished Airing,2017-06-13,2017-07-19,Unknown,Unknown,Unknown,Web manga,"Boys Love, Comedy, Supernatural",Unknown,Unknown,2.0,PG-13 - Teens 13 or older,,,159732.0,15077,370,0
33654,Hitorijime My Hero,ひとりじめマイヒーロー,Hitorijime My Hero,"Masahiro Setagawa is a hopeless teenager who is often used by the neighborhood bullies as an errand boy. Defenseless, Masahiro knows that nobody will ever save him. However, his life drastically changes when he meets Kousuke Ooshiba, a man known as the ""Bear Killer,"" who takes down neighborhood gangs.

A year later, Masahiro and his former friend, Kensuke Ooshiba, attend high school, only to find that Kousuke is their math teacher. While the three grow closer, Masahiro starts to view Kousuke as his ""hero,"" and Kousuke develops an urging desire to protect Masahiro. However, their normal lives take a turn when Kensuke's childhood friend, Asaya Hasekura, returns, seeing Kensuke as more than just a friend, much to his surprise. Will the three boys be able to live a regular high school life? Or will forbidden love keep them apart forever?

[Written by MAL Rewrite]",TV,12.0,Finished Airing,2017-07-08,2017-09-23,"Sotsu, AT-X, Tokyo MX, Avex Pictures, Q-Tec, Docomo Anime Store, Marine Entertainment, Kanon Sound, Contents Seed, Ichijinsha, BS NTV",Sentai Filmworks,Encourage Films,Manga,"Boys Love, Drama, Romance, Slice of Life",School,Unknown,24.0,PG-13 - Teens 13 or older,7.331,74338.0,23092.0,1309,151370,1296
40491,Hyperventilation,과호흡 (過呼吸),Unknown,"Lee Myeongyi has lived his whole life with pneumothorax—a collapsed lung. He despises the attention he draws at school with his bouts of loud hyperventilating, extended coughing fits, and exemption from physical education as well as military service. Whether suffering through the curiosity or ire of his classmates, Myeongyi is left feeling like a complete outcast. However, the class president Han Seonho often shows Myeongyi kindness and understanding. With his friendly gestures and handsome looks, he becomes Myeongyi's first crush.

Nine years later, Myeongyi attends his high school reunion for only one reason: to see Han Seonho once again. He holds a tiny glimmer of hope about the other man's feelings for him—but after seeing the bright gold ring on Seonho's left hand and listening to their classmates' prying questions, that hope is quickly dashed. Excusing himself to go take a smoke, regardless of the state of his lungs, Myeongyi is followed outside by Seonho. Unexpectedly, that marks the beginning of their illicit love affair.

[Written by MAL Rewrite]",ONA,6.0,Finished Airing,2017-10-11,,Unknown,Unknown,Unknown,Other,"Boys Love, Drama, Romance",Unknown,Unknown,3.0,R+ - Mild Nudity,7.171,9892.0,31382.0,4163,21510,106
50201,Namui BL Manhwa Animation,남의 BL만화’ 애니메이션,Someone Else's BL Cartoon,"Seunghee may seem like a regular high school boy, but he's got a few secrets: he loves to cross-dress and read BL comics. He's looking for a match that will accept him, but it's classmate Seungtaek who spies him on a date gone bad. Now that someone at school knows he's gay, can Seunghee's life remain ordinary the way he likes it?

(Source: TappyToon)

Namui BL Manhwa Animation is a Korean web adaptation of bbobariee's Manhwa made by BOOKCUBE Studio.",ONA,12.0,Finished Airing,2018-01-11,2018-06-14,Unknown,Unknown,Unknown,Web manga,"Boys Love, Comedy, Drama, Romance, Slice of Life",School,Unknown,3.0,PG-13 - Teens 13 or older,5.421,173.0,113652.0,13056,685,4
36522,Ling Qi 2,灵契 2,Spiritpact Bond of the Underworld,"In this new season, we will discover the backstory of Tanmoki and who will learn through his memories who was his ancestor Rakugetsu.

(Source: ANN)",TV,12.0,Finished Airing,2018-02-23,2018-05-11,Tencent Animation & Comics,Unknown,Haoliners Animation League,Web manga,"Action, Boys Love, Comedy, Supernatural",Unknown,Unknown,24.0,PG-13 - Teens 13 or older,7.501,16987.0,16912.0,2969,42559,197
37408,Taishou Mebiusline: Chicchai-san - You and I,大正メビウスライン ちっちゃいさん,Unknown,Special episode of Taishou Mebiusline: Chicchai-san.,Special,1.0,Finished Airing,2018-02-28,,Unknown,Unknown,Studio A-CAT,Visual novel,Boys Love,Historical,Unknown,4.0,PG-13 - Teens 13 or older,4.831,1036.0,126272.0,8844,3149,2
37563,Di Wang Gong Lue,帝王攻略,The Emperor's Strategy,"At the age of 18, Chu Yuan faces tremendous pressure to prove his competence as the new emperor of Chu State. He must be careful with his decisions, especially with the ongoing unrest at the borders of Chu and Xinan. However, the matter is taken from his hands when Duan Baiyue—the young Xinan King—puts an end to the rebellion himself. His aid spares Chu Yuan an insurmountable amount of grief, and the people of Chu now hail Duan Baiyue as their hero.

Two years later, Xinan's influence has grown, stirring rumors that Duan Baiyue intends to take over Chu State soon. As he stands before a winter plum tree, a furious Chu Yuan does not know what to think and recalls a promise made long ago. The tension reaches a breaking point when a visiting duke of Ahnu, an ally of Chu State, is found dead in the streets of Chu.

[Written by MAL Rewrite]",ONA,20.0,Finished Airing,2018-04-30,2018-09-10,Tencent Penguin Pictures,Unknown,Seven Stone Entertainment,Novel,"Adventure, Boys Love, Drama, Mystery","Historical, Martial Arts",Unknown,16.0,PG-13 - Teens 13 or older,6.441,1678.0,67192.0,5827,9523,41
37291,Mo Ri Shu Guang,末日曙光,Dawn of the World,"In the year of 2013, the tide of zombies outbreak exploded in everyone's homeland, humanity launches a large-scale battle in the endless nights awaiting for the arrival of the dawn.

The end is approaching, is there going to be a way out for them? 
Their faiths were shattered into pieces and buried in ashes in the raging fire. But within the blazing fire, a newborn hope arise once again.

(Source: polarbearadise)",ONA,20.0,Finished Airing,2018-05-20,2018-09-23,Tencent Penguin Pictures,Unknown,Dawn Animation,Novel,"Action, Boys Love, Horror, Supernatural, Suspense",Psychological,Unknown,17.0,R - 17+ (violence & profanity),6.051,423.0,87622.0,7666,4848,11
37963,Caramel Honey,からめるハニー,Unknown,"Ayato transfers into a new school hoping for a fresh start.
Sadly for him, the school turns up to be filled with delinquents, and the most feared of them all has his eye set on him.
And it doesn't help, that whenever Ayato accidentally takes off his glasses, everyone around him suddenly becomes completely smitten by him.

(Source: MU)
",ONA,30.0,Finished Airing,2018-06-08,2018-08-24,Production I.G,Unknown,Anime Beans,Manga,"Boys Love, Comedy",School,Unknown,2.0,PG-13 - Teens 13 or older,6.791,4112.0,48412.0,5049,13494,33
49059,Unbelievable Space Love,언빌리버블 스페이스 러브,Unknown,"Gazing at the scenic view of the sky, a man is joined by a stranger who informs him that he is in a dream. Unable to recall the memories of his life, he relies on the visitor to take him on a journey of discovery. Revealing everything—from their seven-year relationship to the emotional hardships they faced together—the two rekindle their bond severed by time. Behind this beautiful love story, however, lies a much darker truth.

[Written by MAL Rewrite]
",ONA,10.0,Finished Airing,2018-07-17,2018-08-07,Unknown,Unknown,Unknown,Original,"Boys Love, Drama, Romance, Sci-Fi",Unknown,Unknown,1.0,PG-13 - Teens 13 or older,6.701,873.0,53192.0,9634,2362,10
38217,"Wei, Kanjian Erduo La!",喂，看見耳朵啦！,Unknown,The cute story of the daily life between a guy and his cat-boy roommate.,ONA,12.0,Finished Airing,2018-08-25,2018-11-03,"bilibili, Alchemy Bros.",Unknown,monofilmo,Web manga,"Boys Love, Comedy, Slice of Life",Unknown,Unknown,3.0,PG-13 - Teens 13 or older,7.251,7784.0,27202.0,4634,16911,93
38250,Xiao Lu He Xiao Lan,小绿和小蓝,Beryl and Sapphire,"""I've been holding a few words back for a long time — I like you!""
""Beryl and Sapphire"" is a popular manhua created by artist Ocarina. Here includes protagonists with the most random names in history  — the mild-mannered Beryl (Green) and the easily-embarrassed Sapphire (Blue). At times the closest of friends, at others the worst of enemies… In this donghua where each episode is set in a different world, how would they encounter each other time and again?? Only angst? Too painful! Nothing but fluff? Too sugary! Come watch B&S, the show where you'll never guess the ending…

(Source: Guodong Subs)",ONA,72.0,Finished Airing,2018-08-27,2019-02-16,"Haoliners Animation League, Tencent Animation & Comics",Unknown,Unknown,Web manga,"Boys Love, Comedy, Drama, Sci-Fi, Slice of Life","School, Strategy Game",Unknown,8.0,PG-13 - Teens 13 or older,7.381,1651.0,21212.0,6164,8304,89
37585,Yarichin☆Bitch-bu,ヤリチン☆ビッチ部,Unknown,"Takashi Toono was unsure what to expect when he transferred to Morimori Academy, a private all-boys boarding school located deep in the mountains. However, it's no different from any other boys' school, and since he entered halfway through the year, he feels like an outcast—until the bright and friendly Kyousuke Yaguchi introduces himself. 

Due to the school's compulsory club policy, Toono chooses to join the low-effort ""Photography Club,"" but the club is not what it seems. Nicknamed the ""Yarichin Bitch Club,"" its members offer sexual services to pent-up boys at the academy—for no reason other than a love of sex. What's worse is his monthly sex quota—and the punishment for failure is severe: the club will forcefully take his innocence. However, as time runs out, Toono is left mortified and out of options. 

At Toono's side throughout his ordeal is Yaguchi, as well as Yuu Kashima—a fellow transfer student and club member who shares Toono's predicament. While the first years in the club struggle with their sticky dilemma, the club collectively has to deal with sex, secrets, and even stalkers!

[Written by MAL Rewrite]",OVA,2.0,Finished Airing,2018-09-21,2019-04-17,TOHO animation,Unknown,GRIZZLY,Manga,"Boys Love, Comedy, Erotica",School,Unknown,26.0,R+ - Mild Nudity,6.201,54137.0,,1876,94551,791
37597,Dakaretai Otoko 1-i ni Odosarete Imasu.,抱かれたい男1位に脅されています。,DAKAICHI -I'm being harassed by the sexiest man of the year-,"Takato Saijou has held the title of ""Sexiest Man of the Year"" for five years running. He is an accomplished actor, with 20 years of experience under his belt, and is aware his good looks are well above average. Proud of his career, Takato regards the title as an appropriate indicator of his success.

But when his reign is ended by acting newbie Junta Azumaya, who debuted only three years ago, Takato's initial shock gives way to jealous hostility. Even in the new drama that he has been cast in, Junta seems to have suddenly surpassed him; snatching Takato's usual spot of lead actor, Junta continually manages to get on his nerves. Most infuriating of all are the bright smile and kind words that accompany everything Junta does.

All this animosity comes to a head, however, when Junta catches Takato in a rather vulnerable drunken state. Endangering his own public image, Takato confronts the junior actor with harsh words and angry comments—an opportunity Junta takes every advantage of. With the famous actor Takato Saijou now on video picking a fight with a co-star, Junta has the perfect means to blackmail him.

Asking the price of his enemy's silence, Takato is shocked to find that his motivation lies far from advancing his career; instead, Junta's terms are those that can only be realized in the bedroom!

[Written by MAL Rewrite]
",TV,13.0,Finished Airing,2018-10-06,2018-12-29,"Aniplex, Movic, Libre, animate",Aniplex of America,CloverWorks,Manga,"Boys Love, Comedy, Drama",Unknown,Unknown,23.0,PG-13 - Teens 13 or older,7.411,69540.0,19712.0,1401,138144,1680
38797,"Papa datte, Shitai","パパだって, したい",Even a Dad Still Wants It...,"Asumi Kouya is a college student who wants to earn some extra money. Utilizing his talents for cooking and cleaning, he accepts a part-time job as a housekeeper. His employer is single father Keiichi Naruse, an attractive young man with a troubling history regarding his former staff.

Naruse's time is constantly dominated by work and his adorable son Ichika, and he rarely gets time to himself. Cleaning the man's room, Asumi gets a startling insight into just how frustrating the life of a single parent can be. He finds a pile of adult videos, which results in plenty of implications.

Despite Naruse being a man, Asumi finds himself completely drawn in by his employer's beautiful face and gentle personality. With the promise of allowing the frustrated father sexual relief, Asumi's life as part of this small family has only just begun.

[Written by MAL Rewrite]",ONA,8.0,Finished Airing,2019-01-07,2019-02-25,"Picante Circus, Suiseisha",Unknown,Magic Bus,Manga,"Boys Love, Hentai",Unknown,Unknown,6.0,Rx - Hentai,5.981,13618.0,,3574,29755,101
51035,Nanyou Zong Zai Xiuluochang,男友总在修罗场,My Boyfriend's Love Complex,Unknown,ONA,6.0,Finished Airing,2019-01-15,2019-02-19,Unknown,Unknown,Unknown,Manga,"Boys Love, Comedy",School,Unknown,3.0,PG-13 - Teens 13 or older,,,137712.0,14752,400,0
51915,19 Tian,19天 漫动画,Unknown,Unknown,ONA,60.0,Finished Airing,2019-01-28,2019-04-22,Shenfan Animation,Unknown,Unknown,Web manga,"Boys Love, Comedy",Unknown,Unknown,1.0,PG-13 - Teens 13 or older,6.291,170.0,75482.0,11989,971,14
39380,"Wei, Kanjian Erduo La! 2",喂，看见耳朵啦 第二季,Unknown,"Second season of Wei, Kanjian Erduo La!.",ONA,12.0,Finished Airing,2019-02-02,2019-04-13,"bilibili, Alchemy Bros.",Unknown,monofilmo,Web manga,"Boys Love, Comedy, Slice of Life",Unknown,Unknown,3.0,PG-13 - Teens 13 or older,7.361,4657.0,22042.0,5966,9001,30
