ID,Title,Japanese,English,Synopsis,Type,Episodes,Status,Start_Aired,End_Aired,Producers,Licensors,Studios,Source,Genres,Themes,Demographics,Duration_Minutes,Rating,Score,Scored_Users,Ranked,Popularity,Members,Favorites,year
38161,Kabukichou Sherlock,歌舞伎町シャーロック,Case File nº221 Kabukicho,"In Shinjuku ward's east side lies Kabukichou, a vibrant city of chaos that glows brilliantly with neon lights but also hides unseen darkness. Employed at a university hospital on the west side, John H. Watson is looking for someone who can assist him with an odd case. His search leads him to the Pipe Cat, an underground bar that serves as a meetup venue and job board for some of the best detectives in Shinjuku, the most prominent among them being Sherlock Holmes.

Upon finding the bar and meeting the peculiar investigators, John learns that they are pursuing a case involving Jack the Ripper, an infamous serial killer. Due to subsequent events, John ends up driving Sherlock to the crime scene of a murder supposedly carried out by Jack the Ripper. Even though John is only there to enlist Sherlock's help with his case, he witnesses Sherlock brilliantly uncover the truth behind the crime scene. However, he begins to realize that Sherlock is not only a genius detective but also an eccentric character.

As John continues to request Sherlock to assist him with his case, he finds himself spiraling into the detective lifestyle of solving cases beyond the minds of ordinary civilians. Through this work, John begins to see the true colors of the chaotic city that is Kabukichou and starts to unravel the unsettling mystery behind his own case.

[Written by MAL Rewrite]",TV,24.0,Finished Airing,"Oct 12, 2019","Mar 28, 2020","Mainichi Broadcasting System, Movic, Glovision, DMM pictures, Kadokawa",Funimation,Production I.G,Original,"Comedy, Drama, Mystery",Unknown,Unknown,24.0,R - 17+ (violence & profanity),6.891,23384.0,43972.0,2092,78527,187,2019.0
5763,Uchuu Kuubo Blue Noah,宇宙空母ブルーノア,Space Carrier Blue Noah,"Set in the year 2052, Earth has managed to find peace until the arrival of the Death Force - ruthless aliens from a dying solar system - who are desperately searching for a new home. Attacking the Earth with a massive satellite ship called Terror Star, the aliens proceed to terraform the planet to make it their own. For mankind there is one hope: it's up to Colin Collins and a small band of his fellow surviving students to crew a top-secret submersible vessel that can fight the invaders at sea or in space.",TV,24.0,Finished Airing,"Oct 13, 1979","Mar 30, 1980",Unknown,Unknown,Academy Productions,Original,"Action, Drama, Sci-Fi","Military, Space",Unknown,26.0,PG - Children,6.501,475.0,63842.0,10366,1820,1,1979.0
2921,Ashita no Joe 2,あしたのジョー２,Tomorrow's Joe 2,"Yabuki Joe is left downhearted and hopeless after a certain tragic event. In attempt to put the past behind him, Joe leaves the gym behind and begins wandering. On his travels he comes across the likes of Wolf Kanagushi and Goromaki Gondo, men who unintentionally fan the dying embers inside him, leading him to putting his wanderings to an end. His return home puts Joe back on the path to boxing, but unknown to himself and his trainer, he now suffers deep-set issues holding him back from fighting. In attempt to quell those issues, Carlos Rivera, a world renowned boxer is invited from Venezuela to help Joe recover.",TV,47.0,Finished Airing,"Oct 13, 1980","Aug 31, 1981",Annapuru,Unknown,Tokyo Movie Shinsha,Manga,"Action, Drama, Slice of Life, Sports",Combat Sports,young boy,24.0,PG-13 - Teens 13 or older,8.711,17003.0,482.0,2925,43615,2209,1980.0
2203,Waga Seishun no Arcadia: Mugen Kidou SSX,わが青春のアルカディア・無限軌道ＳＳＸ,Endless Orbit SSX,"At the end of Arcadia of My Youth Capitain Harlock and the crew of the space ship Arcadia had been banished from Earth. The Earth, as well as many other planets in the universe had been taken over by the Illumidus, a race of destructive humanoids who ruin, enslave or destroy almost any inhabitable planet they come across. In ""Endless Orbit SSX"" Harlock battles the Illumidus while searching for a mythical ""Planet of Peace"" where all the peoples of the universe can live freely and without war.

(Source: Wikipedia)",TV,22.0,Finished Airing,"Oct 13, 1982","Mar 30, 1983",TBS,Discotek Media,Toei Animation,Unknown,"Action, Adventure, Drama, Sci-Fi",Space,Unknown,25.0,PG-13 - Teens 13 or older,7.371,2180.0,21432.0,6826,6416,35,1982.0
10709,Manga Nihon Keizai Nyuumon,マンガ日本経済入門,Unknown,"Depiction of Japan's economy, based on Shoutarou Ishinomori's epynomous manga.",TV,25.0,Finished Airing,"Oct 13, 1987","Mar 29, 1988",TV Tokyo,Unknown,Knack Productions,Manga,"Drama, Slice of Life","Educational, Historical",teenager,25.0,PG-13 - Teens 13 or older,,,132772.0,14207,464,1,1987.0
394,Ai Yori Aoshi: Enishi,藍より青し～縁～,Ai Yori Aoshi Enishi,"Two years after meeting Aoi, Kaoru and gang are still up to their normal habits. Kaoru now in grad school and the tenants being as rowdy as ever what will become of Aoi and Kaoru's love.

Two years has passed since Aoi and Kaoru were freed from the bonds of their families. They continue to live their normal lives with their usual friends in their house.",TV,12.0,Finished Airing,"Oct 13, 2003","Dec 29, 2003","Geneon Universal Entertainment, Rondo Robe, Movic, Cosmic Ray","Funimation, Geneon Entertainment USA",J.C.Staff,Manga,"Comedy, Drama, Romance, Slice of Life",Harem,teenager,23.0,PG-13 - Teens 13 or older,7.121,31538.0,33702.0,2544,56553,82,2003.0
1592,Hataraki Man,働きマン,Unknown,"Hiroko Matsukata is a woman who works for a magazine company. She puts all she has into her work, and is known as a strong, straight-forward working girl, who can at will turn herself into Hataraki man (working man) mode. Despite Hiroko's success at work, her life lacks romance. Even though a hard worker, she'd leave early anytime to go on a date. Too bad her boyfriend is even bigger a workaholic than Hiroko.

(Source: ANN)",TV,11.0,Finished Airing,"Oct 13, 2006","Dec 22, 2006","Dentsu, SKY Perfect Well Think, Kodansha, Fuji TV, Asmik Ace, Sony Music Entertainment",Maiden Japan,Gallop,Manga,"Comedy, Drama, Romance, Slice of Life",Workplace,teenager,22.0,PG-13 - Teens 13 or older,7.001,7362.0,39152.0,3973,23894,58,2006.0
34542,Inuyashiki,いぬやしき,Inuyashiki Last Hero,"Ichirou Inuyashiki is a 58-year-old family man who is going through a difficult time in his life. Though his frequent back problems are painful, nothing hurts quite as much as the indifference and distaste that his wife and children have for him. Despite this, Ichirou still manages to find solace in Hanako, an abandoned Shiba Inu that he adopts into his home. However, his life takes a turn for the worse when a follow-up physical examination reveals that Ichirou has stomach cancer and only three months to live; though he tries to be strong, his family's disinterest causes an emotional breakdown. Running off into a nearby field, Ichirou embraces his dog and weeps—until he notices a strange figure standing before him.

Suddenly, a bright light appears and Ichirou is enveloped by smoke and dust. When he comes to, he discovers something is amiss—he has been reborn as a mechanized weapon wearing the skin of his former self. Though initially shocked, the compassionate Ichirou immediately uses his newfound powers to save a life, an act of kindness that fills him with happiness and newfound hope.

However, the origins of these strange powers remain unclear. Who was the mysterious figure at the site of the explosion, and are they as kind as Ichirou when it comes to using this dangerous gift?

[Written by MAL Rewrite]",TV,11.0,Finished Airing,"Oct 13, 2017","Dec 22, 2017","Aniplex, Dentsu, Kodansha, Fuji TV, DMM pictures",Unknown,MAPPA,Manga,"Action, Drama, Sci-Fi","Gore, Psychological",teenager,22.0,R - 17+ (violence & profanity),7.651,282743.0,12302.0,321,577639,3472,2017.0
40272,A3! Season Autumn & Winter,A3! SEASON AUTUMN & WINTER,A3! Season Autumn & Winter,"With the completion of the Summer Troupe's show, Izumi Tachibana must now recruit five members for the next sub-troupe, the Autumn Troupe. Luckily, enough people arrive at the audition: Banri Settsu, a talented but boastful jack of all trades; Juuza Hyoudou, a stone-faced delinquent passionate about acting; Taichi Nanao, a man wanting to impress girls through the stage; Omi Fushimi, a college student, amateur photographer, and adept cook; and Sakyou Furuichi, a yakuza member who shares a past connection with the Mankai Company.

But between the non-existent teamwork and multiple threats jeopardizing the show's success, Izumi realizes that the troupe might be more difficult to handle than she first thought. How will she be able to unite them in time for their debut performance?

[Written by MAL Rewrite]",TV,12.0,Finished Airing,"Oct 13, 2020","Dec 29, 2020","Pony Canyon, Infinite",Funimation,"P.A. Works, Studio 3Hz",Game,"Drama, Slice of Life",Unknown,Unknown,23.0,PG-13 - Teens 13 or older,7.311,5711.0,24062.0,4319,19816,152,2020.0
8542,Shin Ace wo Nerae!,新・エースをねらえ!,New Aim for the Ace!,"Heroine, Hiromi Oka, has just entered a high school famous for its tennis club. She has started playing tennis yearning after Madam Butterfly. She was expecting to enjoy playing tennis with her best friend, Maki, but the situation changes when the new coach, Mr. Munakata, suddenly picks out Hiromi to be one of the players for the upcoming tournament and starts giving Hiromi tough lessons. She strives under any circumstance. The more the new coach gives her training, the better she seems to get. Finally she becomes the representative in the junior match tournament.

(Source: TMS Entertainment)

Note: This is not a direct sequel to the first series. Due to an overwhelming success of the classic animated series, AIM FOR THE BEST (Ace wo Nerae), this remake was been produced to retrace and flashback to the original series.",TV,25.0,Finished Airing,"Oct 14, 1978","Mar 31, 1979",Tokyo Movie Shinsha,Unknown,Tohokushinsha Film Corporation,Manga,"Drama, Romance, Sports",School,young girl,25.0,PG-13 - Teens 13 or older,6.761,459.0,49942.0,9525,2440,5,1978.0
1651,Uchuu Senkan Yamato 2,宇宙戦艦ヤマト2,Star Blazers The Comet Empire,"A year has passed since the Star Force returned to save the Earth but another danger now approaches from deep space. A gigantic White Comet hurtles toward our galaxy, obliterating everything in its path. But it is no ordinary comet—it is the deadly Comet Empire, conqueror of worlds... and Earth is the next target! Against orders, the Star Force blasts off to investigate, but even if they can get past the flagship Andromeda, they don't yet know the true nature of their new enemy!

(Source: AniDB)",TV,26.0,Finished Airing,"Oct 14, 1978","Apr 7, 1979","Academy Productions, Yomiuri Advertising",Unknown,Group TAC,Original,"Action, Adventure, Drama, Sci-Fi","Adult Cast, Military, Space",Unknown,24.0,PG-13 - Teens 13 or older,7.421,2664.0,19442.0,6317,7811,25,1978.0
1293,Urusei Yatsura,うる星やつら,Urusei Yatsura,"Not much is notable about the lecherous Ataru Moroboshi, but his extraordinary bad luck sticks out like the horns in an alien's head. When Earth is threatened by a fleet of alien invaders known as the Oni, Ataru is selected to represent humanity in a duel against one of them. It's a stroke of rare luck for Ataru that the duel is in fact a game of tag, and that his opponent is Lum, daughter of the Oni's leader, who places her personal dignity above victory—as Ataru finds out by seizing Lum's bikini top and with it, victory.

However, misfortune kicks in again when Lum mistakes Ataru's promise to marry his girlfriend, Shinobu Miyake, as the desire to wed Lum herself, and decides she rather likes the idea. Wielding her influence as an alien princess, she moves in with him. Forced to deal with the consequences of his womanizing ways, Ataru must balance his crumbling relationship with Shinobu while keeping Lum happy, all the while flirting with every woman he meets.

[Written by MAL Rewrite]",TV,195.0,Finished Airing,"Oct 14, 1981","Mar 19, 1986","Kitty Films, Fuji TV, Shogakukan","AnimEigo, Discotek Media","Pierrot, Studio Deen",Manga,"Action, Adventure, Comedy, Drama, Romance, Sci-Fi",Unknown,Unknown,25.0,PG-13 - Teens 13 or older,7.701,15796.0,11072.0,2162,74303,971,1981.0
160,"Ima, Soko ni Iru Boku",今、そこにいる僕,"Now and Then, Here and There","Shuuzou ""Shuu"" Matsutani lives his ordinary life in peace. He has friends, a crush, and a passion for kendo. Dejected after losing to his kendo rival, Shuu climbs a smokestack to watch the sunset where he finds Lala-Ru, a quiet, blue-haired girl wearing a strange pendant. Shuu attempts to befriend her, despite her uninterested, bland responses.

However, his hopes are crushed when a woman, accompanied by two serpentine machines, appear out of thin air with one goal in mind: capture Lala-Ru. Shuu, bull-headed as he is, tries to save his new friend from her kidnappers and is transported to a desert world, unlike anything he has ever seen before. Yet, despite the circumstances, Shuu only thinks of saving Lala-Ru, until he is thoroughly beaten up by some soldiers. As he soon finds out, Lala-Ru can manipulate water and her pendant is the source from which she is able to bring forth the liquid, a scarce commodity in his new environment. But now, the pendant is lost, and Shuu is the prime suspect.

Ima, Soko ni Iru Boku is the haunting story of a dystopian world, and of Shuu, who has to endure torture, hunger, and the horrors of war in order to save the lonely girl he found sitting atop a smokestack.

[Written by MAL Rewrite]",TV,13.0,Finished Airing,"Oct 14, 1999","Jan 20, 2000","Victor Entertainment, Pioneer LDC, Rakuonsha","ADV Films, Central Park Media",AIC,Original,"Adventure, Drama, Fantasy, Sci-Fi","Isekai, Military",Unknown,25.0,R - 17+ (violence & profanity),7.621,38950.0,13142.0,1469,128894,1094,1999.0
13551,Shuukan Storyland,週刊ストーリーランド,Unknown,"This was an anthology program containing several different anime each week along with some non-animated segments. Several of the animated films were short series including: Nazo no Rouba [謎の老婆] (tvss), Meibugyou Bun-san [名奉行・文さん], Jo Keibu Jinguuji Youko [女警部・神宮寺葉子], Remon Suzumori's Soudanjo [鈴森なんでも相談所].

(Source: animated-divots.net)",TV,56.0,Finished Airing,"Oct 14, 1999","Sep 13, 2001",Nippon Television Network,Unknown,Satelight,Original,"Comedy, Drama, Slice of Life",Unknown,teenager,25.0,PG-13 - Teens 13 or older,,,151102.0,13243,641,1,1999.0
193,Maburaho,まぶらほ,Maburaho,"In the world of Maburaho, everyone is born with the ability to use magic and are thus labeled magicians. However, the magical ability of each person is not equal. The number of times you can use magic determines the amount of respect you receive, and since one’s magical power is determined at birth by traits and genetics, those who have a bloodline stemming from famous magicians are highly sought after.

Having the lowest magic count in Aoi Academy, Kazuki Shikimori is looked down upon by his classmates and seen as a nearly worthless magician. However, his bloodline consists of many great magicians throughout the ages, meaning that while he may not be a great magician, his offspring could be. This leads to him being sought after by three different young women: Yuna Miyama, a transfer student who declares herself his wife upon arrival, Rin Kamishiro, a prideful swordswoman of a traditional family who wants to kill him so she will be free to pursue her own desires, and Kuriko Kazetsubaki, a member of an influential family who bluntly tries to seduce him for his genes.

Now he has to deal with not only the jealousy of all the guys in his school, but also various women chasing after him!",TV,24.0,Finished Airing,"Oct 14, 2003","Apr 6, 2004","Kadokawa Shoten, KlockWorx, Happinet Pictures, Sony PCL",ADV Films,J.C.Staff,Light novel,"Comedy, Drama, Romance, Ecchi","Harem, School",Unknown,24.0,R+ - Mild Nudity,6.751,47422.0,50502.0,1891,93371,213,2003.0
322,Paradise Kiss,Paradise kiss,Paradise Kiss,"On her way home from school, Yukari Hayasaka is approached by a weird-looking guy who starts looking at her body intently. He's got blond spiky hair, a spiked choker, and multiple piercings on his ears and face. She wants nothing to do with him, and runs away, only to bump into a very tall and beautiful purple-haired woman with a flower pattern around her eye. Yukari faints from shock and wakes up later in a strange place called the Atelier. It turns out that these strangers are fashion designers who attend the most famous art school around, Yazawa Art Academy, and their group wants Yukari to model for their brand in Yazawa Academy's upcoming show.

Yukari turns down their offer and escapes the Atelier, but unknowingly leaves her school ID behind. George Koizumi, the head designer, later sees it and immediately knows she would be the perfect model for them and will not stop until he gets what he wants—and he wants her. Yukari had never considered something as frivolous as modeling before, but could life among these eccentric designers actually prove to be fun? Or will Yukari lose herself in this world of art and passion?

[Written by MAL Rewrite]
",TV,12.0,Finished Airing,"Oct 14, 2005","Dec 30, 2005","Aniplex, Dentsu, Fuji TV, Shodensha",Geneon Entertainment USA,Madhouse,Manga,"Comedy, Drama, Romance, Slice of Life",Visual Arts,female,24.0,R - 17+ (violence & profanity),7.851,88762.0,8002.0,1020,200042,3773,2005.0
2562,Shion no Ou,しおんの王 - The Flowers of Hard Blood,The Flowers of Hard Blood,"Shion no Ou follows the story of Yasuoka Shion, a 13-year-old Shougi player with a past of tragedy. Shion's parents were brutally murdered in front of her when she was 5 years old. The murderer sat down with her and challenged her to a game of Shougi, after telling her that if she wanted to stay alive she should forget how to speak, and forget what happened that night. 

Now Shion has entered the realm of female pro Kishi, mute but strong. As her playing gathers more and more attention, so do the questions about her past and the brutal murder she witnessed. Shion's memories slowly come back, and the mystery begins to unravel, thread by thread. ",TV,22.0,Finished Airing,"Oct 14, 2007","Mar 23, 2008","Yomiko Advertising, Pony Canyon, Fuji TV, DAX Production",Unknown,Studio Deen,Manga,"Drama, Mystery, Suspense",Strategy Game,Unknown,23.0,PG-13 - Teens 13 or older,7.521,10664.0,16242.0,3516,30737,86,2007.0
10793,Guilty Crown,ギルティクラウン,Guilty Crown,"On December 24, 2029—the day colloquially known as the ""Lost Christmas""—the Apocalypse Virus spread across Japan, bringing death to its citizens and plunging the country into utter chaos. In an effort to establish order, the United Nations sends the GHQ to assist with the crisis by containing the outbreak while removing all political autonomy in the process. A decade later, the country still lives under their control, unable to break free from their draconian rule.

Frustrated with the state of the nation, a resistance group named the Funeral Parlor aims to liberate Japan from the GHQ. Led by the charismatic Gai Tsutsugami, the group plots to steal a vial containing the ""Void Genome"" to further their goals. The vial falls into the hands of internet vocalist Inori Yuzuriha, who ends up being hunted by the GHQ's Anti-Bodies forces. Having nowhere to go, she seeks refuge in a warehouse where she meets Shuu Ouma—a socially awkward high school student who is a huge fan of her music.

Shuu gets dragged into the conflict the moment he rescues Inori, and the Void Genome shatters in his hand, granting him the ""Power of the Kings."" While learning how to control his grand new ability, Shuu must now fight to liberate Japan from its cruel oppressors.

[Written by MAL Rewrite]
",TV,22.0,Finished Airing,"Oct 14, 2011","Mar 23, 2012","Aniplex, Dentsu, Movic, Fuji TV, Fujipacific Music, 1IN",Funimation,Production I.G,Original,"Action, Drama, Sci-Fi","Mecha, Romantic Subtext, Super Power",Unknown,24.0,R - 17+ (violence & profanity),7.431,603562.0,19212.0,101,1138081,16684,2011.0
32948,Fune wo Amu,舟を編む,The Great Passage,"Kouhei Araki, a veteran editor of the dictionary editorial division at Genbu Publishing, plans to retire in order to better care for his ailing wife. However, before retiring, he must find a replacement to complete his latest project: a new dictionary called The Great Passage. But no matter where he looks, he cannot find anyone suitable, as making a dictionary requires a wealth of patience, time, and dedication.

Mitsuya Majime works in Genbu Publishing's sales division, yet he has poor social skills and an inability to read the mood in most situations. In spite of this, he excels at having an enthusiasm for words thanks to his love of reading and careful personality. It is these skills that draw Araki to him and prompt him to offer Majime a position in the dictionary editorial department. As Majime accepts his new position, he finds himself unsure of his abilities and questioning whether he will fit in with his new co-workers. Yet amid the vast sea of words, The Great Passage will bring them together.

[Written by MAL Rewrite]",TV,11.0,Finished Airing,"Oct 14, 2016","Dec 23, 2016","Aniplex, Dentsu, Fuji TV, Kyoraku Industrial Holdings, Kansai Telecasting, Kobunsha",Discotek Media,Zexcs,Novel,"Drama, Romance, Slice of Life",Workplace,Unknown,22.0,PG-13 - Teens 13 or older,7.621,38676.0,13062.0,1662,110972,442,2016.0
35180,3-gatsu no Lion 2nd Season,3月のライオン 第2シリーズ,March Comes In Like A Lion 2nd Season,"Now in his second year of high school, Rei Kiriyama continues pushing through his struggles in the professional shogi world as well as his personal life. Surrounded by vibrant personalities at the shogi hall, the school club, and in the local community, his solitary shell slowly begins to crack. Among them are the three Kawamoto sisters—Akari, Hinata, and Momo—who forge an affectionate and familial bond with Rei. Through these ties, he realizes that everyone is burdened by their own emotional hardships and begins learning how to rely on others while supporting them in return. 

Nonetheless, the life of a professional is not easy. Between tournaments, championships, and title matches, the pressure mounts as Rei advances through the ranks and encounters incredibly skilled opponents. As he manages his relationships with those who have grown close to him, the shogi player continues to search for the reason he plays the game that defines his career.

[Written by MAL Rewrite]",TV,22.0,Finished Airing,"Oct 14, 2017","Mar 31, 2018","Aniplex, Dentsu, NHK, Hakusensha, Asmik Ace, Toy's Factory",Aniplex of America,Shaft,Manga,"Drama, Slice of Life","Childcare, Iyashikei, Strategy Game",teenager,25.0,PG-13 - Teens 13 or older,8.951,181281.0,132.0,533,361815,14417,2017.0
3053,Ganbare! Kickers,がんばれ！キッカーズ,Fight! Kickers,"The Kickers are first and foremost a football team. Actually, they're only playing for their school, but haven't exactly covered themselves with glory. When the new player, Gregor (Daichi Kakeru) arrives at the school, they just had faced a resounding defeat again. However, thanks to Gregor, things are going to change. Highly motivated, they'll try to get rid of their ""always-loser-team"" image. Their strongest enemy are the Devils, who Gregor provokes right from the start. However, it's not all about football. When the captain, Mario (Hongou Masaru), is not pursued by his female fans, the Kickers often hang around and do stuff together.
(Source: AniDB)",TV,23.0,Finished Airing,"Oct 15, 1986","Mar 25, 1987",Nippon Television Network,Unknown,Pierrot,Manga,"Comedy, Drama, Sports",Team Sports,Kids,23.0,G - All Ages,6.831,5590.0,46812.0,6002,8880,34,1986.0
3110,Kaze no Naka no Shoujo: Kinpatsu no Jeanie,風の中の少女 金髪のジェニー,Unknown,"The story begins in a small town, Pennsylvania in 1838. Jeanie MacDowell is a cheerful and beautiful girl with light brown hair. Jeanie enjoys playing the piano and loves taking piano lessons from her mother.

Steven, a good harmonica player, and Bill, a black boy who is very good at playing the banjo, are great friends of Jeanie's. They enjoy playing music together like a small band.

However, Jeanie's happy life changes dramatically after her mother suddenly passes away.

Experiencing many difficulties and learning the importance of life, she decides to devote her life to helping many people suffering from illness.

This series is a highly emotional love story about the relationship between young Stephen Foster, who later becomes a famous composer and author of children's songs, and young Jeanie MacDowell, who becomes Stephen Foster's wife.",TV,52.0,Finished Airing,"Oct 15, 1992","Sep 30, 1993",TV Tokyo,Unknown,Nippon Animation,Unknown,Drama,Historical,Unknown,26.0,G - All Ages,7.001,1026.0,39232.0,8549,3526,13,1992.0
