ID,Title,Japanese,English,Synopsis,Type,Episodes,Status,Start_Aired,End_Aired,Producers,Licensors,Studios,Source,Genres,Themes,Demographics,Duration_Minutes,Rating,Score,Scored_Users,Ranked,Popularity,Members,Favorites,year
34055,Berserk 2nd Season,ベルセルク,Berserk Season II,"Demons have now become commonplace around the kingdom of Midland, which has fallen into chaos. The swordsman Guts still cannot stay in one place for long due to his demonic brand. He could always manage to protect himself when he was alone, but now he has the added challenge of protecting former Commander Casca, a shell of her former self who neither remembers nor trusts him. They never have a moment's rest with the constant threat of demons, and they need a place where Casca will be safe till they find a way to heal her. Their elf ally, Puck, tells of the mystical land of Elfhelm, which is supposed to be a safe haven from the demons that ravage the lands. Tired and with only a vague hope, they struggle on to find a place to live—and they still need to find those responsible for the madness they are forced to endure. 

[Written by MAL Rewrite]
",TV,12.0,Finished Airing,"Apr 7, 2017","Jun 23, 2017","WOWOW, Mainichi Broadcasting System, Hakusensha, Ultra Super Pictures, LIDENFILMS, NBCUniversal Entertainment Japan, Lucent Pictures Entertainment, Docomo Anime Store, Koei Tecmo Games","Funimation, Crunchyroll","Millepensee, GEMBA",Manga,"Action, Adventure, Drama, Fantasy, Horror, Supernatural","Gore, Mythology",Unknown,24.0,R - 17+ (violence & profanity),6.561,88015.0,60392.0,1240,161537,421,2017.0
35928,Devils Line,デビルズライン,Devils' Line,"Vampires walk among society, existing as part of its underbelly. They do not require blood to survive, but extreme emotions can immensely increase their bloodlust, turning them into uncontrollable monsters. Tsukasa Taira, a 22-year-old university student, learns of the existence of vampires when her longtime friend reveals himself to be one of them after a tense confrontation with Yuuki Anzai—a human and vampire hybrid.

Her friend is arrested, and Tsukasa soon finds herself drawn to Anzai, who reluctantly reciprocates her feelings. However, this unconventional romance may prove too difficult to maintain, as Anzai struggles to contain the part of him that wishes to devour Tsukasa.

[Written by MAL Rewrite]",TV,12.0,Finished Airing,"Apr 7, 2018","Jun 23, 2018","Kodansha, King Records",Sentai Filmworks,Platinum Vision,Manga,"Action, Drama, Romance, Supernatural",Vampire,teenager,24.0,R - 17+ (violence & profanity),6.841,102115.0,46062.0,846,241715,1492,2018.0
36565,Major 2nd,メジャーセカンド,Unknown,"Daigo, the son of renowned baseball player Gorou Shigeno, believes he has to live up to his father's name by becoming an all-star player himself. With great dreams, as soon as he reaches fourth-grade, he promptly joins the same little league baseball team his dad played on, the Mifune Dolphins. However, things don't go as planned. After only the first couple of practices, Daigo's lack of talent and inherent baseball sense shows, and his confidence is crushed. Unable to bear the pressure of living up to his father, a baseball prodigy, he quits the team in less than a year.

Two years later, now in sixth-grade, a transfer student joins Daigo's class. This student turns out to be Hikaru, the son of Gorou's lifelong friend and fellow baseball star, Toshiya Satou. One day, Daigo's mother receives a call from the Dolphins requesting players for a game, so she forces Daigo to attend. To Daigo's surprise, he finds Hikaru there. Even more shocking is that despite his father's occupation, Hikaru has never played baseball before!

Unlike Daigo, though, Hikaru immediately picks up the game demonstrating excellent performance. Needless to say, Daigo and Hikaru are polar opposites of each other. But this friction will inevitably thrust both of these inexperienced children into the world their fathers cherish—the world of baseball.

[Written by MAL Rewrite]",TV,25.0,Finished Airing,"Apr 7, 2018","Sep 22, 2018","Shogakukan-Shueisha Productions, NHK, NHK Enterprises",Unknown,OLM,Manga,"Comedy, Drama, Sports",Team Sports,young boy,24.0,PG-13 - Teens 13 or older,7.411,14250.0,19892.0,3490,31148,77,2018.0
36266,Mahou Shoujo Site,魔法少女サイト,Magical Girl Site,"Every day, Aya Asagiri thinks about killing herself. She is bullied relentlessly at school, and at home, her older brother Kaname physically abuses her to relieve the academic stress put on him by their father.

One night, as she lies awake wishing for death, a mysterious website called Magical Girl Site appears on her laptop, promising to give her magical powers. At first, she dismisses it as a creepy prank, but when she finds a magical gun in her shoe locker the next day, she doesn't know what to believe. Deciding to take it with her, she soon runs into her bullies once again. But this time, desperate for anything to save her, she uses the gun—and her assailants are transported to a nearby railroad crossing, where they are run over. 

Aya's conscience is unable to handle the fact that she murdered two of her classmates with magic, and she desperately tries to understand the situation. However, when she finds herself in trouble again, she is saved by Tsuyuno Yatsumura, a classmate who can use magic to stop time. This duo has a lot to do: not only do they have to fight alongside and against other magical girls, but they also need to uncover the truth behind the website and the apocalyptic event known as ""The Tempest"" that is soon to occur.

[Written by MAL Rewrite]",TV,12.0,Finished Airing,"Apr 7, 2018","Jun 23, 2018",Sotsu,Sentai Filmworks,production doA,Manga,"Drama, Horror, Supernatural","Gore, Mahou Shoujo, Psychological",Unknown,24.0,R - 17+ (violence & profanity),6.521,87333.0,62742.0,959,211676,1127,2018.0
37952,Shoumetsu Toshi,消滅都市,Afterlost,"One day, a city suddenly disappears. Takuya, a professional by-the-contract courier and lone wolf, meets Yuki, the only survivor from the city's extinction. The two rely on a message from Yuki's father, who was heard to be missing, and head toward the disappeared city, Lost. 

However, unexpected obstacles strike before the pair, with the reality especially shocking for Yuki. Before them are the feelings of those left behind, a mysterious group manipulating in the shadows, and unveiling the hidden conspiracy. Takuya and Yuki, who both were initially strangers, would deepen their bond during the journey and unravel the mystery of the Lost city. 

(Source: MAL News)",TV,12.0,Finished Airing,"Apr 7, 2019","Jun 23, 2019","Sotsu, Pony Canyon, KlockWorx, Tokyo MX, GREE, Akatsuki",Funimation,Madhouse,Game,"Action, Adventure, Drama, Fantasy, Mystery",Unknown,Unknown,23.0,PG-13 - Teens 13 or older,5.461,18629.0,112512.0,2406,62364,51,2019.0
38080,Kono Oto Tomare!,この音とまれ！,Kono Oto Tomare! Sounds of Life,"Gen Kudou, a koto maker, believes that his delinquent grandson Chika would never understand the profoundness of the traditional musical instrument. In an attempt to make up for his naivety and understand the words of his late grandfather, Chika tries to join the Tokise High School Koto Club. 

Even though the club is in dire need of members, new club president Takezou Kurata is unwilling to easily accept Chika's application due to his bad reputation. Nonetheless, after seeing Chika's seriousness and enthusiasm, Takezou allows the problem child to join, along with koto prodigy Satowa Houzuki and three of Chika's energetic friends. Kono Oto Tomare! follows the merry band of musicians as they aspire to play at the national competition.

[Written by MAL Rewrite]",TV,13.0,Finished Airing,"Apr 7, 2019","Jun 30, 2019","WOWOW, Movic, KlockWorx, Memory-Tech, King Records, Shueisha, Pony Canyon Enterprise",Funimation,Platinum Vision,Manga,"Drama, Romance","Music, Performing Arts, School",young boy,23.0,PG-13 - Teens 13 or older,7.911,101045.0,6892.0,803,252255,2035,2019.0
40417,Fruits Basket 2nd Season,フルーツバスケット 2nd season,Unknown,"A year has passed since Tooru Honda began living in the Souma residence, and she has since created stronger relationships with its inhabitants Shigure, Kyou, and Yuki. She has also grown closer to the rest of the Souma family and has become familiar with their ancestral secret, having helped them with many of their personal issues. The closer Tooru gets, however, the more she begins to realize that their secret holds a darker truth than she first presumed.

Summer is approaching and Tooru is invited to spend her days with the Soumas, mainly Kyou and Yuki. Tooru wishes for an easy-going vacation, but her close relationships with the two boys and the rest of the Soumas may prove to cause trouble. As they grow more intimate, their carefree time together is hindered by older hardships and feelings from the past that begin to resurface. The Eternal Banquet also dawns on the members of the zodiac, and they must tend to their duties alongside the unnerving head of the family, Akito Souma.

With the banquet approaching and a plethora of feelings to be solved, will Tooru's life with the Soumas remain peaceful, or will she find herself in a situation from which she cannot escape?

[Written by MAL Rewrite]",TV,25.0,Finished Airing,"Apr 7, 2020","Sep 22, 2020","TV Tokyo, TV Osaka, Nihon Ad Systems, Hakusensha, Avex Pictures, TMS Music, 8PAN",Funimation,TMS Entertainment,Manga,"Drama, Romance, Supernatural",Unknown,young girl,23.0,PG-13 - Teens 13 or older,8.561,211471.0,882.0,446,422519,5286,2020.0
3819,Sasurai no Taiyou,さすらいの太陽,Nozomi In The Sun,"Two baby girls were born in the same hospital: one of them is the daughter of an aristocratic family while the other belongs to a deprived household which lives in the slums of the city. However, the nurse-in-charge, Michiko, secretly switches the two babies due to a personal grudge, resulting in a change of fates of the girls from then on. Many years later, the lives of the two girls continue to be intertwined with each other, with the rich Miki ill-treating the poor Nozomi, yet both of them hold similar dreams to become a singer.

(Source: ANN)",TV,26.0,Finished Airing,"Apr 8, 1971","Sep 30, 1971",Unknown,Unknown,Mushi Production,Manga,Drama,Music,Unknown,24.0,PG-13 - Teens 13 or older,6.411,366.0,69062.0,10584,1684,7,1971.0
3807,Honoo no Alpenrose: Judy & Randy,炎のアルペンローゼ・ジュディ＆ランディ,Alpenrose,"While Randy was walking through the Swiss countryside he finds a small girl, who seemed to be the only survived person from an airplane crash. The little girl didn’t remember anything, and Randy decided to take care of her and he called her Judy. The both go their childhood together. A few years later, Judy, now 16 years old, wants to find her past. With the help of Randy, she leaves to research her origins. Her single clue is a song that she keeps hearing in her head, the song is called Alpine Rose. At a time of world war, these two young people will have to overcome many obstacles to arrive at their goal in this time of war, with having only each other to comfort and support. the depth of their love.

(Source : ANN)",TV,20.0,Finished Airing,"Apr 8, 1985","Apr 3, 1986",Unknown,Unknown,Tatsunoko Production,Manga,"Drama, Romance",Historical,young girl,22.0,PG-13 - Teens 13 or older,6.671,888.0,54682.0,8841,3150,8,1985.0
677,Sentimental Journey,センチメンタルジャーニー,Unknown,"Sentimental Journey is a collection of twelve short stories about twelve different girls. Though unrelated, there is one common theme that binds the episodes together: each girl's bittersweet experience of first love. 

(Source: ANN)",TV,12.0,Finished Airing,"Apr 8, 1998","Jul 1, 1998",Unknown,Media Blasters,Sunrise,Original,"Drama, Romance",Unknown,Unknown,24.0,PG-13 - Teens 13 or older,6.481,820.0,64832.0,8714,3281,8,1998.0
1846,Princess Nine: Kisaragi Joshikou Yakyuubu,プリンセスナイン 如月女子高野球部,Princess Nine,"Keiko Himuro, Chairman of the Kisuragi School, puts together an all-girl baseball team led by Ryo Hayakawa, daughter of a legendary pitcher, in hopes of proving that girls can compete just as well as boys. Their goal: Koshien Stadium, where only the best teams get the opportunity to play. 

(Source: ANN)",TV,26.0,Finished Airing,"Apr 8, 1998","Oct 14, 1998",NHK,"ADV Films, Nozomi Entertainment",Phoenix Entertainment,Original,"Drama, Romance, Sports",Team Sports,Unknown,25.0,PG-13 - Teens 13 or older,7.181,3683.0,30642.0,5417,11357,43,1998.0
2732,Baby Baachan,ベイベーばあちゃん,Baby Grandma,"Amika is a elementary school student who dreams of becoming an idol. Her grandmother is a harsh yet wealthy woman who lives on a remote island that she owns. When her grandmother passed away, Amika's life begins to appear subtle changes. Not long after the passing of her grandmother, Amika's mother gave birth to a baby girl. Ironically, Amika's little sister looks and behaves exactly like her grandmother.

(Source: ANN)",TV,53.0,Finished Airing,"Apr 8, 2002","Dec 4, 2002","Bandai Visual, NHK, Bandai",Unknown,Unknown,Original,"Comedy, Drama",Unknown,Unknown,7.0,G - All Ages,6.521,251.0,62542.0,12340,869,0,2002.0
167,Scrapped Princess,スクラップド・プリンセス,Scrapped Princess,"Born to the royal family, Pacifica Casull has earned the nickname ""Scrapped Princess"" after an apocalyptic prophecy foretells her destroying the world on her 16th birthday. Rescued from certain death by a kindly family, she takes shelter with her adoptive older brother and sister, Shannon and Raquel Casull. When news of her survival reaches the ears of the God Mauser's worshippers, they issue her death at all costs, forcing Pacifica to flee for her life.

Plagued by threats from the church, the nobility and even the common people, the three siblings attempt to outrun the fate Pacifica is destined to bring, all the while questioning if one girl's life is worth the world's demise. The true nature of the Scrapped Princess, along with the harrowing revelations of the world itself, becomes more and more apparent as the princess' 16th birthday fast approaches.

[Written by MAL Rewrite]",TV,24.0,Finished Airing,"Apr 8, 2003","Oct 7, 2003","Kadokawa Shoten, A-Line","Funimation, Bandai Entertainment",Bones,Light novel,"Adventure, Comedy, Drama, Fantasy, Sci-Fi",Mecha,young boy,23.0,PG-13 - Teens 13 or older,7.381,36766.0,21112.0,1930,90037,413,2003.0
2337,Tetsujin 28-gou (2004),鉄人２８号 (2004),Tetsujin 28,"In post-WWII Japan, Prof. Shikishima has built up Shikishima Industries to be a technological powerhouse, working on developing robots. However, at the heart of their success lurks a dark secret from the war, something that cost the life of Prof. Kaneda, the mentor of Prof. Shikishima. Now Kaneda's son, Shoutarou, is about to learn the truth, and it will change him forever. 

(Source: ANN)",TV,26.0,Finished Airing,"Apr 8, 2004","Sep 30, 2004",Genco,"Discotek Media, Geneon Entertainment USA",Palm Studio,Unknown,"Adventure, Drama, Sci-Fi","Historical, Mecha",young boy,25.0,G - All Ages,7.291,1060.0,25132.0,7703,4786,37,2004.0
942,Nishi no Yoki Majo: Astraea Testament,西の善き魔女 Astraea Testament,The Good Witch Of The West,"On Filiel's 15th birthday, she received her mother's necklace as a memento from her obstinate astronomer father. Her common and tedious life was turned into a life of conspiracies. With her new life, many adventures await.

(Source: ANN)",TV,13.0,Finished Airing,"Apr 8, 2006","Jul 1, 2006","Geneon Universal Entertainment, Mellow Head, Imagica, Mag Garden, Tablier Communications, On The Run",Maiden Japan,Hal Film Maker,Light novel,"Comedy, Drama, Fantasy, Mystery, Romance",Unknown,Unknown,24.0,PG-13 - Teens 13 or older,6.701,5858.0,53042.0,4534,17906,48,2006.0
957,Saiunkoku Monogatari,彩雲国物語,The Story of Saiunkoku,"Shuurei Kou, the daughter of a noble yet impoverished family, is a clever young lady who dreams of becoming a government official and contributing toward her country. However, her dream is out of her reach as such a position is forbidden to women. While her father works a low wage job as an archivist at the palace, Shuurei has to juggle odd jobs to make ends meet. Then, one day, an unexpected visit changes her life. 

Shuurei is called to assist Ryuuki Shi, the new emperor who is known for slacking on his duties and preferring the company of men. Tempted by the generous compensation, she readily accepts the chance to become the young emperor's consort for six months. Luckily, she is not alone as Seiran Shi, her trusty friend, joins her as Ryuuki's bodyguard. While tasked with transforming the new emperor into a responsible ruler, court life and politics prove troublesome as Shuurei faces the challenges of her new life.

Set in a fictional country, Saiunkoku Monogatari centers on the idea of meaningful leadership, its adversities and the rewards that come alongside a prospering nation.

[Written by MAL Rewrite]",TV,39.0,Finished Airing,"Apr 8, 2006","Feb 24, 2007","NHK, Sogo Vision","Funimation, Geneon Entertainment USA",Madhouse,Light novel,"Adventure, Comedy, Drama, Fantasy, Romance","Historical, Reverse Harem",Unknown,25.0,PG-13 - Teens 13 or older,7.891,33684.0,7222.0,1932,89921,1089,2006.0
3457,Vampire Knight,ヴァンパイア騎士〈ナイト〉,Vampire Knight,"The cheerful Yuuki Cross and the gruff Zero Kiryuu are members of the disciplinary committee at Cross Academy, which houses two very distinct classes: the Day Class and the Night Class. Their job consists of upholding order between the classes when they switch out. While that may not seem like an especially difficult task, the Day Class is unaware of the truth behind the Night Class—their utterly gorgeous students are vampires.

Ten years ago, Yuuki was saved from a vampire attack by Kaname Kuran, a Pureblood vampire. Now, Kaname is the leader of the Night Class, and Yuuki's disciplinary committee position allows her to see him again, making her feelings for him grow complicated. Meanwhile, Zero bears a white-hot hatred of all vampires and believes they can never live in harmony with humans. But a secret from Zero's past soon threatens the fragile peace of all at the academy, and things may never be the same again.

[Written by MAL Rewrite]
",TV,13.0,Finished Airing,"Apr 8, 2008","Jul 1, 2008","TV Tokyo, Aniplex, Nihon Ad Systems",VIZ Media,Studio Deen,Manga,"Drama, Mystery, Romance, Supernatural","Love Polygon, Vampire",young girl,24.0,PG-13 - Teens 13 or older,6.901,336207.0,43512.0,326,568117,7164,2008.0
27989,Hibike! Euphonium,響け！ユーフォニアム,Sound! Euphonium,"Now that Kumiko Oumae has enrolled in Kitauji High School, she hopes to forget about her past. Despite her desire for a fresh start, she gets dragged into the school's band club by her new friends—Sapphire Kawashima and Hazuki Katou—and is once again stuck playing the euphonium. 

As the band currently stands, they won't be able to participate in the local festival, Sunfest, let alone compete at a national level. The band's new advisor, Noboru Taki, gives them a choice: they can relax and have fun, or practice hard and attempt to get into nationals. Not wanting to repeat her mistakes from middle school, Kumiko is doubtful as to whether they should try for nationals. Amidst the chaos, she learns that her old bandmate, Reina Kousaka (who she had a bitter relationship with) has joined Kitauji's band club. Under the pressure of Noboru's strict training, Kumiko and her bandmates must learn to overcome their struggles and find success together.

[Written by MAL Rewrite]
",TV,13.0,Finished Airing,"Apr 8, 2015","Jul 1, 2015","Lantis, Pony Canyon, Rakuonsha",Ponycan USA,Kyoto Animation,Novel,Drama,"Music, Performing Arts, School",Unknown,23.0,PG-13 - Teens 13 or older,8.001,175630.0,5652.0,453,417639,6588,2015.0
28623,Koutetsujou no Kabaneri,甲鉄城のカバネリ,Kabaneri of the Iron Fortress,"The world is in the midst of the industrial revolution when horrific creatures emerge from a mysterious virus, ripping through the flesh of humans to sate their never-ending appetite. The only way to kill these beings, known as ""Kabane,"" is by destroying their steel-coated hearts. However, if bitten by one of these monsters, the victim is doomed to a fate worse than death, as the fallen rise once more to join the ranks of their fellow undead.

Only the most fortified of civilizations have survived this turmoil, as is the case with the island of Hinomoto, where mankind has created a massive wall to protect themselves from the endless hordes of Kabane. The only way into these giant fortresses is via heavily-armored trains, which are serviced and built by young men such as Ikoma. Having created a deadly weapon that he believes will easily pierce through the hearts of Kabane, Ikoma eagerly awaits the day when he will be able to fight using his new invention. Little does he know, however, that his chance will come much sooner than he expected...

[Written by MAL Rewrite]",TV,12.0,Finished Airing,"Apr 8, 2016","Jul 1, 2016","Aniplex, Dentsu, Fuji TV, Kyoraku Industrial Holdings, Kansai Telecasting","Funimation, Crunchyroll",Wit Studio,Original,"Action, Drama, Fantasy, Horror, Supernatural",Unknown,Unknown,22.0,R - 17+ (violence & profanity),7.261,398842.0,26872.0,217,743088,3265,2016.0
34338,Lost Song,LOST SONG,Unknown,"Lost Song tells the stories of the cheerful Rin and the reserved Finis, two songstresses who are capable of performing magical songs. Rin grew up in a remote village with her family and was taught to keep her power secret, while Finis lives and performs in the royal palace.

Rin's happy and peaceful life is shattered after she saves an injured knight named Henry Leobort with her song of healing. She was seen by soldiers who proceeded to attack her village in hopes of capturing her. With nowhere else to go, she and her inventor brother Al begin a journey to the capital.

Finis finds herself falling in love with Henry and, knowing that the greedy and spiteful Prince Lood Bernstein IV desires her, must hide their relationship. She wants to help people with her songs, but with war on the horizon, she worries that Lood will order her to cast her magic in the battlefield. Only time will tell how her destiny and Rin's will intersect, as the two of them struggle to find their paths.

[Written by MAL Rewrite]",TV,12.0,Finished Airing,"Apr 8, 2018","Jun 16, 2018","Ultra Super Pictures, MAGES.",Netflix,LIDENFILMS,Original,"Drama, Fantasy",Unknown,Unknown,23.0,PG-13 - Teens 13 or older,6.921,20060.0,42442.0,2948,43129,167,2018.0
40893,Komatta Jiisan,困ったじいさん,Unknown,"The comedy centers on an old man who pulls stereotypical ikemen (handsome man) actions on similarly old women and makes their hearts flutter. 

(Source: ANN)",TV,13.0,Finished Airing,"Apr 8, 2020","Jul 1, 2020",BS NTV,Unknown,Kachidoki Studio,Manga,"Adventure, Comedy, Drama, Romance, Slice of Life",Unknown,Unknown,1.0,None,6.391,1841.0,70302.0,8098,4183,6,2020.0
20223,Shounen Tokugawa Ieyasu,少年徳川家康,Unknown,"A historical tale of the early life of Tokugawa Ieyasu, who would eventually become shogun and establish the Edo Period in Japan.

(Source: AniDB)",TV,20.0,Finished Airing,"Apr 9, 1975","Sep 17, 1975",TV Asahi,Unknown,Toei Animation,Unknown,Drama,Historical,young boy,25.0,None,,,150612.0,13971,501,0,1975.0
2542,Lady Georgie,レディジョージィ,Unknown,"An Australian farmer returns home from the woods with a baby named Georgie. The girl lives ignoring the terrible secret hidden in the golden bracelet on her hand. Her ""Father"" and Her ""brothers"", Abel and Arthur, love her dearly, but her ""mother"" considers her an intruder and doesn't manage to open her heart to the girl. Georgie grows up into a beautiful young girl, and both her ""brothers"" are deeply in love with her. Not knowing the truth, Georgie eventually falls in love with the handsome grandson of the British Governor. When Mother finally reveals the truth to her and condemns the girl for being an exile's daughter, Georgie leaves for Britain in search of her real parents - and for her love, who has also left Australia. Abel and Arthur follow her and the three are thrown into the cruel world of London aristocracy, lies and intrigues.
",TV,45.0,Finished Airing,"Apr 9, 1983","Feb 25, 1984","TV Asahi, Asatsu DK",Unknown,Tokyo Movie Shinsha,Manga,"Drama, Romance",Historical,young girl,24.0,PG-13 - Teens 13 or older,7.161,3995.0,31712.0,5844,9441,60,1983.0
506,Glass no Kamen,ガラスの仮面,Unknown,"Kitajima Maya, a 13-year old girl with a talent for acting, was discovered by the reclusive actress Tsukikage. The story follows Maya's growing up, intense training, overcoming challenges, and evolving into the foremost actress of her generation (she is about 20 so far). Maya's greatest rival is Himekawa Ayumi, the beautiful daughter of a famous movie couple. They ultimately vied for the most sought-after role - the ""Crimson Goddess"". An equally important subplot Maya's relationship with the handsome and ruthless entertainment mogul Hayami Masumi, who secretly became her number one fan, but misunderstandings and bad-timing obstructed their romance...

(Source: ANN)",TV,23.0,Finished Airing,"Apr 9, 1984","Sep 24, 1984",Studio Jack,Maiden Japan,Eiken,Manga,"Drama, Romance",Performing Arts,young girl,24.0,PG-13 - Teens 13 or older,7.331,2491.0,23072.0,6129,8425,40,1984.0
