ID,Title,Japanese,English,Synopsis,Type,Episodes,Status,Start_Aired,End_Aired,Producers,Licensors,Studios,Source,Genres,Themes,Demographics,Duration_Minutes,Rating,Score,Scored_Users,Ranked,Popularity,Members,Favorites,year
13115,Hakuouki: Reimeiroku,薄桜鬼 黎明録,Hakuoki Demon of the Fleeting Blossom - Dawn of the Shinsengumi,"Beaten and left to perish, Ryuunosuke Ibuki is robbed of everything to his name. Seeing him in such a pitiful state, a man named Kamo Serizawa gives him a second chance and offers him to become his personal assistant. Ibuki seems to be spared by grief, but this new lifestyle only makes him nothing more than a dog to one of the most influential men in all of Kyoto.

Meanwhile, with the rise of ronin attacks on the general population, the shogunate sends the Roshigumi to Kyoto to strike for peace. Led by the honorable yet soft-spoken Isami Kondou, the Roshigumi is composed of strong and skilled samurai but lacks any meaningful political connections to gain footing in the city plagued by crime. Having no other choice, Kondou allies with the arrogant Serizawa and his connections in exchange for their combative strength.

Despite hating everything the samurai stand for, Ibuki finds himself tangled in the business of the Roshigumi. However, as he interacts with the members under Kondou's leadership, Ibuki slowly realizes that not all samurai are as cruel and dishonorable as he once thought. Hakuouki Reimeiroku explores the early days leading up to the formation of the Shinsengumi while the political tension in Kyoto gives rise to instability and uncertainty.

[Written by MAL Rewrite]
",TV,12.0,Finished Airing,"Jul 10, 2012","Sep 25, 2012",Unknown,Sentai Filmworks,Studio Deen,Visual novel,"Action, Drama, Supernatural","Historical, Samurai",female,23.0,R - 17+ (violence & profanity),7.441,21339.0,18602.0,2580,55034,138,2012.0
37458,Kyoto Teramachi Sanjou no Holmes,京都寺町三条のホームズ,Holmes of Kyoto,"High schooler Aoi Mashiro moved from home six months ago, but her recent breakup has made her want to return to tell off her ex-boyfriend. In need of money for a train ticket, she steals two hanging scrolls from her grandfather's attic and takes them to be appraised at an antique shop in the heart of Kyoto's Teramachi Sanjou shopping district. Little does she know that a fateful encounter awaits her during this visit.

Upon entering the shop, Aoi is greeted by Kiyotaka Yagashira, the owner's grandson and a graduate student at Kyoto University. Nicknamed ""Holmes"" for a pun involving his surname, as well as for his incredible deductive skills, Kiyotaka inspects the scrolls that Aoi brought with her. Based on the items she selected to sell, Kiyotaka senses that Aoi possesses great intuition not unlike his own. Seeing her potential and sympathizing with her story, Kiyotaka offers Aoi a part-time job so she can earn the required money herself.

Aoi and Kiyotaka begin working together soon after—not only within the antique shop, but also around town whenever the locals ask for help with their various problems. With Kiyotaka's deduction and Aoi's intuition, no case is too tough for this modern-day Holmes and Watson duo!

[Written by MAL Rewrite]
",TV,12.0,Finished Airing,"Jul 10, 2018","Sep 25, 2018","MediaNet, AT-X, Futabasha, Crunchyroll, Hakuhodo, A-Craft, Tohan Corporation, AQUA ARIS",Discotek Media,Seven,Novel,"Drama, Mystery, Romance, Slice of Life",Workplace,Unknown,23.0,PG-13 - Teens 13 or older,6.741,22183.0,51192.0,2494,58881,94,2018.0
37769,Aguu: Tensai Ningyou,悪偶 ‐天才人形‐,Aguu Genius Dolls,"The series is about a missing genius whose mysterious disappearance becomes a shady secret among the successful members of society.

(source: MAL News)",TV,12.0,Finished Airing,"Jul 10, 2018","Sep 25, 2018",Tencent Animation & Comics,Unknown,Studio Deen,Web manga,"Action, Drama, Supernatural",Unknown,Unknown,23.0,PG-13 - Teens 13 or older,5.421,2110.0,113652.0,6713,6708,6,2018.0
40529,No Guns Life 2nd Season,ノー・ガンズ・ライフ,No Guns Life,Second half of No Guns Life.,TV,12.0,Finished Airing,"Jul 10, 2020","Sep 25, 2020","Sony Pictures Entertainment, TBS, AT-X, Hakuhodo DY Music & Pictures, BS11, Egg Firm, Good Smile Film",Funimation,Madhouse,Manga,"Action, Drama, Sci-Fi",Unknown,teenager,23.0,PG-13 - Teens 13 or older,7.071,27176.0,35732.0,2203,72423,76,2020.0
48470,D_Cide Traumerei the Animation,D_CIDE TRAUMEREI（ディーサイドトロイメライ）,D_Cide Traumerei the Animation,"When he was little, Ryuuhei Oda witnessed the death of his caring older brother, along with a mysterious mark that was left near his body. Now a second-year high school student, the outgoing and impulsive young boy spends his days doing what he loves most—kickboxing.

One night on his way home, a peculiar creature bites Ryuuhei's leg and causes him to have a strange dream filled with odd entities. When he is attacked the next day by the same creatures in the real world, Jessica Clayborn and Aruto Fushibe come to his rescue, claiming that Ryuuhei is their new recruit.

Faced with an imminent threat, Jessica urges a confused Ryuuhei to transform into a ""knocker-up,"" a person with the ability to confront the monsters hailing from the dreamscape. Using his talent for kickboxing to his advantage, Ryuuhei awakens his powers to save the city, only to come across a familiar mark—a mark that he could never forget.

[Written by MAL Rewrite]",TV,13.0,Finished Airing,"Jul 10, 2021","Oct 2, 2021","Bushiroad, Bit grooove promotion",Unknown,SANZIGEN,Mixed media,"Action, Drama, Fantasy",Unknown,Unknown,23.0,PG-13 - Teens 13 or older,5.811,5856.0,99112.0,4117,22179,102,2021.0
44881,100-man no Inochi no Ue ni Ore wa Tatteiru 2nd Season,100万の命の上に俺は立っている,I’m Standing on a Million Lives Season 2,"Once again, the Game Master's world of quests unexpectedly pulls in Yuusuke Yotsuya and the rest of this old team. Accompanied by the newest addition, Keita Torii, the team reunites with Kahabell, still unaware of their actions' impact on this world. 

After bidding Kahabell farewell, the team sets out on their newly appointed quest—an offering of a Jiffon Buffalo at Vaikdamnia on Jiffon Island. However, as their journey to the island commences, the team shortly finds that the quest is not as simple as it initially seemed.

In fact, the island is terrorized by orcs that have made a deal with its inhabitants: instead of devouring the islanders, the orcs will be granted buffalo. With the growing shortage of buffalo, the annual Vaikdamnia festival cannot proceed. But, given the importance of the team's quest, they are left with the obvious choice—rid the island of the orcs and save the islanders.

[Written by MAL Rewrite]",TV,12.0,Finished Airing,"Jul 10, 2021","Sep 25, 2021",Warner Bros. Japan,Unknown,Maho Film,Manga,"Drama, Fantasy","Isekai, Video Game",young boy,23.0,PG-13 - Teens 13 or older,6.811,59578.0,47562.0,1481,128021,589,2021.0
1485,Akachan to Boku,赤ちゃんと僕,Baby and Me,"Takuya Enoki is living a difficult life for a fifth grader. His mother passed away in a tragic car accident a few months ago, forcing him to pick up the slack and take care of his baby brother, Minoru, as his father works the endless hours typical of a Japanese salaryman.

He will have to sacrifice his childhood in order to meet the needs of his little brother. Cooking, cleaning, worrying, and trying to discipline Minoru are some of the tasks Takuya will have on his plate, all while their neighbors blame him for Minoru’s constant crying. Meanwhile, he will watch as his friends live their carefree lives, enjoying their free time. It will not be easy and there will be plenty of stumbling blocks, but along the way, he may actually learn the true meaning of family.",TV,35.0,Finished Airing,"Jul 11, 1996","Mar 26, 1997","TV Tokyo, Youmex, Yomiuri Advertising",Unknown,Pierrot,Manga,"Comedy, Drama",Childcare,young girl,25.0,G - All Ages,7.811,7920.0,8662.0,4203,21033,139,1996.0
171,Strange Dawn,ストレンジ・ドーン,Unknown,"Yuko and Eri are two normal girls who are sucked into the alternate world filled with tiny people. The people of this mysterious world sees them as their ""Great Protectors"" who can protect their land in a time of strife. The two girls set out on a mission with a group of warriors from the village to find out how they were brought here and how might they return home. However, there is a war brewing and these two Great Protectors are the political tool that every faction lusts for to rally the people to their side. 

(Source: ANN)",TV,13.0,Finished Airing,"Jul 11, 2000","Sep 26, 2000",Unknown,Urban Vision,Hal Film Maker,Original,"Adventure, Drama, Fantasy",Unknown,Unknown,23.0,PG - Children,6.291,1447.0,75402.0,7542,5055,7,2000.0
35834,Angolmois: Genkou Kassenki,アンゴルモア 元寇合戦記,Angolmois Record of Mongol Invasion,"The scary great king comes from the other side of the sea... The big incident ""Genkou"" that shook medieval Japan is being drawn in an original way in this historical anime, along with the beginning of the Samurai!

(Source: Crunchyroll)",TV,12.0,Finished Airing,"Jul 11, 2018","Sep 26, 2018",HOTZIPANG,Unknown,NAZ,Manga,"Action, Drama","Historical, Military, Samurai",Unknown,23.0,PG-13 - Teens 13 or older,7.131,24708.0,32942.0,2553,56276,116,2018.0
1219,Chocotto Sister,ちょこッとSister,Unknown,"Haruma Kawagoe is an only child. A long time ago, at Christmas time, his mother miscarried the child that was to have been his baby sister. That night, young Haruma knelt down and offered up an earnest prayer: ""Please make my mother well again, and please give me a little sister."" Years have passed, and Haruma has nearly forgotten his prayer. But Santa hasn't.... one Christmas, when Haruma is least expecting it, he gets an unusual present - his sister.

(Source: ANN)",TV,24.0,Finished Airing,"Jul 12, 2006","Dec 20, 2006",Unknown,Unknown,Nomad,Manga,"Comedy, Drama, Romance, Ecchi",Unknown,Unknown,24.0,R+ - Mild Nudity,6.761,8267.0,50122.0,4267,20241,34,2006.0
35114,Clione no Akari,クリオネの灯り,Lights of the Clione,"The story centers around an illness-stricken, constantly bullied orphan girl named Minori. After one rainy day, she doesn't turn up at school, having been admitted into a hospital in a distant town. Two months pass, and the girl's two school friends, Takashi and Kyouko, receive a mysterious email with no sender listed. The email reveals a summer festival taking place at a nearby town...

(Source: ANN)",TV,12.0,Finished Airing,"Jul 12, 2017","Sep 27, 2017","Kyotoma, Kanetsu Investment",Unknown,drop,Novel,Drama,School,Unknown,9.0,PG - Children,5.401,4363.0,114372.0,5104,13244,10,2017.0
35507,Youkoso Jitsuryoku Shijou Shugi no Kyoushitsu e,ようこそ実力至上主義の教室へ,Classroom of the Elite,"On the surface, Koudo Ikusei Senior High School is a utopia. The students enjoy an unparalleled amount of freedom, and it is ranked highly in Japan. However, the reality is less than ideal. Four classes, A through D, are ranked in order of merit, and only the top classes receive favorable treatment.

Kiyotaka Ayanokouji is a student of Class D, where the school dumps its worst. There he meets the unsociable Suzune Horikita, who believes she was placed in Class D by mistake and desires to climb all the way to Class A, and the seemingly amicable class idol Kikyou Kushida, whose aim is to make as many friends as possible.

While class membership is permanent, class rankings are not; students in lower ranked classes can rise in rankings if they score better than those in the top ones. Additionally, in Class D, there are no bars on what methods can be used to get ahead. In this cutthroat school, can they prevail against the odds and reach the top?

[Written by MAL Rewrite]",TV,12.0,Finished Airing,"Jul 12, 2017","Sep 27, 2017","Studio Hibari, Lantis, Media Factory, AT-X, Sony Music Communications, Toranoana, Crunchyroll, Kadokawa Media House, AKABEiSOFT2",Funimation,Lerche,Light novel,Drama,"Psychological, School",Unknown,24.0,PG-13 - Teens 13 or older,7.861,641396.0,7782.0,123,1010262,15488,2017.0
39533,Given,ギヴン,Unknown,"Tightly clutching his Gibson guitar, Mafuyu Satou steps out of his dark apartment to begin another day of his high school life. While taking a nap in a quiet spot on the gymnasium staircase, he has a chance encounter with fellow student Ritsuka Uenoyama, who berates him for letting his guitar's strings rust and break. Noticing Uenoyama's knowledge of the instrument, Satou pleads for him to fix it and to teach him how to play. Uenoyama eventually agrees and invites him to sit in on a jam session with his two band mates: bassist Haruki Nakayama and drummer Akihiko Kaji.

Satou's voice is strikingly beautiful, filling Uenoyama with the determination to make Satou the lead singer of the band. Though reticent at first, Satou takes the offer after an emotional meeting with an old friend. With the support of his new friends, Satou must not only learn how to play guitar, but also come to terms with the mysterious circumstances that led him to be its owner.

[Written by MAL Rewrite]",TV,11.0,Finished Airing,"Jul 12, 2019","Sep 20, 2019","Aniplex, Dentsu, Movic, Fuji TV, Shinshokan",Unknown,Lerche,Manga,"Boys Love, Drama, Romance, Slice of Life",Music,Unknown,22.0,PG-13 - Teens 13 or older,8.341,268595.0,1982.0,380,489421,15493,2019.0
17741,Kimi no Iru Machi,君のいる町,A Town Where You Live,"Haruto Kirishima lived a calm life out in the countryside, away from the fast-paced life of the city. Then Yuzuki Eba appeared in his life out of nowhere, having come from Tokyo to briefly live with her family. Their time together left him enamored with the memories of that short period before she just as abruptly disappeared from his life, and left him full of questions.

Kimi no Iru Machi begins some time later, after Haruto moves to Tokyo to live with his sister, in order to pursue a career as a cook. In reality though he wishes to be with Yuzuki. Things don't start good though. When he arrives he is mistaken for a burglar and attacked by his sister's neighbour Mishima Asuka. After the misunderstanding is cleared his feelings begin to waver though. Is Eba, who keeps avoiding him for seemingly no reason, the one for him or is it Asuka? ",TV,12.0,Finished Airing,"Jul 13, 2013","Sep 28, 2013","TV Tokyo, ZERO-A",Nozomi Entertainment,Gonzo,Manga,"Drama, Romance, Slice of Life",Love Polygon,young boy,20.0,R+ - Mild Nudity,6.851,60332.0,45702.0,1367,143034,558,2013.0
795,Oniisama e...,おにいさまへ…,Dear Brother,"When 16-year-old Nanako Misonoo enters the prestigious all-girls Seiran Academy, she believes a bright future awaits her. Instead, the unlucky girl finds herself dragged into a web of deceit, misery, and jealousy. On top of that, she is chosen as the newest inductee of the Sorority, an elite group whose members are the envy of the entire school. Having none of the grace, wealth, or talent of the other members, Nanako quickly draws the ire of her jealous classmates—especially the fierce Aya Misaki.

To cope with her increasingly difficult school life, Nanako recalls her days through letters to her former teacher, Takehiko Henmi, whom she affectionately calls ""onii-sama"" (big brother). She also finds comfort with her four closest friends: her childhood friend Tomoko Arikura, the sociable but erratic Mariko Shinobu, the troubled musician Rei Asaka, and the athletic tomboy Kaoru Orihara.

An impassioned drama about the hardships of bullying, Oniisama e... chronicles a young girl's harsh life at her new school, as she endures cruel rumours, heartless classmates, and countless social trials.

[Written by MAL Rewrite]",TV,39.0,Finished Airing,"Jul 14, 1991","May 31, 1992",NHK,Discotek Media,Tezuka Productions,Manga,"Drama, Girls Love","Psychological, School",young girl,25.0,PG-13 - Teens 13 or older,7.831,8959.0,8352.0,3044,40753,883,1991.0
37517,Happy Sugar Life,ハッピーシュガーライフ,Happy Sugar Life,"Satou Matsuzaka is a beautiful high schooler who has a reputation for being permissive with men. However, a chance encounter with a young girl named Shio Koube makes Satou realize that this is her first and only true feeling of love.

Telling others that she lives with her aunt, Satou secretly shares an apartment with Shio. Despite her innocent appearance, Satou is willing to do anything to protect her beloved, resorting to desperate measures to ensure that their ""happy sugar life"" remains intact.

[Written by MAL Rewrite]",TV,12.0,Finished Airing,"Jul 14, 2018","Sep 29, 2018","VAP, Square Enix, Genco, Mainichi Broadcasting System, Bit Promotion",Unknown,Ezόla,Manga,"Drama, Girls Love, Horror",Psychological,young boy,24.0,R - 17+ (violence & profanity),6.811,121126.0,47702.0,772,265405,2466,2018.0
196,Onegai☆Twins,おねがい☆ツインズ,Please Twins!,"Maiku Kamishiro's past has always been somewhat of a mystery to him. The only clue he has to who his family might be is an old photograph showing two young children, a boy and a girl, playing in a small pool outside of a blue house. In an attempt to find his family, he moves to this blue house and begins working as a programmer. He's living a comfortable life until the day two very different girls show up at his door, both in possession of the same photograph, and both claiming to be his twin. With no way to prove who is a relative and who is a stranger, Maiku allows both girls to move in with him until they know for sure. 

(Source: ANN) ",TV,12.0,Finished Airing,"Jul 15, 2003","Oct 14, 2003","Bandai Visual, Genco, Lantis","Nozomi Entertainment, Bandai Entertainment",Daume,Original,"Comedy, Drama, Sci-Fi","Harem, School",Unknown,25.0,PG-13 - Teens 13 or older,6.831,48287.0,46492.0,2005,85133,181,2003.0
32947,Battery,バッテリー,Unknown,"At only 12 years old, Takumi Harada is already hailed as a prodigious baseball pitcher. But when his family moves to the backwater town of Nitta, Takumi has no choice but to join his new school's unskilled baseball team. This development has little effect on the boy, as he believes it is more interesting if this no-name club becomes a powerhouse due to his presence. However, due to his overwhelming talent, Takumi is in need of a catcher able to keep up with his pitches.

His worries are soon put to rest after meeting Gou Nagakura. As his fan and fellow student, Gou is eager to prove that he is not a simple braggart, but rather a player skillful enough to catch Takumi's pitches. Amid struggling to form a ""battery"" with Gou, Takumi comes into conflict with his new teammates due to his irreverent personality but grapples to find the true joy of the sport under his grandfather's guidance.

[Written by MAL Rewrite]",TV,11.0,Finished Airing,"Jul 15, 2016","Sep 23, 2016","Aniplex, Dentsu, Kadokawa Shoten, Fuji TV, Kyoraku Industrial Holdings, Kansai Telecasting",Discotek Media,Zero-G,Novel,"Drama, Slice of Life, Sports",Team Sports,Unknown,23.0,PG-13 - Teens 13 or older,5.711,19972.0,103032.0,2711,50558,51,2016.0
43767,Night Head 2041,NIGHT HEAD 2041,Night Head 2041,"In the year 2041, World War III has wiped out two-thirds of the human population, and in the newfound structure, the belief in any god or beyond-human entity is considered a preposterous notion. In order to prevent citizens from bearing possibly incriminating thoughts, the government has assembled a Special Weapon Enforcement division to capture and rehabilitate such believers.

The Kirihara brothers, Naoya and Naoto—who were hidden away from society by their captors for years to conceal their psychic abilities—were promised freedom once the world was ready to face their existence. Now, wandering in the appalling new societal climate where psychics are not welcome, the brothers find themselves on the run from the Enforcement's devoted operatives, Yuuya and Takuya Kuroki.

[Written by MAL Rewrite]",TV,12.0,Finished Airing,"Jul 15, 2021","Sep 30, 2021","Fuji TV, Slow Curve, BS Fuji, Hakuhodo DY Media Partners, Office ENDLESS",Unknown,Shirogumi,Other,"Drama, Mystery, Sci-Fi, Supernatural",Psychological,Unknown,22.0,R - 17+ (violence & profanity),6.521,9077.0,62812.0,3037,40965,301,2021.0
30344,The iDOLM@STER Cinderella Girls 2nd Season,アイドルマスター シンデレラガールズ 2ndシーズン,THE IDOLM@STER CINDERELLA GIRLS 2nd SEASON,Second season of The iDOLM@STER Cinderella Girls.,TV,12.0,Finished Airing,"Jul 18, 2015","Oct 17, 2015","Aniplex, Half H.P Studio, Nippon Columbia, Bandai Namco Games, Anime Consortium Japan",Unknown,A-1 Pictures,Game,"Comedy, Drama","Idols (Female), Music",Unknown,24.0,PG-13 - Teens 13 or older,7.341,16440.0,22662.0,3344,34314,144,2015.0
6012,Kinpatsu no Jeanie,金髪のジェニー,Unknown,"During the civil war a girl living in Virginia, named Jeanie, waits for her old boyfriend Robert  to marry him, according to a childish promise, but the war makes the things complicated and, Robert comes back as northerner soldier.    
Only with the conflict's end, and many misadventures, their dream will become true. ",TV,13.0,Finished Airing,"Jul 19, 1979","Oct 18, 1979",DAX Production,Unknown,Unknown,Music,Drama,Historical,Unknown,25.0,G - All Ages,5.921,221.0,94452.0,11837,1034,0,1979.0
2216,Shigurui,シグルイ,Shigurui Death Frenzy,"At the beginning of the Edo Era, when people enjoyed a time of peace, Lord Tokugawa Tadanaga holds a fighting tournament. In the past, matches were fought with wooden swords. This time, real swords will be used.

One-armed Fujiki Gennosuke and blind Irako Seigen will fight each other in this match. Both are disciples of Iwamoto Kogan, who is known as Japan's greatest swordsman. Each of them are determined to prove himself the successor of Iwamoto's school. However, there can only be one champion.

So begins a story of intertwining fates, conflict, and strange destinies.

(Source: ANN)",TV,12.0,Finished Airing,"Jul 19, 2007","Oct 11, 2007","Geneon Universal Entertainment, WOWOW, Akita Shoten",Funimation,Madhouse,Manga,"Action, Drama","Gore, Historical, Martial Arts, Psychological, Samurai",teenager,23.0,R+ - Mild Nudity,7.381,34683.0,21132.0,1633,113251,834,2007.0
2609,Kakyuusei (TV),下級生,Unknown,"When Tsuyoshi rushed to school as usual, he found a girl who tried to help a kitten which couldn't get down from a tree. It was Minamizato Ai who had loved Tsuyoshi secretly for a long time.

(Source: AniDB)",TV,13.0,Finished Airing,"Jul 2, 1999","Sep 24, 1999",Pink Pineapple,Unknown,PP Project,Visual novel,"Drama, Romance","Harem, School",Unknown,26.0,PG-13 - Teens 13 or older,6.181,1042.0,81372.0,7196,5609,6,1999.0
529,Saishuu Heiki Kanojo,最終兵器彼女,"She, The Ultimate Weapon","Chise is an ordinary schoolgirl: small, frail, and not particularly intelligent. Her greatest joy is her budding romance with her classmate and childhood friend, Shuuji. They both live in a small military town in Hokkaido, where high schoolers have few concerns other than who is dating whom and complaining about the steep climb up ""Hell Hill"" every day before school.

One day, Shuuji and his friends make a trip to Sapporo to buy gifts for their girlfriends. A massive air raid on Sapporo that day kills thousands, including one of Shuuji's friends, and signals the beginning of a war. Fleeing from the carnage, Shuuji spots Chise, though now she has steel wings and a massive gun where her right arm should be. Against her will, she has been transformed into the ultimate cyborg weapon, capable of leveling entire cities.

As the war rages closer and closer to their hometown, Chise and Shuuji's relationship is strained by her transformation, and they are left to wonder whether she is even still human.

[Written by MAL Rewrite]",TV,13.0,Finished Airing,"Jul 2, 2002","Sep 24, 2002","Toei Video, Toshiba EMI, Tohokushinsha Film Corporation","VIZ Media, Sentai Filmworks",Gonzo,Manga,"Drama, Romance, Sci-Fi","Military, School",Unknown,24.0,R - 17+ (violence & profanity),7.151,36221.0,32122.0,1902,92113,561,2002.0
294,Divergence Eve,ダイバージェンス・イヴ,Unknown,"In the 24th Century, Intergalactic Space Travel has become a reality. One of the first outposts in the far reaches of space is WATCHER'S NEST - an inflation hole drive portal - which has recently come under attack by a mysterious force known simply as GHOUL... A group of young female cadets assigned to the portal are unexpectedly thrown into a hornet's nest of trouble as they finalize their training to become an elite pilot in the Seraphim Squadron.

(Source: DVD Collection Back Cover)",TV,13.0,Finished Airing,"Jul 2, 2003","Sep 24, 2003","Media Factory, Imagica, KlockWorx","ADV Films, Sentai Filmworks",Radix,Original,"Adventure, Comedy, Drama, Sci-Fi","Mecha, Military, Space",Unknown,24.0,R+ - Mild Nudity,5.931,4041.0,93732.0,5324,11907,11,2003.0
470,Okusama wa Joshikousei (TV),おくさまは女子高生,My Wife is a High School Girl,"Asami Onohara is a seventeen-year old high-school student with a secret which has not been revealed to anyone: She is already married. Her husband, Kyosuke Ichimaru, is a Physics teacher in the same high school as her. However, even though they are officially a married couple, Asami's father forbids them to have any sexual contact until after Asami has graduated. Asami has to hide the fact that she is married to Kyosuke while trying desperately to further their relationship, and it does not help when there are so many interferences and obstacles from her father and other third parties. 

(Source: ANN)",TV,13.0,Finished Airing,"Jul 2, 2005","Sep 24, 2005",Unknown,Unknown,Madhouse,Manga,"Comedy, Drama, Romance, Slice of Life",Unknown,Unknown,24.0,PG-13 - Teens 13 or older,6.311,10309.0,74052.0,3794,26400,34,2005.0
