ID,Title,Japanese,English,Synopsis,Type,Episodes,Status,Start_Aired,End_Aired,Producers,Licensors,Studios,Source,Genres,Themes,Demographics,Duration_Minutes,Rating,Score,Scored_Users,Ranked,Popularity,Members,Favorites,year
29527,Kagee Mukashibanashi,影絵むかし話,Unknown,The 1st arc of the Chiyotarou Kodomo Gekijou program that aired on TBS. Every episode is a different Japanese fairy tale told with shadow puppet animation. ,TV,65.0,Finished Airing,1976,1979,TBS,Unknown,Unknown,Unknown,"Adventure, Drama, Fantasy, Romance, Supernatural","Historical, Mythology, Samurai",Kids,15.0,G - All Ages,,,189072.0,15503,334,0,1976.0
29529,Kagee Aesop Monogatari,影絵イソップ物語,Unknown,The 2nd arc of the Chiyotarou Kodomo Gekijou program that aired on TBS. Every episode is a different Aesop fable told with shadow puppet animation. ,TV,26.0,Finished Airing,1978,Not Available,TBS,Unknown,Unknown,Unknown,"Adventure, Drama, Fantasy, Romance, Supernatural","Historical, Mythology",Kids,15.0,G - All Ages,,,189042.0,15674,320,0,1978.0
10236,Kagee Grimm Douwa,影絵グリム童話,Unknown,The 3rd arc of the Chiyotarou Kodomo Gekijou program that aired on TBS. Every episode is a different Brothers Grimm fairy tale told with shadow puppet animation.,TV,52.0,Finished Airing,1980,1981,Unknown,Unknown,Unknown,Unknown,"Adventure, Drama, Fantasy, Romance, Supernatural","Historical, Mythology",Kids,15.0,G - All Ages,,,189062.0,15235,356,0,1980.0
39634,Boy General,소년장수,Boy General,"The brave young warrior Seo-Me defeats the SeoGuk invaders. After defeating Hobi, Seo-Me and his comrades return home. Meanwhile Hobi survived after falling and some people rescued him out.",TV,50.0,Finished Airing,1982,1997,Unknown,Unknown,SEK Studios,Unknown,"Action, Drama","Historical, Military",Unknown,20.0,G - All Ages,,,171692.0,18730,128,0,1982.0
17893,Cheonbangjichuk Hani,천방지축 하니,Unknown,"Sequel of Dallyeola Hani.

Hany is a small tomboy and slightly troublesome teenager who lives life a bit carelessly on her own since her Father lives abroad due to work in the Middle East and her Mother died when she was very small. The only thing Hany is very good at is running~ fast!

(Source: Cute in Korea)",TV,13.0,Finished Airing,1988,1989,KBS,Unknown,Daewon Media,Unknown,"Comedy, Drama, Sports",School,Unknown,20.0,None,6.251,127.0,77422.0,14587,416,0,1988.0
43868,Baiyu Tang,白玉堂,Unknown,Unknown,TV,52.0,Finished Airing,2002,Not Available,Unknown,Unknown,Shanghai Animation Film Studio,Unknown,"Action, Drama","Historical, Martial Arts",Kids,22.0,G - All Ages,,,169902.0,20554,38,0,2002.0
47022,Mayi Gongzhu,蚂蚁公主,Unknown,Unknown,TV,26.0,Finished Airing,2011,Not Available,Unknown,Unknown,Unknown,Original,"Drama, Fantasy",Unknown,Kids,19.0,PG - Children,,,133302.0,19833,56,0,2011.0
49766,Under Ninja,アンダーニンジャ,Unknown,"A high school loner is given the part-time job of a lifetime as a modern day ninja tasked to perform international assassinations.

After World War II, Allied Command in Japan developed a new agency to help manage terrorism and violence within the Pacific region. The agency was staffed with ninja and they were initially tasked to handle domestic affairs. Eventually that program grew to its current form, managing 20,000 ninja across a range of domestic and international affairs. One of those ninjas happens to be Kudo. The seventeen-year-old high school loser is now poised to be the next line of defense against a potential surge in foreign assassins invading Tokyo. 

(Source: Denpa, edited)",TV,,Not yet aired,2023,Unknown,Unknown,Unknown,Unknown,Manga,"Action, Comedy, Drama, Slice of Life",Unknown,teenager,,None,,,,7761,4694,13,2023.0
49858,Shinigami Bocchan to Kuro Maid 2nd Season,死神坊ちゃんと黒メイド,The Duke of Death and His Maid 2nd Season,Second season of Shinigami Bocchan to Kuro Maid.,TV,,Not yet aired,2023,Unknown,NBCUniversal Entertainment Japan,Unknown,J.C.Staff,Manga,"Comedy, Drama, Supernatural",Romantic Subtext,Unknown,,PG-13 - Teens 13 or older,,,,3777,26686,92,2023.0
51179,Mushoku Tensei: Isekai Ittara Honki Dasu 2nd Season,無職転生 ～異世界行ったら本気だす～,Mushoku Tensei Jobless Reincarnation 2nd Season,Second season of Mushoku Tensei: Isekai Ittara Honki Dasu.,TV,,Not yet aired,2023,Unknown,Unknown,Unknown,Studio Bind,Light novel,"Drama, Fantasy, Ecchi","Isekai, Reincarnation",Unknown,,R - 17+ (violence & profanity),,,,1949,88883,439,2023.0
51535,Shingeki no Kyojin: The Final Season - Kanketsu-hen,進撃の巨人 The Final Season完結編,Attack on Titan The Final Season Part 3,Unknown,TV,,Not yet aired,2023,Unknown,"Production I.G, Dentsu, Mainichi Broadcasting System, Pony Canyon, Kodansha, Pony Canyon Enterprise",Unknown,MAPPA,Manga,"Action, Drama","Gore, Military, Survival",young boy,,R - 17+ (violence & profanity),,,,1101,183687,1646,2023.0
51180,Youkoso Jitsuryoku Shijou Shugi no Kyoushitsu e 3rd Season,ようこそ実力至上主義の教室へ,Unknown,3rd season of Youkoso Jitsuryoku Shijou Shugi no Kyoushitsu e (TV).,TV,,Not yet aired,2023,Unknown,Kadokawa,Unknown,Unknown,Light novel,"Drama, Suspense","Psychological, School",Unknown,,PG-13 - Teens 13 or older,,,,2681,51734,198,2023.0
40333,Uzumaki,うずまき,Uzumaki Spiral into Horror,"In the town of Kurouzu-cho, Kirie Goshima lives a fairly normal life with her family. As she walks to the train station one day to meet her boyfriend, Shuuichi Saito, she sees his father staring at a snail shell in an alley. Thinking nothing of it, she mentions the incident to Shuuichi, who says that his father has been acting weird lately. Shuuichi reveals his rising desire to leave the town with Kirie, saying that the town is infected with spirals.

But his father's obsession with the shape soon proves deadly, beginning a chain of horrific and unexplainable events that causes the residents of Kurouzu-cho to spiral into madness.

[Written by MAL Rewrite]",TV,4.0,Not yet aired,2023,Unknown,Production I.G,Unknown,Drive,Manga,"Avant Garde, Drama, Horror, Romance, Supernatural",Psychological,teenager,,None,,,,2003,85241,307,2023.0
2402,Ashita no Joe,あしたのジョー,Tomorrow's Joe,"Joe Yabuki is a troubled youth, whose only solution to problems is throwing punches at them. What he lacks in manners and discipline, he makes up for with his self-taught fighting skills.

One day, while wandering the slums of Doya, Joe gets into a fight with the local gang. Although greatly outnumbered, he effortlessly defeats them, drawing the attention of Danpei Tange—a former boxing coach turned alcoholic. Seeing his potential, he offers to train Joe into Japan's greatest boxer. At first, Joe dismisses Danpei as a hopeless drunk; but after the trainer saves his life, he agrees to live with him and learn the art of boxing. Unfortunately, Joe's personality makes him an unruly student, and he often falls back to his old ways.

To survive the harsh world of his new career, Joe needs to trust his mentor and master the techniques taught to him. However, the road to becoming a professional boxer is rife with struggles that will test his mettle to the end.

[Written by MAL Rewrite]",TV,79.0,Finished Airing,"Apr 1, 1970","Sep 29, 1971",Fuji TV,Unknown,Mushi Production,Manga,"Action, Drama, Slice of Life, Sports",Combat Sports,young boy,25.0,PG-13 - Teens 13 or older,8.281,20410.0,2542.0,2084,78983,1723,1970.0
2816,Toushou Daimos,闘将ダイモス,Daimos,"The third of Tadao Nagahama's Romance Super Robot Trilogy. (#1: Chou Denji Robo Combattler V, #2: Chou Denji Machine Voltes V)

After the destruction of their home world, the survivors of the planet Barm head toward Earth with the goal of negotiating the purchase of land to emigrate to. Unfortunately, during the negotiations, the Barmian's leader, Leon, is assassinated by his second in command, Olban, and the delegation from Earth is framed for the murder. In the ensuing chaos, Doctor Isamu Ryuuzaki of the Earth delegation is shot and killed.

Shortly after the disastrous end of the talks, the Barmians (called ""Valerians"" in Starbirds) begin a campaign of terror against Earth, lead by Leon's son, Admiral Richter, who deploys a variety of ""Mecha Soldiers"" against the planet's defenses. The only thing standing between the Earthlings and annihilation is the transforming, karate-using super robot, Daimos, and its pilot, Kazuya Ryuuzaki. But that changes when he meets and falls in love with a mysterious girl named Erika, who turns out to be Richter's sister. Over the course of their struggles to reunite, Kazuya and Erika each learn that the other's people are not all evil... and that their own people are not all good.

(Source: AniDB)",TV,44.0,Finished Airing,"Apr 1, 1978","Jan 27, 1979",Studio Nue,Discotek Media,"Sunrise, Toei Animation",Unknown,"Adventure, Drama, Romance, Sci-Fi",Mecha,young boy,24.0,PG-13 - Teens 13 or older,7.181,2707.0,30722.0,7346,5333,26,1978.0
2582,Soukou Kihei Votoms,装甲騎兵ボトムズ,Armored Trooper Votoms,"A century of bloodshed between warring star systems has plunged nearly 200 worlds into the flames of war. Now, an uneasy truce has settled across the Astragius Galaxy...

Chirico Cuvie, a special forces powered-armor pilot is suddenly transferred into a unit engaged in a secret and highly illegal mission to steal military secrets—from their own military! Now he's on the run...from his own army!

Unsure of his loyalties and to cover their own tracks, Chirico is left behind to die in space. Surviving by luck, the renegade is now hunted by both the conspirators and military intelligence.

He is driven by the haunting image of a mysterious and beautiful woman—the objective of their mission, and his sole clue to unraveling their treacherous scheme. But the conspirators will do anything to preserve their mysterious agenda...

(Source: AnimeNfo)",TV,52.0,Finished Airing,"Apr 1, 1983","Mar 23, 1984",TV Tokyo,"Central Park Media, Maiden Japan",Sunrise,Original,"Action, Drama, Sci-Fi","Mecha, Military, Space",Unknown,25.0,PG-13 - Teens 13 or older,7.681,5465.0,11582.0,4128,22010,341,1983.0
96,Mobile Fighter G Gundam,機動武闘伝Gガンダム,Mobile Fighter G Gundam,"In the year Future Century 0060, the many countries that once comprised Earth's surface exist as separate colonies floating in space. Their home planet now uninhabitable, the ruler of all of the colonies is decided by their unanimous participation in the intergalactic Gundam Fight Tournament—a series of battles between the champions of each colony to determine who is most fit to reign over them all.

Neo-Japan's champion is Domon Kasshu, a man who accepts the role with some ulterior motives. Domon searches the galaxy for his brother, a criminal who allegedly murdered their mother and made off with the Devil Gundam, a highly advanced weapon with the power to unleash mass destruction across the galaxy. In his quest to bring his sibling to justice, Domon travels from colony to colony, meeting many of the fighters who will become his allies and enemies in the forthcoming Gundam Fight Tournament.

Armed with the strength of the Shining Gundam, Domon battles to uncover the truth behind his tortured childhood, suffering great betrayal and crushing blows on his quest toward personal and national triumph.

[Written by MAL Rewrite]",TV,49.0,Finished Airing,"Apr 1, 1994","Mar 31, 1995","TV Asahi, Sotsu",Bandai Entertainment,Sunrise,Original,"Adventure, Comedy, Drama, Romance, Sci-Fi, Sports","Martial Arts, Mecha, Space",Unknown,24.0,PG-13 - Teens 13 or older,7.561,34818.0,14492.0,2373,63759,928,1994.0
6,Trigun,トライガン,Trigun,"Vash the Stampede is the man with a $$60,000,000,000 bounty on his head. The reason: he's a merciless villain who lays waste to all those that oppose him and flattens entire cities for fun, garnering him the title ""The Humanoid Typhoon."" He leaves a trail of death and destruction wherever he goes, and anyone can count themselves dead if they so much as make eye contact—or so the rumors say. In actuality, Vash is a huge softie who claims to have never taken a life and avoids violence at all costs.

With his crazy doughnut obsession and buffoonish attitude in tow, Vash traverses the wasteland of the planet Gunsmoke, all the while followed by two insurance agents, Meryl Stryfe and Milly Thompson, who attempt to minimize his impact on the public. But soon, their misadventures evolve into life-or-death situations as a group of legendary assassins are summoned to bring about suffering to the trio. Vash's agonizing past will be unraveled and his morality and principles pushed to the breaking point.

[Written by MAL Rewrite]",TV,26.0,Finished Airing,"Apr 1, 1998","Sep 30, 1998",Victor Entertainment,"Funimation, Geneon Entertainment USA",Madhouse,Manga,"Action, Adventure, Comedy, Drama, Sci-Fi",Adult Cast,young boy,24.0,PG-13 - Teens 13 or older,8.221,335568.0,3112.0,243,677402,13704,1998.0
206,Lodoss-tou Senki: Eiyuu Kishi Den,ロードス島戦記 英雄騎士伝,Record of Lodoss War Chronicles of the Heroic Knight,"Five years after the death of the Emperor of Marmo in the War of Heroes, Parn is now the Free Knight of Lodoss, he and his old allies now famous through the land. However, the Emperor's right-hand man, Ashram, seeks the scepter of domination to re-unify Lodoss under his former leader's banner. Meanwhile, beyond his attempts at conquest lies a more sinister force beginning to set the stage for the resurrection of the goddess of death and destruction...

(Source: ANN)",TV,27.0,Finished Airing,"Apr 1, 1998","Sep 30, 1998","Kadokawa Shoten, Yomiko Advertising, Marubeni","Funimation, Central Park Media",AIC,Novel,"Action, Adventure, Drama, Fantasy, Romance",Unknown,Unknown,24.0,PG-13 - Teens 13 or older,7.131,10780.0,33172.0,3575,29754,118,1998.0
52,Kidou Tenshi Angelic Layer,機動天使エンジェリックレイヤー,Battle Doll Angelic Layer,"12-year-old Misaki Suzuhara has just gotten involved in Angelic Layer, a battling game using electronic dolls called angels. Even as a newbie, Misaki shows advanced skills as she meets new friends and enters Angelic Layer tournaments to fight the greatest Angelic Layer champions of the nation.",TV,26.0,Finished Airing,"Apr 1, 2001","Sep 23, 2001",TV Tokyo Music,"ADV Films, Sentai Filmworks",Bones,Manga,"Comedy, Drama, Sci-Fi, Sports",Unknown,young boy,24.0,PG-13 - Teens 13 or older,7.261,27989.0,26862.0,2570,55548,280,2001.0
2036,Cosmic Baton Girl Comet-san☆,Cosmic Baton Girl コメットさん☆,Unknown,"Comet (12 years old in human years) is the princess of the Harmonica Star country and was to meet the prince of the Tambourine Star country at a ball where he'd pick a bride. But he isn't there and so Comet is sent to Earth to find him. He'll be known by the starlight in his eyes. She finds the Earth and she loves the people she meets there. Meanwhile, Princess Meteor of the Castanet Star country also arrives on Earth in search of the prince. Comet's companion is a little puppy with a star at the end of his tail named Rubba Ball. Of course, Comet was not the first to visit the Earth and love it, another before her did as well and married. Her pet (a white cat with bunny ears and a tiny heart on her tail named Bunny) continued life as a kind of fairy in the forest. Comet's power is drawn from the stars of her home and is channeled through her baton; she also wears a special pendant from where Rubba Ball immerges, and with which she can detect and find the prince.

(Source: ANN)",TV,43.0,Finished Airing,"Apr 1, 2001","Jan 27, 2002","Group TAC, Yomiko Advertising",Unknown,Nippon Animation,Manga,"Adventure, Comedy, Drama, Sci-Fi",Unknown,Unknown,24.0,G - All Ages,7.231,1420.0,28152.0,8231,3973,34,2001.0
874,Digimon Tamers,デジモンテイマーズ,Digimon Tamers,"Digimon Tamers takes place in a world where the popular Digimon franchise is all the rage, consisting of a cartoon, video games, and the trading card game. Takato Matsuda is a huge Digimon fan that's particularly obsessed with the card game, and constantly daydreams about the universe therein. One day, he finds a mysterious blue card, which he slides through a scanner toy to use in the popular battle game. His toy suddenly glows and transforms into a Digivice, and Takato's fan-made design, Guilmon, materialises in front of him. Thrilled by the prospect of having a real-life Digimon, Takato embraces his new partner, and his adventures as a Digimon Tamer begin.

Takato quickly discovers that being a Digimon Tamer is not all fun and games—in reality, it's much more dangerous than the card games he's accustomed to. Wild Digimon have begun to appear all across Japan, causing rampages that result in chaos and mayhem. Armed with his Digivice, which can scan trading cards to strengthen Guilmon, Takato and his new partner set out to combat the rogue Digimon. They are tasked with protecting the world from Digimon attacks, whilst a mysterious organization determined to eliminate all Digimon and their Tamers lurks in the shadows... ",TV,51.0,Finished Airing,"Apr 1, 2001","Mar 31, 2002","Yomiko Advertising, Fuji TV","Saban Entertainment, Flatiron Film Company",Toei Animation,Original,"Adventure, Comedy, Drama, Fantasy",Isekai,young boy,25.0,PG - Children,7.631,116606.0,12562.0,1089,185204,1751,2001.0
260,Happy☆Lesson (TV),HAPPY☆LESSON,Unknown,"Hitotose Chitose was always alone and untrusting of people but when 5 female teachers appear and started living together with him in his family's house as his mothers, things started to change and pick up, together with Hazuki-nee and Minazuki (his 2 sisters) everyday is a lesson. 

(Source: ANN)",TV,13.0,Finished Airing,"Apr 1, 2002","Jun 30, 2002",KSS,ADV Films,Studio Hibari,Manga,"Comedy, Drama, Romance, Slice of Life",Harem,Unknown,23.0,PG-13 - Teens 13 or older,6.621,11690.0,56952.0,3784,26552,29,2002.0
236,E's Otherwise,エスアザーワイズ,E's Otherwise,"Kai, who has powers different from the rest, together with his sickly sister Hikaru was protected by an organization called ASHURUM. Scouted by Eiji, Kai was delegated to the ASHURUM special force AESES and undergo intensive training. Whenever he was free, Kai visited Hikaru at the hospital belongs to the organization, but Hikaru's condition never improved. So, one year later, with amazing growth from the intensive training, Kai decides to escape from the organization.

(Source: ANN)",TV,26.0,Finished Airing,"Apr 1, 2003","Sep 23, 2003",Sotsu,ADV Films,Pierrot,Manga,"Adventure, Comedy, Drama, Sci-Fi, Supernatural",Military,young boy,23.0,PG-13 - Teens 13 or older,6.611,6779.0,57752.0,4763,15765,22,2003.0
850,Gakuen Heaven,学園ヘヴン,Gakuen Heaven,"Itou Keita, an average guy, is shocked when he's invited to attend the elite institution, ""Bell Liberty Academy."" Unnerved by the mystery, he's further distracted by the school's social dynamics. In a sea of amazing young men, Keita struggles to find out what makes him unique, and how he can possibly deserve to be treated as an equal by the boys of BL. Lacking any particular ability, just why has Itou been welcomed into the privileged world of the talented and the beautiful? 

Along the way, he develops intense relationships with the almost everyone at school but he is terribly drawn to the friendly, over-caring but very mysterious classmate, Kazuki Endou.",TV,13.0,Finished Airing,"Apr 1, 2006","Jun 24, 2006","Geneon Universal Entertainment, Visual Arts",Media Blasters,Tokyo Kids,Visual novel,"Boys Love, Comedy, Drama, Romance","Harem, School",Unknown,26.0,PG-13 - Teens 13 or older,6.481,30426.0,65172.0,2370,64025,168,2006.0
6919,X-Men,エックスメン,X-Men,"The X-Men are reunited following the death of a teammate, and are summoned by Charles Xavier to Japan following the abduction of Hisako Ichiki (Armor). There, they confront the U-Men, a lunatic cult that steals and transplants mutant organs to further strengthen their own army, and the battle for justice is on.

(Source: Marvel)",TV,12.0,Finished Airing,"Apr 1, 2011","Jun 24, 2011","Sony Pictures Entertainment, Atelier Musa",Marvel Entertainment,Madhouse,Other,"Action, Drama",Super Power,Unknown,23.0,PG-13 - Teens 13 or older,6.331,12557.0,73192.0,3840,25743,26,2011.0
32438,Mayoiga,迷家-マヨイガ-,The Lost Village,"A bus full of eccentric individuals is headed towards the urban legend known as Nanaki Village, a place where one can supposedly start over and live a perfect life. While many have different ideas of why the village cannot be found on any map, or why even the police cannot pinpoint its location, they each look forward to their new lives and just what awaits them once they reach their destination.

After a few mishaps, they successfully arrive at Nanaki Village only to find it completely abandoned. Judging from the state of disrepair, it has been vacant for at least a year. However, secrets are soon revealed as some of the group begin to go missing while exploring the village and amidst the confusion, they find bloody claw marks in a forest. As mistrust and in-fighting break out, will they ever be able to figure out the truth behind this lost village?

[Written by MAL Rewrite]",TV,12.0,Finished Airing,"Apr 1, 2016","Jun 17, 2016","WOWOW, Mainichi Broadcasting System, Pony Canyon, KlockWorx, Studio Mausu, Azumaker, Shogakukan",Ponycan USA,Diomedéa,Original,"Drama, Horror, Mystery",Psychological,Unknown,24.0,R - 17+ (violence & profanity),5.501,106539.0,110892.0,975,208473,276,2016.0
25777,Shingeki no Kyojin Season 2,進撃の巨人 Season2,Attack on Titan Season 2,"For centuries, humanity has been hunted by giant, mysterious predators known as the Titans. Three mighty walls—Wall Maria, Rose, and Sheena—provided peace and protection for humanity for over a hundred years. That peace, however, was shattered when the Colossal Titan and Armored Titan appeared and destroyed the outermost wall, Wall Maria. Forced to retreat behind Wall Rose, humanity waited with bated breath for the Titans to reappear and destroy their safe haven once more.

In Shingeki no Kyojin Season 2, Eren Yeager and others of the 104th Training Corps have just begun to become full members of the Survey Corps. As they ready themselves to face the Titans once again, their preparations are interrupted by the invasion of Wall Rose—but all is not as it seems as more mysteries are unraveled. As the Survey Corps races to save the wall, they uncover more about the invading Titans and the dark secrets of their own members.

[Written by MAL Rewrite]",TV,12.0,Finished Airing,"Apr 1, 2017","Jun 17, 2017","Production I.G, Dentsu, Mainichi Broadcasting System, Pony Canyon, Kodansha, Techno Sound, Pony Canyon Enterprise",Funimation,Wit Studio,Manga,"Action, Drama","Gore, Military, Survival",young boy,24.0,R - 17+ (violence & profanity),8.501,650516.0,1192.0,12,2395390,20123,2017.0
876,Street Fighter II V,ストリートファイターII V,Street Fighter II The Animated Series,"Ryu and Ken Masters are close friends and both are martial artists. In order to become better fighters and learn new techniques, they travel the world and are exposed to many different fighting styles, as well as meeting new people. During their journey, they find themselves caught up in a conspiracy perpetrated by a mysterious organisation called Shadowlaw, both now face their ultimate challenge and must fight for their lives as they combat the evil M. Bison. 

(Source: ANN)",TV,29.0,Finished Airing,"Apr 10, 1995","Nov 27, 1995","YTV, Studio Take Off",Manga Entertainment,Group TAC,Game,"Action, Adventure, Drama, Mystery",Unknown,young boy,24.0,PG-13 - Teens 13 or older,7.041,14277.0,37422.0,3852,25553,95,1995.0
1563,Magic Knight Rayearth II,魔法騎士（マジックナイト）レイアース II,Magic Knight Rayearth II,"Little time has passed since the Magic Knights’ final confrontation with Princess Emeraude’s ""Mashin."" Still haunted by the princess’ death, Hikaru Shidou returns to Tokyo Tower. There, she meets her friends Umi Ryuuzaki and Fuu Hououji for the first time since their spontaneous quest to save Cephiro. Plagued by nightmares of the realm she had left behind, Hikaru is relieved to find that her companions too want to return and serve the kingdom they once so dutifully protected.

The Magic Knights’ wish is answered, for at the top of Tokyo Tower, the three are blinded by the same great light they had seen on the day they first met. Once more on the back of a flying fish, the group returns to Cephiro—a world now desolate and in ruins. With the collapse of the Pillar's power, monsters freely roam the land while three nations seek to annex Cephiro with hopes of seizing the Pillar for themselves. Complicating things further is the mysterious Lady Debonair, who proclaims herself to be the rightful heir of the fallen country.

Now confronting graver stakes and radically different enemies, the three Magic Knights set forth once more to save Cephiro and bring peace. With the bonds they have forged together, the trio stands united in the face of such a great challenge.

[Written by MAL Rewrite]
",TV,29.0,Finished Airing,"Apr 10, 1995","Nov 27, 1995",Unknown,"Media Blasters, Discotek Media",TMS Entertainment,Manga,"Adventure, Drama, Fantasy, Romance","Isekai, Mecha",young girl,24.0,PG-13 - Teens 13 or older,7.511,15751.0,16282.0,3515,30746,136,1995.0
