ID,Title,Japanese,English,Synopsis,Type,Episodes,Status,Start_Aired,End_Aired,Producers,Licensors,Studios,Source,Genres,Themes,Demographics,Duration_Minutes,Rating,Score,Scored_Users,Ranked,Popularity,Members,Favorites,year
6164,Aoi Hana,青い花,Sweet Blue Flowers,"Shy and soft-spoken Fumi Manjoume and upfront and caring Akira Okudaira were best friends in elementary school, but this changed when Fumi and her family moved away. Years later, Fumi moves back to her hometown after being accepted at Matsuoka Girls’ High School. She finally reunites with Akira, who is going to attend Fujigatani Girls’ Academy. Despite their reunion, their relationship isn't the same as it was years ago.

As soon as Fumi starts attending school, popular senior Yasuko Sugimoto takes notice of her and flatters her more than any other underclassmen. After running to Akira for help so many times before, Fumi must figure out who she is as a person instead of standing in someone else’s shadow.  However, that doesn’t stop Akira from wanting her friendship with Fumi to be as it once was. Will the girls be able to conquer the high school stage of growing up before it pulls them apart?

[Written by MAL Rewrite]
",TV,11.0,Finished Airing,"Jul 2, 2009","Sep 10, 2009","Fuji TV, Fujipacific Music",Nozomi Entertainment,J.C.Staff,Manga,"Girls Love, Romance, Slice of Life",Unknown,Unknown,22.0,PG-13 - Teens 13 or older,7.111,34442.0,33962.0,1889,93478,381,2009.0
12403,Yuru Yuri♪♪,ゆるゆり♪♪,YuruYuri Happy Go Lily ♪♪,"The girls of the Amusement Club return in Yuru Yuri♪♪, finding new ways to make passing time even more enjoyable. Their members consist of the always energetic Kyouko Toshinou; calm and sensible Yui Funami; polite but often overlooked Akari Akaza; and Chinatsu Yoshikawa, who stumbled upon the others while looking for the Tea Ceremony Club. Together they are the Amusement Club, which has the deceptively simple task of keeping its members entertained.

Along with the Student Council and the odd family member, they strive to enjoy their youth to the fullest. Whether it's a trip to a hot spring or finishing overdue homework, their lives are never dull, and they will always find an excuse to spend time together.

[Written by MAL Rewrite]",TV,12.0,Finished Airing,"Jul 3, 2012","Sep 18, 2012","Sotsu, Pony Canyon, DAX Production","NIS America, Inc.",Doga Kobo,Manga,"Comedy, Girls Love","CGDCT, Gag Humor, School",Unknown,23.0,PG-13 - Teens 13 or older,7.831,96835.0,8432.0,1165,173549,922,2012.0
444,Maria-sama ga Miteru: Haru,マリア様がみてる～春～,Maria Watches Over Us Printemps,"The spring term is beginning for the students at Lillian Girls' Academy. Friends are reunited, but for the Yamayuri Council, it's a bittersweet time. Yoko, Eriko, and Sei are busy preparing to depart Lillian while Sachiko, Rei, and Shimako are doing their best to ensure that their dear sisters receive a memorable commencement.

Sei's departure will leave a sizable hole in the White Roses, and filling it won't be easy. But is there anyone who could appeal to Shimako enough to become the next Rosa Gigantea en bouton?

(Source: RightStuf)",TV,13.0,Finished Airing,"Jul 4, 2004","Sep 26, 2004",Unknown,Nozomi Entertainment,Studio Deen,Light novel,"Drama, Girls Love, Romance",School,young girl,24.0,PG-13 - Teens 13 or older,7.641,12042.0,12362.0,3832,25880,83,2004.0
10495,Yuru Yuri,ゆるゆり,YuruYuri Happy Go Lily,"After a year in grade school without her childhood friends, first year student Akari Akaza is finally reunited with second years Yui Funami and Kyouko Toshinou at their all-girls' middle school. During the duo's first year, Yui and Kyouko formed the ""Amusement Club"" which occupies the now nonexistent Tea Club's room. Shortly after Akari joins, one of her fellow classmates, Chinatsu Yoshikawa, pays the trio a visit under the impression that they are the Tea Club; it is only once the three girls explain that the Tea Club has been disbanded that they can convince Chinatsu to join the Amusement Club—a group with no purpose other than to provide entertainment for its members.

Based on the slice-of-life manga by Namori, Yuru Yuri is an eccentric comedy about a group of girls who spend their spare time drinking tea and fawning over each other, all while completely failing to even notice the supposed main character Akari amongst them.

[Written by MAL Rewrite]",TV,12.0,Finished Airing,"Jul 5, 2011","Sep 20, 2011","TV Tokyo, Daume, Sotsu, Pony Canyon, DAX Production, Studio Gram, PRA, Jumondo","NIS America, Inc.",Doga Kobo,Manga,"Comedy, Girls Love","CGDCT, Gag Humor, School",Unknown,23.0,PG-13 - Teens 13 or older,7.581,144786.0,14022.0,622,319696,4381,2011.0
34383,Netsuzou TRap,捏造トラップ―NTR―,Netsuzou Trap -NTR-,"High school students Yuma Okazaki and Hotaru Mizushina are childhood friends. With their respective boyfriends, Takeda and Fujiwara, their lives couldn't be more perfect. From playing in school to going on group dates, it seems nothing can break their bond. 

However, during one such group date, Hotaru makes an unexpected move. While Takeda and Fujiwara are distracted, she begins stroking Yuma's thighs. Taken aback by this peculiar action, Yuma awkwardly retreats to the toilets, followed shortly by her aggressor. Now in private, Hotaru forces the innocent Yuma into a locked cubicle and whispers into her ear: ""You'll be more nervous with a boy; I'll help you practice.""

[Written by MAL Rewrite]",TV,12.0,Finished Airing,"Jul 5, 2017","Sep 20, 2017","DMM.com, Ichijinsha, Cloud22",Unknown,Creators in Pack,Manga,"Drama, Girls Love, Romance",Unknown,Unknown,9.0,R+ - Mild Nudity,5.341,66565.0,116322.0,1338,147274,281,2017.0
5914,Kanamemo,かなめも,Unknown,"Middle schooler Kana Nakamachi's life drastically changes when her grandmother passes away. Leaving behind an empty house, Kana learns that no one can provide her lodging due to her young age. Eventually, she stumbles upon the Fuhshin Gazette, a local newspaper delivery business who is able to provide her with a place to stay if she works for them in return.

The small store is staffed by several unique people: the sweets-loving Yume Kitaoka and her girlfriend Yuuki Minami; the frugal Hinata Azuma; the alcoholic Haruka Nishida; and the young but mature Saki Amano. It is not all fun and games at the Fuhshin Gazette, though, as Kana must deal with long working hours, energetic dogs guarding mailboxes, and confusing delivery routes. Add in a small rivalry with Mika Kujiin, a girl from a competing store, and Kana will have more than enough to keep her hands full!

[Written by MAL Rewrite]",TV,13.0,Finished Airing,"Jul 6, 2009","Sep 28, 2009","Starchild Records, TV Tokyo Music, Houbunsha",Maiden Japan,feel.,4-koma manga,"Comedy, Girls Love, Slice of Life, Ecchi",CGDCT,Unknown,24.0,PG-13 - Teens 13 or older,6.851,14742.0,45672.0,3184,37330,68,2009.0
98,Mai-HiME,舞-HiME,My-Hime,"Thirteen girls, each with the ability to materialize ""Elements"" and summon metallic guardians called ""Childs"" have been brought to Fuuka Academy to battle mysterious creatures called Orphans. Each with a different personality and background, they must decide who they truly care about and why they fight. ",TV,26.0,Finished Airing,"Oct 1, 2004","Apr 1, 2005","Bandai Visual, TV Tokyo Music, Studio Zain","Funimation, Bandai Entertainment",Sunrise,Original,"Action, Comedy, Drama, Fantasy, Girls Love, Romance","Mecha, School",Unknown,23.0,PG-13 - Teens 13 or older,7.421,50375.0,19312.0,1673,110307,1144,2004.0
30385,Valkyrie Drive: Mermaid,ヴァルキリードライヴ マーメイド,Valkyrie Drive Mermaid,"Naïve 16-year-old Mamori Tokonome is accustomed to being teased at school for having an unfortunate surname that can also be read as ""virgin."" However, young Mamori will soon have to get used to being teased in other ways...

Kidnapped during gym class, Mamori wakes up only to find herself stranded and under attack on the exotic island of Mermaid. Luckily, enigmatic fellow castaway Mirei Shikishima knows exactly how to take the lead—through a passionate kiss, Mirei unleashes Mamori's Exter transformation abilities, turning the innocent red-head into a battle-ready cutlass through the power of arousal.

The duo will need to tap into that power as Mermaid Island is full of potential friends and foes: Charlotte, the sadistic Liberator of an Exter harem; the gluttonous and crafty Meifon; the mysterious but charismatic Akira Hiiragi; and the erotic biker duo Lady Lady. Mamori and Mirei's powerful and intimate embrace is the only way for the pair to ensure their survival on this scandalous island.

[Written by MAL Rewrite]",TV,12.0,Finished Airing,"Oct 10, 2015","Dec 26, 2015",Genco,Funimation,Arms,Original,"Action, Fantasy, Girls Love, Ecchi",Unknown,Unknown,24.0,R+ - Mild Nudity,6.051,51941.0,87862.0,1476,128403,405,2015.0
52381,Aru Asa Dummy Head Mic ni Natteita Ore-kun no Jinsei,ある朝ダミーヘッドマイクになっていた俺クンの人生,Unknown,"After reincarnating into a dummy head microphone, the protagonist gets involved in the lives of high school girls who do ASMR. The comedic anime will follow these high schoolers as they aim for the ASMR Koshien.

(Source: MAL News)",TV,,Not yet aired,"Oct 13, 2022",Unknown,Unknown,Unknown,"EKACHI EPILKA, Indivision",Original,"Girls Love, Slice of Life",Unknown,Unknown,3.0,None,,,,7422,5214,25,2022.0
497,Yami to Boushi to Hon no Tabibito,ヤミと帽子と本の旅人,"Yamibo Darkness, The Hat and the Travelers of the Books","Hatsuki is a highschool student living with her sister, Hatsumi, who she has a huge crush on. On Hatsumi's 16th birthday, she is suddenly surrounded by a green light and disappears in front of Hatsuki. She manages to follow Hatsumi with the help of a being resembling a fat baby chick (literally), ending up in a place called ""The Great Library"", which is full of different worlds stored in books. Hatsumi wasn't there, though, so the search for Hatsuki's great love begins and involves traveling from book to book.

(Source: AniDB) ",TV,13.0,Finished Airing,"Oct 2, 2003","Dec 25, 2003",Unknown,Media Blasters,Studio Deen,Visual novel,"Adventure, Fantasy, Girls Love, Mystery, Ecchi",Unknown,Unknown,24.0,R+ - Mild Nudity,6.531,10115.0,62162.0,3673,28281,104,2003.0
143,Kannazuki no Miko,神無月の巫女,Destiny of the Shrine Maiden,"Kannazuki no Miko begins in the village of Mahoroba, where time passes slowly for both man and nature. Two students from the village's prestigious Ototachibana Academy might as well be night and day. Himeko is shy and unassertive, while Chikane is bold and elegant. Despite this, they love each other, and nothing can come between them, no matter how hard they try.

On the two girls' shared birthday, a sinister voice corrupts one of their friends into attacking them, and just when it seemed grimmest, the lunar and solar priestess powers that lay dormant in the two girls awaken, dispelling the evil. That was only the first hurdle, however. The two must now fend off the countless others who would threaten their well-being—even the people closest to them!",TV,12.0,Finished Airing,"Oct 2, 2004","Dec 18, 2004","Studio Fantasia, Geneon Universal Entertainment, Remic, Front Line, Kodansha, Rondo Robe, Memory-Tech, Toshiba Entertainment","Sentai Filmworks, Geneon Entertainment USA",TNK,Manga,"Drama, Girls Love, Romance, Supernatural",Mecha,young boy,24.0,PG-13 - Teens 13 or older,6.821,29032.0,47122.0,2312,66816,694,2004.0
6205,Kämpfer,けんぷファー,Kämpfer,"Waking up transformed into a beautiful girl might be the stuff of some guys' fantasies, but when the suddenly effeminatized Natsuru is informed by a stuffed tiger that he's now a Kampfer, a mystical fighter who has to fight other Kampfers in female form, his life becomes a living nightmare!

Putting aside the obvious ""plumbing"" issues, Natsuru's best childhood friend turns out to swing the other way and SHE has a crush on his new female body. Not complex enough? Natsuru's school has separate sections for boys and girls, so he and she are now double enrolled. The rumor-mill has it that he's dating herself. And there are other Kampfers attending the school who want to take her out, and he's not sure which ones mean ""on a date"" and which ones mean ""permanently."" Oh, and did we mention that some Kampfers use swords and guns?! Hormones, fists, and other body parts will fly as the daring, new gender-bender defender must become a contender or die!

(Source: Sentai Filmworks)",TV,12.0,Finished Airing,"Oct 2, 2009","Dec 18, 2009","TBS, RAY",Sentai Filmworks,Nomad,Light novel,"Action, Comedy, Girls Love, Romance, Ecchi","Magical Sex Shift, School, Super Power",Unknown,24.0,PG-13 - Teens 13 or older,6.391,139797.0,70272.0,760,269269,773,2009.0
2964,Blue Drop: Tenshi-tachi no Gikyoku,BLUE DROP ～天使達の戯曲～,Blue Drop,"Five years ago, something horrifying happened on Kamioki Island. Something so nightmarish that it stripped all memory from Mari Wakatake's mind even as it left every other human on the island dead in its wake! Now enrolled against her will at an isolated girl's academy, Mari is unaware that hidden eyes are watching her, waiting for her memory to return. 

Buried in her psyche is the most terrifying secret of all: while Mari was the only human who lived, she may not have been the only survivor! As something in a female skin invades Kaihou Academy, Mari's only hope may lie in a strange girl to whom she is inexplicably drawn yet cannot trust. 

(Source: Sentai Filmworks) ",TV,13.0,Finished Airing,"Oct 3, 2007","Dec 26, 2007","Pony Canyon, Memory-Tech, Showgate, King Records",Sentai Filmworks,"BeSTACK, Asahi Production",Manga,"Drama, Girls Love, Sci-Fi",Unknown,Unknown,26.0,PG-13 - Teens 13 or older,6.691,11754.0,53542.0,3617,29183,103,2007.0
35241,Konohana Kitan,このはな綺譚,Konohana Kitan,"In a bustling village of spirits, Yuzu, a cheerful fox girl, starts her first job as an attendant at the traditional hot springs inn Konohanatei. Though Yuzu has no experience working at such a high-class establishment, Kiri, the affable and reliable head attendant, immediately puts her to work learning the basics.

While Yuzu's eagerness initially proves to be more of a hindrance than a blessing, her playful nature brings a unique charm to the inn, as both customers and her fellow workers quickly warm up to her clumsy yet well-meaning mistakes. Under the guidance of the other foxes—the rigid Satsuki, the carefree Natsume, the critical Ren, and the quiet Sakura—Yuzu steadily learns the trade of an inn attendant while learning to love the magical world surrounding her.

Konohana Kitan presents the heartwarming tale of a simple fox girl forging bonds with others and finding a home amidst the mysterious, beautiful world of spirits.

[Written by MAL Rewrite]",TV,12.0,Finished Airing,"Oct 4, 2017","Dec 20, 2017","Genco, Lantis, AT-X, GAGA, Memory-Tech, Studio Mausu, DeNA, Kadokawa, Melonbooks",Funimation,Lerche,Manga,"Fantasy, Girls Love, Slice of Life","Anthropomorphic, CGDCT, Iyashikei, Workplace",teenager,23.0,PG-13 - Teens 13 or older,7.511,46599.0,16552.0,1384,140518,621,2017.0
37579,Tonari no Kyuuketsuki-san,となりの吸血鬼さん,Ms. vampire who lives in my neighborhood.,"Rumors tell about an ageless girl who only comes out at night, living in a mansion in the middle of the forest. Some say that she is a living doll with a soul. Upon hearing these rumors, Akari Amano seeks out this girl, only to find herself lost as she treks through the woods amidst the darkness.

A vampire named Sophie Twilight saves her, turning out to be the rumored girl. However, unlike the vampires told in myths, Sophie does not attack humans and instead orders her blood online. Akari instantly becomes charmed with her doll-like appearance and proceeds to abruptly move in with her, thus starting their life together.

[Written by MAL Rewrite]",TV,12.0,Finished Airing,"Oct 5, 2018","Dec 21, 2018",Nippon Columbia,Discotek Media,"Studio Gokumi, AXsiZ",4-koma manga,"Comedy, Girls Love, Slice of Life, Supernatural","CGDCT, Vampire",Unknown,23.0,PG-13 - Teens 13 or older,7.091,39238.0,35042.0,1844,96419,308,2018.0
37786,Yagate Kimi ni Naru,やがて君になる,Bloom Into You,"Yuu Koito has always been entranced with romantic shoujo manga and the lyrics of love songs. She patiently waits for the wings of love to sprout and send her heart aflutter on the day that she finally receives a confession. Yet, when her classmate from junior high declares his love for her during their graduation, she feels unexpectedly hollow. The realization hits her: she understands romance as a concept, but she is incapable of experiencing the feeling first-hand.

Now, having enrolled in high school, Yuu, disconcerted and dispirited, is still ruminating over how to respond to her suitor. There, she happens upon the seemingly flawless student council president, Touko Nanami, maturely rejecting a confession of her own. Stirred by Touko's elegant manner, Yuu approaches her for advice, only to be bewildered when the president confesses to her! Yuu quickly finds herself in the palm of Touko's hand, and unknowingly sets herself on a path to find the emotion which has long eluded her.

[Written by MAL Rewrite]",TV,13.0,Finished Airing,"Oct 5, 2018","Dec 28, 2018","AT-X, Sony Music Communications, Docomo Anime Store, Kadokawa Media House, Kadokawa",Sentai Filmworks,TROYCA,Manga,"Drama, Girls Love, Romance",School,Unknown,24.0,PG-13 - Teens 13 or older,7.911,122860.0,7012.0,685,296139,5509,2018.0
37722,Uchi no Maid ga Uzasugiru!,うちのメイドがウザすぎる！,UzaMaid!,"Having lost her mother at a young age, Misha Takanashi, a second grader who is Russian now lives with her Japanese step-father. Tsubame Kamoi, formerly a Japan Air Self-Defense Force, JASDF officer, comes to the Takanashi household as a housekeeper. This is a home comedy where Kamoi, a hardcore lolicon, attempts to get near Misha as she tries to fight against her.
",TV,12.0,Finished Airing,"Oct 5, 2018","Dec 21, 2018","AT-X, Sony Music Communications, Futabasha, Kadokawa Media House, NTT Plala, Kadokawa",Unknown,Doga Kobo,Manga,"Comedy, Girls Love, Slice of Life",Unknown,Unknown,23.0,PG-13 - Teens 13 or older,6.901,47290.0,43492.0,1670,110450,183,2018.0
28883,Hidan no Aria AA,緋弾のアリアAA（ダブルエー）,Aria the Scarlet Ammo AA,"Akari Mamiya, a first-year student from Tokyo Butei High, idolizes the S-rank Butei Aria Holmes Kanzaki and wishes to follow in her footsteps. Despite only being an inept E-rank Butei, Akari's resolve to improve remains strong. After the idea of having an Amica contract (a senior-student mentorship program) with Aria is brought up, Akari submits a request form attempting to establish said contract. Her classmates and friends do not expect Aria to accept Akari's request, mainly because of the girl's strict selection process, but to everyone's surprise, Aria gives Akari a chance through a test, which Akari miraculously passes! However, Aria will not officially make Akari her Amica until Akari meets her standards.

Training under Aria will be no easy feat, as she has to concurrently manage her relationships with her friends. Will Akari have what it takes to walk down the same path as her idol?

[Written by MAL Rewrite]
",TV,12.0,Finished Airing,"Oct 6, 2015","Dec 22, 2015","flying DOG, Fujishouji",Funimation,Doga Kobo,Manga,"Action, Girls Love",School,Unknown,23.0,PG-13 - Teens 13 or older,6.201,40697.0,80202.0,1863,95472,79,2015.0
30279,Yuru Yuri San☆Hai!,ゆるゆり さん☆ハイ！,Unknown,"The members of the Amusement Club are back with more of Kyouko Toshinou's antics, Chinatsu Yoshikawa's schemes, Yui Funami's retorts, and Akari Akaza's small social presence as they strive to make each day as fun as the last! Whether the activity is an arm wrestling contest or making pancakes together, the group of entertainment-seekers are sure to give it their all.

The club members are often joined by their friends in the Student Council, who know how to have a good time as well. While it can get a little chaotic when all eight girls get together, it sure doesn't stop them from meeting up and having fun!

[Written by MAL Rewrite]",TV,12.0,Finished Airing,"Oct 6, 2015","Dec 22, 2015","Sotsu, Pony Canyon",Unknown,TYO Animations,Manga,"Comedy, Girls Love","CGDCT, Gag Humor, School",Unknown,23.0,PG-13 - Teens 13 or older,7.921,61563.0,6672.0,1605,116119,679,2015.0
6203,Sasameki Koto,ささめきこと,Whispered Words,"Murasame Sumika is popular in the high school for her excellence in the marks and sports. However, she has a secret: she is in love with her classmate Kazama Ushio. Ushio also has a liking to the love between girls, but she hasn't noticed Sumika's feelings and has always been refused by other girls.",TV,13.0,Finished Airing,"Oct 8, 2009","Dec 31, 2009","Half H.P Studio, flying DOG",Unknown,AIC,Manga,"Comedy, Girls Love, Romance",School,Unknown,24.0,PG-13 - Teens 13 or older,7.061,25082.0,36642.0,2262,69339,283,2009.0
39790,Adachi to Shimamura,安達としまむら,Adachi and Shimamura,"Somewhere in the school at noon, one might hear the sound of two girls playing table tennis together as they wait for time to pass by.

As if by fate, two students—Sakura Adachi and Hougetsu Shimamura—stumble upon each other on the second floor of the school gymnasium. As they gradually foster a budding friendship, their feelings for one another only become more ambiguous. Growing closer by the day, the two must learn to navigate their contrasting personalities as well as determine the depth of their affection for each other.

The nature of this relationship gradually shifts when one of them starts to develop feelings beyond the boundaries of a platonic relationship. Even so, Adachi and Shimamura must realize if forming a bond stronger than friendship will bring them closer or tear them apart.

[Written by MAL Rewrite]",TV,12.0,Finished Airing,"Oct 9, 2020","Dec 25, 2020","Pony Canyon, Kadokawa",Funimation,Tezuka Productions,Light novel,"Girls Love, Romance, Slice of Life",School,Unknown,24.0,PG-13 - Teens 13 or older,7.101,64066.0,34432.0,1220,165668,1314,2020.0
51817,Watashi no Yuri wa Oshigoto desu!,私の百合はお仕事です！,Yuri is My Job!,"Life appears promising for Hime Shiraki, a girl with good grades, a flawless reputation, and a cute face to top it all off. As long as she can keep up her picture perfect facade, she will be able to accomplish her dream: to be loved by everyone and become the trophy wife of a billionaire.

On a day like any other, Hime slips down a flight of stairs and lands on top of Mai Mikoshiba, injuring the latter's arm. It turns out that Mai is the manager of a cafe, and the injury will make work impossible for her. It is decided that while Mai recovers, Hime will have to replace Mai at Café Liebe, which boasts an all-girls academy theme.

Despite causing Mai's injury, Hime is accepted by the other staff members, with the exception of one girl who seems to hate her for reasons unknown. Hime becomes terrified that this girl has seen past her facade, which reminds her of a troubling event in her past. 

[Written by MAL Rewrite]",TV,,Not yet aired,Unknown,Not Available,"Infinite, Ichijinsha",Unknown,"Passione, Studio Lings",Manga,"Comedy, Girls Love",Unknown,Unknown,,None,,,,6881,6289,35,
