ID,Title,Japanese,English,Synopsis,Type,Episodes,Status,Start_Aired,End_Aired,Producers,Licensors,Studios,Source,Genres,Themes,Demographics,Duration_Minutes,Rating,Score,Scored_Users,Ranked,Popularity,Members,Favorites,year
52736,Tensei Oujo to Tensai Reijou no Mahou Kakumei,転生王女と天才令嬢の魔法革命,Unknown,"Despite her supposed ineptitude with regular magic, Princess Anisphia defies the aristocracy's expectations by developing ""magicology,"" a unique magical theory based on memories from her past life. One day, she witnesses the brilliant noblewoman Euphyllia unjustly stripped of her title as the kingdom's next monarch. That's when Anisphia concocts a plan to help Euphyllia regain her good name-which somehow involves them living together and researching magic! Little do these two ladies know, however, that their chance encounter will alter not only their own futures, but those of the kingdom...and the entire world!

(Source: Yen Press)",TV,,Not yet aired,2023,Unknown,Kadokawa,Unknown,Diomedéa,Light novel,"Comedy, Fantasy, Girls Love",Unknown,Unknown,,None,,,,9211,2769,17,2023.0
22123,Inugami-san to Nekoyama-san,犬神さんと猫山さん,Inugami-san to Nekoyama-san,"Yachiyo Inugami, a cat-loving extrovert, and Suzu Nekoyama, a dog-loving introvert, are unexpectedly cast into a relationship on a day like any other. The pair find themselves drawn together through an inexplicable attraction of their opposite personalities. As they quickly begin to understand one another, Inugami's hardened resolve to gain Nekoyama's favor only leads to frenzied responses. Soon after their momentous union, the two begin to spend more time with one another, growing closer all the while.

Their combined antics gain the attention of the mousy Mikine Nezu, a classmate of Inugami, and soon they join the ""biology"" club. There, they meet Ushikawa Ukiji, a passive, cow-like upperclassmen. Nezu and Nekoyama soon begin to build upon their relationship and a game of cat and mouse soon begins.

Wild, explosive, and vibrant, Inugami-san to Nekoyama-san tells the comedic tale of two high school girls and their less-than-normal relationship.

[Written by MAL Rewrite]",TV,12.0,Finished Airing,"Apr 11, 2014","Jun 27, 2014","DAX Production, Dream Creation",Unknown,Seven,4-koma manga,"Comedy, Girls Love",School,Unknown,3.0,PG-13 - Teens 13 or older,6.531,35482.0,62392.0,2168,73938,109,2014.0
555,Koutetsu Tenshi Kurumi 2,鋼鉄天使くるみ2式,Steel Angel Kurumi 2,"Taking place 75 years after the first series, Steel Angel Kurumi 2 brings the Steel Angels in a new mis-adventure. High school student and aspiring cellist Nako Kagura accidentally discovers and kisses Kurumi Mk. II at her home, thus making her Kurumi's master. But things go awry as Nako's best friend Uruka gets jealous and tries anything - including her father's army of top-secret mecha - to destroy Kurumi and win back Nako. Things get more out of control when Saki Mk. II is awakened by Uruka, and Karinka Mk. II joins in to steal Nako away from Kurumi. 

(Source: ANN)",TV,12.0,Finished Airing,"Apr 12, 2001","Jun 28, 2001","m.o.e., Pony Canyon",ADV Films,OLM,Original,"Comedy, Girls Love, Romance, Sci-Fi",Mecha,young boy,15.0,R+ - Mild Nudity,6.271,5207.0,76502.0,5397,11437,9,2001.0
879,Simoun,シムーン,Unknown,"In the peaceful theocracy of Simulicram, everyone is born female. At age 17, each maiden undergoes a special ceremony where she chooses her sex. However, only Pairs of maiden priestesses can synchronize with the ancient flying ships known as Simoun needed to defend Simulicram. These Pairs refrain from undergoing the ceremony as long as they wish to keep piloting their Simoun.

Aer is recruited to be a Simoun pilot after a terrifying attack by an enemy nation decimates the squadron known as Chor Tempest. To earn her wings she needs to find her way into the heart of Neviril, Regina of Chor Tempest. But Neviril's heart still belongs to her previous Pair, lost in the battle when she attempted a forbidden Simoun maneuver.

(Source: Media Blasters) ",TV,26.0,Finished Airing,"Apr 3, 2006","Sep 25, 2006","Bandai Visual, Sotsu, TV Tokyo Music",Media Blasters,Studio Deen,Original,"Drama, Fantasy, Girls Love, Romance",Military,Unknown,24.0,PG-13 - Teens 13 or older,7.431,11278.0,18962.0,3063,40130,418,2006.0
855,Strawberry Panic,ストロベリー・パニック,Strawberry Panic,"Nagisa Aoi begins her new school life as a transfer student at St. Miator’s Girls Academy, one of three prestigious all-girls institutions atop Astraea Hill. Getting lost on her first day, Nagisa encounters a mysterious student whose elegance and charm is so bewitching, she ends up in the infirmary.

There to greet her when she awakens is Tamao Suzumi, her roommate, who enthusiastically introduces Nagisa to the daily life and social structure on campus. Most notably, Tamao informs her of the existence of an exceptional student representative among all three schools—the Etoile, or ""star."" Eager to meet this person, Nagisa learns that the ethereal beauty she met earlier, Shizuma Hanazono, is the one and only Etoile herself! Not only that, Shizuma seems openly interested in Nagisa! Her interactions with Shizuma naturally make her a hot topic on campus; yet despite being so captivated, Nagisa can’t help but wonder if something is off.

Strawberry Panic! follows the everyday routines of Nagisa, Shizuma, and her friends at St. Miator’s, St. Spica, and St. Lulim as they navigate through the challenge of relationships while confronting hidden feelings, lingering regrets, and new possibilities.

[Written by MAL Rewrite]",TV,26.0,Finished Airing,"Apr 4, 2006","Sep 26, 2006","Lantis, Dwango",Media Blasters,Madhouse,Other,"Drama, Girls Love, Romance",School,Unknown,25.0,PG-13 - Teens 13 or older,7.281,55319.0,25682.0,1448,132817,1758,2006.0
19429,Akuma no Riddle,悪魔のリドル,Riddle Story of Devil,"Tokaku Azuma has just transferred to the elite Myoujou Academy, a private girls' boarding school. But there's a catch: she, along with 11 of her fellow students in Class Black, is an assassin taking part in the challenge to kill their sweet-natured classmate, Haru Ichinose. Whoever succeeds will be granted their deepest desire, no matter the difficulty or cost. However, each assassin only gets one chance; if they fail to kill her, they will be expelled.

Despite the extraordinary reward, Tokaku decides to take a different course of action. Though Haru is her target, the young assassin soon finds herself drawn to the very girl she is supposed to kill. With the entire class out for Haru, Tokaku refuses to let her friend die, vowing to protect her from a growing bloodlust.

[Written by MAL Rewrite]",TV,12.0,Finished Airing,"Apr 4, 2014","Jun 20, 2014","Mainichi Broadcasting System, Pony Canyon, DAX Production",Funimation,Diomedéa,Manga,"Action, Girls Love",School,Unknown,23.0,R - 17+ (violence & profanity),6.611,122183.0,57652.0,802,253502,993,2014.0
36943,Tachibanakan Triangle,立花館To Lieあんぐる,Love To-LIE-Angle,"As Hanabi Natsuno returns home after six years in Tokyo, memories flood into her. As she prepares to start high school, she moves to Tachibanakan, the local dormitory for female students. Upon her arrival, Hanabi stumbles upon a bare naked beauty, and instantly falls head over heels for her. She also reencounters Konomi Fujiwara, her childhood friend who she barely remembers.

Hanabi is introduced to the other residence of the dorm and quickly becomes the center of attention. As the girls instantly take to the newcomer and begin shooting for her affection—subtly or obtrusively—Hanabi realizes that it is certainly going to be an interesting school year.

[Written by MAL Rewrite]",TV,12.0,Finished Airing,"Apr 4, 2018","Jun 20, 2018","Ichijinsha, Cloud22",Unknown,"Creators in Pack, Studio Lings",Manga,"Comedy, Girls Love, Ecchi",Unknown,Unknown,3.0,PG-13 - Teens 13 or older,5.601,24628.0,107772.0,2419,61869,71,2018.0
28817,Mikagura Gakuen Kumikyoku (TV),ミカグラ学園組曲,Mikagura School Suite,"To be around cute girls wearing cute clothing is all Eruna Ichinomiya desires. Since Mikagura High School happens to have the cutest uniforms around, she decides to enroll in this prestigious high school known for its cultural clubs.

However, she does not realize that joining a club is mandatory, and representatives from each club must battle for a ranking. Based on these rankings, club members are awarded housing and food. Chasing after Seisa Mikagura, the most beautiful girl in school, Eruna joins the going-home club but finds herself thrust into fighting the next club battle. With the other club representatives wielding unique powers, the competition is sure to be fierce!

Based on the popular song series, Mikagura Gakuen Kumikyoku follows Eruna as she explores the various clubs in school and assists the members with their troubled lives, all of whom are also vying for the top spot in school.

[Written by MAL Rewrite]",TV,12.0,Finished Airing,"Apr 7, 2015","Jun 23, 2015","Media Factory, Movic, AT-X, Showgate",Funimation,Doga Kobo,Mixed media,"Action, Comedy, Girls Love","School, Visual Arts",Unknown,24.0,PG-13 - Teens 13 or older,6.681,34258.0,54042.0,2004,85162,174,2015.0
9712,Maria†Holic Alive,まりあ†ほりっく あらいぶ,Maria†Holic Alive,"When Kanako Miyamae transferred to a new all-girls school, she hoped to find true love. What she found instead was the beautiful Mariya Shidou, a charming classmate Kanako met on her first day. But Mariya has one flaw: she is actually a cross-dressing boy! After discovering Mariya's secret and becoming stuck with him as her roommate, Kanako's life has become a series of misfortunes. All she wants is to find the girl of her dreams, which is hard to do with the meddling of the sadistic Mariya and his sharp-tongued maid Matsurika Shinouji.

Maria†Holic Alive continues the story of Kanako as she deals with being Mariya's roommate and aims to find true love, while enduring high school itself.

[Written by MAL Rewrite]",TV,12.0,Finished Airing,"Apr 8, 2011","Jun 24, 2011",TV Tokyo Music,Sentai Filmworks,Shaft,Manga,"Comedy, Girls Love","Crossdressing, Parody, School",Unknown,23.0,PG-13 - Teens 13 or older,6.961,28321.0,40642.0,2396,62756,64,2011.0
3342,Mnemosyne: Mnemosyne no Musume-tachi,Mnemosyne－ムネモシュネの娘たち－,Rin Daughters of Mnemosyne,"Immortality is something many people would wish for. But would it be such a coveted ability if people knew they would be subject to countless attacks because of it? Such is the case for Rin Asougi, an immortal private investigator, because there is no shortage of people who want her dead. Over the centuries, she has met many grisly ends, but each time, she returns to life as if nothing had happened.

In 1990, while looking for a lost cat, Rin runs into Kouki Maeno, a man who feels that his memories are wrong. Agreeing to help him, Rin discovers that Kouki is not what he seems, all the while drawing closer to her true enemy. This adversary knows Rin and her kind all too well, and if she dies by his hand, she may stay dead permanently.

[Written by MAL Rewrite]",TV,6.0,Finished Airing,"Feb 4, 2008","Jul 7, 2008","VAP, Sotsu, Genco, AT-X, Showgate",Funimation,Xebec,Original,"Action, Girls Love, Horror, Sci-Fi, Supernatural",Gore,Unknown,45.0,R+ - Mild Nudity,7.271,69603.0,26252.0,1171,172784,1054,2008.0
20047,Sakura Trick,桜Trick,Sakura Trick,"Having been best friends since middle school, Haruka Takayama and Yuu Sonoda plan to attend Misato West High School together. However, despite being assigned to the same class, a cruel twist of fate has them seated on the opposite ends of their classroom! To make matters worse, their school will shut down in three years, making them the final intake of first-year students. Undeterred by this chain of unfortunate events, Haruka is set on sticking with Yuu, striving to create many wonderful memories with her.

Much to Haruka's jealousy however, Yuu's easygoing demeanor quickly attracts the attention of their female classmates. Sympathizing with her friend's growing insecurity, Yuu ends up sharing a deep, affectionate kiss with her in an empty classroom. The act intensifies their bond as ""special friends,"" gradually revealing a different aspect to their unique friendship while also inviting new conflicts.

[Written by MAL Rewrite]",TV,12.0,Finished Airing,"Jan 10, 2014","Mar 28, 2014","Pony Canyon, TBS",Sentai Filmworks,Studio Deen,4-koma manga,"Comedy, Girls Love, Romance, Slice of Life",School,teenager,24.0,PG-13 - Teens 13 or older,6.971,115170.0,40492.0,827,246194,1476,2014.0
37890,Oshi ga Budoukan Ittekuretara Shinu,推しが武道館いってくれたら死ぬ,"If My Favorite Pop Idol Made It to the Budokan, I Would Die","A girl is obsessed with her favorite idol, a minor member of a less popular group, enough that she says she'd die to see her play at Budoukan. ",TV,12.0,Finished Airing,"Jan 10, 2020","Mar 27, 2020","Pony Canyon, TBS, Movic, Tokuma Shoten",Funimation,8bit,Manga,"Comedy, Girls Love, Slice of Life","Idols (Female), Music, Otaku Culture",teenager,24.0,PG-13 - Teens 13 or older,7.421,16379.0,19362.0,3156,38198,274,2020.0
667,Kashimashi: Girl Meets Girl,かしまし〜ガール・ミーツ・ガール〜,Girl Meets Girl,"Hazumu was a shy boy who enjoyed gardening, collecting herbs, and long walks in the mountains. One day he finally worked up the courage to confess his love to Yasuna, but she rejected him. 

Depressed, he wandered up Mt. Kashimayama, the place where they first met, to reconsider his feelings. After getting lost, he wished upon a shooting star and received a bizarre twist of fate. 

Now he is a she, and she stumbles headfirst back into social life and relationships only to find that the entire landscape has changed!

(Source: Media Blasters)",TV,12.0,Finished Airing,"Jan 12, 2006","Mar 30, 2006","Bandai Visual, Lantis","Media Blasters, Discotek Media",Studio Hibari,Manga,"Comedy, Drama, Girls Love, Romance, Slice of Life","Love Polygon, Magical Sex Shift, School",Unknown,24.0,PG-13 - Teens 13 or older,6.631,22568.0,56802.0,2780,47720,170,2006.0
11769,Gokujo.: Gokurakuin Joshikou Ryou Monogatari,ゴクジョッ。~極楽院女子高寮物語~,Unknown,"A story about the humorous misadventures of Akabane Aya, an arrogant high school girl who's constantly trying to outdo her classmates in everything (especially sex appeal), only to make a fool of herself in the process. Since the story takes place in an all-girls school, expect lots of yuri fanservice innuendos without much seriousness.
",TV,12.0,Finished Airing,"Jan 24, 2012","Mar 27, 2012","Lantis, Cammot",Unknown,LMD,Manga,"Comedy, Girls Love, Ecchi",School,teenager,6.0,PG-13 - Teens 13 or older,6.151,12264.0,82712.0,3559,30106,37,2012.0
3750,Maria-sama ga Miteru 4th,マリア様がみてる〜４th〜,Maria Watches Over Us Season 4,"Yumi and the Yamayuri Council have found two new helpers in Kanako and Toko. Unfortunately, their assistance comes with tension, as neither girl is particularly fond of the other and both seem likely candidates to be Yumi's petite soeur. Will either be a good fit for Yumi? As the school year marches on, the work for the Yamayuri Council piles up, and pressure begins to mount for Yumi to make her final decision.

(Source: RightStuf)",TV,13.0,Finished Airing,"Jan 3, 2009","Mar 28, 2009",Unknown,Nozomi Entertainment,Studio Deen,Light novel,"Girls Love, Slice of Life",School,young girl,25.0,PG-13 - Teens 13 or older,7.761,8949.0,9542.0,4213,20908,84,2009.0
5030,Maria†Holic,まりあ†ほりっく,Maria†Holic,"In search of true love, Kanako Miyamae transfers to Ame no Kisaki Catholic school, inspired by how her parents fell in love with each other there. There is just one difference, though: because men make Kanako break into hives, she has actually come to the all-girls school to find a partner of the same sex.

When she meets the beautiful Mariya Shidou, Kanako believes she has found that special someone; however, there's more to Mariya than meets the eye—it turns out that Kanako's first love is actually a cross-dressing boy. Mariya threatens to expose Kanako's impure intentions unless she keeps his real gender a secret, and to make things worse, he also replaces her original roommate so that he can now keep a close eye on her.

Maria†Holic follows Kanako as she looks for love in all the wrong places and searches for the girl of her dreams—that is, if she can survive being Mariya's roommate!

[Written by MAL Rewrite]",TV,12.0,Finished Airing,"Jan 4, 2009","Mar 22, 2009","Frontier Works, Genco, Media Factory, AT-X, Omnibus Japan",Sentai Filmworks,Shaft,Manga,"Comedy, Girls Love","Crossdressing, Parody, School",Unknown,24.0,PG-13 - Teens 13 or older,7.021,74625.0,38132.0,1212,167469,490,2009.0
41392,Urasekai Picnic,裏世界ピクニック,Otherside Picnic,"The ""Otherworld"" is a vast and dangerous realm hidden from the knowledge of the common folk. It is also home to many creatures that threaten any human who dare visit it. To witness its desolate yet oddly absorbing environment, one must search for portals that could reside anywhere, from secret elevators to shrine entrances.

After a fateful encounter with a horrendous Otherworld denizen, Sorao Kamikoshi ponders whether to keep going or give up in life. Meanwhile, Toriko Nishina scours the Otherworld in hopes of finding her friend Satsuki, who she believes is lost somewhere within the realm. 

When the two cross paths, friendship blossoms. In order to acquire as much information about this obscure dimension, the two travel back and forth from the real world to the other. Sorao and Toriko's bodies are soon influenced by the Otherworld, preparing them for the many horrors to come as both of them try to fulfill their goals.

[Written by MAL Rewrite]",TV,12.0,Finished Airing,"Jan 4, 2021","Mar 22, 2021","Sony Pictures Entertainment, Square Enix, Frontier Works, AT-X, Hakuhodo DY Music & Pictures, Amusement Media Academy, BS11, Good Smile Film, Hayakawa Shobou",Funimation,"LIDENFILMS, Felix Film",Novel,"Adventure, Fantasy, Girls Love, Mystery, Sci-Fi",Isekai,Unknown,23.0,R - 17+ (violence & profanity),6.591,34946.0,58632.0,1738,105653,488,2021.0
26165,Yuri Kuma Arashi,ユリ熊嵐,Yurikuma Arashi,"In the past, humanoid bears coexisted with humans. However, a meteor shower that fell onto Earth had a strange effect on bears throughout the world: they suddenly became violent and hungry for human flesh, spurring an endless cycle of bloodshed in which bear ate man and man shot bear, forgetting the lively relationship they once had. The ""Wall of Severance"" was thus built, separating the two civilizations and keeping peace.

Kureha Tsubaki and Sumika Izumino are two lovers attending Arashigaoka Academy, who, upon the arrival of two bears that have sneaked through the Wall of Severance and infiltrated the academy, find their relationship under a grave threat. The hungering yet affectionate bears, Ginko Yurishiro and Lulu Yurigasaki, seem to see the bear-hating Kureha as more than just another meal, and in getting closer to her, trigger an unraveling of secrets that Kureha may not be able to bear.

When their relationships provoke the Invisible Storm, a group that keeps order within the ideological school, the girls must stand on trial with their love, embarking on a journey of self-discovery en route to attaining true love's ""promised kiss.""

[Written by MAL Rewrite]",TV,12.0,Finished Airing,"Jan 6, 2015","Mar 31, 2015","Frontier Works, Media Factory, Mainichi Broadcasting System, Movic, Gentosha Comics",Funimation,"SILVER LINK., Lapin Track",Original,"Drama, Fantasy, Girls Love","Psychological, School",teenager,24.0,R - 17+ (violence & profanity),7.051,32652.0,36782.0,1853,95991,722,2015.0
34382,Citrus,シトラス,Citrus,"During the summer of her freshman year of high school, Yuzu Aihara's mother remarried, forcing her to transfer to a new school. To a fashionable socialite like Yuzu, this inconvenient event is just another opportunity to make new friends, fall in love, and finally experience a first kiss. Unfortunately, Yuzu's dreams and style do not conform with her new ultrastrict, all-girls school, filled with obedient shut-ins and overachieving grade-skippers. Her gaudy appearance manages to grab the attention of Mei Aihara, the beautiful and imposing student council president, who immediately proceeds to sensually caress Yuzu's body in an effort to confiscate her cellphone.

Thoroughly exhausted from her first day, Yuzu arrives home and discovers a shocking truth—Mei is actually her new step-sister! Though Yuzu initially tries to be friendly with her, Mei's cold shoulder routine forces Yuzu to begin teasing her. But before Yuzu can finish her sentence, Mei forces her to the ground and kisses her, with Yuzu desperately trying to break free. Once done, Mei storms out of the room, leaving Yuzu to ponder the true nature of her first kiss, and the secrets behind the tortured expression in the eyes of her new sister.

[Written by MAL Rewrite]",TV,12.0,Finished Airing,"Jan 6, 2018","Mar 24, 2018","Sotsu, Lantis, AT-X, KlockWorx, Happinet Pictures, BS Fuji, Tokyo MX, Infinite, Children's Playground Entertainment, Ichijinsha, Crunchyroll SC Anime Fund",Funimation,Passione,Manga,"Drama, Girls Love, Romance",School,Unknown,23.0,PG-13 - Teens 13 or older,6.461,249275.0,65972.0,401,468304,3588,2018.0
158,Maria-sama ga Miteru,マリア様がみてる,Maria Watches Over Us,"When Yumi Fukuzawa entered the Lillian Girls' Academy, a prestigious all-girls Catholic school in Tokyo, she never imagined she would catch the eye of beautiful and demure Sachiko Ogasawara, one of the school's most popular students. Now Sachiko has offered to be Yumi's soeur, her ""sister"" and guide for all her years at the academy. The whole idea has Yumi completely flustered—after all, they hardly know each other!

The entire campus is abuzz with rumors about the two of them, but Yumi is conflicted over accepting Sachiko's offer. While she admires Sachiko, being her soeur would also mean constantly being at the center of the entire school's attention!

(Source: RightStuf)",TV,13.0,Finished Airing,"Jan 8, 2004","Apr 1, 2004","Rondo Robe, TV Tokyo Music","Nozomi Entertainment, Maiden Japan",Studio Deen,Light novel,"Drama, Girls Love, Romance, Slice of Life",Unknown,young girl,24.0,PG-13 - Teens 13 or older,7.301,20309.0,24602.0,2372,63937,660,2004.0
37993,Watashi ni Tenshi ga Maiorita!,私に天使が舞い降りた！,WATATEN! an Angel Flew Down to Me,"College student Miyako Hoshino is quite shy around other people. She mostly spends her time in her room making cosplay outfits. When her fifth-grade sister Hinata brings her classmate Hana Shirosaki home, Miyako instantly becomes captivated with Hana's cuteness. 

Miyako tries to do various things, ranging from making Hana wear cosplay dresses to giving her sweets. This gives Hana a bad impression of her at first, but Miyako will do anything to grow closer to the angel who has descended before her.

[Written by MAL Rewrite]",TV,12.0,Finished Airing,"Jan 8, 2019","Mar 26, 2019","AT-X, flying DOG, Sony Music Communications, Kadokawa Media House, Ichijinsha, Kadokawa",Unknown,Doga Kobo,4-koma manga,"Comedy, Girls Love, Slice of Life",Unknown,Unknown,23.0,PG-13 - Teens 13 or older,7.301,74657.0,24832.0,1106,181536,898,2019.0
795,Oniisama e...,おにいさまへ…,Dear Brother,"When 16-year-old Nanako Misonoo enters the prestigious all-girls Seiran Academy, she believes a bright future awaits her. Instead, the unlucky girl finds herself dragged into a web of deceit, misery, and jealousy. On top of that, she is chosen as the newest inductee of the Sorority, an elite group whose members are the envy of the entire school. Having none of the grace, wealth, or talent of the other members, Nanako quickly draws the ire of her jealous classmates—especially the fierce Aya Misaki.

To cope with her increasingly difficult school life, Nanako recalls her days through letters to her former teacher, Takehiko Henmi, whom she affectionately calls ""onii-sama"" (big brother). She also finds comfort with her four closest friends: her childhood friend Tomoko Arikura, the sociable but erratic Mariko Shinobu, the troubled musician Rei Asaka, and the athletic tomboy Kaoru Orihara.

An impassioned drama about the hardships of bullying, Oniisama e... chronicles a young girl's harsh life at her new school, as she endures cruel rumours, heartless classmates, and countless social trials.

[Written by MAL Rewrite]",TV,39.0,Finished Airing,"Jul 14, 1991","May 31, 1992",NHK,Discotek Media,Tezuka Productions,Manga,"Drama, Girls Love","Psychological, School",young girl,25.0,PG-13 - Teens 13 or older,7.831,8959.0,8352.0,3044,40753,883,1991.0
37517,Happy Sugar Life,ハッピーシュガーライフ,Happy Sugar Life,"Satou Matsuzaka is a beautiful high schooler who has a reputation for being permissive with men. However, a chance encounter with a young girl named Shio Koube makes Satou realize that this is her first and only true feeling of love.

Telling others that she lives with her aunt, Satou secretly shares an apartment with Shio. Despite her innocent appearance, Satou is willing to do anything to protect her beloved, resorting to desperate measures to ensure that their ""happy sugar life"" remains intact.

[Written by MAL Rewrite]",TV,12.0,Finished Airing,"Jul 14, 2018","Sep 29, 2018","VAP, Square Enix, Genco, Mainichi Broadcasting System, Bit Promotion",Unknown,Ezόla,Manga,"Drama, Girls Love, Horror",Psychological,young boy,24.0,R - 17+ (violence & profanity),6.811,121126.0,47702.0,772,265405,2466,2018.0
