anime_ID,Title,Japanese,English,Synopsis,Type,Episodes,Status,Start_Aired,End_Aired,Producers,Licensors,Studios,Source,Genres,Themes,Demographics,Duration_Minutes,Rating,Score,Scored_Users,Ranked,Popularity,Members,Favorites
39944,Tokimeki Runners,TOKIMEKI Runners,Unknown,Music video included with the debut album for the Love Live! multimedia project Nijigasaki High School Idol Club.,Music,1.0,Finished Airing,2018-11-21,,Lantis,Unknown,Sunrise,Other,Unknown,"Idols (Female), Music",Unknown,6.0,PG-13 - Teens 13 or older,6.801,1281.0,48262.0,8719,3280,2
39644,Setsugetsuka,Unknown,Unknown,"A music video of the song ""Setsugetsuka"" performed by ST☆RISH and QUARTET NIGHT.",Music,1.0,Finished Airing,2018-11-21,,Broccoli,Unknown,Unknown,Visual novel,Unknown,"Idols (Male), Music",Unknown,3.0,G - All Ages,,,147942.0,16526,262,0
44265,Comet,comet,Comet,"The first official music video and original song by Hoshimachi Suisei, it is sung by and about her.",Music,1.0,Finished Airing,2018-11-22,,Unknown,Unknown,Unknown,Original,Unknown,Music,Unknown,4.0,G - All Ages,,,174672.0,21444,21,2
38980,I Like It,I Like It,I Like It,"The ""Japan Anime Edition"" music video directed by Ruka Noguchi for I Like It by Cardi B.",Music,1.0,Finished Airing,2018-11-26,,Warner Music Japan,Unknown,Unknown,Original,Unknown,Music,Unknown,1.0,PG-13 - Teens 13 or older,3.091,673.0,130992.0,12092,940,3
39245,Shinkaigyo no March,しんかいぎょのまち,Unknown,Music video directed by Kousuke Sugimoto for the song Shinkaigyo no March by Youka Wao that was featured on NHK's Minna no Uta program.,Music,1.0,Finished Airing,2018-12-01,,NHK,Unknown,Unknown,Original,Unknown,Music,Kids,2.0,G - All Ages,,,149732.0,17875,179,0
52373,Shan Shan Shabontama,シャンシャンシャボン玉,Unknown,Unknown,Music,1.0,Finished Airing,2018-12-01,,NHK,Unknown,Unknown,Unknown,Unknown,Music,Kids,2.0,G - All Ages,,,148112.0,20461,41,0
42887,Door,DOOR,Unknown,Music video for the song DOOR by Japanese rock band OKAMOTO'S that was featured on NHK's Minna no Uta program. The video was animated by Kazuma Morino.,Music,1.0,Finished Airing,2018-12-02,,NHK,Unknown,Unknown,Original,Unknown,Music,Kids,2.0,G - All Ages,,,176952.0,18632,135,0
38809,Black'n White Jammin' Cats,Black'n White JAMMIN' CATS,Black'n White Jammin' Cats,Official music video for the song Black'n White JAMMIN' CATS by the fictional band Irodorimidori. It is the 34th song in the franchise and focuses on Naru Hakobe and Shirona Tsukisuzu. ,Music,1.0,Finished Airing,2018-12-03,,Unknown,Unknown,Unknown,Original,Unknown,Music,Unknown,2.0,G - All Ages,5.511,459.0,110752.0,12653,782,0
38812,Botsuraku,没落,Unknown,"A short music video of the song Botsuraku by the band ""Boku no Lyric no Bouyomi."" It was made in honor of their 4th album of the same name going on sale the 2 days later. ",Music,1.0,Finished Airing,2018-12-10,,Victor Entertainment,Unknown,Unknown,Original,Unknown,Music,Unknown,1.0,G - All Ages,5.651,135.0,105662.0,16698,248,0
51428,Sonna Ame no Hi ni Wa,そんな雨の日には,Unknown,Collaboration between Hololive and Vocaloid P.,Music,1.0,Finished Airing,2018-12-12,,Unknown,Unknown,Unknown,Other,Unknown,Music,Unknown,3.0,G - All Ages,5.961,179.0,92522.0,15958,301,0
52560,Universe (2018),ユニバース,Unknown,"Music video for Natsushiro Takaaki's song Universe, featured on the album Ganger.",Music,1.0,Finished Airing,2018-12-16,,Unknown,Unknown,Hurray!,Original,Unknown,Music,Unknown,4.0,PG-13 - Teens 13 or older,,,158222.0,19683,62,0
51813,Umi Yori Fukai Sora no Shita,海より深い空の下,Unknown,Collaboration between Hololive and Vocaloid P.,Music,1.0,Finished Airing,2018-12-18,,Unknown,Unknown,Unknown,Unknown,Unknown,"Idols (Female), Music",Unknown,3.0,G - All Ages,5.901,291.0,95712.0,13271,635,0
51830,Steel Wonder,スチールワンダー,Steel Wonder,"Music video for the song Steel Wonder by Harumaki Gohan featuring Miku Hatsune.

Steel Wonder is the eighth song from Harumaki Gohan's album Neo Dream Traveler to be released as a single.",Music,1.0,Finished Airing,2018-12-26,,Unknown,Unknown,Studio Gohan,Original,Unknown,Music,Unknown,3.0,PG-13 - Teens 13 or older,,,152842.0,19038,106,0
38922,Kimi ga Mita Sora wa,キミが見た空は,Unknown,"Readyyy! is Sega's male idol training smartphone game. Within it is a 4-unit group called Maten Rocket. This is their official music video for their Kimi ga Mita Sora wa song. Maten Rocket is the fifth and final unit that received a MV.

(Source: Readyyy Project Wikia)",Music,1.0,Finished Airing,2018-12-27,,Unknown,Unknown,Unknown,Game,Unknown,"Idols (Male), Music",Unknown,1.0,G - All Ages,5.721,160.0,102912.0,15698,318,0
50242,Wannabe,Wannabe,Unknown,Unknown,Music,1.0,Finished Airing,2019-01-01,,Unknown,Unknown,VCRWORKS,Original,Avant Garde,Music,Unknown,1.0,G - All Ages,,,159102.0,19388,82,0
39001,Light Speed Days,ライトスピード・デイズ,Unknown,Official music video for the song Light Speed Days by the fictional band Irodorimidori. It is the 35th song in the franchise and focuses on Nagi Kobotoke and Serina Akesaka. ,Music,1.0,Finished Airing,2019-01-08,,Unknown,Unknown,Unknown,Original,Unknown,Music,Unknown,2.0,G - All Ages,5.321,415.0,117052.0,13014,697,0
38997,Boku wa Mou Inai,僕はもういない,Unknown,"Official music video for Boku no Lyric no Bouyomi's song Boku wa Mou Inai. It is a fusion of live-action, animation, and motion graphics. It was made in honor of their 4th album ""Botsuraku"" going on sale a month prior.",Music,1.0,Finished Airing,2019-01-08,,Victor Entertainment,Unknown,Unknown,Original,Unknown,Music,Unknown,3.0,G - All Ages,5.611,163.0,107212.0,15830,309,0
42988,New Tribe,New Tribe,Unknown,"Music video by AC-bu for the song New Tribe by Japanese experimental electronic artist Powder (Momoko Goto) from her album ""Powder In Space"".",Music,1.0,Finished Airing,2019-01-23,,Unknown,Unknown,Unknown,Original,Avant Garde,Music,Unknown,4.0,G - All Ages,,,138362.0,18375,151,2
39065,Bokura Mada Underground,僕らまだアンダーグラウンド,We're Still Underground,"Official music video for Eve's song Bokura Mada Underground from their album ""Otogi"" going on sale February 6, 2019.",Music,1.0,Finished Airing,2019-01-24,,Unknown,Unknown,Wit Studio,Original,Unknown,Music,Unknown,5.0,G - All Ages,7.481,2495.0,17372.0,8114,4169,12
39716,"Blue Hawaii feat. Crush, Penomeco","Blue Hawaii feat. Crush, PENOMECO","Blue Hawaii feat. Crush, Penomeco","Music video directed by South Korean animator mareykrap for the song Blue Hawaii feat. Crush, Penomeco by Punchnello in his album ""ordinary.""",Music,1.0,Finished Airing,2019-01-25,,"AOMG, 1theK",Unknown,Unknown,Original,Unknown,Music,Unknown,4.0,PG-13 - Teens 13 or older,5.551,168.0,109202.0,15941,302,0
39112,Kawaki wo Ameku,カワキヲアメク,Unknown,Music video for the song Kawaki wo Ameku by Minami.,Music,1.0,Finished Airing,2019-01-29,,Unknown,Unknown,Unknown,Music,Unknown,Music,Unknown,4.0,PG-13 - Teens 13 or older,8.321,16642.0,2242.0,3823,26001,189
39096,Danbou to Reibou,暖房と冷房,Unknown,"Official music video for Nishinakajima Kinako's song Danbou to Reibou promoting his special feature interview with Natalie (a Japanese entertainment news website) on February 27, 2019. The music video is available to view on Space Show Music's official YouTube channel.",Music,1.0,Finished Airing,2019-01-31,,Unknown,Unknown,Unknown,Original,Avant Garde,Music,Unknown,2.0,G - All Ages,4.791,147.0,126662.0,16586,256,1
51889,Pokemon Kids TV Douyou,ポケモン Kids TV 童謡 (どうよう),Pokémon Kids TV Nursery Rhymes,A collection of assorted animated nursery rhymes and children songs released on Pokemon Kids TV Japan YouTube Channel.,Music,,Currently Airing,2019-02-01,,Unknown,Unknown,Unknown,Game,Comedy,Music,Kids,2.0,PG - Children,,,143302.0,18365,152,0
39706,Cat Step,cat step,Cat Step,"Music video directed by Takashi Ohashi for the song Cat Step by Japanese music producer Daisuke Tanabe in his EP ""Cat Steps.""",Music,1.0,Finished Airing,2019-02-03,,Unknown,Unknown,Unknown,Original,Unknown,Music,Unknown,4.0,G - All Ages,5.381,125.0,115082.0,16995,230,1
50006,Mabashii DNA dake,眩しいDNAだけ,Unknown,"The official music video for the song Mabashii DNA dake from the album ""Imawa Imade Chikaiwa Emide"" by Zutomayo.",Music,1.0,Finished Airing,2019-02-04,,Unknown,Unknown,Unknown,Original,Unknown,Music,Unknown,3.0,G - All Ages,6.291,116.0,75182.0,17464,204,0
29361,Kareshi wa Hammerhead Shark,かれしはハンマーヘッドシャーク,Unknown,Unknown,Music,1.0,Finished Airing,2019-02-06,,Unknown,Unknown,Kachidoki Studio,Original,Comedy,Music,Kids,3.0,G - All Ages,,,190642.0,16542,261,0
39150,Otogi,おとぎ,Unknown,"Eve's first press limited edition release of their Otogi album CD includes an accompanying DVD. Eve is known as a musician and lyricist for Vocaloid videos but this CD+DVD release features only his ""self-covers"" where he is providing the vocals rather than a Vocaloid.

This entry encompasses the official music videos published on the Otogi DVD release. Refer to the More Info section for details.",Music,4.0,Finished Airing,2019-02-06,,"Toy's Factory, TriF Studio",Unknown,Unknown,Original,Unknown,Music,Unknown,3.0,G - All Ages,7.251,832.0,27012.0,10877,1495,3
39211,Fire Me Up,Fire me up,Fire me up,Official music video for the song Fire Me Up by the fictional band Irodorimidori. It is the 36th song in the franchise and focuses on Nazuna Tennozu and Aliciana Ogata.,Music,1.0,Finished Airing,2019-02-06,,Unknown,Unknown,Unknown,Original,Unknown,Music,Unknown,2.0,G - All Ages,5.421,429.0,113762.0,12784,746,0
39224,It's Show Time!,It's Show Time!,It's Show Time!,"Official music video for ARP's song It's Show Time!. ARP (Artists Republic Production) is a virtual ikemen idol group that utilizes augmented reality (AR). They debuted in March 2017 and have done several live concerts using the same technology that allowed for Hatsune Miku concerts. It's Show Time! marks the 1st song and music video of ARP to be signed onto Avex Entertainment's record label, and the first ever AR performance group in Avex's history to receive a record deal.",Music,1.0,Finished Airing,2019-02-07,,Avex Entertainment,Unknown,Unknown,Original,Unknown,"Idols (Male), Music",Unknown,3.0,G - All Ages,5.461,156.0,112562.0,15228,357,0
39257,Sayonara Gokko,さよならごっこ,Play Goodbye,Music video for the song Sayonara Gokko by amazarashi.,Music,1.0,Finished Airing,2019-02-12,,Unknown,Unknown,Unknown,Music,Avant Garde,Music,Unknown,2.0,PG-13 - Teens 13 or older,7.101,2091.0,34762.0,8428,3702,1
50088,No.2,ナンバーツー,No.2,Official music video for the song No.2 by Takuto.,Music,1.0,Finished Airing,2019-02-19,,Unknown,Unknown,Unknown,Original,Unknown,Music,Unknown,4.0,R - 17+ (violence & profanity),,,139052.0,18968,110,0
39831,Hitogata,ヒトガタ,Unknown,Full-length music video of Virtual-san wa Miteiru's ED.,Music,1.0,Finished Airing,2019-02-20,,Unknown,Unknown,Unknown,Original,Unknown,Music,Unknown,3.0,PG-13 - Teens 13 or older,6.561,377.0,60502.0,12797,744,0
39727,Houkago Kappa,放課後カッパー,Unknown,Short music video sung by Sara Azuma from Sarazanmai. It posted on the official noitaminA YouTube channel.,Music,1.0,Finished Airing,2019-02-21,,"Fuji TV, MAPPA",Unknown,Unknown,Original,Unknown,Music,Unknown,1.0,G - All Ages,,,185072.0,19100,105,0
52334,Felicia,フェリシア,Unknown,"AZKi's 3rd original song.

This is a refreshing pop song about youth, friendship, and bittersweet love.

(Source: hololivepro.com)",Music,1.0,Finished Airing,2019-02-25,,INoNaKa Music,Unknown,Unknown,Mixed media,Unknown,Idols (Female),Unknown,4.0,None,6.331,246.0,73322.0,13487,587,0
50485,Meiyou Yiwai,没有意外,No Exception,Music video for the song No Exception by KUN (of Nine Percent).,Music,1.0,Finished Airing,2019-02-26,,Unknown,Unknown,VCRWORKS,Original,Unknown,Music,Unknown,5.0,PG-13 - Teens 13 or older,,,133802.0,19434,80,0
52937,Shake it up 'n' go: Shakitto! Corn no Uta,Shake it up ’n’ go 〜シャキッと！コーンのうた〜,Unknown,"Music video for Shake it up 'n' go: Shakitto! Corn no Uta by Uchikubi Gokumon Doukoukai.

A special song is born from the collaboration between the Uchikubi Gokumon Club and Hagoromo Foods ""Shakitto! Corn""! Furthermore, in creating the music video, the band even collaborated with the popular creator Nagano! The unexpected chemistry of the three parties resulted in the most heartwarming music video.

(Source: Uchikubi Gokumon Doukoukai Official YouTube Channel)",Music,1.0,Finished Airing,2019-02-27,,Unknown,Unknown,Unknown,Music,Unknown,Music,Unknown,3.0,G - All Ages,,,148042.0,20460,41,0
52342,I Can't Control Myself,I can't control myself,Unknown,AZKi's fourth original song.,Music,1.0,Finished Airing,2019-02-28,,Unknown,Unknown,Unknown,Mixed media,Unknown,"Idols (Female), Music",Unknown,3.0,PG-13 - Teens 13 or older,6.111,127.0,85082.0,16868,238,2
39087,The Crater,ザ・クレーター,The Crater,"A short music lyric video for Syudan Koudou song's The Crater whose single was released on the same day. The band formally spells their name as Syudan Koudou but its proper romanization is Shuudan Koudou as their name literally means ""Collective Action.""

The Crater is composed of watercolor animation, particularly its space/atmosphere background which never recycles the same watercolor painting, with each frame being a differently painted segment.",Music,1.0,Finished Airing,2019-03-05,,Victor Entertainment,Unknown,Unknown,Original,Unknown,Music,Unknown,3.0,G - All Ages,,,155302.0,17950,175,0
41177,Parade,パレード,Unknown,A music video for the song Parade by Yorushika.,Music,1.0,Finished Airing,2019-03-11,,Unknown,Unknown,Unknown,Original,Unknown,Music,Unknown,5.0,G - All Ages,6.561,340.0,60082.0,13235,643,0
39560,Donten,曇天,Unknown,"Music video directed by Tomoko Ooshima for the single Donten by Japanese idol group Shiritsu Ebisu Chuugaku. The song was included on their fifth studio album ""MUSiC"". A short version of the music video was posted on the groups' YouTube channel January 24, 2019. The full version was later uploaded March 13, 2019.",Music,1.0,Finished Airing,2019-03-13,,SME Records,Unknown,Unknown,Original,Unknown,Music,Unknown,3.0,PG-13 - Teens 13 or older,5.981,128.0,91672.0,16898,236,0
43351,Sign (2019),sign,Unknown,"Music video by Tarafu Otani for the song sign by Japanese idol unit amiinA from their second album ""Discovery"".",Music,1.0,Finished Airing,2019-03-18,,Space Shower Music,Unknown,Unknown,Original,Avant Garde,Music,Unknown,4.0,G - All Ages,,,151242.0,17898,178,0
39623,You Should See Me in a Crown,you should see me in a crown,Unknown,"A new official music video for American singer and songwriter Billie Eilish's song ""you should see me in a crown"" animated by Takashi Murakami. The music video was available for purchase on iTunes Japan and US on the same day.",Music,1.0,Finished Airing,2019-03-18,,Unknown,Unknown,Poncotan,Music,Avant Garde,Music,Unknown,3.0,R - 17+ (violence & profanity),4.851,604.0,125952.0,12117,934,1
40286,Relationship Scramble feat. Hatsune Miku,スクランブル交際,Unknown,Music video by DECO*27.,Music,1.0,Finished Airing,2019-03-22,,Unknown,Unknown,Unknown,Original,Romance,Music,Unknown,3.0,PG-13 - Teens 13 or older,6.401,273.0,69302.0,13994,497,0
44260,"Tenkyuu, Suisei wa Yoru wo Mataide",天球、彗星は夜を跨いで,"Celestial sphere, comets straddle the night","Music video for the song Tenkyuu, Suisei wa Yoru wo Mataide by Suisei Hoshimachi.
",Music,1.0,Finished Airing,2019-03-22,,Unknown,Unknown,Unknown,Original,Unknown,Music,Unknown,4.0,PG-13 - Teens 13 or older,,,154982.0,21409,27,2
52335,Hikari no Machi,ひかりのまち,Unknown,"AZKi's 3rd original song, produced by music production group SCRAMBLES.",Music,1.0,Finished Airing,2019-03-25,,INoNaKa Music,Unknown,Unknown,Mixed media,Unknown,"Idols (Female), Music",Unknown,3.0,PG-13 - Teens 13 or older,6.071,113.0,86782.0,17503,202,0
39616,Jo Uta,助詩,Unknown,"Official music video for Wrench's song Jo Uta in honor of their album ""weak"" going on sale the previous week. The artwork was done by Tomohiro Matsuda and the animation and direction by Harunobu Mitsui.",Music,1.0,Finished Airing,2019-03-27,,Avex Entertainment,Unknown,Unknown,Original,Avant Garde,Music,Unknown,4.0,G - All Ages,,,188442.0,17758,186,0
52343,Starry Regrets,Starry Regrets,Unknown,"A sad and melancholic ballad about the singer’s
regrets over not having conveyed their feelings to an unrequited love who is no longer here. The song also features another theme about properly conveying our feelings to our loved
ones while we can.

(Source: hololivepro.com)",Music,1.0,Finished Airing,2019-03-28,,Unknown,Unknown,Unknown,Mixed media,Unknown,"Idols (Female), Music",Unknown,5.0,PG-13 - Teens 13 or older,6.031,116.0,89442.0,17338,211,1
50076,Gusha no Parade,愚者のパレード,Parade of Fools,Music video for Sou's song Gusha no Parade.,Music,1.0,Finished Airing,2019-03-29,,Unknown,Unknown,Unknown,Original,Unknown,Music,Unknown,4.0,PG-13 - Teens 13 or older,,,181702.0,18026,171,0
42842,Hanasaka Nyanko,花さかニャンコ,Unknown,Music video for the song Hanasaka Nyanko by Hiroko Taniyama that was featured on NHK's Minna no Uta program. The video was animated by Gaku Kinoshita.,Music,1.0,Finished Airing,2019-04-01,,"NHK, Yamaha Music Communications",Unknown,Unknown,Original,Unknown,Music,Kids,2.0,G - All Ages,,,182362.0,18486,144,0
39682,Daisuki tte Imi dayo,大好きって意味だよ,Unknown,"A song about people who having trouble reconciling after a fight. Even though they are fuming, they still love each other. 

The song also features Chico and Kyoe from Chico-chan ni Shikarareru!, a live-action variety show on NHK's General channel. Chico is a little girl and Kyoe is a crow, both are mascot/costumed characters in the show. The purpose of the show is to answer questions everyone alike might have such as ""why do you shake hands with people when you leave?"" and ""why does the food hotdog have dog in the name if the food isn't made out of the animal dog?"" through anthropology.",Music,1.0,Finished Airing,2019-04-01,,NHK,Unknown,Unknown,Original,Unknown,Music,Kids,2.0,G - All Ages,,,175452.0,17995,172,0
39658,Supermarket Flowers,Supermarket Flowers,Supermarket Flowers,"An animated music video of Ed Sheeran’s song Supermarket Flowers from his third studio album, ""÷(divide)"". The video was directed by Yoriko Hoshi, who’s a winner of a prestigious award: Tezuka Osamu Cultural Prize. The video consists of a heartwarming story, featuring Ed Sheeran and his beloved cats, Calippo and Dorito.",Music,1.0,Finished Airing,2019-04-03,,Warner Music Japan,Unknown,HOTZIPANG,Music,Unknown,Music,Unknown,3.0,G - All Ages,5.621,121.0,106692.0,17089,226,0
39684,Sayonara Freeway,サヨナラフリーウェイ,Sayonara Freeway,"Due to a certain incident three years ago, the Maigahara Senior High School light music club was tragically disbanded. Moreover, Nanase Hagiwara, who was the president at that time, had to drop out of her studies. Now returning as a third-year student, Nanase finally has a chance to make things right once again.

[Written by MAL Rewrite]
",Music,1.0,Finished Airing,2019-04-05,,Unknown,Unknown,Unknown,Original,Unknown,Music,Unknown,2.0,G - All Ages,5.581,414.0,108342.0,12737,757,0
41181,Dakara Boku wa Ongaku wo Yameta,だから僕は音楽を辞めた,That's Why I Gave Up on Music,A music video for the song Dakara Boku wa Ongaku wo Yameta by Yorushika.,Music,1.0,Finished Airing,2019-04-05,,Unknown,Unknown,Unknown,Original,Slice of Life,Music,Unknown,4.0,G - All Ages,7.041,770.0,37552.0,11066,1386,2
42378,We Two,We Two,Unknown,"Rotoscope music video for the song We Two by Japanese singer Aimer that was included on her fifth studio album ""Sun Dance"".",Music,1.0,Finished Airing,2019-04-10,,SME Records,Unknown,Unknown,Original,Unknown,Music,Unknown,4.0,G - All Ages,6.341,162.0,72632.0,15961,301,0
39769,Kimi ni Sekai,君に世界,Unknown,"Music video for Eve's song ""This World to You.""",Music,1.0,Finished Airing,2019-04-20,,Unknown,Unknown,Wit Studio,Music,"Fantasy, Sci-Fi",Music,Unknown,4.0,G - All Ages,6.801,1073.0,48012.0,10396,1805,4
43323,Timeless Tree,timeless tree,Unknown,"Music video directed by Saigo no Shudan and Tomomi Hayashi for the song timeless tree by Japanese jazz and rock musical duo EGO-WRAPPIN' from their ninth studio album ""Dream Baby Dream"".",Music,1.0,Finished Airing,2019-04-25,,Toy's Factory,Unknown,Saigo no Shudan,Original,Avant Garde,Music,Unknown,4.0,G - All Ages,,,155912.0,18540,142,0
40283,Role Playing Soldier,Role Playing Soldier,Unknown,"Music video directed by Sou Ootsuki for the song Role Playing Soldier by SKY-HI (Mitsuhiro Hidaka) on his fourth album ""JAPRISON"".",Music,1.0,Finished Airing,2019-04-26,,Avex Entertainment,Unknown,Unknown,Original,"Action, Fantasy","Music, Strategy Game",Unknown,3.0,PG - Children,6.041,131.0,88692.0,16570,258,0
51811,Fake.Fake.Fake,Fake.Fake.Fake,Unknown,"An original track created as the seventh part of AZKi's ""Virtual Diva AZKi"" campaign, where she released songs regularly for eight consecutive months.

(Source: Hololivepro.com)",Music,1.0,Finished Airing,2019-04-30,,INoNaKa Music,Unknown,Unknown,Unknown,Unknown,"Idols (Female), Music",Unknown,3.0,PG-13 - Teens 13 or older,6.451,499.0,66842.0,11829,1039,8
39786,Tejime,TEJIME,Tejime,"With a track inspired by Tejime, a Japanese custom of ceremonial rhythmic hand clapping, HIFANA gives thanks and bids farewell to the Heisei era (1989-2019), a time when the transition from analog to digital gave rise to so many new and innovative means of expression. This is their first new song in 9 years.

(Source: YouTube)",Music,1.0,Finished Airing,2019-04-30,,Unknown,Unknown,Unknown,Original,Unknown,Music,Unknown,3.0,G - All Ages,5.261,157.0,118552.0,16063,295,0
39975,Android Girl feat. Hatsune Miku,アンドロイドガール,Android Girl,Unknown,Music,1.0,Finished Airing,2019-05-03,,Unknown,Unknown,Unknown,Music,Unknown,Music,Unknown,3.0,G - All Ages,6.641,638.0,56132.0,11643,1104,5
40172,Lucky☆Orb feat. Hatsune Miku,ラッキー☆オーブ feat. 初音ミク,Unknown,"In commemoration of Hatsune Miku's world concert tour series ""Hatsune Miku EXPO"" celebrating its 5th anniversary, a special music video for this year's theme song, ""Lucky☆Orb feat. Hatsune Miku"" by emon(Tes.), was produced. The video is a collaboration between Crypton, Fantasista Utamaro, and Kasoku Sato.

The single was available for purchase that same day online and was later included on the Hatsune Miku EXPO 5th Anniversary EP, along with previous theme songs and contest winners.

(Source: YouTube)",Music,1.0,Finished Airing,2019-05-06,,Unknown,Unknown,Unknown,Original,Unknown,Music,Unknown,5.0,G - All Ages,6.601,481.0,58142.0,12400,852,1
39793,Ever Green Never End,Ever green Never end,Ever green Never end,Official music video for the song Ever Green Never End by the fictional band Irodorimidori. It is the 40th song in the franchise and focuses on Shirona Tsukisuzu.,Music,1.0,Finished Airing,2019-05-08,,Unknown,Unknown,Unknown,Original,Unknown,Music,Unknown,2.0,G - All Ages,5.691,424.0,104182.0,12674,777,0
50007,Seigi,正義,Justice,"The official music video for Seigi from the album ""Imawa Imade Chikaiwa Emide"" by Zutomayo.",Music,1.0,Finished Airing,2019-05-08,,Unknown,Unknown,Unknown,Original,Unknown,Music,Unknown,4.0,G - All Ages,6.341,106.0,72492.0,17733,188,0
39815,More feat. Anderson .Paak,More (feat. Anderson .Paak),More (feat. Anderson .Paak),"Music video directed by Shinichiro Watanabe for the single More (feat. Anderson .Paak) by American record producer Flying Lotus (Steven Ellison). It is featured on his sixth studio album ""Flamagra."" Flying Lotus and Shinichiro Watanabe's creative kinship was cultivated while working on Blade Runner: Black Out 2022, and the mutual respect led them to collaborating on this video.
",Music,1.0,Finished Airing,2019-05-11,,Unknown,Unknown,"Typhoon Graphics, StoryRiders Co. Ltd.",Original,Unknown,Music,Unknown,3.0,PG-13 - Teens 13 or older,6.111,528.0,84742.0,12054,949,0
39812,Stars Colliding,Stars Colliding,Stars Colliding,"Official short lyric music video for The Charm Park's song Stars Colliding in honor of the single's digital release going on sale the same day. There will also be a mini album that has the song on July 3, 2019.",Music,1.0,Finished Airing,2019-05-12,,Avex Entertainment,Unknown,Unknown,Original,Unknown,Music,Unknown,3.0,G - All Ages,5.351,120.0,116012.0,16973,232,0
40363,RoboCop,RoboCop,Unknown,"Music video directed by Takaharu Shimizu for the song RoboCop by Kenmochi Hidefumi on his album ""Footwork"".",Music,1.0,Finished Airing,2019-05-15,,Unknown,Unknown,Unknown,Original,Avant Garde,Music,Unknown,2.0,G - All Ages,4.811,165.0,126472.0,16136,290,0
40415,Senkou Progress,背徳ピストルズ「閃光PROGRESS」,Unknown,Music video for the song Senkou Progress by fictional band Haitoku Pistols.,Music,1.0,Finished Airing,2019-05-16,,XFLAG Pictures,Unknown,Unknown,Original,Unknown,Music,Unknown,3.0,G - All Ages,,,147802.0,17625,195,0
39826,Attouteki Vivid Days,圧倒的 Vivid Days,Unknown,"Official music video for Nanami Yoshi.'s song Attouteki Vivid Days. Nanami is a virtual idol whose song was also used as the ED to Kenja no Mago. A version with watermarks was posted to Avex Entertainment's official YouTube channel on May 17, 2019; it was stated to be the full-length music video. This was meant to advertise her CD+DVD going sale of the same name on June 19, 2019. The accompanying DVD will feature a clean version of the music video.",Music,1.0,Finished Airing,2019-05-17,,Unknown,Unknown,Unknown,Other,Unknown,Music,Unknown,3.0,G - All Ages,5.261,1905.0,118382.0,8210,4017,1
