anime_ID,Title,Japanese,English,Synopsis,Type,Episodes,Status,Start_Aired,End_Aired,Producers,Licensors,Studios,Source,Genres,Themes,Demographics,Duration_Minutes,Rating,Score,Scored_Users,Ranked,Popularity,Members,Favorites
37074,Daremo Shiranai,誰も知らない,Unknown,"One of the first Minna no Uta music videos ever created. It follows a child's imagination where ""nobody knows"" the answers to his questions such as what does a star taste like, if he throws his dad's hat really hard into the sky does it become a UFO, when worm wiggles around is it really wiggling into the shape of a number and calculating mathematics, etc.",Music,1.0,Finished Airing,1961-04-03,,NHK,Unknown,Unknown,Original,Unknown,Music,Kids,2.0,G - All Ages,,,175742.0,17020,229,0
34406,Punpun Polka,プンプンポルカ,Unknown,"A music video for the song ""Punpun Polka"" by Hiroshi Ashino that was featured on NHK's Minna no Uta program.",Music,1.0,Finished Airing,1961-08-10,,NHK,Unknown,Unknown,Original,Unknown,Music,Kids,1.0,G - All Ages,4.661,178.0,128042.0,14845,392,0
43598,Ookina Furudokei,大きな古時計,Unknown,"The original rendition of the Japanese version of the 1876 song My Grandfather's Clock by American composer and songwriter Henry Clay Work that was broadcast on NHK's Minna no Uta program. It was performed by Sumito Tachikawa and the Nagato Miho Kagekidan Jidou Gasshoudan (Miho Nagato Opera Children's Choir) and featured artwork by Rokurou Taniuchi. Due to the copyright law of the time, price of film reels, and overwriting tapes, Ookina Furudokei from 1962 remains to be one that is missing its video tape, as such the music video is considered lost media.",Music,1.0,Finished Airing,1962-06-01,,NHK,Unknown,Unknown,Music,Unknown,Music,Kids,,G - All Ages,,,140812.0,19116,101,0
37153,Warai Kawasemi ni Hanasu na yo,わらいかわせみに話すなよ,Unknown,"A music video for the song ""Warai Kawasemi ni Hanasu na yo"" by Toshie Kusunoki (楠トシエ). Aired as part of NHK's Minna no Uta program. ",Music,1.0,Finished Airing,1962-12-05,,NHK,Unknown,Unknown,Original,Unknown,Music,Kids,2.0,G - All Ages,,,159212.0,17523,201,0
24843,Clarinet Kowashichatta,クラリネットこわしちゃった,Unknown,A Minna no Uta video for a song from Dark Ducks.,Music,1.0,Finished Airing,1963-02-05,,NHK,Unknown,Unknown,Music,Unknown,Music,Kids,2.0,G - All Ages,4.881,182.0,125542.0,15089,368,0
43682,Koneko no Byouki,こねこの病気,Unknown,Music video for the song Koneko no Byouki by Japanese women's chorus sextet Voce Angelica that was featured on NHK's Minna no Uta program. The video features stop-motion animation by Group Claire.,Music,1.0,Finished Airing,1963-06-01,,NHK,Unknown,Unknown,Original,Unknown,Music,Kids,2.0,G - All Ages,,,193062.0,18752,127,0
24901,Cook no Polka,コックのポルカ,Unknown,A song for the Minna no Uta segment.,Music,1.0,Finished Airing,1964-08-03,,NHK,Unknown,Unknown,Music,Unknown,Music,Kids,2.0,G - All Ages,4.831,182.0,126192.0,15183,360,0
24905,Go-hiki no Kobuta to Charleston,五匹のこぶたとチャールストン,Unknown,A song for the Minna no Uta segment.,Music,1.0,Finished Airing,1964-08-03,,NHK,Unknown,Unknown,Music,Unknown,Music,Kids,2.0,G - All Ages,4.941,176.0,124882.0,14883,389,0
36382,Mama Gomennasai,ママごめんなさい,Unknown,A little boy apologizes to his mom about all the bad pranks he's been pulling. ,Music,1.0,Finished Airing,1964-08-06,,NHK,Unknown,Unknown,Original,Unknown,Music,Kids,2.0,G - All Ages,5.131,124.0,121552.0,17031,229,0
39874,Youki ni Utaeba,陽気にうたえば,Unknown,"The Japanese version of the Mexican folk song Las Chiapanecas, believed to be composed by Bulmaro López Fernández, with lyrics later added by Juan Arozamena. The video was animated by Yoji Kuri, accompanied by Japanese male chorus group Dark Ducks.",Music,1.0,Finished Airing,1964-12-11,,NHK,Unknown,Unknown,Music,Unknown,Music,Kids,2.0,G - All Ages,5.171,135.0,120662.0,16537,261,0
36356,Tanoshii ne,たのしいね,Unknown,Three girls have fun playing hand-clapping games.,Music,1.0,Finished Airing,1965-02-15,,NHK,Unknown,Unknown,Original,Unknown,Music,Kids,2.0,G - All Ages,,,154362.0,17364,210,0
36360,Hasami Togi,はさみとぎ,Unknown,A man sings a song while sharpening scissors as a part of his mobile business.,Music,1.0,Finished Airing,1965-04-07,,NHK,Unknown,Unknown,Original,Unknown,Music,Kids,2.0,G - All Ages,,,182792.0,17130,223,0
8719,Donna Donna,ドナ ドナ,Unknown,"A calf goes to a new home while memories of happiness flash by.

This is a 1966 Japanese version of an old 1938 Yiddish folk song that was featured in NHK's Minna no Uta.",Music,1.0,Finished Airing,1966-02-11,,NHK,Unknown,Unknown,Music,Slice of Life,Music,Kids,2.0,G - All Ages,5.171,214.0,120752.0,14375,438,0
8661,Chimuchimucheri ChimChimCheree,チムチムチェリー ChimChimCheree,Unknown,"The life of a chimney sweep in a song. This is the Japanese version of the 1964 Academy Award song Chim Chim Cher-ee that was originally sung by Dick Van Dyke and Julie Andrews in the movie 'Mary Poppins"". Given the anime treatment by graphic artist and animator Tadanori Yokoo and shown in the Minna no Uta segment of NHK programming.
",Music,1.0,Finished Airing,1966-04-05,,NHK,Unknown,Unknown,Music,Slice of Life,Music,Kids,2.0,G - All Ages,4.721,412.0,127402.0,12852,730,1
36378,Hotaru Koi,ほたるこい,Unknown,Kids go looking for fireflies in the night.,Music,1.0,Finished Airing,1966-06-08,,NHK,Unknown,Unknown,Original,Unknown,Music,Kids,2.0,G - All Ages,,,185022.0,17349,211,0
36357,Chibikko Cowboy,ちびっこカウボーイ,Unknown,A little boy has fun being a cowboy out in the Wild West.,Music,1.0,Finished Airing,1966-08-25,,NHK,Unknown,Unknown,Original,Unknown,Music,Kids,2.0,G - All Ages,,,173312.0,16545,260,2
37190,Karasu to Kaki no Tane,からすと柿のたね,Unknown,A song about the circle of life. A crow eats a persimmon and poops the seed out. The elements let the seed sprout and grow. It turns into a new persimmon tree and a new crow comes along and repeats the process.,Music,1.0,Finished Airing,1966-10-05,,NHK,Unknown,Unknown,Original,Unknown,Music,Kids,2.0,G - All Ages,,,190612.0,18457,146,0
24903,Neko Funjatta,ねこふんじゃった,Unknown,"A song for the Minna no Uta segment, it adapts ""Flohwalzer"" (Flea Waltz) is a simple German piano piece, often one of the first learned because its fingering is simple and it allows beginners to perform a piece that is harmonically and rhythmically pleasing. It has different names in different countries but in Japan this piece is known as Neko Funjatta (I Stepped on the Cat).

(Source: Wiki)",Music,1.0,Finished Airing,1966-10-20,,NHK,Unknown,Unknown,Original,Unknown,Music,Kids,2.0,G - All Ages,5.081,180.0,122582.0,15238,355,0
47912,Yurikago no Uta,ゆりかごのうた,Unknown,Music video about craddling a baby to sleep for song by Bonny Jacks featured on NHK's Minna no Uta. ,Music,1.0,Finished Airing,1967-04-01,,NHK,Unknown,Unknown,Unknown,Unknown,"Childcare, Music",Kids,2.0,G - All Ages,,,164992.0,18879,117,0
36301,Oyama no Taishou,お山の大将,Unknown,A song adaptation of the children's game King of the Hill.,Music,1.0,Finished Airing,1967-06-08,,NHK,Unknown,Unknown,Original,Unknown,Music,Kids,2.0,G - All Ages,,,141722.0,17712,190,0
37191,Yoninme no Ousama,四人目の王さま,Unknown,"A song about the three wise men, and how there was a fourth one but he was really easy going and never ended up going on the journey to meet the newborn Jesus.",Music,1.0,Finished Airing,1967-08-07,,NHK,Unknown,Unknown,Original,Unknown,Music,Kids,2.0,G - All Ages,,,164072.0,17165,221,0
36820,Kaijuu ga Yattekuru,怪獣がやってくる,Unknown,"Animals at a zoo hear that a kaijuu is coming. Like a game of ""Telephone"" they hear bits and pieces of what the kaijuu looks like which gets distorted each time the information is passed on. In the end, it was just a normal zoo animal joining the exhibits.",Music,1.0,Finished Airing,1967-10-04,,NHK,Unknown,Unknown,Original,Unknown,Music,Kids,2.0,G - All Ages,,,189232.0,17495,203,0
36056,Amaryllis,アマリリス,Unknown,"The final nine measures of the first ballet, labelled ""Le son de la clochette auquel Circé sortit de son jardin"" (the sound of the bell at which Circe leaves her garden), contain a tune that forms the basis of a nineteenth-century arrangement by Henry Ghys, which the latter mistakenly attributed to the air ""Amaryllis"" composed by Louis XIII. In Japan, this arrangement was given Japanese lyrics and introduced as ""Amaryllis"" on NHK's Minna no Uta series in 1968. The tune has since become well known as a French folk song there and its melody can be heard today as a chime signaling the hour over the PA systems of some schools and rural municipalities.

(Source: alchetron.com)",Music,1.0,Finished Airing,1968-02-07,,NHK,Unknown,Unknown,Original,Unknown,Music,Unknown,2.0,G - All Ages,5.191,124.0,120172.0,16209,284,0
30202,Bucket no Ana,バケツの穴,Unknown,A music video for the song by Kazuo Kumakura and NHK Tokyo Children's Choir that was featured on NHK's Minna no Uta Program. ,Music,1.0,Finished Airing,1968-08-05,,NHK,Unknown,Unknown,Original,Unknown,Music,Unknown,2.0,G - All Ages,4.981,137.0,124172.0,15777,313,0
35668,Okaasan no Kao,おかあさんの顔,Unknown,An ekaki uta of the singer's mother's portrait.,Music,1.0,Finished Airing,1968-12-02,,NHK,Unknown,Unknown,Original,Unknown,Music,Kids,2.0,G - All Ages,,,140222.0,17550,200,0
8646,44-hiki no Neko,44ひきのねこ,Unknown,"The Japanese version of the 1968 '44 Gatti,' an Italian song from the TV program Zecchino D'Oro. It was introduced in the Japanese NHK TV program 'Minna no Uta' in 1969.",Music,1.0,Finished Airing,1969-04-01,,NHK,Unknown,Unknown,Music,Unknown,Music,Kids,2.0,G - All Ages,4.521,1083.0,128872.0,10493,1746,3
47913,Pan no March,パンのマーチ,Unknown,Music video about making bread that was featured on NHK's Minna no Uta.,Music,1.0,Finished Airing,1969-12-01,,NHK,Unknown,Unknown,Unknown,Unknown,Music,Kids,2.0,G - All Ages,,,141932.0,19202,95,0
36380,Power Powan,ポワ ポワーン,Unknown,Unknown,Music,1.0,Finished Airing,1970-02-03,,NHK,Unknown,Unknown,Original,Unknown,Music,Kids,2.0,G - All Ages,,,143762.0,18537,142,0
36358,Tsubiregg Tsuburegg March,ツビレグ ツブレグ マーチ,Unknown,Anthropomorphic eggs go through a march.,Music,1.0,Finished Airing,1970-06-02,,NHK,Unknown,Unknown,Original,Unknown,Music,Kids,2.0,G - All Ages,,,156982.0,18123,166,0
36347,Gomennasai,ごめんなさい,Unknown,An anthropomorphic dog tires to do his best but makes careless errors. Such as cleaning the floors and dumping the bucket of dirty water out the window...which drenches a teacher walking by. He always tries to apologize for his mistakes.,Music,1.0,Finished Airing,1970-10-01,,NHK,Unknown,Unknown,Original,Unknown,Music,Kids,2.0,G - All Ages,,,180952.0,17679,192,0
8778,Avignon no Hashi de,アビニョンの橋で,Unknown,"A Japanese version of an old 15th century French song 'Sur le Pont d'Avignon,' which describes how people would come and dance on the Pont St. Bénézet (Pont d’Avignon). ",Music,1.0,Finished Airing,1970-10-06,,NHK,Unknown,Unknown,Music,Unknown,Music,Kids,2.0,G - All Ages,4.831,266.0,126152.0,13841,521,1
38324,Haru wo Yobu Yume,春をよぶ夢,Unknown,"A boy takes a walk outside as he notices little bits of spring starts to appear. Though in the end, it turns out he is merely dreaming it and winter is at its peak.

The music video was re-aired after 44 years due to being lost media. The Minna no Uta Hakkutsu Project (Minna no Uta Excavation Project) was able to find discover a copy of the original audio, as only the animated footage was originally saved by the NHK in the 70s.",Music,1.0,Finished Airing,1970-12-19,,NHK,Unknown,Unknown,Original,Unknown,Music,Kids,2.0,G - All Ages,,,182772.0,17999,172,0
39225,Watashi no Kamifuusen,わたしの紙風船,Unknown,"The original rendition of Watashi no Kamifuusen sung by Akai Tori and animated by Mouri Atsushi. Due to the copyright law of the time, price of film reels, and overwriting tapes, Watashi no Kamifuusen from 1971 remains to be one that is missing both its audio tape and video tape, as such the music video as a whole is considered lost media.",Music,1.0,Finished Airing,1971-02-03,,NHK,Unknown,Unknown,Original,Unknown,Music,Kids,,G - All Ages,,,159422.0,18653,134,0
36811,Kusakeiba,草競馬,Unknown,"A Minna no Uta version of the classic English song ""Camptown Races.""",Music,1.0,Finished Airing,1971-06-03,,NHK,Unknown,Unknown,Music,Unknown,"Music, Racing",Kids,2.0,G - All Ages,,,194402.0,17292,214,0
42637,Don Pepe no Uta,ドンペペの歌,Unknown,Music video for the song Don Pepe no Uta by Ado Mizumori and Japanese folk group The Shadracks that was featured on NHK's Minna no Uta program. The video was also animated by Ado Mizumori.,Music,1.0,Finished Airing,1971-10-08,,NHK,Unknown,Unknown,Original,Unknown,Music,Kids,2.0,G - All Ages,,,176642.0,18747,127,0
36392,Waga Na wa Cowboy,わが名はカウボーイ,Unknown,A child plays cowboy with their wooden horse.,Music,1.0,Finished Airing,1971-12-02,,NHK,Unknown,Unknown,Original,Unknown,Music,Kids,2.0,G - All Ages,5.391,135.0,114842.0,16535,261,1
36396,Ima demo Senchou to Yobarete iru Senchou no Yoru,今でも船長と呼ばれている船長の夜,Unknown,A sea captain enjoys a nice night slumber at home. But he ponders about all the adventures he'd had before finally drifting off.,Music,1.0,Finished Airing,1971-12-03,,NHK,Unknown,Unknown,Original,Unknown,Music,Kids,2.0,G - All Ages,,,186602.0,17961,175,0
52161,La Golondrina,ラ・ゴロンドリーナ,Unknown,A music video for the song La Golondrina by Bonny Jacks. Aired as part of NHK's Minna no Uta program from February to March 1972.,Music,1.0,Finished Airing,1972-02-01,,NHK,Unknown,Unknown,Original,Unknown,Music,Kids,2.0,G - All Ages,,,194732.0,20193,48,0
36809,Tanjoubi no Chachacha,誕生日のチャチャチャ,Unknown,"Japanese school children merrily sing about Happy Birthday songs, not ""the"" Happy Birthday song, but songs the children created specifically for the birthday person.",Music,1.0,Finished Airing,1972-02-01,,NHK,Unknown,Unknown,Original,Unknown,Music,Kids,2.0,G - All Ages,,,154322.0,18122,166,0
36400,Koinu no Blue,小犬のプルー,Unknown,A man plays with his puppy through the different seasons but the dog passes away. The man feels blue that he lost his best friend but doesn't regret the time he spent with it.,Music,1.0,Finished Airing,1972-02-04,,NHK,Unknown,Unknown,Original,Unknown,"Music, Pets",Kids,2.0,G - All Ages,,,192882.0,17673,193,0
39876,Mori no Kuma-san,森の熊さん,Unknown,"The Japanese version of the traditional American camp song The Other Day I Met a Bear, composed in 1919 by Carey Morgan and Lee David. The video was animated by Yoji Kuri, accompanied by Japanese male chorus group Dark Ducks.",Music,1.0,Finished Airing,1972-07-30,,NHK,Unknown,Unknown,Music,Unknown,Music,Kids,2.0,G - All Ages,,,135952.0,17828,182,0
37070,Hoshi to Niji to,星と虹と,Unknown,Stars twinkling in the sky and a bright rainbow crossing the sky. There's no need for tears with a world so beautiful. The music video invokes these thoughts through stop-motion paper cut-outs with a shadow puppet flair.,Music,1.0,Finished Airing,1972-10-05,,NHK,Unknown,Unknown,Original,Unknown,Music,Kids,2.0,G - All Ages,,,184982.0,18215,161,0
29615,Oh Yoko!,オー・ヨーコ！,Unknown,"Made to accompany the song ‘Oh! Yoko!’ by John Lennon, the hand-drawn animation playfully appropriates and imagines moments in the lives of the celebrity couple, John Lennon and Yoko Ono, in pop caricature versions, with occasional appearances from Elvis Presley and the Yellow Submarine. The animation was aired on the late-night television program 11PM.

(Source: Collaborative Cataloging Japan)",Music,1.0,Finished Airing,1973-01-01,,Unknown,Unknown,Unknown,Original,"Avant Garde, Romance",Music,Unknown,4.0,R+ - Mild Nudity,4.361,615.0,129652.0,11786,1054,0
35669,Saraba Jamaica,さらばジャマイカ,Unknown,An uplifting song about the beautiful country of Jamaica. ,Music,1.0,Finished Airing,1973-06-01,,NHK,Unknown,Unknown,Original,Unknown,Music,Kids,2.0,G - All Ages,,,147162.0,18008,172,0
39075,Sansuu Chachacha,算数チャチャチャ,Unknown,Music video explaining solutions to various mathematical problems that aired as part of NHK’s Minna no Uta program.,Music,1.0,Finished Airing,1973-06-13,,NHK,Unknown,Unknown,Original,Unknown,Music,Kids,2.0,G - All Ages,,,147082.0,17938,176,1
43602,Ookina Furudokei (1973),大きな古時計,Unknown,"The second release of the Japanese version of the 1876 song My Grandfather's Clock by American composer and songwriter Henry Clay Work that was broadcast on NHK's Minna no Uta program. It was again performed by Sumito Tachikawa and the Nagato Miho Kagekidan Jidou Gasshoudan (Miho Nagato Opera Children's Choir), but this time featured animation by Yoshiyuki Takeguchi.",Music,1.0,Finished Airing,1973-06-18,,NHK,Unknown,Unknown,Music,Unknown,Music,Kids,2.0,G - All Ages,,,140822.0,18814,121,0
36821,Machibouke,待ちぼうけ,Unknown,"There was a tree stump at the corner of a farmer's field. A speeding rabbit broke its neck and died on it. Rabbits make for a great meal and sell well on the market so the farmer decided to give up farming and just wait for more rabbits to come hit the stump and die again. But he waited and waited and no new rabbits came. Leaving his crops to fail and himself rabbit-less. The song is supposed to teach the lesson of waiting in vain. It's okay to have an optimistic view on something but do not idly sit around waiting for it to happen because it might not. Similar to the Western adage ""don't count your chickens before they hatch.""",Music,1.0,Finished Airing,1973-08-16,,NHK,Unknown,Unknown,Original,Unknown,Music,Kids,2.0,G - All Ages,,,131972.0,18256,158,0
38287,Sasurai no Violin,さすらいのバイオリン,Unknown,"A Minna no Uta music video meant to illustrate variation of the violin. From the American cowboy fiddle to the South American tango to Japanese enka.

The music video was aired for 2 years before becoming lost media. In 2014 the Minna no Uta Hakkutsu Project  (Minna no Uta Excavation Project) was able to find discover a copy and the music video was saved and re-aired once again after 41 years.",Music,1.0,Finished Airing,1973-12-03,,NHK,Unknown,Unknown,Original,Unknown,Music,Kids,2.0,G - All Ages,,,147262.0,18559,140,0
39499,Den Den Mushi no Danko-san,デンデン虫のデン子さん,Unknown,A music video as a part of the Minna no Uta series featuring a song by Duke Aces. ,Music,1.0,Finished Airing,1974-02-04,,NHK,Unknown,Unknown,Music,Unknown,Music,Kids,2.0,G - All Ages,,,176012.0,17853,180,0
36389,Yukai na Mezamashi Tokei,ゆかいなめざまし時計,Unknown,A song about an alarm clock being used every day.,Music,1.0,Finished Airing,1974-04-04,,NHK,Unknown,Unknown,Original,Unknown,Music,Kids,2.0,G - All Ages,,,164672.0,17628,195,0
21833,Higenashi Gogejabaru,ひげなしゴゲジャバル,Unknown,"A naughty boy sneaks into a sleeping cat, cuts off its whiskers and sets in motion a surprising reaction from all who encounters it.

 This video is accompanied by a catchy tune and shown at NHK's Minna no Uta segment.",Music,1.0,Finished Airing,1974-06-03,,NHK,Unknown,Unknown,Original,"Comedy, Fantasy",Music,Kids,2.0,G - All Ages,4.971,196.0,124312.0,14920,385,0
36806,Sentaku Jab Jab,洗濯ジャブ ジャブ,Unknown,A little boy helps out his family by doing the laundry on a washing board.,Music,1.0,Finished Airing,1974-06-05,,NHK,Unknown,Unknown,Original,Unknown,Music,Kids,2.0,G - All Ages,,,147912.0,17683,192,0
42838,Oto no Symphony,音のシンフォニー,Unknown,"Music video for the song Oto no Symphony by the NHK Tokyo Children's Choir (NHK Tokyo Jidou Gasshoudan) that was featured on NHK's Minna no Uta program. The video was animated by Shuuichi Nakahara.
",Music,1.0,Finished Airing,1974-06-06,,NHK,Unknown,Unknown,Original,Unknown,Music,Kids,2.0,G - All Ages,,,141382.0,18969,110,0
49678,Omoide no Green Grass,想い出のグリーングラス,Unknown,NHK's Minna no Uta video animated by Yoshiyuki Takeguchi.,Music,1.0,Finished Airing,1974-08-01,,NHK,Unknown,Unknown,Original,Unknown,Unknown,Kids,2.0,G - All Ages,,,140422.0,19355,83,0
40531,Akai Yama Aoi Yama Shiroi Yama,赤い山 青い山 白い山（北海道地方のわらべ唄）,Unknown,"Music video for Rumiko Koyanagi's rendition of Akai Yama Aoi Yama Shiroi Yama that was featured in NHK's Minna no Uta program. Warabe uta are traditional Japanese songs, similar to nursery rhymes, that has been passed down through the ages. This song originated from Hokkaido. The video was animated by Seiichi Hayashi and is his first contribution to the Minna no Uta program.",Music,1.0,Finished Airing,1974-10-03,,NHK,Unknown,Unknown,Music,Unknown,Music,Kids,2.0,G - All Ages,,,167702.0,17061,227,0
8681,Kitakaze Kozou no Kantarou,北風小僧の寒太郎,Unknown,"This music video had an original 1974 version and a 1981 version. Both versions used the exact same animated footage, the only difference were the singers. The original 1974 version was sung by Maasaki Sakai and the NHK Tokyo Children's Choir. The 1981 version was sung by Saburou Kitajima and the Hibari Children Chorus.",Music,1.0,Finished Airing,1974-12-04,,NHK,Unknown,Unknown,Original,Unknown,"Music, Samurai",Kids,2.0,G - All Ages,5.121,298.0,121862.0,13703,545,0
39877,Kappa no Kui Kuo Kua,カッパのクィクォクァ,Unknown,"Music video for the song Kappa no Kui Kuo Kua by Japanese vocal group Duke Aces and actress Nobue Ichitani that was featured on NHK's Minna no Uta program. The video was animated by Yoji Kuri.

The video aired in 1975, but was considered lost media some time later. It was recovered thanks to the Minna no Uta Hakkutsu Project.",Music,1.0,Finished Airing,1975-02-01,,NHK,Unknown,Unknown,Original,Unknown,Music,Kids,2.0,G - All Ages,,,190502.0,17330,212,0
36354,Saraba Seishun,さらば青春,Unknown,"A retrospective of a long journey on a great open highway. The time spent, the people they see, the billboards they gaze upon, and the records the go through.",Music,1.0,Finished Airing,1975-06-04,,NHK,Unknown,Unknown,Original,Unknown,Music,Kids,2.0,G - All Ages,,,147172.0,17808,183,0
21831,Dracula no Uta,ドラキュラのうた,Unknown,An imaginative take on Dracula is shown in this musical video from the Minna no Uta franchise.,Music,1.0,Finished Airing,1975-08-02,,NHK,Unknown,Unknown,Original,Unknown,"Music, Vampire",Kids,2.0,G - All Ages,4.741,400.0,127132.0,12771,749,1
50100,Tooi Sekai ni,遠い世界に,Unknown,A music video for the song Tooi Sekai Ni by Chewing Gum that was featured on NHK's Minna no Uta program.,Music,1.0,Finished Airing,1975-10-01,,NHK,Unknown,Unknown,Original,Unknown,Music,Kids,2.0,G - All Ages,,,156652.0,19567,69,0
8732,Yuuki Hitotsu wo Tomo ni Shite,勇気一つを友にして,Unknown,"The story of the Greek Icarus who wanted to escape the island by creating a pair of wings. Icarus, so enamored with the success of his wings, rose higher and higher toward the sun. Unfortunately, this results in the glue of the wings melting under the sun's heat.",Music,1.0,Finished Airing,1975-10-06,,NHK,Unknown,Unknown,Other,Unknown,Music,Kids,2.0,G - All Ages,5.011,236.0,123712.0,14410,435,0
43774,Sherlock Holmes to Watson Hakase,シャーロックホームズとワトソン博士,Unknown,Music video for the song Sherlock Holmes to Watson Hakase by Kei Tani that was featured on NHK's Minna no Uta program. It is an original Japanese song that pays homage to Arthur Conan Doyle's Sherlock Holmes series. The video was animated by Hal Fukushima.,Music,1.0,Finished Airing,1975-12-02,,NHK,Unknown,Unknown,Novel,Mystery,Music,Kids,2.0,G - All Ages,,,148912.0,18505,143,0
30073,Onaka no Ookina Ouji-sama,オナカの大きな王子さま,Unknown,"A fat little king wants to ride a flying carpet. 

This is music video for the song by Kouichi Kawatsu that was featured on NHK's Minna no Uta program. On February 4, 1983 NHK rebroadcasted the song but with a new singer Shiro Kishibe; the animated footage though was identical to the original 1975 release.
",Music,1.0,Finished Airing,1975-12-05,,NHK,Unknown,Unknown,Original,Unknown,Music,Kids,2.0,G - All Ages,5.381,176.0,115132.0,15418,341,0
30162,Hone Hone Rock,ホネホネロック,Unknown,"Music video for the song ""Hone Hone Rock"" by Shimon Masato that was featured on the Fuji TV's show ""Hiragana! Ponkikki.""",Music,1.0,Finished Airing,1976-01-01,,Fuji TV,Unknown,Unknown,Music,Unknown,Music,Kids,1.0,G - All Ages,5.141,160.0,121292.0,15719,317,0
29459,Pata Pata Mama,パタパタママ,Unknown,"Music video for the song Pata Pata Mama by Ikuyo Inoko (猪子育代) that was featured on the Fuji TV's show ""Hirake! Ponkikki.""",Music,1.0,Finished Airing,1976-01-01,,Fuji TV,Unknown,Unknown,Music,Unknown,Music,Kids,2.0,G - All Ages,4.971,140.0,124392.0,16278,279,0
36808,Wakamono to Koinu to Croissant,若者と小犬とクロアサン,Unknown,A young man finds a puppy during a crescent moon lit night which reminds them of a croissant.,Music,1.0,Finished Airing,1976-02-04,,NHK,Unknown,Unknown,Original,Unknown,Music,Kids,2.0,G - All Ages,,,158872.0,17304,214,0
36401,Kozou no Koushin,子象の行進,Baby Elephant Walk,"A Japanese rendition of Henry Mancini's song Baby Elephant Walk which was originally created for the 1962 American film ""Hatari!"".",Music,1.0,Finished Airing,1976-02-05,,NHK,Unknown,Unknown,Music,Unknown,Music,Kids,2.0,G - All Ages,,,193662.0,17917,177,0
