anime_ID,Title,Japanese,English,Synopsis,Type,Episodes,Status,Start_Aired,End_Aired,Producers,Licensors,Studios,Source,Genres,Themes,Demographics,Duration_Minutes,Rating,Score,Scored_Users,Ranked,Popularity,Members,Favorites
34500,Nanocore SP Lianxi Pian 2015 Xinnian Tebie Ban,纳米核心 SP 练习篇 2015新年特别版,Unknown,A special Nanocore video celebrating the new year.,Music,1.0,Finished Airing,2015-01-01,,Coastline Animation Studio,Unknown,Unknown,Original,Comedy,Music,Unknown,5.0,PG-13 - Teens 13 or older,5.421,130.0,113662.0,15801,311,0
37138,Cute Kenkyuukai,きゅーと研究会,Unknown,"Music video for the song Cute Kenkyuukai by Otogivanashi (おとぎ話) from their 2015 album ""Culture Club."" Directed by Necony Cobain.",Music,1.0,Finished Airing,2015-01-09,,Felicity,Unknown,Unknown,Music,Unknown,Music,Unknown,3.0,PG-13 - Teens 13 or older,,,174922.0,18208,161,0
30092,Wakie Wakie,WAKIE WAKIE ～music video vol.1～,Unknown,Music video by Studio Binzo.,Music,1.0,Finished Airing,2015-01-09,,Studio Binzo,Unknown,Unknown,Unknown,Unknown,Music,Unknown,1.0,G - All Ages,4.441,350.0,129402.0,13602,567,0
29707,Yume no Ukiyo ni Saitemina,夢の浮世に咲いてみな,Unknown,"Music video for Yume no Ukiyo ni Saitemina, a collaboration between idol group Momoiro Clover Z, and rock band KISS.",Music,1.0,Finished Airing,2015-01-19,,Unknown,Unknown,Trigger,Unknown,Unknown,Music,Unknown,4.0,PG-13 - Teens 13 or older,5.781,1098.0,100272.0,10216,1925,4
32786,Honky Tonk Women,ホンキー・トンク・ウィメン,Unknown,"A music video for Qing Yong All Stars' Chinese rendition of the song ""Honky Tonk Women.""",Music,1.0,Finished Airing,2015-01-26,,Space Shower Music,Unknown,Unknown,Music,Action,Music,Unknown,3.0,PG-13 - Teens 13 or older,,,184832.0,18633,135,0
30103,Precure All Stars Movie: Haru no Carnival♪ - Ima Koko kara,映画プリキュアオールスターズ 春のカーニバル♪ 「イマココカラ」,Unknown,"A dance video clip from the Precure All Stars: Haru no Carnival film. The clip shows the forty Precure warriors from the past anime series, as well as the upcoming series Go! Princess Precure. The song featured in the video is ""Ima Koko Kara.""

(Source: ANN)",Music,1.0,Finished Airing,2015-01-31,,Unknown,Unknown,Toei Animation,Original,Fantasy,"Mahou Shoujo, Music",young girl,3.0,G - All Ages,6.461,668.0,66292.0,10476,1757,1
30199,Hakimono to Kasa no Monogatari,履物と傘の物語,Unknown,A music video for the song by AKB48 that was featured on NHK's Minna no Uta Program. ,Music,1.0,Finished Airing,2015-02-01,,NHK,Unknown,Unknown,Original,Unknown,Music,Kids,4.0,G - All Ages,5.791,177.0,99752.0,15361,346,0
30200,Piyo no Ongaeshi,ピヨの恩返し,Unknown,A music video for the song by Junko Iwao that was featured on NHK's Minna no Uta Program. ,Music,1.0,Finished Airing,2015-02-02,,NHK,Unknown,Unknown,Original,Unknown,Music,Kids,4.0,G - All Ages,,,143042.0,17798,184,0
30924,Mikagura Gakuen Kumikyoku,ミカグラ学園組曲,Mikagura School Suite,"As a new student, Eruna Ichinomiya meets various strangers, learns about their clubs, and helps them with their problems.

Houkago Stride
Eruna was hardly prepared to go to her new school, but that's no matter. Leading it off with an enormous stride, she will hop, step, and jump her way through, showing her unparalleled motivation and optimistic outlook. One, two, three—she'll shout out her excitement with the fire of a toy gun! 

Mukiryoku Coup d'Etat
As an actor, Yuuto Akama is accustomed to playing different roles, and real life is just another one of these. He wears a practiced smile and a carefree attitude, but inside, a war is waging. A personality squashed and imprisoned... Yuuto puts down the coup d'état of his former self, all to maintain his perfect facade. But no matter how much time passes, the memories don't disappear, and he can never stop the flames of rebellion of his heart.

Uchouten Vivace
With a cheerful hop and skip, Himi Yasaka shows Eruna all the fun and excitement of the Calligraphy Club. It's a rhythmic and all-encompassing art; although calligraphy may take a bit of practice, anyone can do it. All you need is an ecstatic vivace!

Garakuta Innocence
No matter what saturation, contrast, or hue, painter Kyouma Kuzuryuu cannot create a work that is good enough. Everything, including himself, always falls short. He lies to himself that this is what he always wanted, but in the end, he is still another piece of trash. Is there any salvation for the lonesome and self-deprecating Kyouma?

Izayoi Seeing
Asuhi Imizu has lived his life secluded from others. Gazing at the night sky through his telescope, he draws new constellations in his mind. However, like the sun after a rainstorm, Eruna brightens his life, helping him open up to others. Together, they view a 16-day-old moon; all the while, Asuhi is guided by her light.

[Written by MAL Rewrite]",Music,5.0,Finished Airing,2015-02-25,,Unknown,Unknown,Unknown,Music,Unknown,"Music, Psychological, School, Visual Arts",Unknown,3.0,PG-13 - Teens 13 or older,6.611,811.0,57402.0,8891,3090,10
41786,Akaito,アカイト,Red Thread,"""Akaito"" is the sequel to Sarishinohara and Yonjuunana, being the third song in the series.",Music,2.0,Finished Airing,2015-02-27,,Victor Studio,Unknown,Unknown,Manga,"Drama, Romance",Music,Unknown,5.0,PG-13 - Teens 13 or older,,,167712.0,18722,129,0
37217,Heat Meat Up: Kokusan Sengen,Heat Meat Up ～国産宣言～,Heat Meat Up Domestic Proclamation,"Music video (karaoke version) for the boy band Shock☆Breakers, that appeared on Oniku Daisuki! Zeushi-kun 2nd Season fourth episode. ",Music,1.0,Finished Airing,2015-02-27,,Unknown,Unknown,Unknown,Original,Unknown,Music,Unknown,3.0,G - All Ages,,,183042.0,16702,248,1
40914,Aishite Aishite Aishite,愛して愛して愛して,Love Me Love Me Love Me,Music video for Kikuo's Vocaloid song Aishite Aishite Aishite.,Music,1.0,Finished Airing,2015-03-06,,Unknown,Unknown,Unknown,Music,Avant Garde,Music,Unknown,4.0,R - 17+ (violence & profanity),6.841,565.0,46012.0,12109,935,4
39203,Idobata Gossip,井戸端ゴシップ,Idobata Gossip,"An original song by Touyu, animated by Mah. The song was included on the album ""Boom Industry"" released two days earlier.",Music,1.0,Finished Airing,2015-03-20,,Exit Tunes,Unknown,Unknown,Original,Unknown,Music,Unknown,3.0,G - All Ages,5.901,115.0,95462.0,17235,217,1
35350,SYZ Project,しずぷろ～S(静岡の)Y(夜を)Z(ざわつかせる)プロジェクト～,Unknown,"A music project collaboration between the anime studio DLE and Shizuoka prefecture. The main focus is to invigorate Shizuoka's night life tourism as a fun, weird, and sexy place to be. 

The project name is a combination of: 
S (Shizuoka no) Y (Yoru wo) Z (Zawatsuka seru) Project ＝ SYZ Project (pronounced ShizuPro)",Music,8.0,Finished Airing,2015-03-31,2017-04-03,Unknown,Unknown,DLE,Original,Unknown,Music,Unknown,1.0,PG - Children,,,153512.0,18430,148,1
32750,Ashita e Mukau Hito,明日へ向かう人,The One that Heads to Tomorrow,"A music video for ""Ashita e Mukau Hito"" by Yoshiko Hanzaki.",Music,1.0,Finished Airing,2015-04-06,,Space Shower Music,Unknown,Unknown,Original,Unknown,Music,Unknown,5.0,G - All Ages,5.631,278.0,106232.0,13931,508,2
37136,young boy,少年,Unknown,"Music video for the song ""Shounen"" by Otogivanashi (おとぎ話) from their 2015 album ""Culture Club."" Directed by Satoshi Jimbo.",Music,1.0,Finished Airing,2015-04-08,,Felicity,Unknown,Unknown,Music,Unknown,Music,Unknown,4.0,PG-13 - Teens 13 or older,,,150342.0,18689,131,0
42483,Iikaereba,いいかえれば,Unknown,"A minimalist animated lyric video for the song Iikaereba by Japanese music unit Every Little Thing on their 46th single ""ANATA TO"".",Music,1.0,Finished Airing,2015-04-21,,Avex Entertainment,Unknown,Unknown,Original,Romance,Music,Unknown,3.0,G - All Ages,,,186382.0,18634,135,0
33909,Marine Dreamin',Marine Dreamin',Unknown,"A music video for the song ""Marine Dreamin'"", a part of the iMarine project which stars Umi Monogatari's Marin.",Music,1.0,Finished Airing,2015-04-24,,Sanyo,Unknown,Unknown,Game,Unknown,Music,Unknown,3.0,G - All Ages,5.291,365.0,117552.0,13147,662,0
32139,DušaN,DušaN,Unknown,"An independent animated music video for the song ""DušaN"" by the Slovakian band Saténové ruky. Kousuke Sugimoto created it for a friend who is in the band.  The video is about the protagonist's soul that just won't stop ""talking"" when he's coked.",Music,1.0,Finished Airing,2015-04-25,,Unknown,Unknown,Unknown,Original,Avant Garde,"Music, Psychological",Unknown,3.0,PG-13 - Teens 13 or older,5.851,963.0,97662.0,10784,1548,2
34858,Toward Morning,toward morning,Toward Morning,"An official music video for the song Toward Morning by the band ""in the blue shirt"".",Music,1.0,Finished Airing,2015-04-25,,Unknown,Unknown,Unknown,Original,Unknown,Music,Unknown,4.0,G - All Ages,5.651,111.0,105902.0,17054,228,0
52324,Grasshopper Adventures,Grasshopper Adventures,Unknown,Music video for the song Grasshopper Adventures by Merci Merci Me.,Music,1.0,Finished Airing,2015-04-27,,Unknown,Unknown,Studio Binzo,Original,Unknown,Music,Unknown,2.0,PG-13 - Teens 13 or older,,,181132.0,19172,99,0
30771,Mudai,無題,Unknown,"Splotched in blooms of color and bursting with ideas, a young artist paints another beautiful piece, his girlfriend supporting him all the while. Their lives are modest, but they know they will stay by each other no matter what. When one of his works sells, he experiences unprecedented renown; life couldn't be any better for a man with both love and success. However, the lust for creativity consumes him, and as his world crumbles around him, he is left scrambling to pick up the pieces of what remains.

[Written by MAL Rewrite]
",Music,1.0,Finished Airing,2015-05-07,,pH Studio,Unknown,Unknown,Original,"Drama, Romance, Slice of Life","Music, Visual Arts",Unknown,7.0,PG-13 - Teens 13 or older,7.101,2903.0,34702.0,7632,4904,14
49997,Berg,Berg,Unknown,Animation by Hideki Inaba for the song Feasting on Energy by Magic Lantern.,Music,1.0,Finished Airing,2015-05-10,,Unknown,Unknown,Unknown,Original,Unknown,Music,Unknown,3.0,G - All Ages,,,170762.0,18746,127,0
36113,Love,Love,Love,"Official music video for Makura Izumi's song Love which was also released on the album ""Ai Naraba Shitte Iru.""",Music,1.0,Finished Airing,2015-05-12,,Unknown,Unknown,Unknown,Original,Unknown,Music,Unknown,4.0,G - All Ages,4.871,126.0,125722.0,16762,245,0
41034,Meryuu,メリュー,Meru,Unknown,Music,1.0,Finished Airing,2015-05-12,,Unknown,Unknown,Unknown,Original,Unknown,Music,Unknown,3.0,PG-13 - Teens 13 or older,5.841,119.0,97982.0,16927,235,0
35585,Stella-Rium,Stella-Rium,Unknown,Music video for the opening song of Houkago no Pleiades.,Music,1.0,Finished Airing,2015-05-19,,Unknown,Unknown,Unknown,Original,Unknown,Music,Unknown,4.0,G - All Ages,6.831,541.0,46582.0,11691,1089,5
52566,XYZ Note,XYZ NOTE,Unknown,Unknown,Music,1.0,Finished Airing,2015-05-20,,Unknown,Unknown,studio YOG,Original,Avant Garde,Unknown,Unknown,1.0,G - All Ages,,,162982.0,20321,46,0
40830,"Bokura no Te ni wa Nanimo Nai kedo,",僕らの手には何もないけど、,Unknown,"Music video for RAM WIRE's fifth single Bokura no Te ni wa Nanimo Nai kedo,. The video was animated by Aya Shiroi.",Music,1.0,Finished Airing,2015-05-21,,Sony Music Entertainment,Unknown,Unknown,Original,Drama,Music,Unknown,4.0,G - All Ages,,,171482.0,17780,185,1
39323,Bungaku Shoujo,文學少女,Unknown,Music video directed by Takashi Ohashi for the title track Bungaku Shoujo by Burnout Syndromes.,Music,1.0,Finished Airing,2015-05-27,,"Sony Music Communications, Sony Music Entertainment",Unknown,HOTZIPANG,Other,Unknown,Music,Unknown,4.0,PG - Children,5.991,259.0,90972.0,13044,688,2
42954,Hige Hige Gehi Ponpon,ひげヒゲげひポンポン,Unknown,Music video for the song Hige Hige Gehi Ponpon by female pop unit Tanqun Democracy that was featured on NHK's Minna no Uta program. The video was animated by Hironori Oohashi.,Music,1.0,Finished Airing,2015-06-02,,NHK,Unknown,Unknown,Original,Unknown,Music,Kids,2.0,G - All Ages,,,183772.0,18913,114,0
36103,Nandaku Mou,なんだかもう,Nandaku-mou,"A music video for Kidori Kidori's song ""Nandaku Mou.""",Music,1.0,Finished Airing,2015-06-07,,Hipland Music Corporation,Unknown,Onionskin,Music,Unknown,Music,Unknown,3.0,G - All Ages,5.251,105.0,118662.0,17180,220,0
39202,Kazami Tori,カザミ鳥,Unknown,An original song by Mah featuring the Vocaloid VY1 V4.,Music,1.0,Finished Airing,2015-07-01,,Unknown,Unknown,Unknown,Original,Unknown,Music,Unknown,4.0,G - All Ages,,,190902.0,18079,168,0
40877,Suki tte Nandarou... Namida,好きってなんだろう… 涙,Unknown,"Music video directed by ShiShi Yamazaki for the song Suki tte Nandarou... Namida by YUKI (Yuki Kuramochi). The full version of the music video was officially released on YouTube for a limited time before the single's drop on July 29, 2015. It was also included on DVD with a limited edition release.",Music,1.0,Finished Airing,2015-07-03,,Sony Music Entertainment,Unknown,HOTZIPANG,Original,Avant Garde,Music,Unknown,4.0,R+ - Mild Nudity,,,153102.0,17775,185,0
37533,Kurou Shiro,黒う白,Unknown,Official music video for Handsome Kenya's song Kurou Shiro.,Music,1.0,Finished Airing,2015-07-03,,Unknown,Unknown,Unknown,Original,Unknown,Music,Unknown,3.0,PG-13 - Teens 13 or older,,,194362.0,17387,209,0
36091,Ghana,Ghana,Ghana,Official music video for D.A.N.'s song Ghana also released on their EP album.,Music,1.0,Finished Airing,2015-07-06,,Unknown,Unknown,Unknown,Music,Unknown,Music,Unknown,4.0,G - All Ages,5.321,121.0,116982.0,16900,236,0
41309,Hand in Hand,Hand in Hand (Magical Mirai ver.),Unknown,"Hand in Hand is an original song by kz. This was the official theme song for Magical Mirai 2015.

(Source: Vocaloid Wikia)",Music,1.0,Finished Airing,2015-07-07,,Unknown,Unknown,Unknown,Original,Unknown,Music,Unknown,5.0,G - All Ages,6.031,140.0,89082.0,16666,251,0
32853,7-kakan.,7日間.,Unknown,A music video for phatmans after school song 7-kakan.,Music,1.0,Finished Airing,2015-07-09,,Toy's Factory,Unknown,Unknown,Music,Unknown,Music,Unknown,3.0,G - All Ages,5.531,472.0,109972.0,12460,833,3
32854,Fr/day Night,FR/DAY NIGHT,Unknown,"A music video for the Phatmans After School song ""Fr/day Night"".",Music,1.0,Finished Airing,2015-07-09,,Toy's Factory,Unknown,Unknown,Music,Comedy,Music,Unknown,4.0,PG-13 - Teens 13 or older,5.331,336.0,116662.0,13488,587,0
31252,"Korekarasaki, Nando Anata to.","これから先, 何度あなたと.",Unknown,"Animated music video for mishmash＊Aimee Isobe's ""Korekarasaki, Nando Anata to."" ",Music,1.0,Finished Airing,2015-07-15,,Unknown,Unknown,MAPPA,Unknown,Slice of Life,Music,Unknown,4.0,G - All Ages,5.621,663.0,106952.0,11428,1210,0
50127,Sushi Tabetai,SUSHI食べたい,Unknown,"Music video for Orange Range's song Sushi Tabetai, featuring Soy Sauce.",Music,1.0,Finished Airing,2015-07-15,,Unknown,Unknown,Unknown,Original,Comedy,Music,Unknown,4.0,PG-13 - Teens 13 or older,,,153372.0,19505,74,0
31300,Change Our Mirai!,Change Our MIRAI!,Change Our Mirai!,"The members of the band Irodorimidori—guitarists Arishiana Agata and Nazuna Tennouzu, keyboardist Nagi Kobotoke, drummer Serina Akesaka, and bassist Naru Hakobe—are performing at their maiden concert. As these passionate girls begin their musical journey, their voices will unite them in their future endeavors and change their destiny for the better.

[Written by MAL Rewrite]
",Music,1.0,Finished Airing,2015-07-18,,Unknown,Unknown,Trigger,Original,Unknown,Music,Unknown,2.0,PG-13 - Teens 13 or older,5.741,1502.0,101802.0,8708,3292,5
51159,Minna no Douyou: Yuuyake Koyake - Utaitsugitai Uta,みんなのどうよう 夕やけ小やけ 〜うたいつぎたいうた〜,Unknown,A compilation of 15 popular songs for children to sing together with their parents. Second volume.,Music,15.0,Finished Airing,2015-07-22,,Unknown,Unknown,Shin-Ei Animation,Music,Unknown,Music,Kids,3.0,G - All Ages,,,134932.0,20299,46,0
40558,Little Scarlet Bad Girl feat. Hatsune Miku,Little Scarlet Bad Girl feat. 初音ミク,Unknown,Music video for Little Scarlet Bad Girl feat. Hatsune Miku by Hachioji-P.,Music,1.0,Finished Airing,2015-07-22,,Toy's Factory,Unknown,Unknown,Original,Unknown,Music,Unknown,3.0,G - All Ages,5.891,255.0,96002.0,14076,483,0
51158,Minna no Douyou: Shabondama - Oyako de Utau Uta,みんなのどうよう しゃぼん玉 〜親子でうたううた〜,Unknown,A compilation of 15 popular songs for children to sing together with their parents. First volume.,Music,15.0,Finished Airing,2015-07-22,,Unknown,Unknown,Shin-Ei Animation,Music,Unknown,Music,Kids,2.0,G - All Ages,,,134912.0,20354,45,0
51160,Minna no Douyou: Warera wa Umi no Ko - Minna de Utau Uta,みんなのどうよう われは海の子 〜みんなでうたううた〜,Unknown,A compilation of 15 popular songs for children to sing together with their parents. Third volume.,Music,15.0,Finished Airing,2015-07-22,,Unknown,Unknown,Shin-Ei Animation,Music,Unknown,Music,Kids,3.0,G - All Ages,,,134922.0,20355,45,0
36175,Diary,DIARY,Diary,"Official music video for Ken Kamikita's song Diary which was also released on his first album titled ""SCOOP"".",Music,1.0,Finished Airing,2015-07-23,,Unknown,Unknown,Minakata Laboratory,Original,Unknown,Music,Unknown,5.0,G - All Ages,6.151,178.0,82632.0,15620,324,0
32446,MONSTER GENERATiON,アイドリッシュセブン『MONSTER GENERATiON』,Unknown,Official music video for IDOLiSH7's MONSTER GENERATiON album.,Music,1.0,Finished Airing,2015-07-23,,Unknown,Unknown,NAZ,Game,Unknown,"Idols (Male), Music",Unknown,1.0,G - All Ages,6.691,1242.0,53282.0,9328,2629,4
42436,Kimi wo Matsu,君を待つ,Unknown,"Music video for the song Kimi wo Matsu by Aimer that was on her third album ""DAWN"". It was included on DVD with the first press release of the CD. The video was directed by Gaku Kinoshita.",Music,1.0,Finished Airing,2015-07-29,,Unknown,Unknown,Unknown,Original,Drama,Music,Unknown,4.0,G - All Ages,6.131,142.0,84162.0,16403,271,0
40000,Sizq,Sizq,Unknown,"Music video directed by Kouhei Yoshino for the song Sizq by Japanese instrumental band NETWORKS that was included on their album ""Dynamic Nature"".",Music,1.0,Finished Airing,2015-07-30,,Unknown,Unknown,Unknown,Original,Avant Garde,Music,Unknown,6.0,G - All Ages,,,151322.0,17800,184,0
43292,"Toriaezu, Tamade.",とりあえず、タマで。,Unknown,"Music video for the song Toriaezu, Tamade. by Japanese singer Asu that was featured on NHK's Minna no Uta program. The video was animated by Toshiko Hata.",Music,1.0,Finished Airing,2015-08-02,,NHK,Unknown,Unknown,Original,Unknown,Music,Kids,2.0,G - All Ages,,,156702.0,19051,105,0
36970,Hetchara Heiki no Heihachirou,へっちゃら平気の平八郎,Unknown,"Music video for the song ""Hetchara Heiki no Heihachirou"" by Mako Ishino. Aired as part of NHK's Minna no Uta program.",Music,1.0,Finished Airing,2015-08-03,,NHK,Unknown,Unknown,Original,Unknown,Music,Kids,3.0,G - All Ages,,,183622.0,18697,130,0
38855,Yuu Kiri,夕霧,Unknown,"Music video for the song ""Evening Fog"" directed by Minami Kitasono to promote their album ""lumiere.""",Music,1.0,Finished Airing,2015-08-05,,Unknown,Unknown,Calf Studio,Original,Unknown,Music,Unknown,3.0,G - All Ages,5.361,136.0,115742.0,16977,232,0
32633,Nowisee,nowisee,Unknown,Nowisee is a cross-content project that weaves together video and story with a focus on music. The theme is asking young people alive today to ‘question the meaning of life.’ ,Music,24.0,Finished Airing,2015-08-08,2017-07-08,Unknown,Unknown,Unknown,Original,Unknown,Music,Unknown,4.0,G - All Ages,6.541,314.0,61552.0,10628,1656,4
38090,Onnanoko dake ga Wakaru Uta: Only Girls Get It,女の子だけがわかる歌-Only Girls Get It,Unknown,"A music video created for the Sophie brand of Unicharm Co., Ltd. which manufacturers feminine hygiene products. The video features a song completely in English with Japanese subtitles. As stated by the company president, Takahisa Takahara, is that women spend 6 yrs and 9 months menstruating their entire lives. With advancing gender roles and longer lifespans, more women are staying in the work place and having more periods. Mensuration causes hormonal mood swings like that of a cranky edgy prickly hedgehog, starving craving hungry black bear, fragile crying [bloated] elephant, and reclusive lonely lion. These are normal changes and the women are still themselves. It promotes body positivity and how women shouldn't be brushed off in the work place if they are having an effect from a biological function that they have to go through for 6 yrs and 9 months.",Music,1.0,Finished Airing,2015-08-17,,Unknown,Unknown,Unknown,Original,Slice of Life,Music,Unknown,2.0,G - All Ages,,,140712.0,17979,173,0
32749,Hizumu Realism,ヒズムリアリズム,Unknown,"A music video for ""Hizumu Realism,"" a song by A Crow is White.",Music,1.0,Finished Airing,2015-08-25,,Space Shower Music,Unknown,Unknown,Original,Avant Garde,Music,Unknown,4.0,PG - Children,5.201,286.0,119942.0,13887,516,0
37537,Sobakasu,そばかす,Unknown,"Music video for Lon's cover of Sobakasu by the band Judy and Mary. The original song was the 1st opening theme song to Rurouni Kenshin. Lon's cover was in honor of their ""Lon Kaba－J-POP ZOO－"" album going on sale the following day.",Music,1.0,Finished Airing,2015-08-25,,Unknown,Unknown,Unknown,Music,Unknown,Music,Unknown,4.0,G - All Ages,5.741,814.0,102052.0,10303,1865,2
40686,Desktop Cinderella feat. Hatsune Miku,デスクトップ・シンデレラ feat. 初音ミク,Unknown,"MMD music video for the title track Desktop Cinderella feat. Hatsune Miku by Hachioji-P. It was included on DVD with the release of his fourth studio album on September 2, 2015.",Music,1.0,Finished Airing,2015-08-30,,Toy's Factory,Unknown,Unknown,Original,Unknown,Music,Unknown,4.0,G - All Ages,5.651,312.0,105672.0,13633,560,1
31662,Bary-san x Gospe Rats: Tonde Bary Bary Monogatari,バリィさん×ゴスペラッツ 『トンデバリバリ物語』,Unknown,Unknown,Music,1.0,Finished Airing,2015-09-01,,Unknown,Unknown,Kachidoki Studio,Unknown,Unknown,Music,Unknown,2.0,G - All Ages,,,170442.0,16726,245,0
34116,Inochi,いのち,Unknown,An official music video for the musician Hiwa. It was also shown later at the 2015 Kyoto International Art and Film Festival.,Music,1.0,Finished Airing,2015-09-05,,Studio REMap,Unknown,Unknown,Original,"Drama, Slice of Life",Music,Unknown,4.0,G - All Ages,,,186742.0,17727,188,0
31830,Lilac (Bombs Jun Togawa),lilac (bombs 戸川純 ),Unknown,"Music video for Vampillia's ""lilac (bombs Jun Togawa).""",Music,1.0,Finished Airing,2015-09-27,,Virgin Babylon Records,Unknown,Onionskin,Unknown,Unknown,Music,Unknown,4.0,PG - Children,5.761,498.0,101302.0,12315,877,1
31894,"The iDOLM@STER Million Live! ""Dreaming!"" Animation PV","アイドルマスター ミリオンライブ！""Dreaming!"" Animation PV",Unknown,Animation PV of The iDOLM@STER Million Live! included with the limited edition of release of the single THE IDOLM@STER LIVE THE@TER DREAMERS 01 Dreaming!,Music,1.0,Finished Airing,2015-09-30,,Unknown,Unknown,A-1 Pictures,Game,Unknown,"Idols (Female), Music",Unknown,1.0,PG-13 - Teens 13 or older,6.311,731.0,74172.0,9863,2161,1
40612,Pokke,ポッケ,Unknown,"Music video for the song Pokke by Japanese pop group DANCE EARTH PARTY, featuring female performance group Happiness, that aired on NHK's Minna no Uta program. The video depicts the various items stored by a boy in his pockets from the perspective of the family washing machine.",Music,1.0,Finished Airing,2015-10-01,,NHK,Unknown,Unknown,Original,Unknown,Music,Kids,2.0,G - All Ages,,,143362.0,18564,139,0
37610,Nemurihime,ネムリヒメ,Sleeping Beauty,"The story details the baku from the previous song visiting the coffin of a woman he once loved, who presumably died of an unspecified cause. He then explains that he steals the souls of people in order to keep her alive, and continues to do so until the day when she eventually wakes up from her coma. He also seems to lament the fact that whatever dreams he does give her, ends up giving her nightmares.

(Source: Vocaloid Wikia)",Music,1.0,Finished Airing,2015-10-04,,Unknown,Unknown,Unknown,Original,Unknown,Music,Unknown,5.0,G - All Ages,5.571,128.0,108602.0,16593,256,0
33369,Metronome,メトロノーム,Unknown,"A music video for Kenshi Yonezu`s  song ""Metronome.""",Music,1.0,Finished Airing,2015-10-07,,Unknown,Unknown,Unknown,Unknown,Unknown,Music,Unknown,4.0,G - All Ages,6.291,332.0,75222.0,13644,558,1
34860,Dance XX,DANCE XX,Dance XX,"An official music video for the song Dance XX from the Never Look Back! EP release by the band ""Sappy"".",Music,1.0,Finished Airing,2015-10-07,,Unknown,Unknown,Unknown,Original,Unknown,Music,Unknown,4.0,G - All Ages,5.521,135.0,110222.0,16333,275,0
31780,Kimi no Kokoro wa Kagayaiteru kai?,君のこころは輝いてるかい？,Unknown,Music video included with the debut single for the Love Live! Sunshine!! anime idol group Aqours.,Music,1.0,Finished Airing,2015-10-07,,"Lantis, Magic Capsule",Unknown,Sunrise,Music,Unknown,"Idols (Female), Music",Unknown,6.0,PG-13 - Teens 13 or older,7.251,4775.0,27352.0,5730,9861,16
31880,B Who I Want 2 B,安室奈美恵 / 「B Who I Want 2 B feat. HATSUNE MIKU」,Unknown,"Music video for Namie Amuro's ""B Who I Want 2 B"", a track from her album Genic, featuring Hatsune Miku.",Music,1.0,Finished Airing,2015-10-13,,Avex Entertainment,Unknown,Unknown,Music,Unknown,Music,Unknown,3.0,G - All Ages,5.471,1081.0,111962.0,10339,1838,3
41171,Muku na Kisetsu,無垢な季節,Unknown,Music video for the song Muku na Kisetsu by Japanese band Gesu no Kiwami Otome that was included in their fourth single.,Music,1.0,Finished Airing,2015-10-14,,Warner Music Japan,Unknown,Onionskin,Original,Unknown,Music,Unknown,3.0,G - All Ages,,,136572.0,18003,172,0
