ID,Title,Japanese,English,Synopsis,Type,Episodes,Status,Start_Aired,End_Aired,Producers,Licensors,Studios,Source,Genres,Themes,Demographics,Duration_Minutes,Rating,Score,Scored_Users,Ranked,Popularity,Members,Favorites,year
15911,Yuyushiki,ゆゆ式,Yuyushiki,"The story follows the school life of the three girls, Yuzuko, Yukari, and Yui, who join their high school's Data Processing Club. The odd friendship between the three make for wacky humor in even the most mundane of events.",TV,12.0,Finished Airing,"Apr 10, 2013","Jun 26, 2013","Geneon Universal Entertainment, Magic Capsule, Showgate, Houbunsha, Exit Tunes",Sentai Filmworks,Kinema Citrus,4-koma manga,"Comedy, Slice of Life","CGDCT, Gag Humor, School",Unknown,23.0,PG-13 - Teens 13 or older,7.361,37991.0,22072.0,1798,100519,600,2013.0
17082,Aiura,あいうら,Aiura,"As spring vacation comes to a close, a new school semester approaches. Deciding to make the most of the remaining holiday, Ayuko Uehara takes a stroll into her neighborhood and stops by a small cafe. However, her peaceful day is abruptly disturbed when a girl clumsily bumps into her. Left puzzled by the encounter, Ayaku is even more surprised when she meets them again as freshmen at the same high school she attends. Recognizing her from the store, the girls introduce themselves as Kanaka Amaya and Saki Iwasawa, and the three quickly become friends.

As they go through their daily lives as high school girls, the trio's distinct personalities—Kanaka's happy-go-lucky attitude, Saki's tomboyish behavior, and Ayuko's easygoingness—are sure to make every mundane school day filled with silly and fun interactions.

[Written by MAL Rewrite]
",TV,12.0,Finished Airing,"Apr 10, 2013","Jun 26, 2013","Pony Canyon, Tohokushinsha Film Corporation",Unknown,LIDENFILMS,4-koma manga,"Comedy, Slice of Life","CGDCT, Iyashikei, School",young boy,4.0,G - All Ages,6.661,37726.0,54962.0,2037,83042,168,2013.0
21273,Gochuumon wa Usagi Desu ka?,ご注文はうさぎですか？,Is the Order a Rabbit?,"Kokoa Hoto is a positive and energetic girl who becomes friends with anyone in just three seconds. After moving in with the Kafuu family in order to attend high school away from home, she immediately befriends the shy and precocious granddaughter of Rabbit House cafe's founder, Chino Kafuu, who is often seen with the talking rabbit, Tippy, on her head.

After beginning to work as a waitress in return for room and board, Kokoa also befriends another part-timer, Rize Tedeza, who has unusual behavior and significant physical capabilities due to her military upbringing; Chiya Ujimatsu, a waitress from a rival cafe who does everything at her own pace; and Sharo Kirima, another waitress at a different cafe who has the air of a noblewoman despite being impoverished.

With fluffy silliness and caffeinated fun, Gochuumon wa Usagi Desu ka? is a heartwarming comedy about five young waitresses and their amusing adventures in the town they call home.

[Written by MAL Rewrite]",TV,12.0,Finished Airing,"Apr 10, 2014","Jun 26, 2014","Frontier Works, Sotsu, Magic Capsule, Showgate, Houbunsha, NBCUniversal Entertainment Japan, RAY",Sentai Filmworks,White Fox,4-koma manga,Comedy,"CGDCT, Iyashikei, Workplace",Unknown,23.0,PG-13 - Teens 13 or older,7.501,85940.0,16792.0,928,219137,2099,2014.0
38004,Strike Witches: 501 Butai Hasshin Shimasu!,ストライクウィッチーズ 501部隊発進しますっ！,Strike Witches 501st JOINT FIGHTER WING Take Off!,"Yoshika Miyafuji joins the 501st Joint Fighter Wing, a defense unit specializing in taking down alien beings known as the Neuroi. However, in days of no invasion, she and the members of the unit are taking down day to day tasks like cooking and laundry.

(Source: MAL News)",TV,12.0,Finished Airing,"Apr 10, 2019","Jun 26, 2019","Nippon Columbia, Glovision, Anime Beans",Funimation,"Acca effe, Giga Production",Manga,"Comedy, Sci-Fi","CGDCT, Military",young boy,13.0,PG-13 - Teens 13 or older,6.591,5331.0,58612.0,4576,17483,28,2019.0
31564,Sansha Sanyou,三者三葉,"Three Leaves, Three Colors","Having gone from pampered to poor after the bankruptcy of her father's company, Youko Nishikawa struggles to drop her princess-like persona and make friends at her all-girls high school. One day, while eating alone in a nearby forest, she has a chance encounter with Futaba Odagiri, the super-energetic transfer student, and Teru Hayama, an innocent-looking girl with a surprisingly direct and sometimes mean personality. Despite their differing personalities, the three girls who all have the kanji for ""leaf"" in their name begin an unlikely friendship as they try to navigate through an amusing and spontaneous adventure known as high school life.

Sansha Sanyou is a cheerful, cute series revolving around three close but very different friends as they try to balance the everyday challenges that school and adolescence have to offer.

[Written by MAL Rewrite]",TV,12.0,Finished Airing,"Apr 11, 2016","Jun 27, 2016","AT-X, DAX Production, Houbunsha, TOHO animation, RAY",Funimation,Doga Kobo,4-koma manga,"Comedy, Slice of Life","CGDCT, School",Unknown,24.0,PG-13 - Teens 13 or older,7.101,21088.0,34752.0,2470,59816,115,2016.0
5680,K-On!,けいおん!,K-ON!,"A fresh high school year always means much to come, and one of those things is joining a club. Being in a dilemma about which club to join, Yui Hirasawa stumbles upon and applies for the Light Music Club, which she misinterprets to be about playing simple instruments, such as castanets. Unable to play an instrument, she decides to visit to apologize and quit.

Meanwhile, the Light Music Club faces disbandment due to a lack of members. This causes the club members to offer anything, from food to slacking off during club time, in order to convince Yui to join. Despite their efforts, Yui insists on leaving due to her lack of musical experience. As a last resort, they play a piece for Yui, which sparks her fiery passion and finally convinces her to join the club.

From then onward, it's just plain messing around with bits and pieces of practice. The members of the Light Music Club are ready to make their time together a delightful one!

[Written by MAL Rewrite]",TV,13.0,Finished Airing,"Apr 3, 2009","Jun 26, 2009","Pony Canyon, TBS, Movic, Rakuonsha, Animation Do","Bandai Entertainment, Sentai Filmworks",Kyoto Animation,4-koma manga,Comedy,"CGDCT, Music, School",Unknown,24.0,PG-13 - Teens 13 or older,7.851,532051.0,7902.0,133,968973,22294,2009.0
31498,Pan de Peace!,パンでPeace！,Pan de Peace!,"For the airheaded Minami Tani, there is nothing more delightful than delicious bread for breakfast. Bonding over a mutual love for the food, Minami meets the dignified Yuu Aizawa and the upbeat Fuyumi Fukagawa. Joining them is Noa Sakura, a pint-sized girl who sees bread as the ultimate weapon of self-defense. Together, the girls strengthen their bonds of friendship, while striving to sample every kind of bread this world has to offer.

[Written by MAL Rewrite]",TV,13.0,Finished Airing,"Apr 3, 2016","Jun 26, 2016","Jinnan Studio, Contents Seed",Unknown,Asahi Production,4-koma manga,"Comedy, Gourmet, Slice of Life","CGDCT, School",Unknown,3.0,PG-13 - Teens 13 or older,5.631,14609.0,106432.0,3501,30966,31,2016.0
42568,Yaku nara Mug Cup mo,やくならマグカップも,Let's Make a Mug Too,"The city of Tajimi is well-renowned for its Mino ware ceramics and being the hometown of Himeno Toyokawa's mother. Considered a legend in the world of pottery, Himeno's mother suddenly passed away when Himeno was four. However, her legacy lives on in the dozens of unique mugs that adorn the Toyokawas' new restaurant in Tajimi.

Having moved back to the city recently following the bankruptcy of her father's company in Tokyo, Himeno brings some of her mother's mugs to her first day of high school in an attempt to make friends. One person who immediately takes an interest is Mika Kukuri, an eccentric girl in Himeno's class who soon introduces her to Tooko Aoki, the president of the Pottery Club. After learning more about her mother's contributions to the club and the art form, Himeno asks her father for permission to join, which he gladly gives.

Alongside Mika and her childhood friend Naoko Naruse, Himeno enters the Pottery Club to continue her mother's beloved work and discover her own passion for the craft.

[Written by MAL Rewrite]",TV,12.0,Finished Airing,"Apr 3, 2021","Jun 21, 2021","CBC Television, Planet, Half H.P Studio, Nippon Columbia, 81 Produce, Tokyo MX, BS11, Maho Film, Zipang",Unknown,Nippon Animation,Manga,Slice of Life,"CGDCT, Iyashikei, School, Visual Arts",Unknown,14.0,PG-13 - Teens 13 or older,6.501,13583.0,63862.0,2981,41855,129,2021.0
941,Renkin San-kyuu Magical? Pokaan,錬金3級 まじかる?ぽか〜ん,Unknown,"Renkin San-kyuu Magical? Pokaan follows the daily lives of four young girls. There is just one catch: they are anything but normal. This group of friends—the energetic werewolf Liru, the joyful witch-in-training Uma, the motherly android Aiko, and the seductive vampire Pachira—are actually princesses from the netherworld who have traveled to the human world in search of a new home. Unfortunately, their naivety and severe lack of knowledge make living peacefully among earthlings much more difficult than they imagined. 

As they attempt to adapt to their brand new lifestyle, they cause all sorts of trouble, and end up attracting the unwanted attention of a woman by the name of Dr. K-Ko. The scientist believes that these new residents of Earth are up to no good and attempts to capture the girls to prove the existence of the supernatural and gain credibility with the scientific community. Every day brings a new adventure as the girls deal with the insanity of her antics and all that the human realm has to offer.

[Written by MAL Rewrite]",TV,12.0,Finished Airing,"Apr 4, 2006","Jun 20, 2006","Genco, Lantis, Media Factory",Unknown,Remic,Original,"Comedy, Ecchi","CGDCT, Gag Humor, Parody, Vampire",Unknown,24.0,R+ - Mild Nudity,6.971,9634.0,40472.0,3527,30574,115,2006.0
30795,Bakuon!!,ばくおん!!,Bakuon!!,"Every day Hane Sakura makes the arduous trip to school, cycling up a large hill on her bicycle. After encountering the motorcycle enthusiast Onsa Amano one morning, she is introduced to the motorcycle club, led by the ever-silent Raimu Kawasaki. New to motorcycles, Sakura experiences firsthand the difficulty of learning to ride again. However, through this, she hopes to once again recreate her first biking experience, which was filled with both horror and exhilaration.

Alongside Baita, the talking motorcycle; Rin Suzunoki, a Suzuki model enthusiast; Hijiri Minowa, a wealthy girl who dreams of being a thug; and professional racer Chisame Nakano, Sakura strives toward getting her bike license and experiencing the joys and hardships of motorcycles.

[Written by MAL Rewrite]",TV,12.0,Finished Airing,"Apr 5, 2016","Jun 21, 2016","Lantis, DAX Production, NBCUniversal Entertainment Japan, Akita Shoten, eBooK Initiative Japan",Sentai Filmworks,TMS Entertainment,Manga,"Comedy, Slice of Life",CGDCT,teenager,23.0,PG-13 - Teens 13 or older,6.481,23052.0,65042.0,2474,59547,123,2016.0
35756,Comic Girls,こみっくがーるず,Unknown,"Kaoruko ""Chaos"" Moeta is a young manga artist who is down on her luck. She wants to draw manga about high school girls, but her storyboards are bland, her art uninspired, and her premises weak. Her concerned, exasperated editor comes up with an idea: push Chaos to be more social. So, by her recommendation, Chaos moves into a dormitory for female manga artists. She soon meets the other residents: Tsubasa Katsuki, a shounen manga artist; Ruki Irokawa, who draws erotic manga popular with women; and Koyume Koizuka, a shoujo artist who, like Chaos, has yet to be serialized. Quickly striking up a friendship with these girls, Chaos finds new inspiration for her manga and continues to grow her creativity.

Comic Girls is a showcase of the daily lives of these manga artists. Will Chaos finally be able to make her debut and become serialized? None of the girls know, but they will all do their best to help each other become the best artists they can be.

[Written by MAL Rewrite]",TV,12.0,Finished Airing,"Apr 5, 2018","Jun 21, 2018","Sony Pictures Entertainment, Frontier Works, Sotsu, Houbunsha, Chugai Mining, Kansai Telecasting, BS11, My Theater D.D., Good Smile Film",Unknown,Nexus,4-koma manga,"Comedy, Slice of Life","CGDCT, Otaku Culture",Unknown,23.0,PG-13 - Teens 13 or older,7.381,56082.0,20852.0,1433,133938,643,2018.0
23269,Hello!! Kiniro Mosaic,ハロー!!きんいろモザイク,Hello!! KINMOZA!,"Although learning different languages continues to be an interest for Shinobu and her friends, the new school year brings unexpected difficulties. Not only is there always something new and different to distract them from their studies, but Alice and Yoko also are having trouble adjusting to being in a different class from Shinobu and Aya.

Meanwhile, Karen isn't getting along at all with her new homeroom teacher, and it doesn't help that the teacher is having trouble figuring out how to make herself seem friendlier to her students as well. Craziness may ensue, but sometimes, all it takes is the right mutual experience to bring everyone together.

While some of those experiences may not be as well-thought-out as others (like when Alice and Aya act like juvenile delinquents to seem more grown up), the gang's new adventures are certain to warm everyone's heart as the fun and friendships keep growing in HELLO!! KINMOZA!

(Source: Sentai Filmworks)",TV,12.0,Finished Airing,"Apr 6, 2015","Jun 22, 2015","Genco, flying DOG, Showgate",Sentai Filmworks,Studio Gokumi,4-koma manga,"Comedy, Slice of Life","CGDCT, School",teenager,23.0,PG-13 - Teens 13 or older,7.501,35799.0,16812.0,2146,75098,252,2015.0
38295,Joshikausei,女子かう生,Joshi Kausei,"Momoko Futo is an average high-school girl going about her everyday life. Though laid-back and cheerful, her life is anything but mundane as her eccentricity and clumsiness never fail to spice up her days. Her two best friends are always with her: the cute and innocent Mayumi Furui, and the calm and cool Shibumi Shibusawa. Without any spoken dialogue or narration, Joshikausei aims to recount the comedic shenanigans these girls get up to through the expressive sounds and gestures that they make.

[Written by MAL Rewrite]
",TV,12.0,Finished Airing,"Apr 6, 2019","Jun 22, 2019",Unknown,Unknown,Seven,Web manga,"Comedy, Slice of Life","CGDCT, School",Unknown,3.0,PG-13 - Teens 13 or older,5.801,22954.0,99342.0,2519,57964,42,2019.0
48363,RPG Fudousan,RPG不動産,RPG Real Estate,"In a world at peace 15 years after the defeat of the demon lord, a newly graduated mage named Kotone Kazairo moves to Dali—the royal capital of the Kingdom of Actus—to begin a new chapter in her life. To find a place to settle, the 16-year-old goes to a real estate firm called Rent Plan Guide (RPG). There, she meets its employees: the pragmatic priest Rufuria, the tomboyish warrior Rakira, and the adorable demihuman Fa.

Coincidentally, Kotone is also set to work at RPG Real Estate and wastes no time learning about the business from her coworkers. With many housing options available to suit the varied eccentricities of its diverse customer pool, RPG Real Estate strives to deliver perfect matches for clients' specific needs, but it is not always an easy task. Even so, Kotone and her colleagues are determined to bring smiles to the faces of their patrons—one home at a time!

[Written by MAL Rewrite]
",TV,12.0,Finished Airing,"Apr 6, 2022","Jun 22, 2022","AT-X, Nippon Columbia, Houbunsha, Kadokawa Media House, BS NTV, Kadokawa",Unknown,Doga Kobo,4-koma manga,"Comedy, Fantasy",CGDCT,Unknown,23.0,PG-13 - Teens 13 or older,6.731,11720.0,51322.0,3287,35361,109,2022.0
7791,K-On!!,けいおん!!,K-ON! Season 2,"It is the new year, which means that the senior members of the Light Music Club are now third-years, with Azusa Nakano being the only second-year. The seniors soon realize that Azusa will be the only member left once they graduate and decide to recruit new members. Despite trying many methods of attracting underclassmen—handing out fliers, bringing people into the clubroom, and performing at the welcoming ceremony—there are no signs of anyone that plans to join.

While heading to the clubroom, Azusa overhears Yui Hirasawa say that the club is fine with only five people and that they can do many fun things together. Changing her mind, she decides that they do not need to recruit any members for the time being. 

K-On!! revolves around the members of the Light Music Club as they experience their daily high school life. From rehearsing for concerts to just messing around, they are ready to make their last year together an exciting one!

[Written by MAL Rewrite]",TV,26.0,Finished Airing,"Apr 7, 2010","Sep 29, 2010","Pony Canyon, TBS, Movic, Rakuonsha, Animation Do",Sentai Filmworks,Kyoto Animation,4-koma manga,Comedy,"CGDCT, Music, School",Unknown,24.0,PG-13 - Teens 13 or older,8.171,354172.0,3642.0,275,636138,13820,2010.0
31080,Anne Happy♪,あんハピ♪,Anne-Happy,"Tennomifune Academy is an elite institution for the best and the brightest, with the exception of Class 1-7, the so-called ""Happiness Class."" Each member of the classroom copes with personal misfortunes, and the special class is geared to help them move past their issues and find true happiness. 

After being accepted into the academy, An Hanakoizumi, Ruri Hibarigaoka, and Botan Kumegawa find themselves placed into the Happiness Class, plagued by dreadful luck, love problems, and bad health respectively. Alongside their classmates, they do their best to overcome the difficulties they are faced with in pursuit of a life filled with joy.

[Written by MAL Rewrite]",TV,12.0,Finished Airing,"Apr 7, 2016","Jun 23, 2016","Sotsu, AT-X, KlockWorx, Asmik Ace, Houbunsha, BS Fuji, DIVE II Entertainment, Grooove, Avex Pictures, Contents Seed, FuRyu",Crunchyroll,SILVER LINK.,Manga,"Comedy, Slice of Life","CGDCT, School",Unknown,23.0,PG-13 - Teens 13 or older,6.961,31399.0,40852.0,2174,73752,255,2016.0
33948,Hinako Note,ひなこのーと,Hinako Note,"Born and raised in the countryside of Japan, Hinako ""Hina"" Sakuragi gets anxious easily when she talks to new people—so much so that she resembles a stiff scarecrow. To overcome this, Hina hopes to get involved in theater, inspired by a play she saw during her school's field trip. So, Hina moves into the Hitotose Manor in the bustling city of Tokyo to study at Fujiyama High School, aspiring to join the school's renowned theater club.

But to Hina's dismay, she learns that Fujiyama High's theater club has been on a lengthy hiatus. Having already come to Tokyo and enrolled in the school, Hina is at a loss for what to do next. Sensing her disappointment and eagerness to learn theater, Chiaki Hagino, the landlady of Hitotose Manor, encourages Hina to create a troupe with the residents of Hitotose Manor as its members.

Hinako Note follows Hina as she begins a new life in Tokyo attending Fujiyama High while learning the ropes of theater with the support of her friends along the way.

[Written by MAL Rewrite]",TV,12.0,Finished Airing,"Apr 7, 2017","Jun 23, 2017","Media Factory, AT-X, Enterbrain, Sony Music Communications",Unknown,Passione,4-koma manga,"Comedy, Slice of Life","CGDCT, Performing Arts",Unknown,23.0,PG-13 - Teens 13 or older,6.771,32328.0,49452.0,1808,99170,196,2017.0
39730,Houkago Teibou Nisshi,放課後ていぼう日誌,Diary of Our Days at the Breakwater,"Hina Tsurugi and her family have just moved to a quaint seaside town. Hoping to savor the sight of the peaceful ocean, Hina stumbles upon a girl named Yuuki Kuroiwa—an upperclassman at her new school—who invites Hina to join her in fishing. Hina reels in an octopus, which falls onto her; being afraid of bugs and big creatures, she panics and begs Yuuki to remove it from her. Yuuki sees this as an opportunity to force Hina to join the school's Breakwater Club—a club where members gather, catch, and eat various types of marine life as their main activity.

Although her attempts to refuse to join fail, Hina slowly begins to discover the hidden joy in fishing. Her view on the sport changes, now looking forward to all the delightful experiences she can take part in alongside her fellow club members.

[Written by MAL Rewrite]",TV,12.0,Finished Airing,"Apr 7, 2020","Sep 22, 2020",Unknown,Funimation,Doga Kobo,Manga,"Comedy, Slice of Life, Sports","CGDCT, Iyashikei, School",teenager,23.0,PG-13 - Teens 13 or older,7.411,22811.0,19782.0,2569,55578,240,2020.0
40685,Super Cub,スーパーカブ,Super Cub,"Koguma, a reserved second-year high school student, has nothing—no parents, hobbies, friends, or goals. On her way home one afternoon, she visits a vehicle shop in hopes of acquiring a motor scooter. With only enough money to make ends meet, she is disheartened by the price tags and prepares to turn back. However, as she is about to leave, the shop's owner offers her a pre-owned Honda Super Cub for ten thousand yen. Believing that the motorcycle will help brighten her monotonous world, she accepts the deal. As Koguma journeys through her town on small adventures with her Super Cub, she begins to build irreplaceable friendships and eagerly advances toward her new life.

[Written by MAL Rewrite]",TV,12.0,Finished Airing,"Apr 7, 2021","Jun 23, 2021","Chiptune, Bandai Namco Arts",Funimation,Studio Kai,Light novel,Slice of Life,"CGDCT, Iyashikei, School",Unknown,24.0,PG-13 - Teens 13 or older,7.431,38916.0,18982.0,1857,95777,804,2021.0
1887,Lucky☆Star,らき☆すた,Lucky☆Star,"Lucky☆Star follows the daily lives of four cute high school girls—Konata Izumi, the lazy otaku; the Hiiragi twins, Tsukasa and Kagami (sugar and spice, respectively); and the smart and well-mannered Miyuki Takara.

As they go about their lives at school and beyond, they develop their eccentric and lively friendship and making humorous observations about the world around them. Be it Japanese tradition, the intricacies of otaku culture, academics, or the correct way of preparing and eating various foods—no subject is safe from their musings.

[Written by MAL Rewrite]",TV,24.0,Finished Airing,"Apr 8, 2007","Sep 17, 2007","Lantis, Rakuonsha, Lucky Paradise","Funimation, Bandai Entertainment, Kadokawa Pictures USA",Kyoto Animation,4-koma manga,Comedy,"CGDCT, Gag Humor, Otaku Culture, School",Unknown,24.0,PG-13 - Teens 13 or older,7.741,304606.0,9972.0,288,609468,11352,2007.0
66,Azumanga Daioh,あずまんが大王 THE ANIMATION,Azumanga Daioh The Animation,"Chiyo Mihama begins her high school career as one of the strangest students in her freshman class—a tiny, 10-year-old academic prodigy with a fondness for plush dolls and homemade cooking. But her homeroom teacher, Yukari Tanizaki, is the kind of person who would hijack a student's bike to avoid being late, so ""strange"" is a relative word.

There certainly isn't a shortage of peculiar girls in Yukari-sensei's homeroom class. Accompanying Chiyo are students like Tomo Takino, an energetic tomboy with more enthusiasm than brains; Koyomi Mizuhara, Tomo's best friend whose temper has a fuse shorter than Chiyo; and Sakaki, a tall, athletic beauty whose intimidating looks hide a gentle personality and a painful obsession with cats. In addition, transfer student Ayumu Kasuga, a girl with her head stuck in the clouds, fits right in with the rest of the girls—and she has a few interesting theories about Chiyo's pigtails!

Together, this lovable group of girls experience the ups and downs of school life, their many adventures filled with constant laughter, surreal absurdity, and occasionally even touching commentary on the bittersweet, temporal nature of high school.

[Written by MAL Rewrite]",TV,26.0,Finished Airing,"Apr 9, 2002","Oct 1, 2002","Genco, Lantis, Imagica, TV Tokyo Music, Cosmic Ray, King Records","ADV Films, Sentai Filmworks",J.C.Staff,4-koma manga,"Comedy, Slice of Life","CGDCT, Gag Humor, School",Unknown,24.0,PG-13 - Teens 13 or older,7.971,139724.0,6052.0,659,306280,5627,2002.0
39808,Non Non Biyori Nonstop,のんのんびより のんすとっぷ,Non Non Biyori Nonstop,"The carefree journeys of the four girls continue! As their fleeting yet eventful summer becomes a distant memory, the arrival of fall signals a new school year with limitless opportunities. Even as the four girls return to their peaceful routine, the appearance of new faces enlivens the anything but exciting rural life of Asahigaoka.

Non Non Biyori Nonstop leisurely walks back into the lives of Hotaru Ichijou, Komari Koshigaya, Natsumi Koshigaya, and Renge Miyauchi as they fully embrace their rural lifestyles and turn anything they find into nothing but fun!

[Written by MAL Rewrite]",TV,12.0,Finished Airing,"Jan 11, 2021","Mar 29, 2021","TV Tokyo, Lantis, AT-X, Kadokawa, Bandai Namco Arts, Bit grooove promotion, Sony Music Solutions",Sentai Filmworks,SILVER LINK.,Manga,Slice of Life,"CGDCT, Iyashikei",teenager,24.0,PG-13 - Teens 13 or older,8.391,38677.0,1692.0,1720,106592,865,2021.0
