ID,Title,Japanese,English,Synopsis,Type,Episodes,Status,Start_Aired,End_Aired,Producers,Licensors,Studios,Source,Genres,Themes,Demographics,Duration_Minutes,Rating,Score,Scored_Users,Ranked,Popularity,Members,Favorites,year
24629,Koufuku Graffiti,幸腹グラフィティ,Gourmet Girl Graffiti,"The path to becoming a fine wife begins with being an accomplished cook—at least, that is what Ryou Machiko's late grandmother had led her to believe. For a middle schooler, Ryou's cooking skills are incomparable; but recently, though Ryou's food looks appetizing and smells inviting, the taste has not been delicious. Just when the dejected art student comes to terms with the possibility that she might continue living alone for the rest of her life, her aunt tells her that Kirin Morino—Ryou's second cousin—will begin staying with her every weekend since the younger girl has joined a cram school in Tokyo and aims to attend the same school as Ryou.

Surprisingly, with her cousin's arrival, Ryou finds that her cooking has vastly improved—apparently, it is not her prowess in the kitchen, but the sharing of the experience with those closest to her that seems to make the flavors shine.

[Written by MAL Rewrite]",TV,12.0,Finished Airing,"Jan 9, 2015","Mar 27, 2015","TBS, Movic, flying DOG, Sony Music Communications, Houbunsha, Kadokawa",Sentai Filmworks,Shaft,4-koma manga,"Comedy, Gourmet, Slice of Life",CGDCT,teenager,24.0,PG-13 - Teens 13 or older,6.791,27829.0,48582.0,2119,76282,146,2015.0
34914,New Game!!,NEW GAME!!,New Game!!,"​It has been a year since Aoba Suzukaze started working at the Eagle Jump game company. In that time, she and her eccentric coworkers in the character design department have worked hard to release the company's newest game: Fairies Story 3. With their latest title now complete, a new project must begin—starting with a contest to decide the character designs for the upcoming game. Through hard work, dedication, and some guidance from the previous character designer, Kou Yagami, Aoba wins the contest and begins her new role as lead character designer.

However, her new job is not an easy one. In addition to having extra work and longer hours, Aoba questions whether she is the right fit for the job. New Game!! continues as Aoba overcomes her inexperience with the help of her friends and coworkers, willing to face any challenge to make Eagle Jump's newest creation, a cutesy game called Peco.

[Written by MAL Rewrite]",TV,12.0,Finished Airing,"Jul 11, 2017","Sep 26, 2017","Frontier Works, Media Factory, Movic, AT-X, Sony Music Communications, Houbunsha, MAGES., Lawson","Funimation, Crunchyroll",Doga Kobo,4-koma manga,Comedy,"CGDCT, Otaku Culture, Workplace",Unknown,24.0,PG-13 - Teens 13 or older,7.711,123178.0,10912.0,851,240389,869,2017.0
488,Ichigo Mashimaro,苺ましまろ,Strawberry Marshmallow,"""Cute girls doing cute things in cute ways.""

Everyday things make up the fabric of life—whether it's making friends, going to school, trying to make money, or celebrating a holiday. Ichigo Mashimaro is a heartwarming series that follows the daily lives of Itou Chika, her sister Nobue, and her friends Miu, Matsuri, and Ana.

[Written by MAL Rewrite]",TV,12.0,Finished Airing,"Jul 15, 2005","Oct 14, 2005","TBS, Movic","Sentai Filmworks, Geneon Entertainment USA",Daume,4-koma manga,"Comedy, Slice of Life","CGDCT, Iyashikei",Unknown,24.0,PG-13 - Teens 13 or older,7.631,32795.0,12652.0,1900,92375,824,2005.0
12403,Yuru Yuri♪♪,ゆるゆり♪♪,YuruYuri Happy Go Lily ♪♪,"The girls of the Amusement Club return in Yuru Yuri♪♪, finding new ways to make passing time even more enjoyable. Their members consist of the always energetic Kyouko Toshinou; calm and sensible Yui Funami; polite but often overlooked Akari Akaza; and Chinatsu Yoshikawa, who stumbled upon the others while looking for the Tea Ceremony Club. Together they are the Amusement Club, which has the deceptively simple task of keeping its members entertained.

Along with the Student Council and the odd family member, they strive to enjoy their youth to the fullest. Whether it's a trip to a hot spring or finishing overdue homework, their lives are never dull, and they will always find an excuse to spend time together.

[Written by MAL Rewrite]",TV,12.0,Finished Airing,"Jul 3, 2012","Sep 18, 2012","Sotsu, Pony Canyon, DAX Production","NIS America, Inc.",Doga Kobo,Manga,"Comedy, Girls Love","CGDCT, Gag Humor, School",Unknown,23.0,PG-13 - Teens 13 or older,7.831,96835.0,8432.0,1165,173549,922,2012.0
15731,Tamayura: More Aggressive,たまゆら ～もあぐれっしぶ～,Unknown,"The second season of Tamayura: Hitotose.

It's the beginning of a new school year for Fuu and friends. With a new year comes new challenges as Fuu tries to open a photography club at her school.

(Source: ANN)",TV,12.0,Finished Airing,"Jul 3, 2013","Sep 18, 2013",RAY,Unknown,TYO Animations,Original,"Comedy, Drama, Slice of Life","CGDCT, Iyashikei",Unknown,24.0,G - All Ages,7.561,6980.0,14632.0,4385,19326,71,2013.0
30355,Wakaba*Girl,わかば＊ガール,Wakaba Girl,"Wakaba Kohashi, a sheltered rich girl, dreams of becoming a fashionable and trendy gyaru because she admires their outgoing and carefree nature. With this goal in mind, Wakaba begins the school year hoping to make her high school debut as a gyaru. On the first day of class, she meets the pure Moeko Tokita, the serious Nao Mashiba, and the eccentric Mao Kurokawa, and the four of them quickly become friends as they learn about and imitate each other's lifestyles.

Wakaba*Girl follows the adventures of these four friends while they experience events like school festivals, waterpark trips, and gym class tests. Along the way, Wakaba discovers what it is like to live as a regular student while Nao, Moeka, and Mao catch a glimpse into the life of a rich family. With never a dull moment in their lives, the four girls make sure to live each day to the fullest.

[Written by MAL Rewrite]",TV,13.0,Finished Airing,"Jul 3, 2015","Sep 25, 2015","Showgate, NBCUniversal Entertainment Japan",Sentai Filmworks,Nexus,4-koma manga,"Comedy, Slice of Life","CGDCT, School",Unknown,7.0,PG-13 - Teens 13 or older,6.891,18175.0,43752.0,3000,41572,67,2015.0
35672,Yama no Susume Third Season,ヤマノススメ サードシーズン,Encouragement of Climb Season 3,"With the conclusion of an unforgettable summer break, Aoi Yukimura remains invigorated to continue pursuing her new hobby in mountaineering. Having braved her fear of heights and fulfilled her childhood promise with Hinata Kuraue, any opportunity to go climbing intrigues the first-year high school student—including a second chance to reach the summit of Mt. Fuji.

Although the formidable yet exciting trip is planned for next summer, Aoi is already preparing as much as she can to guarantee her success this time around. However, as budding expectations blossom with the shift of the seasons, ascending the unexplored peaks of colorful endeavors begins to strain the bond between the two longtime friends and the perspectives they share of the future.

[Written by MAL Rewrite]
",TV,13.0,Finished Airing,"Jul 3, 2018","Sep 25, 2018","Tokyo MX, Good Smile Company, Yomiuri TV Enterprise, Jinnan Studio, Radio Osaka, Top Marshal, Aeon Entertainment",Unknown,8bit,Manga,"Adventure, Comedy, Slice of Life","CGDCT, Iyashikei",Unknown,13.0,PG-13 - Teens 13 or older,7.571,8023.0,14442.0,4175,21361,64,2018.0
3604,Hidamari Sketch x 365,ひだまりスケッチ×365,Hidamari Sketch x 365,"After passing her entrance exam, Yuno enrolls at Yamabuki High School as part of an art degree. She stays at the Hidamari Apartments along with best friend Miyako, and seniors Hiro and Sae. Each episode follows a day in her life as she mingles with her friends, close peers, overly hyper teachers and closely follows the mundane lives of the high school girls.

(Source: ANN)",TV,13.0,Finished Airing,"Jul 4, 2008","Sep 26, 2008","Aniplex, Lantis, TBS, Movic, Houbunsha",Sentai Filmworks,Shaft,4-koma manga,"Comedy, Slice of Life","CGDCT, Iyashikei, School, Visual Arts",teenager,24.0,PG-13 - Teens 13 or older,7.821,14972.0,8502.0,3561,30077,173,2008.0
31953,New Game!,NEW GAME!,New Game!,"Since childhood, Aoba Suzukaze has loved the Fairies Story game series, particularly the character designs. So when she graduates from high school, it is no surprise that she applies to work at Eagle Jump, the company responsible for making her favorite video game. On her first day, she is excited to learn that she will be working on a new installment to the series: Fairies Story 3—and even more so under Kou Yagami, the lead character designer.

In their department are people who share the same passion for games. There is Yun Iijima, whose specialty is designing monsters; the shy Hifumi Takimoto, who prefers to communicate through instant messaging; Hajime Shinoda, an animation team member with an impressive figurine collection; Rin Tooyama, the orderly art director; Shizuku Hazuki, the game director who brings her cat to work; and Umiko Ahagon, the short-tempered head programmer.

New Game! follows Aoba and the others on their adventure through the ups and downs of game making, from making the perfect character design to fixing all the errors that will inevitably accumulate in the process.

[Written by MAL Rewrite]",TV,12.0,Finished Airing,"Jul 4, 2016","Sep 19, 2016","Frontier Works, Kadokawa Shoten, Movic, AT-X, Delfi Sound, Sony Music Communications, Houbunsha, MAGES., Lawson","Funimation, Crunchyroll",Doga Kobo,4-koma manga,Comedy,"CGDCT, Otaku Culture, Workplace",Unknown,24.0,PG-13 - Teens 13 or older,7.581,192218.0,13852.0,472,402633,2775,2016.0
10495,Yuru Yuri,ゆるゆり,YuruYuri Happy Go Lily,"After a year in grade school without her childhood friends, first year student Akari Akaza is finally reunited with second years Yui Funami and Kyouko Toshinou at their all-girls' middle school. During the duo's first year, Yui and Kyouko formed the ""Amusement Club"" which occupies the now nonexistent Tea Club's room. Shortly after Akari joins, one of her fellow classmates, Chinatsu Yoshikawa, pays the trio a visit under the impression that they are the Tea Club; it is only once the three girls explain that the Tea Club has been disbanded that they can convince Chinatsu to join the Amusement Club—a group with no purpose other than to provide entertainment for its members.

Based on the slice-of-life manga by Namori, Yuru Yuri is an eccentric comedy about a group of girls who spend their spare time drinking tea and fawning over each other, all while completely failing to even notice the supposed main character Akari amongst them.

[Written by MAL Rewrite]",TV,12.0,Finished Airing,"Jul 5, 2011","Sep 20, 2011","TV Tokyo, Daume, Sotsu, Pony Canyon, DAX Production, Studio Gram, PRA, Jumondo","NIS America, Inc.",Doga Kobo,Manga,"Comedy, Girls Love","CGDCT, Gag Humor, School",Unknown,23.0,PG-13 - Teens 13 or older,7.581,144786.0,14022.0,622,319696,4381,2011.0
16353,Love Lab,恋愛ラボ,Love Lab,"At Fujisaki Girls Academy, student council president Natsuo Maki is the epitome of grace and perfection, admired by all the young girls who attend the school. One day, Riko Kurahashi walks into the student council room on an errand, only to discover Natsuo practicing her kissing techniques on a pillow, an act that is neither graceful nor elegant. Riko soon discovers that Natsuo desires more romance in her life, leading her to practice ""romantic situations"" in secret.

Sympathizing with her, Riko agrees to help Natsuo with her love research. Named ""Love Lab,"" the project practices the essentials of love and romance, such as bumping into each other ""accidentally"" and holding hands. Soon, the entire student council joins in on the fun in the Love Lab too! Through their research and real life encounters, what will they learn about romance?

Weaving together funny characters and comedic situations, Love Lab builds a story of friendship and romance, while never missing a beat with the laughter.

[Written by MAL Rewrite]",TV,13.0,Finished Airing,"Jul 5, 2013","Sep 27, 2013","Aniplex, Dentsu, Mainichi Broadcasting System",Sentai Filmworks,Doga Kobo,Manga,"Comedy, Romance","CGDCT, School",Unknown,24.0,PG-13 - Teens 13 or older,7.321,74035.0,23402.0,1067,189043,522,2013.0
5914,Kanamemo,かなめも,Unknown,"Middle schooler Kana Nakamachi's life drastically changes when her grandmother passes away. Leaving behind an empty house, Kana learns that no one can provide her lodging due to her young age. Eventually, she stumbles upon the Fuhshin Gazette, a local newspaper delivery business who is able to provide her with a place to stay if she works for them in return.

The small store is staffed by several unique people: the sweets-loving Yume Kitaoka and her girlfriend Yuuki Minami; the frugal Hinata Azuma; the alcoholic Haruka Nishida; and the young but mature Saki Amano. It is not all fun and games at the Fuhshin Gazette, though, as Kana must deal with long working hours, energetic dogs guarding mailboxes, and confusing delivery routes. Add in a small rivalry with Mika Kujiin, a girl from a competing store, and Kana will have more than enough to keep her hands full!

[Written by MAL Rewrite]",TV,13.0,Finished Airing,"Jul 6, 2009","Sep 28, 2009","Starchild Records, TV Tokyo Music, Houbunsha",Maiden Japan,feel.,4-koma manga,"Comedy, Girls Love, Slice of Life, Ecchi",CGDCT,Unknown,24.0,PG-13 - Teens 13 or older,6.851,14742.0,45672.0,3184,37330,68,2009.0
16732,Kiniro Mosaic,きんいろモザイク,KINMOZA!,"Shinobu Oomiya once left Japan to participate in a homestay in England. During her time there, she became close friends with Alice Cartelet, the daughter of the family she was living with. However, when it was time for Shinobu to return to Japan, the two were able to express their sorrow despite the language barrier between them.

Five years later, now a first year student in high school, Shinobu receives a letter by air mail in a language she does not understand. This letter is penned by none other than Alice, detailing her own homestay in Japan. In fact, Alice will be attending Shinobu's high school and living with her! Alongside their friends Youko Inokuma, Aya Komichi, and Karen Kujou, the five girls attend school together and learn about what their different cultures have to offer, day after day.

[Written by MAL Rewrite]",TV,12.0,Finished Airing,"Jul 6, 2013","Sep 21, 2013","Media Factory, Showgate",Sentai Filmworks,Studio Gokumi,4-koma manga,"Comedy, Slice of Life","CGDCT, School",teenager,24.0,PG-13 - Teens 13 or older,7.231,66423.0,28342.0,1156,174300,854,2013.0
5670,GA: Geijutsuka Art Design Class,GA 芸術科アートデザインクラス,Unknown,"The Ayanoi High School features the Geijutsuka Art Design Class (GA) that focuses on the arts. Five close friends — the energetic ""hime""-prankster Noda Miki; the level-headed, cynical Nozaki Namiko; the intelligent, observant, and kind Oomichi Miyabi; the lively and mischievous tomboy Tomokane; and the curious, innocent, glasses-wearing Yamaguchi Kisaragi — attend this class with great enthusiasm, learning about the many art techniques. Every day seems to pose a new and interesting challenge, be it struggling with the latest assignment or when dealing with the daily strangeness of school life.

(Source: AniDB)",TV,12.0,Finished Airing,"Jul 7, 2009","Sep 22, 2009","AIC, Houbunsha, Studio Jack",Unknown,AIC PLUS+,4-koma manga,"Comedy, Slice of Life","CGDCT, School, Visual Arts",teenager,24.0,PG-13 - Teens 13 or older,7.131,6591.0,33012.0,4392,19193,74,2009.0
23623,Non Non Biyori Repeat,のんのんびより りぴーと,Non Non Biyori Repeat,"Far from the hustle and bustle of urban life, and with only a single candy store and bus route to its name, the rural Asahigaoka is certainly not a place for everyone. Nevertheless, the village's children still manage to cheerfully spend their days exploring and having fun in the wilderness around them. One such child, Renge Miyauchi, the youngest of the group, looks forward to the entrance ceremony of the upcoming school year, signalling her entry into first grade and the beginning of her elementary school life. Attending the only school in town, Renge and her friends, seventh grader Natsumi Koshigaya and her eighth grade sister Komari, make the most out of their rural lifestyle, playing and studying everyday.

Meanwhile, fifth grader Hotaru Ichijou has just moved to Asahigaoka from Tokyo, unaware of the numerous adventures and memories that await her. 

[Written by MAL Rewrite]",TV,12.0,Finished Airing,"Jul 7, 2015","Sep 22, 2015","TV Tokyo, Lantis",Sentai Filmworks,SILVER LINK.,Manga,Slice of Life,"CGDCT, Iyashikei, School",teenager,23.0,PG-13 - Teens 13 or older,8.181,93169.0,3572.0,1084,185597,1277,2015.0
21681,Hanayamata,ハナヤマタ,Hanayamata,"At the tender age of 14, high school student Naru Sekiya finds that she pales in comparison to the fairy tale princesses she adores so much, not to mention the ideal girl she wants to be in contrast to her peers. Her childhood friend Yaya Sasame is enjoying herself with her school rock band, while her other childhood friend Tami Nishimikado is a member of the student council. Desiring the strength to take the next step forward, Naru has wanted a magic key to open her timid heart since the start of high school.

During one moonlit night, Naru encounters what she believes is a cute fairy standing atop a torii gate who shortly invites her to dance with her. The next day, she discovers that the ""fairy"" was not only just an ordinary girl, but also a transfer high school student from America! Excited to meet Naru again, Hana N. Fountainstand encourages her to help her start a club for yosakoi, a festive type of Japanese dance that Hana has been entranced by since childhood. 

Though initially terrified of Hana's enthusiasm and the thought of being seen dancing, Naru slowly finds herself immersed in the art of yosakoi and assisting her new friend achieve her dream—for the path for a maiden such as herself is at the mercy of the wind!

[Written by MAL Rewrite]
",TV,12.0,Finished Airing,"Jul 8, 2014","Sep 23, 2014","TV Tokyo, Avex Entertainment, Sotsu, Movic, AT-X, DIVE II Entertainment, Bandai Namco Games",Sentai Filmworks,Madhouse,Manga,"Comedy, Slice of Life","CGDCT, Iyashikei, Performing Arts, School",Unknown,24.0,PG-13 - Teens 13 or older,7.321,38297.0,23792.0,1743,105446,369,2014.0
9934,Nekogami Yaoyorozu,猫神やおよろず,The Everyday Tales of a Cat God,"Koyama Yuzu is running an antique shop. Mayu, a cat god (nekogami), is living off Yuzu and leads an idle life playing games. Lots of other gods visit Mayu and enjoy merrymaking.

(Source: ANN)",TV,12.0,Finished Airing,"Jul 9, 2011","Sep 24, 2011","Sotsu, AT-X, Marvelous AQL, Akita Shoten","NIS America, Inc.",AIC PLUS+,Manga,"Comedy, Slice of Life, Supernatural",CGDCT,teenager,23.0,PG-13 - Teens 13 or older,6.621,6805.0,57162.0,4285,20096,27,2011.0
21435,Yama no Susume Second Season,ヤマノススメ セカンドシーズン,Encouragement of Climb Season 2,"Continuing their treks through the high peaks of Japan, the mountaineering girls are back for more! First-year high school student Aoi Yukimura, a shy girl with a fear of heights, and her wildly energetic friend Hinata Kuraue set out once again to conquer the perils of backyard camping trips, summer homework, and even a climb on the mountain of their dreams. Joined by middle school student Kokona Aoba and their knowledgeable upperclassman Kaede Saitou, the squad members are ready to take on whatever slopes and challenges they might face, no matter how steep. 

Through their shared hobby of mountain climbing, they bond closer than ever and even make new friends on trails all over the country. Whether it is just a local hill or the tallest mountain around, nothing is too much for Aoi and the crew to handle. They will climb, stumble, and rise to even greater heights together!

[Written by MAL Rewrite]",TV,24.0,Finished Airing,"Jul 9, 2014","Dec 24, 2014","Earth Star Entertainment, Tokyo MX, Good Smile Company, Yomiuri TV Enterprise, Jinnan Studio, Radio Osaka, TSUTAYA, Ashisuto",Unknown,8bit,Manga,"Adventure, Comedy, Slice of Life","CGDCT, Iyashikei",Unknown,13.0,PG-13 - Teens 13 or older,7.551,12998.0,15062.0,3507,30895,149,2014.0
29787,Gochuumon wa Usagi Desu ka??,ご注文はうさぎですか??,Is the Order a Rabbit??,"With a new year comes new adventures, especially at the Rabbit House! Since her arrival at the café, Kokoa Hoto has become accustomed to her new life as a waitress even though the Rabbit House isn't the rabbit paradise she initially envisioned it to be. Life is pleasant, and she enjoys spending time both working and playing with her friends and fellow waitresses Chino Kafuu, a cute middle school student with a fuzzy bunny companion named Tippy, and Rize Tedeza, the pig-tailed daughter of a soldier who is readily armed for any scenario.

Together with Chiya Ujimatsu and Sharo Kirima, who also work at neighboring cafés in town, the Rabbit House crew gets involved in all sorts of crazy adventures. Throughout these adventures, the girls encounter troubled novelists, rival cafes, secret treasure, and... alcoholic chocolates?

[Written by MAL Rewrite]",TV,12.0,Finished Airing,"Oct 10, 2015","Dec 26, 2015","Frontier Works, AT-X, Magic Capsule, Bushiroad, Showgate, Houbunsha, NBCUniversal Entertainment Japan, i0+, Hakuhodo DY Music & Pictures, RAY",Sentai Filmworks,"Kinema Citrus, White Fox",4-koma manga,Comedy,"CGDCT, Iyashikei, Workplace",Unknown,23.0,PG-13 - Teens 13 or older,7.791,55276.0,8962.0,1544,120770,836,2015.0
38337,Gochuumon wa Usagi Desu ka? Bloom,ご注文はうさぎですか? BLOOM,Is the Order a Rabbit? Bloom,"Although the year is coming close to an end, there is no lack of fun for Kokoa Hoto and the other café waitresses! From bazaars to festivals, life is as enjoyable as it gets. As for Chino Kafuu and her middle school friends—the friendly Megumi Natsu and the playful Maya Jouga—they begin to look towards the future and decide on a high school to enroll in.

Bonds of friendship and exciting adventures blend into Gochuumon wa Usagi Desu ka? Bloom as the joyful lives of the café waitresses continue.

[Written by MAL Rewrite]",TV,12.0,Finished Airing,"Oct 10, 2020","Dec 26, 2020",Unknown,Sentai Filmworks,Encourage Films,4-koma manga,Comedy,"CGDCT, Iyashikei, Workplace",Unknown,24.0,PG-13 - Teens 13 or older,7.941,18942.0,6422.0,2581,55032,432,2020.0
40085,Maesetsu!,まえせつ!,Maesetsu! Opening Act,"Manzai is a traditional form of Japanese stand-up comedy where two comedians act out skits as a straight man and funny man, guiding the audience through a series of punchlines. Two determined girls, Mafuyu Kogarashi and Fubuki Kitakaze, are aspiring manzai entertainers who struggle to achieve any real success, despite their lengthy time on stage. They often partner up with manzai newcomers and their close friends—Rin Araya and Nayuta Asougi—to help in the opening acts of each other's routines.

In order to eventually reach their desired fame, the four girls challenge themselves by changing venues, switching roles, entering competitions, and giving it their best to hone their craft and gain more experience. But before that can happen, these flourishing young artists must first grow into presentable performers to get signed as amateurs and start their dream in earnest.

[Written by MAL Rewrite]
",TV,12.0,Finished Airing,"Oct 11, 2020","Dec 27, 2020",Unknown,Funimation,"Studio Gokumi, AXsiZ",Original,"Comedy, Slice of Life",CGDCT,Unknown,24.0,PG-13 - Teens 13 or older,5.811,3279.0,98852.0,5530,10769,8,2020.0
38529,Rifle Is Beautiful,ライフル・イズ・ビューティフル,Chidori RSC,"Rifle-shooting sports are competitive activities testing accuracy and precision using a rifle. In Japan, carrying firearms is prohibited, so most of the participants are members of the defense force. When the use of rifles using a light beam instead of real bullets as ammunition became common, rifle-shooting competitions became accessible to the younger population, giving way to school contests.

First-year high school student and marksmanship enthusiast Hikari Kokura has just transferred to Chidori High School. She tries to join the club of her choice, but finds out that the club no longer exists due to the low popularity of the sport. Distraught, she tries to restore the club and somehow manages to recruit three other members: her childhood friend Izumi Shibusawa, the half-Russian Erika Meinohama, and the stoic Yukio Igarashi.

This marks the beginning of the Chidori Rifle-Shooting Club, who have only one goal—to compete on the national stage!

[Written by MAL Rewrite]",TV,12.0,Finished Airing,"Oct 13, 2019","Jan 18, 2020","Hakuhodo DY Music & Pictures, Bandai Namco Arts",Sentai Filmworks,Studio 3Hz,4-koma manga,"Comedy, Slice of Life, Sports","CGDCT, School, Team Sports",Unknown,23.0,PG-13 - Teens 13 or older,6.171,10393.0,81692.0,3317,34919,33,2019.0
