ID,Title,Japanese,English,Synopsis,Type,Episodes,Status,Start_Aired,End_Aired,Producers,Licensors,Studios,Source,Genres,Themes,Demographics,Duration_Minutes,Rating,Score,Scored_Users,Ranked,Popularity,Members,Favorites,year
1852,Hidamari Sketch,ひだまりスケッチ,Hidamari Sketch,"Ever since she was young, Yuno has always had an interest in art. Now that she has been accepted to Yamabuki Arts High School, it means one thing—moving out. Living in a dorm at Hidamari Apartments alone, Yuno meets her neighbors: the hyperactive Miyako, the self-conscious Hiro, and the mature Sae. Despite their different personalities, they go to the same school, spend time together, and develop a strong friendship. Yuno's life won't be so lonely after all!

Hidamari Sketch revolves around the antics and day-to-day lives of the girls living at Hidamari Apartments.

[Written by MAL Rewrite]",TV,12.0,Finished Airing,"Jan 12, 2007","Mar 30, 2007","Aniplex, Lantis, TBS, Movic, Houbunsha",Sentai Filmworks,Shaft,4-koma manga,"Comedy, Slice of Life","CGDCT, Iyashikei, School, Visual Arts",teenager,24.0,PG-13 - Teens 13 or older,7.441,25004.0,18622.0,2175,73661,990,2007.0
36108,Takunomi.,たくのみ。,Takunomi,"20-year-old Michiru Amatsuki moved to Tokyo after a career change, and now finds herself living in a woman only share house, Stella House Haruno, with a few other women of varying age and occupation. Every night the girls settle down and have a drink or two (or more) as drama ensues.",TV,12.0,Finished Airing,"Jan 12, 2018","Mar 30, 2018","Pony Canyon, TBS, Magic Capsule, Shogakukan, Lawson, RAY, U-NEXT, Nichion",Sentai Filmworks,Production IMS,Web manga,"Comedy, Gourmet, Slice of Life",CGDCT,Unknown,12.0,PG-13 - Teens 13 or older,6.421,14306.0,68202.0,2922,43642,44,2018.0
40930,Azur Lane: Bisoku Zenshin!,アズールレーン びそくぜんしんっ!,Azur Lane Slow Ahead!,"In a seemingly peaceful time without looming threats of Sirens or war, shipgirls from different nations live together in harmony. Some girls, such as the destroyers Ayanami, Javelin, Laffey, and Z23, attend school. Others immerse themselves into various other activities, including sports, foraging, training, going to formal parties, or even vying for the commander's attention! But one thing is for certain: the girls will continue to deepen their friendship in the pleasant port of Azur Lane!

[Written by MAL Rewrite]",TV,12.0,Finished Airing,"Jan 12, 2021","Mar 30, 2021","Delfi Sound, CANDY BOX",Unknown,Yostar Pictures,4-koma manga,"Comedy, Sci-Fi, Slice of Life","Anthropomorphic, CGDCT, Military",Unknown,8.0,PG-13 - Teens 13 or older,7.041,16728.0,37522.0,2945,43234,230,2021.0
38062,Endro~!,えんどろ～！,ENDRO!,"In a world of adventurers and magic lies Naral Island. Every generation, a Demon Lord rises to plague the land, and every generation, a Hero is born to subdue him. For countless centuries, the cycle has repeated with no end in sight. The latest Hero, Juulia ""Yusha"" Charldetto, has almost completed her valiant campaign alongside her party members: responsible priest Seiran ""Seira"" Élénoir, enigmatic mage Meiza ""Mei"" Endust, and hyper-energetic warrior Fai Fai.

In the final battle against the Demon Lord, Yusha's party attempt a risky spell to cast their enemy into the drifts of time. But the incantation goes awry, sending Yusha and her friends back to a time before the Demon Lord, before Yusha becomes the Hero, and before the party had even graduated as adventurers. With their memories of the future erased, the four girls restart their ambitions to become the Hero's Party, aspiring to defeat the Demon Lord.

However, in a sudden twist of fate, the Demon Lord was also sent back in time with her memories intact. Reduced to the form of a little girl, the Demon Lord takes the name Mao and infiltrates the adventurers' school as a teacher, planning to stop Yusha before she becomes a hero. Thus begins the story of Yusha and her friends, in their quest to defeat the Demon Lord, not knowing that the one they seek is right by their side.

[Written by MAL Rewrite]
",TV,12.0,Finished Airing,"Jan 13, 2019","Mar 31, 2019",Egg Firm,Funimation,Studio Gokumi,Original,"Fantasy, Slice of Life",CGDCT,Unknown,23.0,PG-13 - Teens 13 or older,6.911,24574.0,42932.0,2248,70002,167,2019.0
42506,World Witches Hasshin Shimasu!,ワールドウィッチーズ発進しますっ！,World Witches Take Off!,"Countries all over the world formed an alliance to counter the emerging enemy of mankind ""Neuroi,"" whom only girls with special powers could counter. However, the Neuroi never appeared. Instead of fighting, the witches spend their days idly. This time following not only unit 501, but also unit 502 known as ""Brave Witches!"" The 2nd volume of the comical daily drama of the witches who do not fight Neuroi begins!

(Source: MAL News)",TV,12.0,Finished Airing,"Jan 13, 2021","Mar 31, 2021","Nippon Columbia, Glovision",Unknown,"Acca effe, Giga Production",Original,Comedy,"CGDCT, Military",Unknown,15.0,PG-13 - Teens 13 or older,6.431,2590.0,67802.0,5686,10052,15,2021.0
14045,Mangirl!,まんがーる!,Unknown,"""We're going to launch a manga magazine!"" 

A team of girls with zero experience in manga editing are off and running toward their dream of creating the biggest manga magazine in Japan! They seem to do nothing but run into problems and failures... But still they're working hard every day!

(Source: Crunchyroll)",TV,13.0,Finished Airing,"Jan 3, 2013","Mar 28, 2013",Earth Star Entertainment,Unknown,Doga Kobo,Manga,"Comedy, Slice of Life","CGDCT, Otaku Culture",Unknown,3.0,PG-13 - Teens 13 or older,5.811,13986.0,98882.0,3475,31381,17,2013.0
14355,Yama no Susume,ヤマノススメ,Encouragement of Climb,"As a child, Aoi Yukimura adored mountains and was passionate about climbing. However, a playground accident has since left her afraid of heights, turning her toward indoor hobbies. Unfortunately, now a shy and timid first-year high school student, Aoi has become so absorbed in these pastimes that she can barely socialise with others, leaving her practically friendless. It’s only when she runs into the lively Hinata Kuraue, an old friend from her climbing days, that things start to change. 

Impulsive and high-spirited, Hinata insists on having Aoi join her in all sorts of climbing activities. Though reluctant at first, Aoi quickly finds that her time with Hinata brings back fond memories of their childhood and soon decides to start climbing again. As the return to her past hobby starts to bring her out of her shell, Aoi finds herself gaining close friends, taking on new challenges, and continuing to find her own encouragement to climb.

[Written by MAL Rewrite]",TV,12.0,Finished Airing,"Jan 3, 2013","Mar 21, 2013",Earth Star Entertainment,Unknown,8bit,Manga,"Adventure, Comedy, Slice of Life","CGDCT, Iyashikei",Unknown,3.0,PG-13 - Teens 13 or older,6.821,26448.0,47372.0,2159,74508,146,2013.0
39388,Koisuru Asteroid,恋する小惑星〈アストロイド〉,Asteroid in Love,"In a fateful childhood encounter, Mira Kinohata met a stargazing dreamer named Ao Manaka. Though their time together was short, Ao showed Mira the wonders of astronomy, from orbiting planets to distant stars. Before they parted, Mira learned that a star with her name exists, but there are none with Ao's. And so, she forged a promise: one day, she would discover a new asteroid and name it after Ao.

Years later, Mira is still fascinated with astronomy. Now in high school at Hoshizaki Academy, she tries to join the Astronomy Club. Unfortunately, she finds out that the club has been merged with the Geology Club to form a single Earth Sciences Club. She joins this new club and finds a pleasant surprise—she reunites with Ao after years of separation.

Alongside their new clubmates, Mira and Ao begin their journey together to fulfill their promise. How hard could it possibly be to find an asteroid?

[Written by MAL Rewrite]",TV,12.0,Finished Airing,"Jan 3, 2020","Mar 27, 2020","AT-X, flying DOG, Houbunsha, Kadokawa Media House, RAY, Kadokawa, GRANTdesign",Funimation,Doga Kobo,4-koma manga,"Comedy, Slice of Life","CGDCT, Iyashikei, School",Unknown,23.0,PG-13 - Teens 13 or older,6.871,30126.0,44752.0,2081,79082,277,2020.0
34798,Yuru Camp△,ゆるキャン△,Laid-Back Camp,"While the perfect getaway for most girls her age might be a fancy vacation with their loved ones, Rin Shima's ideal way of spending her days off is camping alone at the base of Mount Fuji. From pitching her tent to gathering firewood, she has always done everything by herself, and has no plans of leaving her little solitary world.

However, what starts off as one of Rin's usual camping sessions somehow ends up as a surprise get-together for two when the lost Nadeshiko Kagamihara is forced to take refuge at her campsite. Originally intending to see the picturesque view of Mount Fuji for herself, Nadeshiko's plans are disrupted when she ends up falling asleep partway to her destination. Alone and with no other choice, she seeks help from the only other person nearby. Despite their hasty introductions, the two girls nevertheless enjoy the chilly night together, eating ramen and conversing while the campfire keeps them warm. And even after Nadeshiko's sister finally picks her up later that night, both girls silently ponder the possibility of another camping trip together.

[Written by MAL Rewrite]",TV,12.0,Finished Airing,"Jan 4, 2018","Mar 22, 2018","Sotsu, AT-X, Sony Music Communications, MAGES., 81 Produce, BS11, FuRyu, Crunchyroll SC Anime Fund",Unknown,C-Station,Manga,Slice of Life,"CGDCT, Iyashikei",Unknown,23.0,PG-13 - Teens 13 or older,8.271,188990.0,2602.0,438,429821,9647,2018.0
35298,Ramen Daisuki Koizumi-san,ラーメン大好き小泉さん,Ms. Koizumi Loves Ramen Noodles,"From standing in the sun for hours to traveling miles away from home, gorgeous high school student Koizumi stops at nothing to fulfill her desire for ramen. But these previously solo trips soon change when Koizumi's classmate Yuu Oosawa develops an infatuation with her, and begins to join Koizumi uninvitedly on her adventures. As Yuu continues to be shocked by Koizumi's enormous appetite, she learns about the endless variety of ramen from, arguably, its greatest connoisseur ever!

[Written by MAL Rewrite]",TV,12.0,Finished Airing,"Jan 4, 2018","Mar 22, 2018","Sotsu, KlockWorx, flying DOG, Grooove, Cygames, Crunchyroll SC Anime Fund",Discotek Media,"Studio Gokumi, AXsiZ",Manga,"Comedy, Gourmet, Slice of Life",CGDCT,Unknown,22.0,PG-13 - Teens 13 or older,6.531,22539.0,62002.0,2479,59483,59,2018.0
5162,Minami-ke Okaeri,みなみけ おかえり,Unknown,"A year has passed since Okawari and the three sisters have grown up. Their likings and moods are almost the same. Haruka, the older sister, is a love-giving mother to the younger sisters and a discipline follower. Kana, the middle one, leaves everything to the last possible moment and always gives trouble to the trio. Chiaki, the little one, is the calculating and manipulating one; she likes to be admired and loved by Haruka and always gives trouble to the less blessed Kana. Despite being an unbalanced family, they love each other with all their heart. The family's daily life is as funny as ever; trouble and love are always present. Now it's time to see if they'll survive this age change since Haruka is now a young adult; she has even more responsibilities, having to watch over the young while integrating into the adult life.

(Source: ANN)",TV,13.0,Finished Airing,"Jan 5, 2009","Mar 30, 2009",Unknown,Unknown,asread.,Manga,"Comedy, Slice of Life","CGDCT, School",Unknown,24.0,PG-13 - Teens 13 or older,7.561,34109.0,14482.0,2365,64197,54,2009.0
50267,Irodorimidori,イロドリミドリ,Unknown,"Maigahara Senior High School is a prestigious institution renowned for producing many talented musicians over the years. True to the school's reputation, an intriguing rumor is widespread among its students: whosoever provides a spectacular performance at the upcoming festival will receive extra credits. 

Serina Akesaka is an outgoing first-year student on the verge of failing her classes. After recalling the circulating rumor, Serina decides to recruit four students—Nazuna Tennouzu, Aliciana Ogata, Hakobe Naru, and Nagi Kobotoke—to form a band with her. As these five passionate girls start their journey together, the music they will soon produce is bound to touch everyone's hearts and leave an everlasting impact.

[Written by MAL Rewrite]
",TV,8.0,Finished Airing,"Jan 5, 2022","Feb 23, 2022","Sega, Front Wing",Unknown,Akatsuki,Game,Slice of Life,"CGDCT, Music",Unknown,3.0,PG-13 - Teens 13 or older,5.761,2244.0,101272.0,6372,7683,36,2022.0
14511,Minami-ke Tadaima,みなみけ ただいま,Unknown,"The everyday lives of the Minami sisters continue. Chiaki, the youngest, continues to call people idiots while worshipping her eldest sister. Kana, the middle, still can't figure out that Fujioka's feelings for her are a crush, not a grudge. Haruka, the eldest, still unknowingly avoids Hosaka's advances to invite her to the volleyball team, and after a long day of excitement, the sisters enjoy sitting at the table at their home.

(Source: ANN)",TV,13.0,Finished Airing,"Jan 6, 2013","Mar 31, 2013",Unknown,Funimation,feel.,Manga,"Comedy, Slice of Life","CGDCT, School",Unknown,24.0,PG-13 - Teens 13 or older,7.661,24258.0,11982.0,2596,54512,83,2013.0
32924,Urara Meirochou,うらら迷路帖,Urara Meirocho,"Labyrinth Town is a legendary city composed of ten districts, home to witches and diviners alike. In the outermost district of this maze, many young girls begin training to join the ranks of the ""Urara,"" a group of women known far and wide for their ability to divine the answers to the world's most difficult questions. Chiya, a wild girl raised amongst the animals in the mountains, is invited to take her rightful place as a first rank urara. By joining them, she hopes to divine the location of her long-lost mother.

Chiya quickly makes three friends: studious Kon Tatsumi, aspiring witch Koume Yukimi, and reticent Nono Natsume. Armed with only their own ingenuity and a vague connection to the gods, they begin their journey in the way of the urara.

[Written by MAL Rewrite]",TV,12.0,Finished Airing,"Jan 6, 2017","Mar 24, 2017","TBS, Magic Capsule, Houbunsha, NBCUniversal Entertainment Japan, Nichion",Sentai Filmworks,J.C.Staff,4-koma manga,"Comedy, Fantasy, Slice of Life",CGDCT,teenager,24.0,PG-13 - Teens 13 or older,7.121,39304.0,33662.0,1524,123364,414,2017.0
38673,Mini Toji,みにとじ,Katana Maidens Mini Toji,"Do the girls' daily lives include fighting and not fighting? All characters from the TV animated series Toji no Miko and smartphone game Toji no Miko: Kizamishi Issen no Tomoshibi are gathered together in smaller form!

(Source: Crunchyroll, edited)",TV,10.0,Finished Airing,"Jan 6, 2019","Mar 17, 2019",Unknown,Unknown,Project No.9,Original,"Action, Comedy, Fantasy",CGDCT,Unknown,5.0,None,6.131,2306.0,83722.0,7060,5912,5,2019.0
38476,Heya Camp△,へやキャン△,Room Camp,"During an Outdoor Activities Club meeting, Nadeshiko Kagamihara, Aoi Inuyama, and Chiaki Oogaki debate what it means to be a real Yamanashi native. Somewhere along the line, Chiaki brings up the Yamanashi Kids' Stamp Rally, which Nadeshiko has never heard of. The rally encourages one to visit famous places in the prefecture and collect stamps; those who complete the rally will win a year's worth of Minobu steamed buns. Enticed by the humongous food prize, Nadeshiko is set on participating.

Follow the Outdoor Activities Club as they travel around the Yamanashi prefecture to collect stamps and explore what the region has to offer!

[Written by MAL Rewrite]",TV,12.0,Finished Airing,"Jan 6, 2020","Mar 23, 2020","Sotsu, AT-X, KlockWorx, Houbunsha, MAGES., BS11, DeNA, FuRyu",Unknown,C-Station,Manga,Slice of Life,"CGDCT, Iyashikei",Unknown,3.0,PG-13 - Teens 13 or older,7.311,38675.0,24192.0,1978,86809,107,2020.0
3225,Minami-ke Okawari,みなみけ～おかわり～,Unknown,"The second season of Minami-Ke. It picks up where the first season left off, and just like the first season, it's about the daily lives of the three Minami sisters, Haruka, Kana and Chiaki, and their school friends.",TV,13.0,Finished Airing,"Jan 7, 2008","Mar 31, 2008","Starchild Records, Magic Capsule, TV Tokyo Music",Unknown,asread.,Manga,"Comedy, Slice of Life","CGDCT, School",Unknown,24.0,PG-13 - Teens 13 or older,7.331,39059.0,23172.0,2253,69749,50,2008.0
31422,Minami Kamakura Koukou Joshi Jitenshabu,南鎌倉高校女子自転車部,Minami Kamakura High School Girls Cycling Club,"Maiharu Hiromi has moved to Kamakura from Nagasaki and rides a bicycle to school every day. Then she meets Akizuki Tomoe, the leader of the girls cycling club. She, therefore, joins the club and her life gradually begins to change. ",TV,12.0,Finished Airing,"Jan 7, 2017","Mar 25, 2017","Genco, AT-X, Exit Tunes, Duckbill Entertainment, Shanghai Tiantan Culture & Media, NADA Holdings, My Theater D.D., Crunchyroll SC Anime Fund",Unknown,"J.C.Staff, A.C.G.T.",Manga,Sports,"CGDCT, School",young boy,23.0,PG-13 - Teens 13 or older,6.311,7230.0,74032.0,4302,19960,15,2017.0
35078,Mitsuboshi Colors,三ツ星カラーズ,Mitsuboshi Colors,"Residing within Tokyo's district of Ueno are the Colors, three individuals who protect their city by performing good deeds and aiding their community. Or, at the very least, they pretend to be the city's defenders. In reality, the Colors are just three young girls: the shy Yui Akamatsu, the noisy Sacchan, and the video game-loving Kotoha, who spend their time playing make-believe and exploring the city. The Colors' activities are facilitated by the grandfatherly Daigorou ""Pops"" Kujiraoka, who uses his store's inventory of knick-knacks to entertain the rambunctious trio.

Not everyone is a fan of the Colors though. The local policeman Saitou just wants to deal with his regular duties, but he often finds himself the target of the Colors' attention, having been made the villain in most of their fantasies. But despite his personal feelings, Saitou always finds the time to go along with the three girls' games. Even though the Colors do not actually defend Ueno, they definitely help brighten everyone's day.

[Written by MAL Rewrite]",TV,12.0,Finished Airing,"Jan 7, 2018","Mar 25, 2018","Frontier Works, Movic, AT-X, Grooove, Hakuhodo DY Music & Pictures, Kadokawa Media House, Kadokawa",Sentai Filmworks,SILVER LINK.,Manga,"Comedy, Slice of Life","CGDCT, Iyashikei",young boy,23.0,PG-13 - Teens 13 or older,7.421,31554.0,19332.0,1897,92585,311,2018.0
35540,Slow Start,スロウスタート,Slow Start,"Hana Ichinose, a 17-year-old high school student who is not only introverted, but also insecure and timid, has just moved and will be attending a new school. To make her situation more difficult,  Hana is a ""slow start,"" which means that she missed a year and worries about attending a class where everyone is younger than her.

During her introduction, the teacher reveals it is Hana's birthday, which gives her the jumping-off point  to meet three of her classmates: Tamate Momochi, a charismatic and extroverted girl; Kanmuri Sengoku, who is shy and small; and the popular and pretty Eiko Tokura. Not wanting to lose the chance to make new friends, Hana's interactions with these three mark the beginning of some beautiful relationships that will change her life.

[Written by MAL Rewrite]",TV,12.0,Finished Airing,"Jan 7, 2018","Mar 25, 2018","Aniplex, Houbunsha, Kansai Telecasting, Lawson, Kinoshita Group Holdings, Drecom",Aniplex of America,CloverWorks,4-koma manga,"Comedy, Slice of Life","CGDCT, School",Unknown,23.0,PG-13 - Teens 13 or older,7.011,27331.0,38662.0,2112,76705,156,2018.0
38474,Yuru Camp△ Season 2,ゆるキャン△ SEASON2,Laid-Back Camp Season 2,"Having spent Christmas camping with her new friends, Rin Shima embarks on a solo-camping trip to see the New Year sunrise by the sea. All goes according to plan until unforeseen weather blocks the roads back home, making a return trip impossible. Rin, who is now stranded for a few days, is invited by Nadeshiko Kagamihara to stay at her grandmother's house. 

What is supposed to be a two-day trip becomes an extended period of sightseeing and new experiences for Rin, and she encounters some new and old faces along the way. Yuru Camp△ Season 2 continues the story of Rin, Nadeshiko, and their friends as they further explore the joys of camping.

[Written by MAL Rewrite]",TV,13.0,Finished Airing,"Jan 7, 2021","Apr 1, 2021","Half H.P Studio, MAGES., DeNA",Unknown,C-Station,Manga,Slice of Life,"CGDCT, Iyashikei",Unknown,23.0,PG-13 - Teens 13 or older,8.531,75703.0,1032.0,1073,187803,2668,2021.0
45425,Slow Loop,スローループ,Slow Loop,"Since childhood, Hiyori Yamakawa has witnessed her father's various eccentricities, but one activity she has always loved doing with him is fly fishing—a complicated yet rewarding method of catching fish. Even after his sudden death, Hiyori still visits the seaside in her spare time, savoring the joy that her father's memento brings her.

Three years later, Hiyori's mother decides to remarry and arranges a dinner with her fiancé, his daughter, and Hiyori to celebrate. Anxious and wanting to pass the time, Hiyori goes to her usual fishing spot when a rather energetic girl named Koharu Minagi suddenly appears before her. The two soon become acquainted, with Koharu taking an interest in fly fishing herself. However, their meeting is more than just a coincidence: Koharu turns out to be Hiyori's future stepsibling, which is only the beginning of treasured memories the both of them will reel in as they foster their sisterhood.

[Written by MAL Rewrite]
",TV,12.0,Finished Airing,"Jan 7, 2022","Mar 25, 2022","AT-X, flying DOG, Houbunsha, Kadokawa Media House, Kadokawa, eStream",Unknown,Connect,Manga,"Slice of Life, Sports","CGDCT, Iyashikei",Unknown,24.0,PG-13 - Teens 13 or older,7.231,17768.0,27962.0,2726,49935,228,2022.0
1858,Gakuen Utopia Manabi Straight!,がくえんゆーとぴあ まなびストレート！,Unknown,"Manabi Straight! follows the lives of a group of young high school girls living in the year 2035 while they attend the all-girl Seioh Private High School. Since the birth rate has dropped dramatically, schools are being closed down due to the sheer lack of students available to teach. Morale in schools has dropped dramatically, and Seioh is no exception.

The story begins when the main character, Manami Amamiya, transfers to Seioh. After some initial hijinks involving a futuristic scooter and a swim meet, followed by an inspirational school song performance, she is inducted as the student council president. The story that follows pertains to Manami working with Mika Inamori, the only other student council member, and three other classmates named Mutsuki Uehara, Mei Etoh, and Momoha Odori, in student council matters.  After some remodeling of the student council room, Manami and her friends set forth to plan for the upcoming student festival.

(Source: Wikipedia, edited)",TV,12.0,Finished Airing,"Jan 8, 2007","Mar 26, 2007","Starchild Records, KlockWorx, ASCII Media Works",Discotek Media,ufotable,Original,"Comedy, Slice of Life","CGDCT, School",Unknown,24.0,G - All Ages,7.271,10327.0,26062.0,3602,29419,117,2007.0
7062,Hidamari Sketch x ☆☆☆,ひだまりスケッチ×☆☆☆,Unknown,"When we first met Yuno, she'd just been accepted to the prestigious Yamabuki Art School, and it was up to her new neighbors at Hidamari to help her find her way in the big scary world. Now a seasoned vet of the Hidamari Apartments herself, Yuno's newest challenge is to help the latest arrivals, Nazuna and Nori, acclimate to life on their own. Of course, since it IS Hidamari, there are still lots of trials and tribulations ahead, and nothing will ever go quite as expected. But with friends like Miyako, Hiro, and Sae ready to lend a hand, there will always be a ray of sunshine at the end of every storm in Hidamari Sketch x Hoshimittsu.

(Source: Sentai Filmworks)",TV,12.0,Finished Airing,"Jan 8, 2010","Mar 26, 2010","Aniplex, Lantis, TBS, Movic, Houbunsha",Sentai Filmworks,Shaft,4-koma manga,"Comedy, Slice of Life","CGDCT, Iyashikei, School, Visual Arts",teenager,24.0,PG-13 - Teens 13 or older,7.901,12231.0,7162.0,3831,25902,150,2010.0
34148,Nyanko Days,にゃんこデイズ,Nyanko Days,"Average high school student Yuuko Konagai tends to be rather shy and socially awkward. Due to this, besides earning rather mediocre grades, she barely has friends inside her class. However, after a monotonous day at school, she returns to her long-awaited haven—home with her cats Maa, Shi, and Ro! With their unique personalities, the three possess bodies similar to those of humans, retaining the ability to speak and communicate. Every day, the adorable bunch awaits their owner's return to shower her with much-needed companionship.

Nyanko Days highlights the life of Yuuko and her cats as they brighten up each moment and make new friends in the passing days.

[Written by MAL Rewrite]",TV,12.0,Finished Airing,"Jan 8, 2017","Mar 26, 2017",Quatre Stella,Unknown,EMT Squared,4-koma manga,"Comedy, Slice of Life","CGDCT, Pets",Unknown,2.0,PG-13 - Teens 13 or older,6.621,32858.0,57172.0,2289,67901,149,2017.0
