ID,Title,Japanese,English,Synopsis,Type,Episodes,Status,Start_Aired,End_Aired,Producers,Licensors,Studios,Source,Genres,Themes,Demographics,Duration_Minutes,Rating,Score,Scored_Users,Ranked,Popularity,Members,Favorites,year
49930,Genjitsu Shugi Yuusha no Oukoku Saikenki Part 2,現実主義勇者の王国再建記,How a Realist Hero Rebuilt the Kingdom Part 2,"Together with his talented aides, the ""Realist Hero"" Kazuya Souma continues his quest of reinvigorating the Elfrieden Kingdom through administrative reform. Having successfully conquered Van—the capital city of the Principality of Amidonia—Kazuya now faces the envoy from Gran Chaos Empire, who wishes to impose punishment for breaching the ban on war established by the Mankind Declaration Treaty. Despite the dire situation, Kazuya sees a path to avoid unnecessary conflict whilst gaining new allies. With his plan being seemingly perfect, the only barrier to success is gaining approval from the envoy.

[Written by MAL Rewrite]
",TV,13.0,Finished Airing,"Jan 9, 2022","Apr 3, 2022","Magic Capsule, King Records, WOWMAX",Funimation,J.C.Staff,Light novel,"Action, Fantasy, Romance","Harem, Isekai, Military",Unknown,24.0,PG-13 - Teens 13 or older,7.451,89841.0,18472.0,1114,179728,1257,2022.0
591,Amaenaide yo!!,あまえないでよっ!!,Ah My Buddha,"Satonaka Ikkou, a 16 year old boy, is a first year trainee at the Saienji Buddhist Temple. He was sent there by his parents to be trained by his grandmother, the Saienji Priestess. At the temple he finds himself surrounded by beautiful female priestesses-in-training. Upon seeing a girl naked, Ikko has the ability to turn into a super-monk, performing massive exorcisms for the good of the temple.

(Source: ANN)
",TV,12.0,Finished Airing,"Jul 1, 2005","Sep 16, 2005",Unknown,"Nozomi Entertainment, Media Blasters",Studio Deen,Manga,"Comedy, Romance, Supernatural, Ecchi",Harem,Unknown,24.0,R+ - Mild Nudity,6.461,34527.0,65882.0,2223,71320,80,2005.0
12967,Arcana Famiglia,アルカナ・ファミリア －La storia della Arcana Famiglia－,La storia della Arcana Famiglia,"​On the island of Regalo, a group of supernaturally powered mafia-like protectors called the Arcana Famiglia safeguard the people from any who would harm them. The members of their organization, having made contracts with tarot cards, each possess different abilities, such as overwhelming strength, invisibility, or the power to see into someone's heart. 

Mondo, their leader and the ""Papa"" of their family, announces at his birthday party that he will be retiring soon. He plans to hold the Arcana Duello, a competition that, if won, will grant the winner the title of Papa and any wish they desire. But there is more at stake than just a title: Mondo also decides that the winner will marry his daughter, Felicità. Enraged by this, the strong-willed Felicità decides to enter the competition herself, in order to make her own way in the world. As Felicità battles for her freedom, her competitors battle for her heart.

[Written by MAL Rewrite]",TV,12.0,Finished Airing,"Jul 1, 2012","Sep 16, 2012","Frontier Works, Movic, Warner Bros. Japan, Showgate",Sentai Filmworks,J.C.Staff,Visual novel,"Action, Fantasy, Romance",Reverse Harem,young girl,24.0,PG-13 - Teens 13 or older,6.261,94729.0,77082.0,1038,195960,337,2012.0
10611,R-15,あーるじゅうご,Unknown,"R-15 is about a boy, Taketo Akutagawa, who attends a school for geniuses: Inspiration Academy Private High School. Taketo is a genius novelist and writes erotica. Despite negative perceptions many people have of him, he aims to be at the top of his class and be recognized as the world's greatest writer.

(Source: Wikipedia)",TV,12.0,Finished Airing,"Jul 10, 2011","Sep 25, 2011","Kadokawa Shoten, Kadokawa Pictures Japan, KlockWorx, AMG MUSIC, Glovision",Unknown,AIC,Light novel,"Comedy, Romance, Ecchi","Harem, School",Unknown,24.0,R+ - Mild Nudity,6.441,38050.0,67442.0,1971,87100,78,2011.0
63,DearS,ディアーズ,DearS,"One year ago, a UFO containing 150 aliens crash-landed off the shores of Kasai. Because no one could fix their ship, the Japanese Government decided to bestow upon them the designation ""DearS"" and make them into Japanese citizens, teaching them the language, customs, and culture of Japan. However, in order for them to become more familiar with human society, a home-stay program has been enacted to allow them to mingle with other humans.

One misty morning, a truck carrying a capsule that housed one of these aliens ends up dropping it into the riverbank, releasing her from her confinement. She is eventually found by a high school student named Takeya Ikuhara, who saves her from being hit by a truck and takes pity on her, despite being extremely distrustful of their race and wanting nothing to do with them. Upon being named Ren, she imprints upon him as her ""Master"" and serves as his personal ""Slave,"" leaving him with a ""DearS"" who wants to remain with him no matter what and bringing his ordinary, alien-free days to an end.",TV,12.0,Finished Airing,"Jul 11, 2004","Sep 26, 2004","Bandai Visual, Hal Film Maker, Genco, Lantis","Discotek Media, Geneon Entertainment USA",Daume,Manga,"Comedy, Romance, Sci-Fi, Ecchi",Harem,young boy,23.0,R+ - Mild Nudity,6.571,77193.0,59632.0,1379,141582,337,2004.0
6166,Asobi ni Iku yo!,あそびにいくヨ!,Cat Planet Cuties,"Kio is just another boring, nice guy with a boring, nice life until he meets a beautiful, curvaceous cat-girl while attending a memorial service for one of his ancestors. Next thing he knows, he's lying in bed with this half-naked beauty next to him! Her name is Eris, and she has come to Earth to learn more about its inhabitants as a representative of the planet Catian. And she's decided to set up shop at Kio's home for her stay on Earth!

Unbeknownst to Kio, there are quite a few organizations who will attempt to capture Eris, looking to keep her existence a secret by any means necessary. What's worse is when people around Kio turn out to secretly be a part of those organizations! Kio will have to work hard to keep Eris safe from these shady groups. Things are about to get mysterious, exciting, and most importantly sexy in Asobi ni Iku yo!",TV,12.0,Finished Airing,"Jul 11, 2010","Sep 26, 2010","AIC, Lantis, Media Factory, Pony Canyon, Rakuonsha, AT-X, KlockWorx, Ryukyu Asahi Broadcasting",Funimation,AIC PLUS+,Light novel,"Comedy, Romance, Sci-Fi, Ecchi",Harem,Unknown,24.0,R+ - Mild Nudity,6.591,87639.0,58742.0,1074,187740,503,2010.0
35203,Isekai wa Smartphone to Tomo ni.,異世界はスマートフォンとともに。,In Another World With My Smartphone,"In a thoughtless blunder, God accidentally strikes down Touya Mochizuki with a stray bolt of lightning! As an apology, God offers him one wish and the chance to live again in a magical fantasy world. Touya happily accepts the offer and, for his one wish, asks only to keep his smartphone with him as he begins his journey into this mysterious world.

Starting over in this new world, Touya finds it is filled with magic—which he has an affinity for—and cute girls vying for his attention. These girls—the twins Linze and Elze Silhoueska, Yumina Urnea Belfast, Leen, and Yae Kokonoe—provide Touya with no end of romantic frustrations, but also companionship as he discovers the secrets of this new world.

[Written by MAL Rewrite]",TV,12.0,Finished Airing,"Jul 11, 2017","Sep 26, 2017","Sotsu, MediaNet, Pony Canyon, AT-X, Asmik Ace, Hobby Japan, 81 Produce, Tokyo MX, Exit Tunes",Funimation,Production Reed,Light novel,"Adventure, Comedy, Fantasy, Romance","Harem, Isekai, Reincarnation",Unknown,24.0,PG-13 - Teens 13 or older,6.151,293812.0,82762.0,391,478554,2539,2017.0
40436,Peter Grill to Kenja no Jikan,ピーター・グリルと賢者の時間,Peter Grill and the Philosopher's Time,"After gaining the title of the strongest warrior in the world, Peter Grill has finally proven his worth and is ready to take the hand of his beloved senior, the beautiful and innocent Luvelia Sanctos. Peter expects to have a healthy relationship with her, despite some objections from her father.

Unfortunately, this dream quickly breaks apart as news of his grand victory spreads among the womenfolk of other races—ogres, orcs, elves, and others—some of them even vying for his seed to produce offspring blessed with his might. To avoid betraying the trust of his cherished Luvelia and causing a scandal, Peter strives to avoid other women's salacious advances. However, accomplishing such a feat with so many alluring women on his trail is easier said than done.

[Written by MAL Rewrite]",TV,12.0,Finished Airing,"Jul 11, 2020","Sep 26, 2020",Unknown,Sentai Filmworks,Wolfsbane,Manga,"Comedy, Fantasy, Ecchi",Harem,Unknown,12.0,R+ - Mild Nudity,5.501,77368.0,110922.0,1207,168138,681,2020.0
22865,Rokujouma no Shinryakusha!?,六畳間の侵略者！？,Invaders of the Rokujyoma!?,"After Koutarou Satomi's father is suddenly relocated for his job, the first-year high school student is faced with finding a cheap place to live by himself. Naturally, he jumps at the chance to move into Corona House's Room 106 for a mere five thousand yen a month. But while everything goes well at first, Koutarou soon gets a lot more than he bargained for after stumbling upon a mysterious cave while working his part-time job.

The following night, Koutarou is visited by various seemingly mythical figures, all of whom claim ownership of the poor student's apartment. Among the invaders are Sanae Higashihongan, a ghost supposedly haunting the room, magical girl Yurika, alien princess Theiamillis Gre Fortorthe, and Kiriha Kurano, a direct descendant of the Earth People. But more importantly, each of these four girls needs Koutarou's apartment for her own reasons and won’t back down without a fight!

Rokujouma no Shinryakusha!? is a comedic battle royale over a six-tatami mat apartment involving supernatural beings, romantic high school hijinks, and a deceptively cordial landlady.

[Written by MAL Rewrite]",TV,12.0,Finished Airing,"Jul 12, 2014","Sep 27, 2014","Genco, Showgate",Sentai Filmworks,SILVER LINK.,Light novel,"Comedy, Supernatural","Harem, School",Unknown,23.0,PG-13 - Teens 13 or older,7.141,79995.0,32832.0,1196,170035,404,2014.0
22877,Seireitsukai no Blade Dance,精霊使いの剣舞〈ブレイドダンス〉,Blade Dance of the Elementalers,"On his way to Areishia Spirit Academy, Kamito Kazehaya runs into a naked Claire Rouge, a student who had been bathing as part of a purification ceremony. She had been preparing to form a contract with a powerful spirit in order to acquire more power as an ""elementalist."" Her efforts are wasted, however, when Kamito ends up with the spirit despite the fact that only shrine maidens can become elementalists. Yet to be discouraged, Claire then announces that Kamito must become her contracted spirit instead!

After reaching the school grounds, Kamito escapes from Claire and meets Headmaster Greyworth Ciel Mais, who invites him to enroll at the academy. Although his life at Areishia will be far from easy as the only male student among the shrine princesses-in-training, he begrudgingly accepts in exchange for information about his former contracted spirit, Restia Ashdoll. Adding on to that, he also must fulfill Greyworth's main request: to win in the Blade Dance, a battle festival occurring in two months, where he will face the strongest elementalist rumored to be contracted with a darkness spirit.

[Written by MAL Rewrite]",TV,12.0,Finished Airing,"Jul 14, 2014","Sep 29, 2014","Genco, Media Factory, Movic, AT-X, Showgate",Sentai Filmworks,TNK,Light novel,"Action, Comedy, Fantasy, Romance, Supernatural, Ecchi","Harem, School",Unknown,23.0,PG-13 - Teens 13 or older,6.711,176401.0,52402.0,579,339472,882,2014.0
36726,Yuragi-sou no Yuuna-san,ゆらぎ荘の幽奈さん,Yuuna and the Haunted Hot Springs,"Once a hot springs inn, now a boarding house with extraordinarily cheap rent, Yuragi-sou is virtually uninhabited save for a few peculiar residents. As rumor has it, it is haunted by a vile ghost which scares away all potential tenants. Therefore, it is the perfect refuge for Fuyuzora Kogarashi—a broke, homeless psychic seeking an affordable roof to stay under and ghosts to exorcise.

Kogarashi prepares for a face-off against the ghost, only to find out it is not as malicious as the rumors made it out to be. Instead, it is the ghost of a beautiful, silver-haired girl whose only recollection of her life before death is her name: Yuuna. Even more baffling is that the other tenants of Yuragi-sou not only are able to see Yuuna as well, but each has their own supernatural ability.

Amidst the chaos caused by his quirky fellow residents, Kogarashi attempts to uncover the regret that keeps Yuuna anchored to the world of the living, lest she become an evil spirit sentenced to spend her afterlife in hell.

[Written by MAL Rewrite]",TV,12.0,Finished Airing,"Jul 14, 2018","Sep 29, 2018","Aniplex, Shueisha, BS11",Aniplex of America,Xebec,Manga,"Comedy, Romance, Supernatural, Ecchi",Harem,young boy,23.0,R+ - Mild Nudity,7.021,113865.0,38502.0,769,266254,720,2018.0
41812,Megami-ryou no Ryoubo-kun.,女神寮の寮母くん。,Mother of the Goddess' Dormitory,"Twelve-year-old Koushi Nagumo's life suddenly goes downhill when his father abandons him after their house burns down. Left to fend for himself, Koushi collapses on the street, but an eccentric woman named Mineru Wachi takes pity on him and brings him to the female dormitory ""Megami-ryou.""

After learning of Koushi's situation, Mineru, who happens to be the temporary manager, invites him to become Megami-ryou's official dormitory mother. However, what awaits him are the dorm's residents—each with their own wacky shenanigans—like the androphobic yet gentle Atena Saotome, the feminine tomboy Kiriya Senshou, and Mineru herself, whose recklessness knows no bounds when it comes to science. Despite this, Koushi does his best to fulfill the duties of this crazy new life!

[Written by MAL Rewrite]",TV,10.0,Finished Airing,"Jul 14, 2021","Sep 15, 2021","Media Factory, AT-X, Kadokawa Media House, Kadokawa",Sentai Filmworks,asread.,Manga,"Comedy, Romance, Ecchi",Harem,young boy,25.0,R+ - Mild Nudity,6.531,63373.0,61852.0,1299,153026,1169,2021.0
196,Onegai☆Twins,おねがい☆ツインズ,Please Twins!,"Maiku Kamishiro's past has always been somewhat of a mystery to him. The only clue he has to who his family might be is an old photograph showing two young children, a boy and a girl, playing in a small pool outside of a blue house. In an attempt to find his family, he moves to this blue house and begins working as a programmer. He's living a comfortable life until the day two very different girls show up at his door, both in possession of the same photograph, and both claiming to be his twin. With no way to prove who is a relative and who is a stranger, Maiku allows both girls to move in with him until they know for sure. 

(Source: ANN) ",TV,12.0,Finished Airing,"Jul 15, 2003","Oct 14, 2003","Bandai Visual, Genco, Lantis","Nozomi Entertainment, Bandai Entertainment",Daume,Original,"Comedy, Drama, Sci-Fi","Harem, School",Unknown,25.0,PG-13 - Teens 13 or older,6.831,48287.0,46492.0,2005,85133,181,2003.0
40075,Koi to Producer: EVOL×LOVE,恋とプロデューサー~EVOL×LOVE~,Mr Love Queen's Choice,"After her father passed away, a young woman inherited his production company, Miracle Entertainment, along with its most successful program, ""Miracle Finder."" In recent years, however, the show has fallen off the radar and it is now mostly forgotten. In an attempt to save the show from being canceled, this young woman desperately tries to look for a unique topic to use as inspiration. She finds it in the form of ""Evol,"" a mysterious gene that has granted certain people special powers and is considered the next step in human evolution. But, as marvelous as this gene seems, its existence may lead to an unstoppable battle between humans for survival.

However, as she becomes more entangled with the strange world of the ""Evolvers,"" her life is suddenly disturbed by the arrival of four men: the cheerful idol Kira; the neuroscientist and Loveland University professor, Simon; the stoic CEO of Loveland Financial Group and Miracle Entertainment's benefactor, Zen; and her high school upperclassman Haku, a former delinquent now working as a police officer.

As strange incidents begin to plague the city, will she be able to find out the truth about the ""Evol"" or ""Black Swan,"" the organization behind numerous attacks from ""Evolvers"" and possibly connected to her father's death? What is her part to play in its plan, and how are the men around her connected to it all?

[Written by MAL Rewrite]",TV,12.0,Finished Airing,"Jul 16, 2020","Oct 1, 2020",Unknown,Unknown,MAPPA,Game,"Mystery, Romance, Sci-Fi","Reverse Harem, Super Power",Unknown,24.0,PG-13 - Teens 13 or older,6.181,16063.0,81412.0,2636,52835,259,2020.0
2609,Kakyuusei (TV),下級生,Unknown,"When Tsuyoshi rushed to school as usual, he found a girl who tried to help a kitten which couldn't get down from a tree. It was Minamizato Ai who had loved Tsuyoshi secretly for a long time.

(Source: AniDB)",TV,13.0,Finished Airing,"Jul 2, 1999","Sep 24, 1999",Pink Pineapple,Unknown,PP Project,Visual novel,"Drama, Romance","Harem, School",Unknown,26.0,PG-13 - Teens 13 or older,6.181,1042.0,81372.0,7196,5609,6,1999.0
291,D.C.S.S: Da Capo Second Season,D.C.S.S. ～ダ・カーポ セカンドシーズン～,D.C.S.S. ~Da Capo Second Season~,"Hatsune-Jima was once well-known for its cherry trees, which would bloom no matter what time of year it was. Two years ago, the island's cherry trees lost this ability and all became ordinary cherry trees that bloom only in the spring. Jun'ichi Asakura is now a graduating senior at Kazami Academy, and is surrounded by many close friends, old and new alike. On a stormy summer day, a mysterious young girl, Aisia, arrives at Jun'ichi's door. She is looking for Sakura's grandmother to study magic, ultimately hoping to bring happiness to everyone. When she discovers that grandmother Yoshino had long since passed away, she joyfully assumes (thanks to his error in judgment) that Jun'ichi is able to teach her. Even though she finally understands that the only magic he's capable of is conjuring Japanese confections, Aisia continues her search for magic on Hatsune-Jima. Amid the chaos of her search, Kazami Academy hires new medical staff.

(Source: ANN)",TV,26.0,Finished Airing,"Jul 2, 2005","Dec 24, 2005",Unknown,Unknown,feel.,Visual novel,"Comedy, Drama, Romance, Supernatural",Harem,Unknown,25.0,PG-13 - Teens 13 or older,6.951,15304.0,40982.0,3415,32543,33,2005.0
4063,Sekirei,セキレイ,Sekirei,"Struggling yet brilliant 19-year-old Minato Sahashi has failed his college entrance exams for the second time, resulting in him being regarded as worthless by those around him. However, the course of his seemingly bleak future is altered dramatically when a beautiful, supernatural woman falls from the sky and into his life. That woman, Musubi, is a unique being known as a ""Sekirei,"" a humanoid extraterrestrial with extraordinary abilities. These aliens are known for kissing humans carrying the Ashikabi gene in order to awaken additional latent powers deep within.

Recognizing the potential within the seemingly insignificant youth, Musubi kisses the bewildered Minato, initiating a bond between the two of them. This drags him into the high-stakes world of the Sekirei, where he and his new partner must compete against others in a battle for survival called the ""Sekirei Plan."" However, unbeknownst to the contestants, there is far more at risk that what the competition initially entailed.

[Written by MAL Rewrite]",TV,12.0,Finished Airing,"Jul 2, 2008","Sep 17, 2008","Aniplex, Movic",Funimation,Seven Arcs,Manga,"Action, Comedy, Ecchi","Harem, Super Power",Unknown,23.0,R+ - Mild Nudity,7.061,195951.0,36652.0,504,381285,1622,2008.0
8676,Amagami SS,アマガミSS,Amagami SS,"Two years ago, Junichi Tachibana had a date on Christmas Eve but was stood up instead. Since then, he has had a hard time showing others his true feelings in fear of being rejected again. However, as luck would have it, Junichi may have a second chance at love when he meets several girls whom he becomes romantically interested in: Haruka Morishima, the energetic and popular upperclassman with a love for cute things; Kaoru Tanamachi, his childhood friend who harbors secret feelings for him; Sae Nakata, the timid transfer student who is shy around men; Ai Nanasaki, a girl on the swim team who has a bad first impression of Junichi; Rihoko Sakurai, a childhood friend with a love for sweets; and Tsukasa Ayatsuji, a seemingly perfect class representative who has a hidden dark side. As Christmas Eve approaches, Junichi can only hope that this will be the year he will finally spend the holidays with the one he truly loves.

[Written by MAL Rewrite]",TV,25.0,Finished Airing,"Jul 2, 2010","Dec 24, 2010","Pony Canyon, TBS, Movic",Sentai Filmworks,AIC,Visual novel,Romance,"Harem, School",Unknown,24.0,PG-13 - Teens 13 or older,7.301,151123.0,24272.0,557,351707,2149,2010.0
15605,Brothers Conflict,BROTHERS CONFLICT,Brothers Conflict,"Ema Hinata is a sweet girl with only her father to call family. One day, she learns that he will be remarrying Miwa Asahina, a wealthy fashion designer. Though she's glad she has a new place to call home, the family she gains is greater than she could ever imagine—Ema now has 13 step-brothers!

Wishing to give her father space, she moves into the Sunrise Residence where her brothers live. As she settles in, Ema realizes she may not experience the loving kinship of a family that she has always longed for, as many of her new brothers exhibit feelings toward Ema that aren't just familial.

With each brother desiring Ema's attention in his own way, will she be able to work toward a happy ending for all, or will she choose one brother that has stolen her heart?

[Written by MAL Rewrite]",TV,12.0,Finished Airing,"Jul 2, 2013","Sep 17, 2013","Kadokawa Shoten, Movic, DAX Production, Showgate, NBCUniversal Entertainment Japan",Funimation,Brain's Base,Novel,Romance,Reverse Harem,young girl,24.0,PG-13 - Teens 13 or older,5.981,93404.0,91612.0,1176,172265,716,2013.0
318,Hand Maid May,HAND MAID メイ,Unknown,"Saotome Kazuya is a computer whiz. One day his friend Nanbara, threatens him with a computer virus. Trying to stop the virus, Kazuya ends up making a special order. May is a cyberdoll that arrives at his door a few minutes later and she is 1/6th the size of a normal person, which makes for many awkward situations. Not to mention the fact Kazuya can't even afford to keep May. Cyberdyne is not satisfied with Kazuya's non-payments and will do anything to retrieve CBD May.

(Source: ANN)",TV,10.0,Finished Airing,"Jul 26, 2000","Sep 27, 2000","Geneon Universal Entertainment, Pioneer LDC, Cosmic Ray",Geneon Entertainment USA,TNK,Original,"Comedy, Romance, Sci-Fi, Ecchi",Harem,Unknown,23.0,PG-13 - Teens 13 or older,6.701,13119.0,52912.0,3667,28329,31,2000.0
261,Happy☆Lesson Advance,HAPPY☆LESSON ADVANCE,Unknown,"Hitotose Chitose is now living together with his 5 teachers as his mothers when a mysterious girl appears and becomes their neighbor which turns out that that person is Nagatsuki Kuron who wants Mu-chan to be her mother so another sibling rivalry ensues as to who would end up as Mu-chan's child. 

(Source: ANN)",TV,13.0,Finished Airing,"Jul 3, 2003","Sep 28, 2003","KSS, Studio Jack",Unknown,Studio Hibari,Manga,"Comedy, Romance, Slice of Life",Harem,Unknown,24.0,PG-13 - Teens 13 or older,6.791,6218.0,48472.0,4946,14288,6,2003.0
1195,Zero no Tsukaima,ゼロの使い魔,The Familiar of Zero,"Louise Françoise Le Blanc de La Vallière is a self-absorbed mage in a world of wands, cloaks, and royalty. Although she studies at Tristain Academy, a prestigious school for magicians, she has a major problem: Louise is unable to cast magic properly, earning her the nickname of ""Louise the Zero"" from her classmates.

When the first year students are required to perform a summoning ritual, Louise's summoning results in a catastrophic explosion! Everyone deems this to be yet another failure, but when the smoke clears, a boy named Saito Hiraga appears. Now Louise's familiar, Saito is treated as a slave, forced to clean her clothes and eat off the ground. But when an unfamiliar brand is found etched on Saito's hand from the summoning ritual, it is believed to be the mark of a powerful familiar named Gandalfr.

Wild, adventurous, and explosive, Zero no Tsukaima follows Saito as he comes to terms with his new life and as Louise proves that there is more to her than her nickname suggests.

[Written by MAL Rewrite]",TV,13.0,Finished Airing,"Jul 3, 2006","Sep 25, 2006","Genco, Media Factory, Shochiku, Bushiroad, Happinet Pictures","Sentai Filmworks, Geneon Entertainment USA",J.C.Staff,Light novel,"Action, Adventure, Comedy, Fantasy, Romance, Ecchi","Harem, Isekai, School",Unknown,23.0,PG-13 - Teens 13 or older,7.251,438257.0,26902.0,199,763111,7672,2006.0
