ID,Title,Japanese,English,Synopsis,Type,Episodes,Status,Start_Aired,End_Aired,Producers,Licensors,Studios,Source,Genres,Themes,Demographics,Duration_Minutes,Rating,Score,Scored_Users,Ranked,Popularity,Members,Favorites,year
50392,Mato Seihei no Slave,魔都精兵のスレイブ,Unknown,"When entrances to a different dimension known as the ""Mato"" emerge all over Japan, a new resource known as ""Peaches"" are discovered which give unique abilities only to women. However, dangerous monsters called ""Yomotsu Shuuki"" also roam throughout the Mato and have been responsible for various disasters ever since. To combat them, the government formed the Anti-demon Corps, an elite group of women who have received power from the Peaches.

One day, a high school student named Yuuki Wakura was walking home from school when he suddenly got lost in a Mato entrance. When he calls for help, he is immediately rescued by Kyouka Uzen, the chief of the Seventh Unit of the Anti-demon Corps. Recognizing his potential while also needing him to make her Peach power more effective, she asks that Yuuki join the Anti-demon Corps by becoming her slave, a position he might find more enjoyable than he initially would have thought... 

(Source: MU, edited)",TV,,Not yet aired,2023,Unknown,"Pony Canyon, Shueisha",Unknown,Seven Arcs,Manga,"Action, Fantasy, Supernatural",Harem,young boy,,PG-13 - Teens 13 or older,,,,4396,19189,189,2023.0
52973,Megami no Café Terrace,女神のカフェテラス,Unknown,"Hayato Kasukabe has been accepted to Tokyo U on his first try. Receiving news of his grandmother's death, he returns to his childhood home, Café Terrace Familia, for the first time in three years to find five strange girls there who claim to be ""Grandma's Family""! Hayato's unexpected life in a seaside town with these five girls of fate begins here!

(Source: Kodansha, translated)",TV,,Not yet aired,2023,Unknown,Unknown,Unknown,Unknown,Manga,"Comedy, Romance, Ecchi",Harem,young boy,,PG-13 - Teens 13 or older,,,,11113,1371,11,2023.0
538,Shin Tenchi Muyou!,新・天地無用!,Tenchi in Tokyo,"Tenchi Masaki heads out to tackle the big world, setting off to school in Tokyo! But not everyone is happy to hear he is moving away, as his female friends sulk and complain at the prospect of him being alone. However, Tenchi is not by himself for very long, as he soon meets a kind and compassionate girl named Sakuya Kumashiro who helps him get used to life in Tokyo.

The two become close friends, but Sakuya wants more than just that, so she proclaims her love for Tenchi. This confession comes as a shock not only to Tenchi, but also the girls back home. In response, the girls decide to step up their game, and they immediately flock to Tokyo to take Tenchi for themselves. 

With the girls competing for his love, Tenchi must decide once and for all who the most important woman in his life is. However, he is going to have a hard time deciding, as strange events start happening that drive Tenchi further apart from his friends.

[Written by MAL Rewrite]",TV,26.0,Finished Airing,"Apr 1, 1997","Sep 23, 1997",Pioneer LDC,"Funimation, Geneon Entertainment USA",AIC,Original,"Comedy, Romance, Sci-Fi",Harem,young boy,23.0,PG-13 - Teens 13 or older,6.871,17296.0,44972.0,3321,34835,83,1997.0
260,Happy☆Lesson (TV),HAPPY☆LESSON,Unknown,"Hitotose Chitose was always alone and untrusting of people but when 5 female teachers appear and started living together with him in his family's house as his mothers, things started to change and pick up, together with Hazuki-nee and Minazuki (his 2 sisters) everyday is a lesson. 

(Source: ANN)",TV,13.0,Finished Airing,"Apr 1, 2002","Jun 30, 2002",KSS,ADV Films,Studio Hibari,Manga,"Comedy, Drama, Romance, Slice of Life",Harem,Unknown,23.0,PG-13 - Teens 13 or older,6.621,11690.0,56952.0,3784,26552,29,2002.0
850,Gakuen Heaven,学園ヘヴン,Gakuen Heaven,"Itou Keita, an average guy, is shocked when he's invited to attend the elite institution, ""Bell Liberty Academy."" Unnerved by the mystery, he's further distracted by the school's social dynamics. In a sea of amazing young men, Keita struggles to find out what makes him unique, and how he can possibly deserve to be treated as an equal by the boys of BL. Lacking any particular ability, just why has Itou been welcomed into the privileged world of the talented and the beautiful? 

Along the way, he develops intense relationships with the almost everyone at school but he is terribly drawn to the friendly, over-caring but very mysterious classmate, Kazuki Endou.",TV,13.0,Finished Airing,"Apr 1, 2006","Jun 24, 2006","Geneon Universal Entertainment, Visual Arts",Media Blasters,Tokyo Kids,Visual novel,"Boys Love, Comedy, Drama, Romance","Harem, School",Unknown,26.0,PG-13 - Teens 13 or older,6.481,30426.0,65172.0,2370,64025,168,2006.0
2026,Hayate no Gotoku!,ハヤテのごとく！,Hayate the Combat Butler,"According to Murphy's Law, ""anything that can go wrong, will go wrong,"" and truer words cannot describe the unfortunate life of the hard-working Hayate Ayasaki. Abandoned by his parents after accumulating a debt of over one hundred fifty million yen, he is sold off to the yakuza, initiating his swift getaway from a future he does not want. On that fateful night, he runs into Nagi Sanzenin, a young girl whom he decides to try and kidnap to pay for his family's massive debt.

Unfortunately, due to his kind-hearted nature and a string of misunderstandings, Nagi believes Hayate to be confessing his love to her. After saving her from real kidnappers, Hayate is hired as Nagi's personal butler, upon which she is revealed to be a member of one of the wealthiest families in Japan.

Highly skilled but cursed with the world's worst luck, Hayate gets straight to work serving his employer all the while trying to deal with the many misfortunes that befall him. From taking care of a mansion to fending off dangerous foes, and even unintentionally wooing the hearts of the women around him, Hayate is in over his head in the butler comedy Hayate no Gotoku!

[Written by MAL Rewrite]",TV,52.0,Finished Airing,"Apr 1, 2007","Mar 30, 2008","TV Tokyo, Shogakukan-Shueisha Productions, Studio Tulip","Bandai Entertainment, Sentai Filmworks",SynergySP,Manga,"Action, Comedy, Romance","Harem, Parody",young boy,24.0,PG-13 - Teens 13 or older,7.531,94211.0,15892.0,947,214834,1559,2007.0
12461,Hiiro no Kakera,緋色の欠片,Hiiro no Kakera The Tamayori Princess Saga,"Gods and ghosts only exist in fairy tales, right? That's the impression that high school girl Tamki Kasuga has before she goes to live with her grandmother in the remote village of Kifumura. After being attacked by strange creatures upon her arrival, she is soon informed that females in her family contain the blood of the Tamayori Princess, who has the responsibility and power of keeping gods and ghosts sealed away so that they can't harm the general public. At first Tamaki has trouble believing this, but having five beautiful young men following her everywhere she goes acting as her guardians goes a long way towards convincing her.

There's more to this job than Tamaki first realizes, however, and the path that lies ahead of her is fraught with peril and danger. Will she be able to successfully take on the heavy role that has been put on her shoulders?",TV,13.0,Finished Airing,"Apr 1, 2012","Jun 24, 2012","Bandai Visual, Yomiuri Telecasting, Lantis, Kids Station, Movic, DAX Production, Yomiuri TV Enterprise",Sentai Filmworks,Studio Deen,Visual novel,"Fantasy, Romance, Supernatural",Reverse Harem,young girl,24.0,PG-13 - Teens 13 or older,6.711,44407.0,52702.0,1718,106668,386,2012.0
27787,Nisekoi:,ニセコイ,Nisekoi False Love,"Despite having seemingly quelled the war between their respective gangs, Raku Ichijou and Chitoge Kirisaki still carry on with their fake relationship. Eventually, as Chitoge's perception of Raku slowly changes, she even begins to see him as a little charming. 

Chitoge struggles to come to terms with her newfound feelings for Raku, as a new girl joins the slew of Raku's admirers and the competition among those vying for the yakuza heir's attention grows even fiercer. And amidst all this, Raku's search for his first love and the contents of the mysterious sealed locket continues in Nisekoi:, which picks up where the first season left off.

[Written by MAL Rewrite]",TV,12.0,Finished Airing,"Apr 10, 2015","Jun 26, 2015","Aniplex, Shueisha",Aniplex of America,Shaft,Manga,"Comedy, Romance","Harem, School",young boy,24.0,PG-13 - Teens 13 or older,7.361,397382.0,21882.0,269,641104,1775,2015.0
53,Ai Yori Aoshi,藍より青し,Ai Yori Aoshi,"Kaoru Hanabishi, a college student who lives alone, met a beautiful but bewildered girl dressed in a kimono at a train station. He volunteered to guide her way to the address she was looking for, which happened to be in his neighborhood, but turned out to be an empty lot. Not knowing what to do next, Kaoru invited the devastated girl to his apartment and asked for any additional clues to her destination. She supplied him with a photo of two children whom Kauru immediately identified as himself and Aoi Sakuraba, his childhood friend. It turned out that the girl in front of him is Aoi Sakuraba herself, his betrothed fiancee who came all the way to Tokyo to marry him. Her revelation was not only surprising but also reminded the deepest part of Kaoru's memory for why he left the Hanabishi family in the first place.",TV,24.0,Finished Airing,"Apr 11, 2002","Sep 26, 2002","Movic, Fuji TV, Pioneer LDC, Cosmic Ray","Funimation, Geneon Entertainment USA",J.C.Staff,Manga,"Comedy, Drama, Romance, Slice of Life",Harem,teenager,23.0,PG-13 - Teens 13 or older,7.111,51975.0,33932.0,1744,105346,433,2002.0
10079,Hoshizora e Kakaru Hashi,星空へ架かる橋,A Bridge to the Starry Skies,"Kazuma Hoshino is preparing himself for a new stage of his life as a teenager. Because of his brother Ayumu's weaker than average health, their parents thought it best for the family to move out from the city to a more rural environment. Now the two brothers are off to the Yorozuyo Inn where they’ll be staying until their parents can settle affairs back in the city and set up their new home.

Their arrival to the inn doesn't go as planned though when they catch the wrong bus, wind up in the middle of nowhere, Ayumu gets his hat stolen by a wild monkey, and Kazuma gets lost in the woods trying to track the animal down. It all leads to a chance encounter with a spirited young girl named Ui, who Kazuma ends up accidentally falling onto and kissing while she tries leading him back to the bus stop. This hardly sits well with Ui’s friend Ibuki who swiftly kicks Kazuma and sends him on his way. Much to Kazuma's continued horror, his bad luck is perpetuated at the inn thanks to its landlady Senka and her slightly perverted sense of humor, and then finding out that two of his classmates are the girls he embarrassed himself in front of back in the woods!

Hoshizora e Kakaru Hashi finds Kazuma adapting to his new school, dealing with the multiple women who have entered his life, providing emotional support for his younger brother, and coping with living with his new landlady. However, for some reason, something about this place is bringing whispers of the past into Kazuma's mind. Small flashes back to a more innocent time and a friendship long forgotten. What could this déjà vu mean?",TV,12.0,Finished Airing,"Apr 11, 2011","Jun 27, 2011","Dentsu, Sotsu, Marvelous, Pony Canyon, feng, PRA, Jumondo",Unknown,Doga Kobo,Visual novel,"Comedy, Romance, Ecchi","Harem, School",Unknown,25.0,PG-13 - Teens 13 or older,6.711,86076.0,52722.0,1218,165986,333,2011.0
403,Hanaukyou Maid-tai,花右京メイド隊,Unknown,"After losing his mother, 14-year-old Taro journeys to Tokyo to live with his grandfather. But he gets the biggest surprise when he discovers that his grandfather's home is a huge mansion with hundreds of beautiful maids ready to serve him. Making matters worse (at least for Taro, but not for our viewing) is that not only does he inherit the Hanaukyo mansion, he gets the services of all of the maids 24 hours a day, 7 days a week.

(Source: ANN)",TV,12.0,Finished Airing,"Apr 12, 2001","Jun 28, 2001",m.o.e.,Unknown,Daume,Manga,"Comedy, Romance, Ecchi",Harem,Unknown,14.0,R+ - Mild Nudity,6.581,13181.0,59472.0,3550,30308,41,2001.0
10080,Kami nomi zo Shiru Sekai II,神のみぞ知るセカイ II,The World God Only Knows II,"Keima Katsuragi, the ""God of Conquest,"" returns to his quest of expelling runaway spirits that have possessed the hearts of women. Still stuck in his contract with the demon Elsie, he must continue to utilize the knowledge he has gained from mastering multitudes of dating simulators and chase out the phantoms that reside within by capturing the hearts of that which he hates most: three-dimensional girls.

However, the God of Conquest has his work cut out for him. From exorcising karate practitioners and student teachers to the arrival of Elsie's best friend from Hell, he is up against a wide array of girls that will test his wit and may even take him by surprise. Though he would much rather stick to the world of 2D, he is trapped in lousy reality, and so Keima must trudge forward in his conquest of love.

[Written by MAL Rewrite]",TV,12.0,Finished Airing,"Apr 12, 2011","Jun 28, 2011","TV Tokyo, Geneon Universal Entertainment",Sentai Filmworks,Manglobe,Manga,"Comedy, Romance, Supernatural","Harem, Otaku Culture",young boy,23.0,PG-13 - Teens 13 or older,7.891,229421.0,7312.0,519,368881,966,2011.0
19163,Date A Live II,デート・ア・ライブⅡ,Date A Live II,"Spirits are otherworldly entities with immense power, capable of creating spatial quakes whenever they appear. One way of dealing with them is through brute force and killing them... or making them fall in love and sealing their powers. 

Having sealed three Spirits, Shidou Itsuka continues his mission with Ratatoskr in locating more spirits and dating them, to ensure the world's safety from further destruction. However, this time around, their problems will not be limited to Spirits as a more imposing threat seems to have noticed their activities.

[Written by MAL Rewrite]
",TV,10.0,Finished Airing,"Apr 12, 2014","Jun 14, 2014","Kadokawa Shoten, AT-X, Nippon Columbia",Funimation,Production IMS,Light novel,"Comedy, Romance, Sci-Fi","Harem, Mecha, School",Unknown,28.0,R - 17+ (violence & profanity),7.201,363171.0,29772.0,315,583391,2140,2014.0
28677,Yamada-kun to 7-nin no Majo,山田くんと7人の魔女,Yamada-kun and the Seven Witches,"When Ryuu Yamada entered high school, he wanted to turn over a new leaf and lead a productive school life. That's why he chose to attend Suzaku High, where no one would know of his violent delinquent reputation. However, much to Ryuu's dismay, he is soon bored; now a second year, Ryuu has reverted to his old ways—lazy with abysmal grades and always getting into fights.

One day, back from yet another office visit, Ryuu encounters Urara Shiraishi, a beautiful honors student. A misstep causes them both to tumble down the stairs, ending in an accidental kiss! The pair discover they can switch bodies with a kiss: an ability which will prove to be both convenient and troublesome.

Learning of their new power, Toranosuke Miyamura, a student council officer and the single member of the Supernatural Studies Club, recruits them for the club. Soon joined by Miyabi Itou, an eccentric interested in all things supernatural, the group unearths the legend of the Seven Witches of Suzaku High, seven female students who have obtained different powers activated by a kiss. The Supernatural Studies Club embarks on its first quest: to find the identities of all the witches.

[Written by MAL Rewrite]",TV,12.0,Finished Airing,"Apr 12, 2015","Jun 28, 2015","Dentsu, Frontier Works, Kodansha, Rakuonsha, Ultra Super Pictures, Memory-Tech, Daiichikosho, Lawson HMV Entertainment, Amuse, Animatic, A-Sketch","Funimation, Crunchyroll",LIDENFILMS,Manga,"Comedy, Mystery, Romance, Supernatural","Harem, School",young boy,24.0,PG-13 - Teens 13 or older,7.561,410196.0,14672.0,227,716215,3877,2015.0
15225,Hentai Ouji to Warawanai Neko.,変態王子と笑わない猫。,"The ""Hentai"" Prince and the Stony Cat.","Youto Yokodera wants to be seen in a way different from most men: as a pervert. However, his lewd actions are often misinterpreted as good intentions, and people cannot see his true nature. Upon hearing rumors of a cat statue that can banish an unwanted trait, he searches for it and prays for his façade to be removed. But each wish comes at a price: those unwelcomed traits are transferred to someone else who desires them!

After realizing that vocalizing his dirty thoughts is not the best thing, Youto decides to regain his lost traits by seeking out the person who received them. Unfortunately, he was not alone in praying to the cat statue, and now he must not only fix his life, but the lives of others as well.

[Written by MAL Rewrite]",TV,12.0,Finished Airing,"Apr 13, 2013","Jun 29, 2013","Frontier Works, Media Factory, FuRyu",Sentai Filmworks,J.C.Staff,Light novel,"Comedy, Romance, Supernatural","Harem, School",Unknown,24.0,PG-13 - Teens 13 or older,7.181,227040.0,30912.0,440,425997,1654,2013.0
30727,Saenai Heroine no Sodatekata ♭,冴えない彼女〈ヒロイン〉の育てかた♭,Saekano How to Raise a Boring Girlfriend .flat,"After finally completing the first route of his visual novel, Blessing Software's producer Tomoya Aki is optimistic about the future of his team and achieving their goal of creating the best game of the season.

However, they still have a long way to go. For one, Megumi Katou still has an incredibly flat personality and is unable to fit the role of Tomoya's ideal heroine. The other members of Blessing Software, Eriri Spencer Sawamura, Utaha Kasumigaoka, and Michiru Hyoudou, often forget she is even there due to her lack of presence and character. 

Throughout the development of their game, Blessing Software learns the struggles of working in an industry where deadlines must be met and edits are made constantly, and the hardships of working in a group setting.

[Written by MAL Rewrite]",TV,11.0,Finished Airing,"Apr 14, 2017","Jun 23, 2017","Aniplex, Dentsu, Fuji TV, Cospa, Good Smile Company, Kansai Telecasting, Fujimi Shobo",Unknown,A-1 Pictures,Light novel,"Comedy, Romance, Ecchi","Harem, Otaku Culture, School",Unknown,22.0,PG-13 - Teens 13 or older,7.771,170071.0,9512.0,602,330562,1621,2017.0
43007,Osananajimi ga Zettai ni Makenai Love Comedy,幼なじみが絶対に負けないラブコメ,Osamake Romcom Where The Childhood Friend Won't Lose,"Suehara Maru is childhood best friends with one of Hozumino High School's most popular girls, Kuroha Shida. Cute, outgoing, and affectionate, Kuroha is the perfect older sister type. She has boys constantly begging at her feet to be with her. Yet, when she confesses to Suehara one day, he immediately rejects her; he just can't think of her in that way! Besides, he already has his sights set on his first love—school idol and renowned author Shirokusa Kachi.

Suehara believes that he has a chance with Kachi after one fateful meeting, but soon, he finds out that Kachi has a boyfriend! With his dreams now shattered, Suehara agonizes over what could have been. That is, until Kuroha approaches him with a proposal: ""let's get revenge.""

[Written by MAL Rewrite]",TV,12.0,Finished Airing,"Apr 14, 2021","Jun 30, 2021","Delfi Sound, Kadokawa",Unknown,Doga Kobo,Light novel,"Comedy, Romance","Harem, School",Unknown,23.0,PG-13 - Teens 13 or older,6.071,101928.0,86902.0,892,228739,1632,2021.0
34281,High School DxD Hero,ハイスクールDxD HERO,High School DxD Hero,"After rescuing his master, Rias Gremory, from the Dimensional Gap, Red Dragon Emperor and aspiring Harem King Issei Hyoudou can finally return to his high school activities alongside fellow members of the Occult Research Club: Yuuto Kiba, Asia Argento, Xenovia Quarta, and Irina Shidou. The group soon embarks on a school trip to Kyoto. 

While peacefully visiting a temple thanks to Rias' spell, an attacking group of local youkai breaks the calm atmosphere. Once the altercation ends, the club learns that the mythical nine-tailed fox that protected the city was abducted and that someone has framed them for the act. Issei and his friends will now have to fight to protect the city and save their school trip from a planned disaster!

In the meantime, Rias, who had to stay in Tokyo with Akeno Himejima and Koneko Toujou, grows increasingly restless to have left the perverted Issei alone with the other girls of the Occult Research Club. Beyond this vague anxiety, what is the exact nature of the feelings Rias has been struggling with for the past few months?

[Written by MAL Rewrite]",TV,12.0,Finished Airing,"Apr 17, 2018","Jul 3, 2018",AT-X,Funimation,Passione,Light novel,"Action, Comedy, Romance, Ecchi","Harem, Mythology, School",Unknown,23.0,R+ - Mild Nudity,7.261,246947.0,26822.0,424,447945,2388,2018.0
189,Love Hina,ラブひな,Love Hina,"Keitaro Urashima promised a girl when he was young that they would meet up again at Tokyo University in the future. Sadly, in the National Practice Exam, Keitaro ranked 27th from the bottom. Knowing his grandmother owned a hotel, Keitaro intended to stay there while continuing his studies for Tokyo U, only to find out the hotel had long been transformed into an all-girls dormitory. Through an odd twist of fate, Keitaro eventually became the manager of the dorm, beginning his life of living with five other girls.",TV,24.0,Finished Airing,"Apr 19, 2000","Sep 27, 2000","TV Tokyo, Yomiko Advertising","Funimation, Bandai Entertainment",Xebec,Manga,"Comedy, Romance, Slice of Life, Ecchi",Harem,young boy,23.0,PG-13 - Teens 13 or older,7.111,131422.0,34202.0,805,251756,1428,2000.0
29095,Grisaia no Rakuen,グリザイアの楽園,The Eden of Grisaia,"Grisaia no Rakuen begins right at the end of the previous installment, Grisaia no Meikyuu. Kazami Yuuji is arrested under suspicion for terrorism. A video showing apparently concrete proof that Yuuji committed these acts, and he is held in custody by Ichigaya.

Ichigaya knows full well that Yuuji didn't commit the crimes he has been accused of. But he did fail to assassinate Heath Oslo, who is the leader of the terrorist organization with an extremely devastating weapon in their possession. In fact, Ichigaya have their own plans for Yuuji... 

But all may not be lost for Yuuji. The girls of the Mihama Academy are not about to let Yuuji be used for political gain, and neither may the mysterious new figure which appears before them.",TV,10.0,Finished Airing,"Apr 19, 2015","Jun 21, 2015","Frontier Works, AT-X, Bushiroad, NBCUniversal Entertainment Japan, i0+, Front Wing",Sentai Filmworks,8bit,Visual novel,"Drama, Romance","Harem, Psychological",Unknown,23.0,R - 17+ (violence & profanity),7.781,208398.0,9252.0,505,379922,2027,2015.0
696,Tenchi Muyou!,天地無用！,Unknown,"Tenchi Masaki's life changes forever when the ship of an infamous space pirate, Ryouko Hakubi, is shot down and crashes near his family's temple. Little did Tenchi know that by saving Ryouko, he would spark a series of events that would lead alien women from all walks of life to inhabit his home. This includes the delicate Princess Aeka of Jurai and her playful younger sister Princess Sasami; the scatterbrained first-class detective Mihoshi Kuramitsu and her more capable partner Kiyone Makibi; and the eccentric, mad scientist Washuu Hakubi.

The six women do their best to adapt to their new lives, but their more advanced and exotic lifestyle does not mesh well with the simplistic customs on Earth. As a result, they just end up making a mess and causing trouble for poor Tenchi. Though the girls are a pain, Tenchi begins to form a close relationship with each of them, and through their bond, he begins to gain a better understanding of his role in the universe.

[Written by MAL Rewrite]",TV,26.0,Finished Airing,"Apr 2, 1995","Sep 24, 1995","TV Tokyo, Pioneer LDC","Funimation, Geneon Entertainment USA",AIC,Original,"Comedy, Romance, Sci-Fi","Harem, Space",young boy,23.0,PG-13 - Teens 13 or older,7.421,32814.0,19432.0,2183,73345,581,1995.0
472,To Heart,トゥハート,To Heart,"For as long as Akari can remember, she and Hiroyuki have always been friends. But with time, everything changes, and her feelings have turned into something more. As a new semester of high school begins, will the two childhood friends come closer together or drift further apart? Join Hiroyuki, Akari and all their friends—the bubbly Shiho, the quiet Serika, the lovely Kotone, and more—in this heartwarming tale of love, relationships and friendship!

(Source: RightStuf)",TV,13.0,Finished Airing,"Apr 2, 1999","Jun 25, 1999",KSS,Nozomi Entertainment,OLM,Visual novel,"Drama, Romance, Slice of Life","Harem, School",Unknown,25.0,PG - Children,6.581,9280.0,59122.0,3868,25365,54,1999.0
