ID,Title,Japanese,English,Synopsis,Type,Episodes,Status,Start_Aired,End_Aired,Producers,Licensors,Studios,Source,Genres,Themes,Demographics,Duration_Minutes,Rating,Score,Scored_Users,Ranked,Popularity,Members,Favorites,year
872,Mahou Shoujo-tai Arusu,魔法少女隊アルス,Tweeny Witches,"Arusu believes in magic. With all her heart, she believes that magic is possible and that it can be used for good deeds and fun games. But suddenly, she finds herself transported into another world, ruled by a mysterious elite of witches—and these witches don't seem to be in it for the fun. They're hard at work capturing sprites, the native magical beings of the world, and forcing them into slavery. Once Arusu realizes that her new surroundings aren't just a dream, she sets out to change things.

(Source: ANN)",TV,40.0,Finished Airing,"Apr 9, 2004","Mar 4, 2005","Tohokushinsha Film Corporation, Beyond C.",Media Blasters,Studio 4°C,Original,"Adventure, Comedy, Fantasy",Isekai,Unknown,9.0,PG-13 - Teens 13 or older,7.061,6320.0,36482.0,3674,28278,77,2004.0
16518,Arata Kangatari,アラタカンガタリ～革神語～,Arata The Legend,"As a young boy from a noble family in Amawakuni, Arata has always expected to make life his own—until word of the princess growing weak reaches his city. Unbeknown to him, his grandmother had claimed him to be female at birth, and now, with no other girls to succeed the princess from the matriarchal Hime clan, he is next in line for the throne! Disguised as a woman awaiting a replacement to be found, Arata witnesses an assassination attempt on the princess by none other than her own guard, the 12 Shinsho. The crime is pinned on his head, forcing Arata to escape to the Kando forest, where it is said that no one comes out the same.

Meanwhile, in modern-day Japan, Arata Hinohara longs for escape from the cruelty of his classmates. Hearing his name called from an alley, he wanders from his path and unwittingly switches universes with Arata from Amawakuni. With his own power as a newly awakened ""Sho""—a warrior able to wield Hayagami, weapons with the power of the gods—and the help of his companions he meets along his journey, Hinohara sets out to restore order to this new world.

[Written by MAL Rewrite]",TV,12.0,Finished Airing,"Apr 9, 2013","Jul 2, 2013","TV Tokyo, Sotsu, Lantis, JM Animation",Unknown,Satelight,Manga,"Adventure, Fantasy",Isekai,young boy,24.0,PG-13 - Teens 13 or older,6.451,31808.0,66692.0,2283,68191,61,2013.0
19815,No Game No Life,ノーゲーム・ノーライフ,"No Game, No Life","Sixteen sentient races inhabit Disboard, a world overseen by Tet, the One True God. The lowest of the sixteen—Imanity—consists of humans, a race with no affinity for magic. In a place where everything is decided through simple games, humankind seems to have no way out of their predicament—but the arrival of two outsiders poses a change.

On Earth, stepsiblings Sora and Shiro are two inseparable shut-ins who dominate various online games under the username ""Blank."" While notorious on the internet, the pair believe that life is merely another dull game. However, after responding to a message from an unknown user, they are suddenly transported to Disboard. The mysterious sender turns out to be Tet, who informs them about the world's absolute rules. After Tet leaves, Sora and Shiro begin their search for more information and a place to stay, taking them to Elkia—Imanity's only remaining kingdom.

There, the duo encounters Stephanie Dola, an emotional girl vying for the kingdom's sovereignty. In desperation, she attempts to regain her father's throne, but her foolhardiness makes her goal unachievable. Inspired by the girl's motivation and passion, Sora and Shiro decide to aid Stephanie in getting Elkia back on its feet, ultimately aiming to become the new rulers of the enigmatic realm.

[Written by MAL Rewrite]
",TV,12.0,Finished Airing,"Apr 9, 2014","Jun 25, 2014","Frontier Works, Media Factory, Movic, AT-X",Sentai Filmworks,Madhouse,Light novel,"Comedy, Fantasy, Ecchi","Isekai, Strategy Game",Unknown,23.0,PG-13 - Teens 13 or older,8.101,427730.0,4402.0,15,2201000,46672,2014.0
41623,Isekai Maou to Shoukan Shoujo no Dorei Majutsu Ω,異世界魔王と召喚少女の奴隷魔術Ω,How Not to Summon a Demon Lord Ω,Second season of Isekai Maou to Shoukan Shoujo no Dorei Majutsu.,TV,10.0,Finished Airing,"Apr 9, 2021","Jun 11, 2021","Kodansha, Half H.P Studio, KlockWorx, 81 Produce, Avex Pictures, Crunchyroll, GREE",Funimation,"Tezuka Productions, Okuruto Noboru",Light novel,"Comedy, Fantasy, Ecchi","Harem, Isekai",Unknown,24.0,PG-13 - Teens 13 or older,6.721,148610.0,51952.0,580,338732,2672,2021.0
16385,Dog Days'',ドッグデイズ'',Unknown,"Cinque Izumi, Nanami Takatsuki, and Rebecca Anderson must once again embark on a journey to the continent of Flonyard and participate in the friendly war games of the three allied nations: Biscotti Republic, Galette, and Pastilage. Cinque is Biscotti’s hero, who also happens to be the cousin of Galette’s hero Nanami. Rebecca is Pastillage’s hero and a dear friend of Cinque.

Dog Days'' begins in the human world. Rebecca prepares her things for her journey back to Pastilage from Japan. Meanwhile, Cinque and Nanami set out to travel to Biscotti and Galette, respectively, all the way from England, when suddenly, a freakish streak of bad luck—in the form of lightning, of course—sends them off course. They soon find themselves in the great Dragon Forest, protected by a Dragon Priestess named Sharu. The Dragon Priestess informs them that demons threaten to invade the forest, as well as the whole continent of Flonyard!

It looks like a real war is about to begin in Dog Days''. Can these three heroes save the whole continent from these evil beings?",TV,12.0,Finished Airing,"Jan 11, 2015","Mar 29, 2015","Aniplex, Starchild Records, Bandai Namco Games, Glovision",Unknown,Seven Arcs Pictures,Original,"Action, Adventure, Fantasy",Isekai,Unknown,23.0,PG-13 - Teens 13 or older,6.891,32096.0,43872.0,2243,70186,75,2015.0
31859,Hai to Gensou no Grimgar,灰と幻想のグリムガル,Grimgar Ashes and Illusions,"Fear, survival, instinct. Thrown into a foreign land with nothing but hazy memories and the knowledge of their name, they can feel only these three emotions resonating deep within their souls. A group of strangers is given no other choice than to accept the only paying job in this game-like world—the role of a soldier in the Reserve Army—and eliminate anything that threatens the peace in their new world, Grimgar.

When all of the stronger candidates join together, those left behind must create a party together to survive: Manato, a charismatic leader and priest; Haruhiro, a nervous thief; Yume, a cheerful hunter; Shihoru, a shy mage; Moguzo, a kind warrior; and Ranta, a rowdy dark knight. Despite its resemblance to one, this is no game—there are no redos or respawns; it is kill or be killed. 

It is now up to this ragtag group of unlikely fighters to survive together in a world where life and death are separated only by a fine line. 

[Written by MAL Rewrite]",TV,12.0,Finished Airing,"Jan 11, 2016","Mar 28, 2016",TOHO animation,Funimation,A-1 Pictures,Light novel,"Action, Adventure, Drama, Fantasy",Isekai,Unknown,24.0,PG-13 - Teens 13 or older,7.651,348163.0,12272.0,248,665723,5668,2016.0
35997,Märchen Mädchen,メルヘン・メドヘン,Maerchen Maedchen,"Hazuki Kagimura is a socially awkward girl with no friends; and having been recently adopted, she struggles to connect with her new family as well. Her only refuge from this painful reality is between the pages of stories where her vivid imagination allows her to live out her dreams of friendship and adventure. However, one day, an old and mysterious text appears in her book bag. On her way back to the library to return it, Hazuki sees a familiar girl who is seemingly invisible to everyone but her. Deciding to follow her, Hazuki is led a hidden library where a world she thought only existed in her dreams awaits her. 

Märchen Mädchen tells the story of Hazuki's meeting with Shizuka Tsuchimikado, her very first friend, and discovering she has been chosen by the original print of Cinderella to become a powerful mage known as an Origin Master. Hazuki enrolls at Kuzunoha Girl's Magic Academy where she learns to conquer her fears and believe in her ability to create her own amazing story.

[Written by MAL Rewrite]
",TV,10.0,Finished Airing,"Jan 11, 2018","Mar 29, 2018","Lantis, AT-X, NBCUniversal Entertainment Japan, Medicos Entertainment, Shueisha, Kanon Sound, DMM.com, NichiNare",Unknown,Hoods Entertainment,Light novel,Fantasy,"Isekai, School",Unknown,23.0,PG-13 - Teens 13 or older,5.391,13600.0,114742.0,3122,39020,40,2018.0
34497,Death March kara Hajimaru Isekai Kyousoukyoku,デスマーチからはじまる異世界狂想曲,Death March to the Parallel World Rhapsody,"Ichirou Suzuki, a programmer nearing his thirties, is drowning in work. Worn out, he eventually has a chance to catch up on sleep, only to wake up and discover himself in a fantasy RPG world, which is mashed together from the games he was debugging in reality. In this new place, he realizes that not only has his appearance changed to a younger version of himself, but his name has also changed to Satou, a nickname he used while running beta tests on games. 

However, before Satou can fully grasp his situation, an army of lizardmen launch an assault on him. Forced to cast a powerful spell in retaliation, Satou wipes them out completely and his level is boosted to 310, effectively maximizing his stats. Now, as a high-leveled adventurer armed with a plethora of skills and no way to return to reality, Satou sets out to explore this magical new world.

[Written by MAL Rewrite]
",TV,12.0,Finished Airing,"Jan 11, 2018","Mar 29, 2018","Sotsu, AT-X, DIVE II Entertainment, Tokyo MX, Avex Pictures, BS11, Kadokawa, KLab",Funimation,"SILVER LINK., Connect",Light novel,"Adventure, Fantasy","Harem, Isekai, Reincarnation",Unknown,23.0,PG-13 - Teens 13 or older,6.471,257212.0,65652.0,430,443111,1673,2018.0
39535,Mushoku Tensei: Isekai Ittara Honki Dasu,無職転生 ～異世界行ったら本気だす～,Mushoku Tensei Jobless Reincarnation,"Despite being bullied, scorned, and oppressed all of his life, a 34-year-old shut-in still found the resolve to attempt something heroic—only for it to end in a tragic accident. But in a twist of fate, he awakens in another world as Rudeus Greyrat, starting life again as a baby born to two loving parents.

Preserving his memories and knowledge from his previous life, Rudeus quickly adapts to his new environment. With the mind of a grown adult, he starts to display magical talent that exceeds all expectations, honing his skill with the help of a mage named Roxy Migurdia. Rudeus learns swordplay from his father, Paul, and meets Sylphiette, a girl his age who quickly becomes his closest friend.

As Rudeus' second chance at life begins, he tries to make the most of his new opportunity while conquering his traumatic past. And perhaps, one day, he may find the one thing he could not find in his old world—love.

[Written by MAL Rewrite]",TV,11.0,Finished Airing,"Jan 11, 2021","Mar 22, 2021","Frontier Works, TOHO animation, Hakuhodo DY Music & Pictures, BS11, Egg Firm, Kadokawa, GREE, Toho Music",Funimation,Studio Bind,Light novel,"Drama, Fantasy, Ecchi","Isekai, Reincarnation",Unknown,23.0,R - 17+ (violence & profanity),8.381,616575.0,1802.0,125,1003891,24696,2021.0
15315,Mondaiji-tachi ga Isekai kara Kuru Sou Desu yo?,問題児たちが異世界から来るそうですよ?,"Problem Children Are Coming from Another World, Aren't They?","Izayoi Sakamaki, Asuka Kudou, and You Kasukabe are extraordinary teenagers who are blessed with psychic powers but completely fed up with their disproportionately mundane lives—until, unexpectedly, each of them receives a strange envelope containing an invitation to a mysterious place known as Little Garden. 

Inexplicably dropped into a vast new world, the trio is greeted by Kurousagi, who explains that they have been given a once-in-a-lifetime chance to participate in special high-stakes games using their abilities. In order to take part, however, they must first join a community. Learning that Kurousagi's community ""No Names"" has lost its official status and bountiful land due to their defeat at the hands of a demon lord, the group sets off to help reclaim their new home's dignity, eager to protect its residents and explore the excitement that Little Garden has to offer.

[Written by MAL Rewrite]",TV,10.0,Finished Airing,"Jan 12, 2013","Mar 16, 2013","Kadokawa Shoten, Nippon Columbia, flying DOG",Sentai Filmworks,Diomedéa,Light novel,"Action, Comedy, Fantasy, Supernatural",Isekai,Unknown,23.0,PG-13 - Teens 13 or older,7.471,294408.0,17532.0,342,544871,3627,2013.0
32937,Kono Subarashii Sekai ni Shukufuku wo! 2,この素晴らしい世界に祝福を！ 2,KonoSuba God's Blessing on This Wonderful World! 2,"When Kazuma Satou died, he was given two choices: pass on to heaven or be revived in a fantasy world. After choosing the new world, the goddess Aqua tasked him with defeating the Demon King, and let him choose any weapon to aid him. Unfortunately, Kazuma chose to bring Aqua herself and has regretted the decision ever since then.

Not only is he stuck with a useless deity turned party archpriest, the pair also has to make enough money for living expenses. To add to their problems, their group continued to grow as more problematic adventurers joined their ranks. Their token spellcaster, Megumin, is an explosion magic specialist who can only cast one spell once per day and refuses to learn anything else. There is also their stalwart crusader, Lalatina ""Darkness"" Dustiness Ford, a helpless masochist who makes Kazuma look pure in comparison.

Kono Subarashii Sekai ni Shukufuku wo! 2 continues to follow Kazuma and the rest of his party through countless more adventures as they struggle to earn money and have to deal with one another's problematic personalities. However, things rarely go as planned, and they are often sidetracked by their own idiotic tendencies.

[Written by MAL Rewrite]",TV,10.0,Finished Airing,"Jan 12, 2017","Mar 16, 2017","Kadokawa Shoten, Nippon Columbia, KlockWorx, Sony Music Communications, Toranoana, 81 Produce, Kadokawa Media House",Discotek Media,Studio Deen,Light novel,"Adventure, Comedy, Fantasy","Isekai, Parody, Reincarnation",Unknown,23.0,PG-13 - Teens 13 or older,8.271,905852.0,2582.0,75,1350631,11436,2017.0
39551,Tensei shitara Slime Datta Ken 2nd Season,転生したらスライムだった件,That Time I Got Reincarnated as a Slime Season 2,"Taking a break from his time as a teacher, the powerful slime Rimuru Tempest returns to his kingdom, eponymously named Tempest, just in time to begin negotiations with a nearby nation—the Kingdom of Eurazania. While the negotiations are anything but peaceful, they do end successfully, allowing Rimuru to return and finish teaching. When trying to again return to Tempest, this time permanently, Rimuru is stopped by a mysterious figure who is somehow able to constrain the many magical abilities he has at his disposal. 

In Tempest, the situation is even worse. A group of unknown humans has invaded the land and are assaulting its citizens, both influential and innocent. They are not just trying to bring harm either—they have the intent to kill. Can Rimuru overcome his powerful and dangerous foe and return to Tempest before it is too late?  

[Written by MAL Rewrite]",TV,12.0,Finished Airing,"Jan 12, 2021","Mar 30, 2021",Kodansha,Funimation,8bit,Manga,"Action, Adventure, Comedy, Fantasy","Isekai, Mythology, Reincarnation",Unknown,23.0,PG-13 - Teens 13 or older,8.401,441208.0,1652.0,194,774577,9855,2021.0
48997,Fantasy Bishoujo Juniku Ojisan to,異世界美少女受肉おじさんと,Life with an Ordinary Guy who Reincarnated into a Total Fantasy Knockout,"Since their days as students, Tsukasa Jinguuji has had incredible luck with women due to his good looks; Hinata Tachibana has had almost none, overshadowed by Jinguuji's brilliance. However, while Jinguuji has never shown interest in the opposite sex, Tachibana is always desperate for a girlfriend. Despite their polar differences, they continue to be best friends even in their thirties as salarymen. 

One night, the two are returning home from a mixer where Jinguuji was the center of attention as usual. In his drunken rambles, a frustrated Tachibana inadvertently wishes to become a beautiful girl with irresistible charm. As if the heavens were listening, a goddess suddenly shows herself before Jinguuji and Tachibana, transporting them to another world to defeat the Demon Lord and simultaneously granting Tachibana's desire.

Tachibana—now in the body of an impossibly perfect woman—has become so attractive that even Jinguuji is captivated. Moreover, Tachibana grows aware of Jinguuji's stunning appearance, finally understanding his popularity. Before they fall in love with each other, the duo must complete their mission or risk remaining prisoners to their infatuations forever.

[Written by MAL Rewrite]
",TV,12.0,Finished Airing,"Jan 12, 2022","Mar 30, 2022","TV Tokyo, bilibili, Cygames, Bit grooove promotion, Bushiroad Move, Music Brains",Unknown,OLM Team Yoshioka,Manga,"Adventure, Comedy, Fantasy","Gag Humor, Isekai, Magical Sex Shift",Unknown,23.0,PG-13 - Teens 13 or older,7.191,57333.0,30132.0,1496,126655,641,2022.0
42072,Kenja no Deshi wo Nanoru Kenja,賢者の弟子を名乗る賢者,She Professed Herself Pupil of the Wise Man,"With a dignified veteran's body and a long white beard, summoner mage Dunbalf was one of the strongest player characters in the virtual reality online multiplayer roleplaying game Ark Earth Online, even heralded as a one-man army. Together with the ""Nine Wise Mages"" and King Solomon, they formed the mage player Kingdom of Alcait. But one day, Dunbalf and the other Nine Wise Mages suddenly go missing, leaving no trace behind.

In an effort to spend his expiring credits, Dunbalf had purchased a cosmetic kit and tinkered with his character; however, he accidentally fell asleep during the customization process. Upon waking up, Dunbalf not only notices that the world of Ark Earth Online has become more realistic, but also discovers that he has turned into a cute girl! After reaching Alcait, he learns it has been 30 years since he supposedly disappeared.

Now tasked with finding the other missing mages by King Solomon, the avid role player proclaims his new identity as Mira—the Pupil of the Wise Man Dunbalf—and ventures forth to prove his legacy.

[Written by MAL Rewrite]
",TV,12.0,Finished Airing,"Jan 12, 2022","Mar 30, 2022","DAX Production, MAGES., Kadokawa, Micro House",Funimation,Studio A-CAT,Light novel,"Adventure, Fantasy",Isekai,Unknown,23.0,PG-13 - Teens 13 or older,6.281,36353.0,76262.0,1911,91621,585,2022.0
40507,Arifureta Shokugyou de Sekai Saikyou 2nd Season,ありふれた職業で世界最強 2nd Season,Arifureta From Commonplace to World's Strongest Season 2,"Transported to another world and left behind by his former friends, Hajime had to make his rise from literal rock bottom. It was in the labyrinth where he strengthened his weak magic and found several beautiful allies. Now after saving his classmates, he ventures for Erisen to escort Myuu and her mother. He'll fight and defeat anyone he has to in order to find a way home—including a god!

(Source: Funimation)",TV,12.0,Finished Airing,"Jan 13, 2022","Mar 31, 2022",Unknown,Unknown,"asread., studio MOTHER",Light novel,"Action, Adventure, Fantasy","Harem, Isekai",Unknown,23.0,PG-13 - Teens 13 or older,7.201,106206.0,29732.0,709,287799,4075,2022.0
30831,Kono Subarashii Sekai ni Shukufuku wo!,この素晴らしい世界に祝福を！,KonoSuba God's Blessing on This Wonderful World!,"After dying a laughable and pathetic death on his way back from buying a game, high school student and recluse Kazuma Satou finds himself sitting before a beautiful but obnoxious goddess named Aqua. She provides the NEET with two options: continue on to heaven or reincarnate in every gamer's dream—a real fantasy world! Choosing to start a new life, Kazuma is quickly tasked with defeating a Demon King who is terrorizing villages. But before he goes, he can choose one item of any kind to aid him in his quest, and the future hero selects Aqua. But Kazuma has made a grave mistake—Aqua is completely useless!

Unfortunately, their troubles don't end here; it turns out that living in such a world is far different from how it plays out in a game. Instead of going on a thrilling adventure, the duo must first work to pay for their living expenses. Indeed, their misfortunes have only just begun!

[Written by MAL Rewrite]",TV,10.0,Finished Airing,"Jan 14, 2016","Mar 17, 2016","Half H.P Studio, Nippon Columbia, KlockWorx, Sony Music Communications, Toranoana, 81 Produce, Kadokawa Media House","Discotek Media, Crunchyroll",Studio Deen,Light novel,"Adventure, Comedy, Fantasy","Isekai, Parody, Reincarnation",Unknown,23.0,PG-13 - Teens 13 or older,8.121,147252.0,4152.0,38,1747536,41789,2016.0
39988,Isekai Quartet 2,異世界かるてっと2,Isekai Quartet 2,"Despite completing all the tasks given to them, Ainz Ooal Gown, Tanya Degurechaff, Kazuma Satou, Subaru Natsuki, and the other members of Class 2 are surprised to find out that their role as students is far from over. With no means of returning home, the class of eccentric personalities is still mysteriously stuck in the unfamiliar world. Although, as they are becoming quite fond of each other, spending more time together does not sound that bad.

With the unexpected arrival of new transfer students, the comedic antics of our beloved characters continue to grow. Thus, their bizarre yet nonchalant school life continues.

[Written by MAL Rewrite]",TV,12.0,Finished Airing,"Jan 15, 2020","Apr 1, 2020",Kadokawa,Funimation,Studio PuYUKAI,Original,"Comedy, Fantasy","Isekai, Parody",Unknown,11.0,PG-13 - Teens 13 or older,7.371,126588.0,21562.0,958,211849,240,2020.0
49109,Kami-tachi ni Hirowareta Otoko 2nd Season,神達に拾われた男,By the Grace of the Gods Season 2,Second season of Kami-tachi ni Hirowareta Otoko.,TV,,Not yet aired,Jan 2023,Unknown,"Lantis, Hobby Japan",Unknown,Maho Film,Light novel,"Adventure, Fantasy, Slice of Life","Isekai, Iyashikei, Reincarnation",Unknown,,PG-13 - Teens 13 or older,,,,3327,34741,285,2023.0
51462,Isekai Nonbiri Nouka,異世界のんびり農家,Unknown,"Having died of sickness at the age of 39, Machio Hiraku is given the opportunity to go to another world. When asked what his wish is by God intending to give him strength, he requests to have a healthy body, offered a second wish, he chooses to live peacefully, a third wish to be able to know the local language, and for a final wish, to be able to be a farmer.

(Source: MAL News)",TV,,Not yet aired,Jan 2023,Unknown,"Pony Canyon, Kadokawa",Unknown,Zero-G,Light novel,Fantasy,"Isekai, Reincarnation",Unknown,,None,,,,7236,5536,23,2023.0
52461,Rougo ni Sonaete Isekai de 8-manmai no Kinka wo Tamemasu,老後に備えて異世界で８万枚の金貨を貯めます,Unknown,"One day, Mitsuha falls off a cliff and is transported to a medieval Europe–type world! After a near-death encounter with a pack of wolves, she then realizes that she's able to transport between two worlds—this one and her own. Taking advantage of this ability, Mitsuha decides to live in both worlds and calculates that she'll need 80,000 gold coins to be able to retire! Mitsuha now has to come up with different ways to collect her gold coins! 

(Source: Kodansha USA)",TV,,Not yet aired,Jan 2023,Unknown,ABC Animation,Unknown,Felix Film,Light novel,Fantasy,Isekai,Unknown,,None,,,,8822,3195,9,2023.0
51495,Shin Shinka no Mi: Shiranai Uchi ni Kachigumi Jinsei,真・進化の実～知らないうちに勝ち組人生～,Unknown,Second season of Shinka no Mi: Shiranai Uchi ni Kachigumi Jinsei.,TV,,Not yet aired,Jan 2023,Unknown,Unknown,Unknown,Hotline,Light novel,"Adventure, Comedy, Fantasy, Romance",Isekai,Unknown,,PG-13 - Teens 13 or older,,,,5282,12201,63,2023.0
487,Girls Bravo: Second Season,GIRLSブラボー second season,Girls Bravo Second Season,"Small for his age, Yukinari has been bullied and abused by girls all his life. Now in high school, he has developed a rare condition: whenever girls touch him, or even come close, he breaks out in hives. Imagine his surprise, when he is suddenly transported to the city of Seiren on a mystic world invisibly orbiting the Earth, and populated with vast numbers of women and very few men. Fortunately, he has a new friend, Miharu-chan, whose touch inexplicably doesn't affect him.

(Source: ANN)",TV,13.0,Finished Airing,"Jan 27, 2005","Apr 21, 2005","WOWOW, AIC, Lantis, Kadokawa Shoten, Rakuonsha, KlockWorx, Happinet Pictures, Studio Jack","Funimation, Geneon Entertainment USA",AIC Spirits,Manga,"Comedy, Fantasy, Romance, Ecchi","Harem, Isekai, School",young boy,23.0,R+ - Mild Nudity,6.621,46917.0,56942.0,1972,87036,123,2005.0
