ID,Title,Japanese,English,Synopsis,Type,Episodes,Status,Start_Aired,End_Aired,Producers,Licensors,Studios,Source,Genres,Themes,Demographics,Duration_Minutes,Rating,Score,Scored_Users,Ranked,Popularity,Members,Favorites,year
3878,Mahou Shoujo Lalabel,魔法少女ララベル,Unknown,"Lalabel is a magical girl who arrives in the Human world to stop an evil wizard from stealing various magical objects or items. As a magical girl, she has a kitty for a companion and a magic wand. Coincidentally, she lands on the doorstep of the Tachibana couple and lives in with them during her stay in the human world. She attends the local school and begins to learn about the different things in the human world.

(Source: ANN) ",TV,49.0,Finished Airing,"Feb 15, 1980","Feb 27, 1981",Unknown,Unknown,Toei Animation,Unknown,"Comedy, Slice of Life",Mahou Shoujo,young girl,24.0,G - All Ages,6.621,508.0,57072.0,10111,1990,2,1980.0
21407,Happiness Charge Precure!,ハピネスチャージプリキュア！,Unknown,"Some time ago, the opening of a box known as the ""Axia"" set loose the previously sealed members of the Phantom Empire into the world. Rising to protect humanity from these spiteful villains are warriors known as the Precure, whose heroic feats have garnered them celebrity status on television screens across the globe.

Hime Shirayuki, princess of the kingdom where the Axia was originally held, is one such warrior who transforms into ""Cure Princess"" to battle monsters summoned by the Empire. However, Hime's timid personality often hampers her success in fending off the enemy. Frustrated with her hard luck and determined to find a Precure partner, Hime befriends Megumi Aino, a happy-go-lucky teenager. When a general of the Phantom Empire appears, Hime fails to do much in the face of his attacks. Intent on protecting her new friend, Megumi ignites her hidden potential—transforming into ""Cure Lovely.""

With their sights set on protecting the world, Megumi and Hime form a new Precure team known as the ""Happiness Charge Precure"" whilst embarking on a journey to discover true love.

[Written by MAL Rewrite]",TV,49.0,Finished Airing,"Feb 2, 2014","Jan 25, 2015",Unknown,Unknown,Toei Animation,Original,"Action, Fantasy",Mahou Shoujo,young girl,24.0,G - All Ages,6.811,4069.0,47692.0,5535,10715,54,2014.0
40610,Healin' Good♡Precure,ヒーリングっど♥プリキュア,Healin' Good Pretty Cure,"Sickly but optimistic middle school student Nodoka Hanadera has just moved to Sukoyaka City, a place famous for its healthy atmosphere. She immediately befriends two of her classmates: the gentle but athletic Chiyu Sawaizumi, whose family runs a hot spring inn, and the bubbly and fashionable daughter of a vet, Hinata Hiramitsu.

Soon after arriving, Nodoka finds an ill puppy in a forest, surrounded by three magical talking animals: Rabbirin, Penguitan, and Nyatoran. They tell her that the puppy, Princess Latte, can only be cured by defeating a nearby monster known as a ""Mega Byogen"" and purifying the land it has corrupted. Despite being powerless, Nodoka refuses to give up and let Latte suffer. 

Moved by her determination, Rabbirin forms a pact with Nodoka, allowing her to transform into a hero known as a Precure. Assuming the persona of  ""Cure Grace,"" the energized Nodoka fights off the Byogen and heals the earth, curing Latte.

As the Byogen and their leaders continue their attacks, Penguitan and Nyatoran also find their partners in Chiyu and Hinata, giving them the powers of ""Cure Fontaine"" and ""Cure Sparkle"" respectively. Now, it's up to the three Precure and their animal friends to stop the Byogen and protect the earth from their infections!

[Written by MAL Rewrite]",TV,45.0,Finished Airing,"Feb 2, 2020","Feb 21, 2021","Asatsu DK, Asahi Broadcasting, ABC Animation",Unknown,Toei Animation,Original,"Action, Fantasy",Mahou Shoujo,young girl,24.0,G - All Ages,6.891,2810.0,43942.0,5803,9595,70,2020.0
44191,Tropical-Rouge! Precure,トロピカル～ジュ！プリキュア,TROPICAL-ROUGE! PRETTY CURE,"It's an exciting day for fashionable teenager Manatsu Natsumi, who is moving into the big city for the first time. Upon arriving, Manatsu is immediately charmed by the city's spectacles. However, things take an unbelievable turn when she encounters Laura—a real-life mermaid!

Laura is searching for the Precure, a group of radiant warriors who may have the key to rescuing Grand Ocean, Laura's home. This duty soon falls upon Manatsu, whose unwavering determination causes her to awaken as one of the Precure: the vivid Cure Summer. As new friends join the team, Manatsu needs to adapt to her hectic, new life while protecting humanity's liveliness from oceanic invaders! With each battle more difficult than the last, the girls must discover what is truly valuable to them.

[Written by MAL Rewrite]",TV,46.0,Finished Airing,"Feb 28, 2021","Jan 30, 2022","ABC Animation, ADK Emotions",Unknown,Toei Animation,Original,"Action, Fantasy",Mahou Shoujo,young girl,24.0,G - All Ages,7.341,2717.0,22672.0,5796,9609,115,2021.0
3692,Yes! Precure 5 GoGo!,Yes! プリキュア5 GoGo!,Unknown,"A direct continuation of the former season, this series again follows the story of Nozomi Yumehara and her friends from Yes! Precure 5. The girls who had formerly lost their powers and bade farewell to their friends Coco and Nuts from Palmier Kingdom are resurrected as Pretty Cure by the mysterious woman Flora who also wants them to find her in a place called Cure Rosegarden. To go there, they need the magic Rose Pact and the powers of the four kings of countries surrounding Palmier. But a dark organization called Eternal is also striving to get to Cure Rosegarden by stealing the Rose Pact. Luckily, Precure get helped by new allies: the delivery-boy Syrup who can change into a giant bird and fly them anywhere they want and the mysterious and beautiful fighter Milky Rose stand alongside Pretty Cure to protect what is really valuable.",TV,48.0,Finished Airing,"Feb 3, 2008","Jan 25, 2009",Asahi Broadcasting,Unknown,Toei Animation,Original,"Action, Fantasy","Mahou Shoujo, School",young girl,24.0,G - All Ages,7.171,3737.0,31202.0,5801,9597,32,2008.0
11285,Black★Rock Shooter (TV),ブラック★ロックシューター,Black Rock Shooter,"On the first day of junior high school, Mato Kuroi happens to run into Yomi Takanashi, a shy, withdrawn girl whom she immediately takes an interest in. Mato tries her best to make conversation with Yomi, wanting to befriend her. At first, she is avoided, but the ice breaks when Yomi happens to notice a decorative blue bird attached to Mato's phone, which is from the book ""Li'l Birds At Play."" Discovering they have a common interest, the two form a strong friendship.

In an alternate universe, the young girls exist as parallel beings, Mato as Black★Rock Shooter, and Yomi as Dead Master. Somehow, what happens in one world seems to have an effect on the other, and unaware of this fact, the girls unknowingly become entangled by the threads of fate.

[Written by MAL Rewrite]",TV,8.0,Finished Airing,"Feb 3, 2012","Mar 23, 2012","Aniplex, Dentsu, Fuji TV, Toho, Ultra Super Pictures, Sony Music Entertainment, Fujipacific Music, MAGES., Good Smile Company",Discotek Media,"Ordet, SANZIGEN",Other,"Action, Drama","Mahou Shoujo, Super Power",Unknown,23.0,PG-13 - Teens 13 or older,6.811,169312.0,47592.0,584,336828,2121,2012.0
16419,Dokidoki! Precure,ドキドキ! プリキュア,Glitter Force Doki Doki,"Middle schooler Mana Aida is known for her vivid passion and kind-hearted disposition, especially by her friends Rikka Hishikawa and Alice Yotsuba. While the girls are on a school field trip, otherworldly villains from the ""Trump Kingdom"" appear and create giant monsters from the civilians' selfish desires to cause havoc. 

In the midst of finding a way to stop the destruction, Mana encounters ""Cure Sword,"" a mysterious Precure warrior. As Cure Sword engages in combat with the monsters, Mana meets Cure Sword's fairy allies, who tell her that she also has the ability to transform into a warrior herself. When Trump Kingdom's invaders begin to outnumber Cure Sword, Mana takes to the battleground with resolve. She partners with Sharuru, one of the fairies, and transforms into ""Cure Heart""—the Precure of Love. 

In her attempts to ally with Cure Sword, Mana ends up pulling Rikka and Alice into the fray, whom each partner with a fairy ally to transform into ""Cure Diamond"" and ""Cure Rosetta,"" respectively. Together, they battle against the Trump Kingdom invaders to protect the love in the world from being destroyed.

[Written by MAL Rewrite]",TV,49.0,Finished Airing,"Feb 3, 2013","Jan 26, 2014",Asahi Broadcasting,Saban Entertainment,Toei Animation,Original,"Action, Fantasy",Mahou Shoujo,young girl,24.0,G - All Ages,6.621,10668.0,56912.0,4019,23344,132,2013.0
38578,Star☆Twinkle Precure,スター☆トゥインクルプリキュア,Unknown,"Hikaru Hoshina is an energetic middle school student with a love for space and the occult. As she draws constellations in her notebook, a small and fluffy creature suddenly appears from it! The creature, which she names Fuwa, turns out to be an alien with the ability to create warp holes. 

When Fuwa's companions, the aliens Lala Hagoromo and Prunce, arrive on Earth, they declare that they are searching for the Precure, legendary warriors who will save the universe. But an organization known as the Notraiders soon follows and attacks, intending to capture Fuwa and its power. Overcome by a desire to protect Fuwa, Hikaru finds herself transforming into ""Cure Star,"" one of the Precure that Lala and the others have been searching for!

It is now up to Hikaru and the rest to fend off the Notraiders' onslaught, discover the rest of the Precure, and find the Star Color Pens, artifacts that will awaken the 12 Star Princess who keep the universe in balance.

[Written by MAL Rewrite]",TV,49.0,Finished Airing,"Feb 3, 2019","Jan 26, 2020","TV Asahi, Echoes",Unknown,Toei Animation,Original,"Action, Fantasy",Mahou Shoujo,young girl,24.0,G - All Ages,7.481,3143.0,17252.0,5764,9760,149,2019.0
1932,Yes! Precure 5,Yes! プリキュア5,Yes! Precure 5,"Yumehara Nozomi, a regular student, finds a magical book called the Dream Collet in the library and meets Coco and Nuts, two creatures from the Palmier Kingdom. They plead with Nozomi to restore their world, which has been destroyed by an organization called the Nightmares, by completing the Dream Collet and finding the 55 Pinkies to make any wish come true. Meanwhile, the Nightmares are moving into the real world. Once Nozomi agrees to help, Coco and Nuts transform her into the magical girl Cure Dream and turn four fellow students into her Pretty Cure team.

(Source: ANN)",TV,49.0,Finished Airing,"Feb 4, 2007","Jan 27, 2008",Asahi Broadcasting,Unknown,Toei Animation,Original,"Action, Fantasy","Mahou Shoujo, School",young girl,24.0,G - All Ages,7.181,6253.0,30752.0,4801,15467,88,2007.0
36593,Hug tto! Precure,HuGっと！プリキュア,Unknown,"It's her first day at a new school, and the cheerful Hana Nono is ready to make a fresh start, dreaming of becoming mature and reliable—a far cry from her usual childish self. Although she makes a disastrous first impression, Hana soon befriends two of her classmates: the gentle and studious class representative Saaya Yakushiji, and a cool and mysterious girl Homare Kagayaki.

That night, a magical baby falls from the sky right onto Hana's balcony. She is immediately smitten with her and names her Hug-tan. Alongside Hug-tan is a snarky talking hamster, Hariham Harry, who mutters that Hana ""isn't the one"" before vanishing with the baby.

The next day, Hana believes the encounter to be a dream, until people all over the city begin collapsing and a giant monster appears, feeding on their energy. As Hana escapes, she spots Hug-tan and Harry under attack. Making a stand to protect them, she and Hug-tan suddenly both glow with energy and a heart-shaped gem forms.

With the crystal's power, Hana transforms into a hero called ""Cure Yell"" and defeats the monster. Surprised at Hana's power, Harry explains that he and Hug-tan came from a future frozen in time by the Criasu Corporation, the same organization that created the monster. Only the Future Crystals, manifestations of one's hopes and dreams, and the Precure they create have a chance at defeating Criasu and saving the future!

[Written by MAL Rewrite]",TV,49.0,Finished Airing,"Feb 4, 2018","Jan 27, 2019","Asahi Broadcasting, ABC Animation, Echoes",Unknown,Toei Animation,Original,"Action, Fantasy",Mahou Shoujo,young girl,24.0,G - All Ages,7.791,4359.0,8982.0,4936,14371,231,2018.0
1534,Futari wa Precure: Splash☆Star,ふたりはプリキュア Splash☆Star,Unknown,"During the summer festival five years ago, two girls met at a mysterious tree and saw two glowing spheres. Now, these two girls--Saki Hyuuga, ace pitcher on the school softball team; and Mai Mishou, who prefers sketching over stargazing--are chosen by the spirits of flowers (Flappy) and birds (Choppy) to restore the Seven Fountains and save their worlds from Dark Autumn. Together, they are the NEW Pretty Cure.

(Source: ANN)",TV,49.0,Finished Airing,"Feb 5, 2006","Jan 28, 2007",Asahi Broadcasting,Unknown,Toei Animation,Original,"Action, Comedy, Fantasy",Mahou Shoujo,young girl,24.0,G - All Ages,7.181,4836.0,30882.0,5290,12117,76,2006.0
12191,Smile Precure!,スマイルプリキュア,Glitter Force,"To teenager Miyuki Hoshizora, fairy tales are a world of wondrous encounters and happy endings. Inspired by her love for these stories, she lives every day searching for happiness. While running late on her first day of school as a transfer student, Miyuki meets Candy—a mysterious fairy from the world of fairy tales, Märchenland. However, when Candy disappears as quickly as she appeared, Miyuki is left believing the encounter was only a dream.

After an eventful first day, Miyuki finds a mysterious library at school. While combing through the bookshelves, she is transported next to Candy, who claims to be searching for the so-called legendary warriors, Precure. When forced to protect Candy's and everyone else's happiness, Miyuki transforms into ""Cure Happy,"" one of the Precure warriors! As Cure Happy, Miyuki is now tasked with finding the other legendary warriors and protecting the world from destruction, all while possibly discovering her very own happy ending.

[Written by MAL Rewrite]",TV,48.0,Finished Airing,"Feb 5, 2012","Jan 27, 2013",Saban Brands,Unknown,Toei Animation,Original,"Action, Fantasy",Mahou Shoujo,young girl,24.0,G - All Ages,6.741,19158.0,50892.0,3140,38527,333,2012.0
34290,Kirakira☆Precure A La Mode,キラキラ☆プリキュアアラモード,Unknown,"Cheerful teenager Ichika Usami has a passion for sweets that is inspired by her mother's baking. In celebration of her mother's return from overseas, she tries her hand at making a cake herself. She is interrupted when a dog-like fairy named Pekorin crashes into her kitchen. With Pekorin's help, Ichika successfully bakes her cake. Only then enters an imp named Gummy who bursts in and attempt to steal the cake's ""kirakiraru"", a magical power that gives sweets the ability to bring happiness.

Though Ichika initially offers her cake to Gummy in order to protect Pekorin, the fairy helps her realize how important the treat is and the love it represents. As the kirakiraru within Ichika's cake grows, it changes into a set of trinkets that transforms her into Cure Whip, a hero known as a Pretty Cure. Using her newfound powers, she goes on to battle kirakiraru thieves whenever they appear. Ichika fights to protect Ichigozaka's sweets and finds colorful new allies along the way.

[Written by MAL Rewrite]
",TV,49.0,Finished Airing,"Feb 5, 2017","Jan 28, 2018","Asatsu DK, Asahi Broadcasting, ABC Animation, Echoes",Unknown,Toei Animation,Original,"Action, Fantasy, Gourmet, Slice of Life",Mahou Shoujo,young girl,24.0,G - All Ages,7.061,3647.0,36432.0,5521,10861,116,2017.0
1929,Futari wa Precure: Max Heart,ふたりはプリキュア ー マックスハート,Unknown,"Shortly after the fall of the Wicked King, the Queen of the Garden of Light lost her memory and came to Earth, in the form of a 12-year-old girl named Hikari Kujou. Now, she—with the help of Nagisa and Honoka, endowed with new costumes and powers—must find the 12 Heartiels, which hold the key to restoring the Queen's lost memories. For together once again, they are Pretty Cure.

(Source: AniDB)",TV,47.0,Finished Airing,"Feb 6, 2005","Jan 29, 2006",Asahi Broadcasting,Unknown,Toei Animation,Original,"Action, Comedy, Fantasy",Mahou Shoujo,young girl,24.0,G - All Ages,6.971,7196.0,40292.0,4660,16704,36,2005.0
9893,Suite Precure♪,スイート プリキュア♪,Unknown,"Major Land is a colorful world of music where instruments and notes come to life. During an annual concert event, Hummy, the cat songstress of Major Land, prepares to sing the ""Melody of Happiness,"" capable of spreading happiness to worlds beyond. However, Mephisto, the king of Minor Land, interrupts the event and rewrites the score into the ""Melody of Sorrow""—a dissonant composition that would instead cause despair when performed. In order to prevent this from happening, Hummy is tasked with finding the Precure, renowned warriors with an unmatched passion for music, and recreating the Melody of Happiness.

Hummy arrives in Kanon Town, home of musically-inclined athlete Hibiki Houjou and studious baker Kanade Minamino. Engaging only in endless bickers, Hibiki and Kanade were formerly best friends and have since fallen out of touch. Their activities are stopped short by an unwelcome guest—the songstress of Minor Land, Siren. 

When Siren turns an important record into a gigantic monster, the girls' hearts resonate with the desire to protect what they hold dear and the two transform into the Suite Precure! As legendary warriors, Hibiki and Kanade will have to put their personal squabbles aside if they wish to protect the happiness of the world.

[Written by MAL Rewrite]",TV,48.0,Finished Airing,"Feb 6, 2011","Jan 29, 2012",Unknown,Unknown,Toei Animation,Original,"Action, Fantasy",Mahou Shoujo,young girl,24.0,G - All Ages,7.291,5590.0,25082.0,4928,14445,112,2011.0
50281,Delicious Party♡Precure,デリシャスパーティ♡プリキュア,Unknown,"The mysterious, delicious world of CooKingdom, which rules over all the cuisine in this world. CooKingdom has closely guarded the Recipe-Bon, in which it's written how to prepare any dish. But, oh no! One day, it gets stolen by the Bundoru Gang! The Bundoru Gang plans to monopolize everything for themselves, and their next target is the Cuisine Fairy Recipeppi... The Energy Fairies have come to Oishi-Na Town in the human world in search of the Recipe-Bon. With their help, an unexpected turn of events leads to three ordinary girls transforming into Pretty Cures! They stand up to the Bundoru Gang, to recover the Recipe-Bon, and to protect everyone's delicious smiles! 

(Source: Toei Animation USA)",TV,,Currently Airing,"Feb 6, 2022",Unknown,"TV Asahi, Asatsu DK, ABC Animation, ADK Emotions",Asahi Broadcasting,Toei Animation,Original,"Action, Fantasy",Mahou Shoujo,young girl,24.0,G - All Ages,7.201,1084.0,29782.0,6761,6607,80,2022.0
31884,Mahoutsukai Precure!,魔法つかいプリキュア！,Maho Girls Precure!,"In the human realm, witches and wizards seem to be mere creations of fantasy. Ever the adventurous teenager, Mirai Asahina sets out to disprove this notion by following the tracks of a peculiar shooting star that had fallen the night before. Sure enough, Mirai soon has a chance encounter with Liko—a clumsy witch apprentice who hails from the Magic World, a colorful realm inhabited by magicians.

As if by fate, the appearance of strange villains forces Mirai and Liko to join hands. In doing so, they unleash their strength as a pair of legendary magicians—the ""Maho Girls Precure!"" Now gifted with unbelievable power, the unlikely duo embarks on an adventure filled with magical spells and powerful gemstones. Along the way, the two girls discover the hidden marvels that tie their individual worlds together.

[Written by MAL Rewrite]",TV,50.0,Finished Airing,"Feb 7, 2016","Jan 29, 2017",ABC Animation,Unknown,Toei Animation,Original,"Action, Fantasy, Slice of Life","Mahou Shoujo, School",young girl,24.0,G - All Ages,7.211,3806.0,29182.0,5316,11961,90,2016.0
3112,Papillon Rose,パピヨンローゼ,Papillon Rose,"The story takes place one year after the OVA.

Because of the previous war, Kabucki-cho was devastated, and the owner abandoned his lingerie pub, ""Pallion,"" and opened ""New Papillion"" in Akihabara. During the war, Tsubomi, and her colleagues Anne and Shizuku lost their memories, and they began new lives in Akihabara.

On the other hand, the Susano, aliens who were invading the Earth, appeared. They turned a UMA (Unidentified Mysterious Animal) into a monster and make it raid on Akihabara. Rama the cat made Tsubomi and her buddies retrieve their memories, and let them fight against the monster as Lingerie Soldiers.

(Source: AnimeNfo)",TV,6.0,Finished Airing,"Feb 9, 2006","Mar 17, 2006",Unknown,Maiden Japan,Studio Kelmadick,Other,"Comedy, Ecchi","Mahou Shoujo, Parody",Unknown,24.0,R+ - Mild Nudity,4.521,1067.0,128962.0,8274,3914,3,2006.0
31890,Nurse Witch Komugi-chan R,ナースウィッチ小麦ちゃんR,Unknown,"The new ""slapstick"" story will depict Komugi-chan and her rivals as they juggle their daily lives as students, idols, and magical girls ""with laughter and tears.""

Komugi Yoshida is a somewhat clumsy second-year middle-school student whose strong point is her spiritedness. She performs as an idol like Kokona Saionji (her classmate and close friend) and Tsubasa Kisaragi (an idol who dresses in male clothing). However, unlike Kokona whose popularity is skyrocketing and Tsubasa with her charisma in male attire, Komugi's only gigs are low-end ones like those at the local shopping district. Still, Komugi has her ""dream"" as she lives her dual lives as a idol and a middle school girl.

One day, a mysterious injured creature named Usa-P appears before Komugi. Komugi gives Usa-P medical treatment, and Usa-P, in consideration of Komugi's kindness, asks if she wants to be a Legendary Girl who can use magical powers.

Having become a reluctant Legendary Girl, Komugi battles strange masked figures who suddenly appear! As a newly deemed Magical Nurse, she fights still more waves of masked figures. Meanwhile, a Magical Maid, a Magical Sister, and more also appear to make it a three-way battle!? Can Komugi handle the three roles of middle school girl, idol, and Magical Nurse? And, what lies ahead in these battles and her ""dream""...?!

(Source: ANN)",TV,12.0,Finished Airing,"Jan 10, 2016","Mar 27, 2016","VAP, Nippon Television Network",Sentai Filmworks,Tatsunoko Production,Original,Comedy,"Gag Humor, Mahou Shoujo, Parody",Unknown,22.0,PG-13 - Teens 13 or older,5.981,4072.0,91392.0,5287,12125,14,2016.0
31793,Mahou Shoujo Nante Mou Ii Desukara.,魔法少女なんてもういいですから。,Mahou Shoujo Nante Mouiidesukara,"Yuzuka Hanami is a young, carefree girl who lives the most ordinary life imaginable. Although her father works around the clock and her mother is rarely home, she still enjoys herself and strives to be an excellent student.

Miton, on the other hand, is an alien life-form with the ability to transform his master into a magical girl, a warrior who fights evil wherever it may appear. However, there are not as many enemies as there used to be, so Miton has been out of work for a while. Starving and homeless, he has taken up residence in a pile of garbage.

As Yuzuka walks past him one day, Miton seizes the opportunity to offer his services to the young girl. Yuzuka reluctantly agrees, but when she transforms into a magical girl and discovers that her outfit is a swimsuit, she begins to have second thoughts about what she has gotten herself into!

[Written by MAL Rewrite]",TV,12.0,Finished Airing,"Jan 12, 2016","Mar 29, 2016","Earth Star Entertainment, F.M.F",Unknown,Pine Jam,Web manga,Comedy,Mahou Shoujo,Unknown,4.0,PG-13 - Teens 13 or older,5.931,11470.0,93922.0,3883,25157,18,2016.0
3573,Moegaku★5,もえがく★５,Unknown,"A Tokyo school girl named Tukishima Moe obtains the ability of becoming a magical girl with the help of Lulue. Her duty is to protect Akihabara, the source of moe energy, from falling into the evil hands.

Note: This is a hybrid anime/live-action television series based on the Moegaku language-learning software.

The series further the original concept by expanded language study to include English, Korean, Spanish, Chinese, and French.

(Source: Wikipedia)",TV,40.0,Finished Airing,"Jan 14, 2008","Mar 3, 2008",Unknown,Unknown,AIC Spirits,Unknown,Unknown,"Mahou Shoujo, Parody",Unknown,7.0,G - All Ages,5.431,194.0,113312.0,11664,1096,0,2008.0
