ID,Title,Japanese,English,Synopsis,Type,Episodes,Status,Start_Aired,End_Aired,Producers,Licensors,Studios,Source,Genres,Themes,Demographics,Duration_Minutes,Rating,Score,Scored_Users,Ranked,Popularity,Members,Favorites,year
577,Kagi Hime Monogatari: Eikyuu Alice Rondo,鍵姫物語 永久アリス輪舞曲,Eternal Alice,"Average high school student Aruto Kirihara is obsessed with the Alice stories, written in this alternate world by the enigmatic recluse, Alternite L. Tachyon. One night, while writing his own version of a potential ""third book,"" he sees a girl flying in front of a full moon... and she looks just like the ""Alice"" in his imagination. Aruto runs out of his house and chases the flying figure from the ground, ending up at a library, where he witnesses her in combat with another costumed girl.

And so begins his sudden introduction to the world of Alices, an elite club of super-powered teenage girls who regularly fight in an extra-dimensional Wonderland in order to steal each other's ""hidden stories."" When all of the stories have been gathered, they will form the legendary third volume, ""Eternal Alice,"" and the possessor will be granted one wish.

It probably won't be Aruto, who can't turn into a magical girl. But it could be his doting little sister, Kiraha. Or maybe the girl of his dreams, Arisu...

(Source: Discotek Media)",TV,13.0,Finished Airing,"Jan 4, 2006","Mar 29, 2006",Mellow Head,Discotek Media,"Trinet Entertainment, Picture Magic",Manga,Fantasy,Mahou Shoujo,Unknown,24.0,PG-13 - Teens 13 or older,6.141,2483.0,83292.0,6214,8099,17,2006.0
38256,Magia Record: Mahou Shoujo Madoka☆Magica Gaiden,マギアレコード 魔法少女まどか☆マギカ外伝 (TV),Magia Record Puella Magi Madoka Magica Side Story,"Rumor has it that if a young girl strikes a bargain with a white fairy, it will grant any wish her heart desires. However, in exchange, she will become a magical girl and must put her life on the line to slay fearsome and ferocious witches.

Iroha Tamaki, a kind-hearted middle schooler from Takarazaki City, is living proof that these rumors are true. Armed with a magical crossbow and the ability to heal injuries, Iroha seeks out the labyrinths where witches hide and defeats them before they can prey on humans. Yet Iroha has no memory of her wish, and even Kyuubey, the white fairy himself, seems to have no idea what Iroha requested of him.

One day, Iroha hears rumors of a city where ""magical girls can be saved,"" and finds herself on a sunset train to Kamihama City. Unfortunately, she discovers that the witches in Kamihama are far more powerful than usual. After veteran magical girl Yachiyo Nanami is forced to save her, Iroha vows to never return. But when a chance encounter with a tiny Kyuubey seems to trigger distant memories, Iroha is compelled to investigate the mysterious city despite the danger.

[Written by MAL Rewrite]",TV,13.0,Finished Airing,"Jan 5, 2020","Mar 29, 2020","Aniplex, Houbunsha, f4samurai",Aniplex of America,Shaft,Game,"Drama, Suspense","Mahou Shoujo, Psychological",Unknown,23.0,PG-13 - Teens 13 or older,6.791,49651.0,48632.0,1364,143606,748,2020.0
9756,Mahou Shoujo Madoka★Magica,魔法少女まどか★マギカ,Puella Magi Madoka Magica,"Madoka Kaname and Sayaka Miki are regular middle school girls with regular lives, but all that changes when they encounter Kyuubey, a cat-like magical familiar, and Homura Akemi, the new transfer student.

Kyuubey offers them a proposition: he will grant any one of their wishes and in exchange, they will each become a magical girl, gaining enough power to fulfill their dreams. However, Homura Akemi, a magical girl herself, urges them not to accept the offer, stating that everything is not what it seems.

A story of hope, despair, and friendship, Mahou Shoujo Madoka★Magica deals with the difficulties of being a magical girl and the price one has to pay to make a dream come true.

[Written by MAL Rewrite] ",TV,12.0,Finished Airing,"Jan 7, 2011","Apr 22, 2011","Aniplex, Mainichi Broadcasting System, Movic, Nitroplus, Houbunsha",Aniplex of America,Shaft,Original,"Drama, Suspense","Mahou Shoujo, Psychological",Unknown,24.0,PG-13 - Teens 13 or older,8.361,694267.0,1902.0,93,1179480,50364,2011.0
33354,Cardcaptor Sakura: Clear Card-hen,カードキャプターさくら クリアカード編,Cardcaptor Sakura Clear Card,"With all of the Clow Cards recaptured and changed into her own Sakura Cards, Sakura Kinomoto now enters her first year at Tomoeda Middle School. After her initial day of classes, Sakura reunites with her love Shaoran Li, who informs her that he is permanently moving back to Tomoeda. Much to her surprise, it even turns out that Shaoran will attend the same school and it seems as if Sakura's life is heading in all the right directions.

However, when Sakura goes to sleep, she encounters in her dream a mysterious cloaked figure and finds herself surrounded by transparent cards. Waking up in fear, Sakura is shocked to see her dream has come true, with the Sakura Cards having turned clear. Continued dreamlike encounters with the unknown enemy and her gaining a new magical key sets the stage for Cardcaptor Sakura's latest adventure!

[Written by MAL Rewrite]
",TV,22.0,Finished Airing,"Jan 7, 2018","Jun 10, 2018","NHK, Kodansha, NHK Enterprises",Funimation,Madhouse,Manga,"Adventure, Comedy, Fantasy, Romance",Mahou Shoujo,young girl,25.0,PG - Children,7.651,41286.0,12222.0,1658,111219,586,2018.0
2044,Mahou no Tenshi Creamy Mami,魔法の天使 クリィミーマミ,Magical Angel Creamy Mami,"Creamy Mami is about a young girl, Yuu, who after seeing a spaceship is given the power to use magic for one year. She is also given 2 cats, Poji and Nega, to watch over and guide her. Using her magic powers to transform into the idol Creamy Mami, Yuu must work hard at acting, singing, helping her parents at their crepe shop, fighting aliens and bad guys, going to school, plus try to get the affections of her childhood friend Toshio.

(Source: ANN)",TV,52.0,Finished Airing,"Jul 1, 1983","Jun 29, 1984",Kodansha,Unknown,Pierrot,Original,"Comedy, Fantasy, Romance, Sci-Fi","Idols (Female), Mahou Shoujo, School",young girl,24.0,G - All Ages,7.231,3654.0,27832.0,5139,13019,133,1983.0
20509,Fate/kaleid liner Prisma☆Illya 2wei!,Fate/kaleid liner プリズマ☆イリヤ ツヴァイ!,Fate/Kaleid Liner Prisma Illya 2Wei!,"Another lovely summer goes by for Illyasviel von Einzbern. Taking a break from her magical girl duties, she enjoys her time off after collecting the Class Cards with her best friend Miyu Edelfelt. 

However, her break comes to an abrupt end when she and Miyu are abducted by Rin Toosaka and Luviagelita Edelfelt, while out with her friends. The magical girls learn that their work is far from over, as Clock Tower informs them that the out of control mana thought to have been sealed continues to be dispersing throughout Fuyuki City. After heading to the origin point of the out of control mana, Illya and Miyu are tasked with solving the anomaly. 

But after casting their spell, Illyasviel discovers that she's split into two people! As this mysterious new form darts off, she can only wonder: what is to come from the existence of her dopplegänger, running amok in the unsuspecting town?

[Written by MAL Rewrite]",TV,10.0,Finished Airing,"Jul 10, 2014","Sep 11, 2014","Lantis, Kadokawa Shoten, AT-X, DAX Production, KlockWorx, Tokyo MX, Kadokawa Media House",Sentai Filmworks,SILVER LINK.,Manga,"Action, Comedy, Fantasy",Mahou Shoujo,Unknown,23.0,PG-13 - Teens 13 or older,7.241,80310.0,27462.0,1312,151070,253,2014.0
39071,Machikado Mazoku,まちカドまぞく,The Demon Girl Next Door,"After a strange dream of a mysterious ancestor, high school student Yuuko Yoshida wakes to see that she has grown demonic horns and a tail. Dazed and confused, her mother reveals to her a dark family secret: her family is descended from a Dark Clan that was banished to live powerless and destitute by their mortal enemies, the magical girls of the Light Clan. The only way to lift their ancestry's curse is for Yuuko to find a magical girl, murder her, and splatter her blood all over her ancestor's Demon God statue.

Fortunately for ""Shadow Mistress Yuuko,"" a magical girl saves her from being run over by an oncoming truck. Unfortunately, Momo Chiyoda happens to be Yuuko's classmate at Sakuragaoka High and is much stronger than her in both strength and endurance. Taking pity on her wimpy assailant, the magical girl agrees to train Yuuko and help her unlock her dormant powers. Now, Yuuko must rise up and defeat her generous frenemy to save her family from the terrible grip of poverty.

[Written by MAL Rewrite]
",TV,12.0,Finished Airing,"Jul 12, 2019","Sep 27, 2019","Pony Canyon, TBS, Houbunsha, Medicos Entertainment, RAY",Sentai Filmworks,J.C.Staff,4-koma manga,"Comedy, Slice of Life",Mahou Shoujo,Unknown,24.0,PG-13 - Teens 13 or older,7.651,54722.0,12062.0,1378,141707,1008,2019.0
14829,Fate/kaleid liner Prisma☆Illya,Fate/kaleid liner プリズマ☆イリヤ,Fate/Kaleid Liner Prisma Illya,"Mage's Association members Rin Toosaka and Luviagelita ""Luvia"" Edelfelt are tasked with finding and retrieving seven Class Cards, medieval artifacts containing the life essence of legendary Heroic Spirits. To aid them in their mission, they are granted the power of Ruby and Sapphire, two sentient Kaleidosticks that would enable them to transform themselves into magical girls and drastically increase their abilities. However, the two mages are on anything but good terms, prompting the Kaleidosticks to abandon them in search for new masters. They stumble upon two young schoolgirls—Illyasviel von Einzbern and Miyu—and quickly convince them to form a contract. With their new powers and responsibilities, Illya and Miyu set forth to collect all the Class Cards.

[Written by MAL Rewrite]
",TV,10.0,Finished Airing,"Jul 13, 2013","Sep 14, 2013","Lantis, Kadokawa Shoten, AT-X, DAX Production, KlockWorx, Notes, Dwango, Tokyo MX, Docomo Anime Store, Kadokawa Media House",Sentai Filmworks,SILVER LINK.,Manga,"Action, Comedy, Fantasy",Mahou Shoujo,Unknown,24.0,PG-13 - Teens 13 or older,7.051,115872.0,36862.0,798,256182,998,2013.0
27525,Fate/kaleid liner Prisma☆Illya 2wei Herz!,Fate/kaleid liner プリズマ☆イリヤ ツヴァイ ヘルツ！,Fate/Kaleid Liner Prisma Illya 2Wei Herz!,"Based on the Fate/Kaleid Liner Prisma☆Illya 2wei! manga by Hiroshi Hiroyama, which is a spin-off of the Fate/stay night erotic visual novel by Type-Moon.",TV,10.0,Finished Airing,"Jul 25, 2015","Sep 26, 2015","Lantis, Kadokawa Shoten, AT-X, DAX Production, KlockWorx, Tokyo MX, Kadokawa Media House",Sentai Filmworks,SILVER LINK.,Manga,"Action, Comedy, Fantasy, Slice of Life",Mahou Shoujo,Unknown,23.0,PG-13 - Teens 13 or older,7.191,68064.0,30142.0,1454,131439,241,2015.0
1688,Nanatsu-iro★Drops,ななついろ★ドロップス,Unknown,"Tsuwabuki is a normal student, though not very social. One day he meets a new transfer student, named Sumomo Akihime, and another girl, both the only members of the gardening club. Tsuwabuki is forced by a teacher to join this club. But then he bumps into a strange guy with dog ears, switching his drink with they guy's by mistake. Drinking it, he is turned in a stuffed animal. The teacher tells him that the only way to turn back to normal is to find the chosen girl and let her catch the seven stardrops. This girl is Sumomo, that accepts to help him, though she's not allowed to know the animal's true identity. 

(Source: ANN)",TV,12.0,Finished Airing,"Jul 3, 2007","Sep 18, 2007",Unknown,Unknown,Diomedéa,Visual novel,Romance,"Mahou Shoujo, School",Unknown,24.0,PG-13 - Teens 13 or older,7.001,8743.0,39342.0,4143,21832,92,2007.0
48193,Mabeobsonyeo Dee Dee,마법소녀 디디,Unknown,Unknown,TV,13.0,Finished Airing,"Jul 30, 2020","Nov 26, 2020",Unknown,Unknown,Unknown,Original,Fantasy,Mahou Shoujo,Kids,,PG - Children,,,131952.0,20567,38,0,2020.0
614,Okusama wa Mahou Shoujo,奥さまは魔法少女,Madam is a Magical Girl,"Ureshiko Asaba, 26 years old, married. Few people know the fact that she is a magical girl named ""Agnes"", and she is actually the guardian of the town where she lives. One day she meets Sayaka Kurenai, aka ""Cruje"", another magical girl appointed by the magic realm as the legitimate sucessor to her position, but Agnes is reluctant in letting her assume because she knows that Cruje has orders to erase the whole place, including its human inhabitants with the purpose of creating a new one. To complicate matters, Ureshiko must deal with the growing distance between her and her husband, Tamotsu, her crescent feelings for Tatsumi Kagura, a young man who is now living as a tenant in her home, and the fact that in the moment she ever kisses a common human, she would lose her powers forever. 

(Source: ANN)",TV,13.0,Finished Airing,"Jul 4, 2005","Sep 26, 2005","Media Factory, Amber Film Works",Unknown,J.C.Staff,Original,Romance,Mahou Shoujo,Unknown,24.0,PG-13 - Teens 13 or older,6.371,2579.0,70982.0,5969,8976,11,2005.0
2039,Mahou no Yousei Persia,魔法の妖精 ペルシャ,Unknown,"11-year-old Persia has grown up alongside the animals on the Serengeti plains of Africa. Twins Riki and Gaku Muroi and their grandfather, Gouken, bring Persia to Japan with them, where she will live with a couple (who Persia calls Mama and Papa) that own a grocery store. During the flight to Japan, Persia finds herself in the ""Lovely Dream"" where she meets the Fairy Queen, who explains that the Lovely Dream is in danger and requests Persia's help. Giving Persia a magical headband (which can also summon a magical baton) that allows her to transform into a teenage girl, connecting her to the Lovely Dream and allowing her to use magic. She is sent with three kappa back into the regular world with the mission of collecting love energy to thaw the frozen Lovely Dream. If Persia fails her task of collecting love energy or if someone catches her using magic, Riki and Gaku will be transformed into women.

(Source: ANN)",TV,48.0,Finished Airing,"Jul 6, 1984","May 31, 1985",Unknown,Unknown,Pierrot,Original,Comedy,Mahou Shoujo,Unknown,24.0,PG - Children,7.021,686.0,38112.0,9110,2864,12,1984.0
19207,Maji de Otaku na English! Ribbon-chan: Eigo de Tatakau Mahou Shoujo - The TV,マジでオタクなイングリッシュ! りぼんちゃん ~英語で戦う魔法少女~ the TV,Unknown,"The story centers around Ribbon-chan, a girl struggling with English who becomes a magical girl when she makes a contract with a self-described familiar named Toner. She aims to become a super heroine who can fill the Tokyo Dome arena with her singing and dancing.

(Source: ANN)",TV,10.0,Finished Airing,"Jul 6, 2013","Sep 7, 2013","AIC, AIR AGENCY",Unknown,AIC Frontier,Unknown,Comedy,Mahou Shoujo,Unknown,4.0,PG-13 - Teens 13 or older,5.291,1034.0,117532.0,8777,3209,2,2013.0
17651,Genei wo Kakeru Taiyou,幻影ヲ駆ケル太陽,Day Break Illusion,"Akari Taiyou is an apprentice fortune teller living with her aunt, uncle, and their daughter Fuyuna. Having lost her mother at a young age, the only thing Akari has left of her is a deck of tarot cards and a dream to follow in her footsteps as a fortune teller.

One night, Akari has a dream of being attacked by a plant monster and witnesses a stronger version of herself defeat it. When she awakens, she discovers to her horror that the monster was actually Fuyuna. But mysteriously, Akari and her relatives soon forget Fuyuna ever existed. After another close encounter with a similar monster, she is rescued by three magical girls: Ginka Shirokane, Seira Hoshikawa, and Luna Tsukuyomi. They explain that they are from the Sefiro Fiore organization, which uses Elemental Tarot power to fight the evil creatures known as ""Daemonia.""

Akari discovers she too is a magical girl and has inherited her mother's power of The Sun card. However, she comes to realize Daemonia are actually people who have been possessed, and she must decide whether to try to save what is left of their humanity or to wipe them from existence. As Akari comes to terms with her grim duty of protecting the world from Daemonia, the bonds of the organization and that of their team will soon be strained when they deal with grave threats from the outside and from within.

[Written by MAL Rewrite]",TV,13.0,Finished Airing,"Jul 6, 2013","Sep 28, 2013","Aniplex, Nihon Ad Systems, Bushiroad, Good Smile Company, Asahi Broadcasting",Aniplex of America,AIC,Original,Unknown,Mahou Shoujo,Unknown,24.0,R - 17+ (violence & profanity),6.401,19839.0,69642.0,2666,51969,125,2013.0
31706,Fate/kaleid liner Prisma☆Illya 3rei!!,Fate/kaleid liner プリズマ☆イリヤ 3rei!!,Fate/kaleid liner Prisma Illya 3rei!!,"Waking up to find herself in a parallel version of Fuyuki City, Illyasviel ""Illya"" von Einzbern is lost and alone. She discovers her home in ruins, with a massive crater lying in the center of her hometown. With snow falling in the middle of summer, confusion consumes the young elementary schooler, who has no knowledge of where her friends or her wand Ruby may be.

Making it to the remains of her house, she is suddenly tackled by an amnesiac girl. Wearing a gym uniform as the icy temperature sets in, the mysterious girl has no idea of where she is or why she showed up. However, this stranger, known as Tanaka, apparently has information about the location of Rin Toosaka, Miyu Edelfelt, and the rest of Illya's missing friends. 

Fleeing from agents of the Ainsworth family⁠—those in control of this parallel realm—where will these two end up, and how will Illya restore the present back to the world she once knew?

[Written by MAL Rewrite]",TV,12.0,Finished Airing,"Jul 6, 2016","Sep 21, 2016","Lantis, Kadokawa Shoten, AT-X, DAX Production, KlockWorx, Tokyo MX, Kadokawa Media House, Plus One",Unknown,SILVER LINK.,Manga,"Action, Comedy, Fantasy",Mahou Shoujo,Unknown,24.0,PG-13 - Teens 13 or older,7.521,57810.0,16032.0,1602,116437,311,2016.0
41589,Tokyo Mew Mew New ♡,東京ミュウミュウ にゅ～♡,Tokyo Mew Mew New,"Ichigo Momomiya is excited to start high school and fall in love. She is in luck when she meets the popular and good-looking Masaya Aoyama, and she immediately develops a crush on him. When Ichigo learns that Aoyama is passionate about the environment, she seizes the chance to ask him out thanks to some tickets to an exhibition about endangered animals.

During their date, Ichigo is struck by a mysterious light and faints. Waking up to the sight of Aoyama, she remains unharmed—but they both must escape from a giant rat-like creature after it injures Aoyama. To save her crush, Ichigo awakens her powers and transforms into a heroine with the skills of a cat.

After she defeats the monster, researchers Ryou Shirogane and Keiichiro Akasaka explain that Ichigo was chosen to become a part of the Mew Project: a group of five magical girls whose DNA has been infused with those of certain endangered species. Now, Ichigo must find the rest of her teammates to defeat the Chimera Anima—beings infected by aliens who want to take over the world—before it is too late.

[Written by MAL Rewrite]
",TV,12.0,Currently Airing,"Jul 6, 2022","Sep 21, 2022","TV Tokyo, Dentsu, Pony Canyon, Kodansha",Sentai Filmworks,"Yumeta Company, Graphinica",Manga,"Comedy, Fantasy, Romance, Sci-Fi",Mahou Shoujo,young girl,24.0,PG-13 - Teens 13 or older,6.641,3569.0,56092.0,3367,33841,288,2022.0
33394,Mahou Shoujo? Naria☆Girls,魔法少女? なりあ☆がーるず,Mahou Shoujo? Naria Girls,"After the Ice Queen brings eternal winter to the land of Nariadia, the only hope to restore balance is to gather human warriors and give them the power of Naria crystals. For this reason, Animaru has chosen the middle schoolers Urara, Inaho, and Hanabi as warriors. The girls, however, are much more focused on mocking the events happening around them and trying to earn money as idols.

When the Ice Queen's familiars appear, they use the ""Ice Mirror"" to trick the girls into performing ridiculous skits. Will Urara, Inaho, and Hanabi ever step up and embrace their roles as magical girls, or will their antics prove too distracting to themselves?

[Written by MAL Rewrite]
",TV,12.0,Finished Airing,"Jul 7, 2016","Sep 22, 2016","Pony Canyon, Pony Canyon Enterprise, Smiral Animation",Unknown,Bouncy,Original,Unknown,Mahou Shoujo,Unknown,8.0,PG-13 - Teens 13 or older,3.861,2655.0,130522.0,6215,8101,12,2016.0
2038,Mahou no Star Magical Emi,魔法のスター マジカルエミ,Unknown,"Kozuki Mai is an elementary student who wants to be a magician and perform in her family's ""Magicarat"" magical act; however, she is too young, and her magic skills are not very good. Then one day, she encounters a ball of light that was put into a stuffed doll of flying squirrel, bringing it to life and somehow giving her the power to turn in to the 18-year-old magician ""Magical Emi."" As Emi, Mai was able to join the magic act. But she must keep her identity a secret from her family and from her crush.",TV,38.0,Finished Airing,"Jun 7, 1985","Feb 28, 1986",Unknown,Unknown,Pierrot,Original,"Comedy, Slice of Life","Mahou Shoujo, Performing Arts",young girl,23.0,G - All Ages,6.891,1268.0,43532.0,7893,4482,11,1985.0
518,Mahou no Princess Minky Momo,魔法のプリンセス ミンキーモモ,Magical Princess Minky Momo,"Momo is the princess of Fenarinarsa, a land of dreams that is getting further and further from Earth. She is sent to help the Earth regain faith in its dreams. To assist her are her friends Sindbook, Mocha, and Pipiru and her magic wand that transforms her into an adult. She's ready and willing to help anyone she can in order to make their dream come true, no matter what happens.",TV,63.0,Finished Airing,"Mar 18, 1982","May 26, 1983",Yomiko Advertising,Unknown,Production Reed,Original,Unknown,Mahou Shoujo,young girl,23.0,G - All Ages,6.931,1993.0,41972.0,6420,7514,32,1982.0
532,Bishoujo Senshi Sailor Moon S,美少女戦士セーラームーン S,Sailor Moon S,"The Sailor Guardians and their leader, Sailor Moon, continue their duty of protecting Earth from any who would dare cause it harm. However, Sailor Mars' apocalyptic visions and the appearance of two new guardians—Sailor Neptune and Sailor Uranus—signal that a new battle will soon begin.

These newcomers seek three Talismans that are inside the Pure Heart Crystals within human beings. Once brought together, these objects form The Holy Grail, a magical relic with extraordinary abilities. They want to use the Grail to save the world, but an evil organization known as the Death Busters seeks its power for their own desires.

The removal of a Talisman from a person's Heart Crystal will cause their death, something that Uranus and Neptune see as a necessary sacrifice to form the Grail, while Sailor Moon and her group deem it unforgivable. But can any sacrifice be worth the cost if it saves the lives of the entire human race?

[Written by MAL Rewrite]
",TV,38.0,Finished Airing,"Mar 19, 1994","Feb 25, 1995","TV Asahi, Toei Advertising","VIZ Media, Geneon Entertainment USA",Toei Animation,Manga,"Drama, Romance",Mahou Shoujo,young girl,24.0,PG-13 - Teens 13 or older,7.871,72571.0,7572.0,1425,135154,1337,1994.0
48343,Catch! Tiniping,캐치! 티니핑,Catch! Teenieping,"Catch! Teenieping revolves around mischievous creatures called Teenieping that like to enter people's minds, but their playful nature and magical powers can wreak havoc in their hosts' lives. When the Teenieping are set loose on Earth, Princess Romi of the Emotion Kingdom becomes an ordinary girl that has to turn into a magical girl to stop them, all while balancing her new civilian life as a worker for the Bakery Heartrose with her coworkers Ian, Kyle, and Jun.

(Source: Wikipedia)",TV,52.0,Finished Airing,"Mar 19, 2020","Apr 1, 2021",SAMG Entertainment,Unknown,Unknown,Original,Fantasy,"Mahou Shoujo, School",Kids,11.0,PG - Children,,,172562.0,17033,228,2,2020.0
1239,Bishoujo Senshi Sailor Moon SuperS,美少女戦士セーラームーン Super S,Sailor Moon SuperS,"SuperS centers heavily on Chibi-usa and the Sailor Team. A new enemy, the Dead Moon Circus, has now appeared. Their motive is to find the Golden Dream Mirror that would be used to rule the world. To do this, the enemy attacks innocent victims for their Dream Mirrors and test their energy. Chibi-usa also has a new ally on her side, Pegasus. This season also sees the Sailor Senshi obtaining new powers. ",TV,39.0,Finished Airing,"Mar 4, 1995","Mar 2, 1996","TV Asahi, Toei Advertising","VIZ Media, Geneon Entertainment USA",Toei Animation,Manga,"Drama, Romance",Mahou Shoujo,young girl,24.0,PG-13 - Teens 13 or older,7.611,56709.0,13192.0,1686,109409,486,1995.0
