ID,Title,Japanese,English,Synopsis,Type,Episodes,Status,Start_Aired,End_Aired,Producers,Licensors,Studios,Source,Genres,Themes,Demographics,Duration_Minutes,Rating,Score,Scored_Users,Ranked,Popularity,Members,Favorites,year
1881,Sasami: Mahou Shoujo Club,砂沙美 -魔法少女クラブ-,Sasami Magical Girls Club,"In this world, there live a group of people who call themselves ""Majo"" or ""Magical Girls."" They hide their powers so as to assimilate into the environment. They have been living together in harmony with the humans for many years to come, and their predecessors continue to do so. Sasami was enthroned with magical powers since her birth. However, at the age of three, she was told by her parents never to use her innate powers and from then on, had kept it a secret from everyone. On the day of a new school term, a new transfer teacher by the name of Wajuu arrives and from then on, Sasami's life begins to change tremendously.

(Source: ANN)",TV,13.0,Finished Airing,"Apr 13, 2006","Jul 13, 2006","VAP, AIC, BeSTACK",Funimation,AIC Spirits,Unknown,Fantasy,"Mahou Shoujo, School",Unknown,25.0,PG - Children,6.611,2474.0,57512.0,6411,7547,12,2006.0
440,Shoujo Kakumei Utena,少女革命ウテナ,Revolutionary Girl Utena,"Years ago, a tragic incident befell a young princess when both her parents died. Devastated, it seemed nothing would calm this poor soul. However, a prince traveling through the area came to see the princess, hoping to cheer her up. After wiping her sorrowful tears, the prince gave her a ring carrying a rose emblem and told her as long as she holds onto the ring, they are destined to meet again. The event leaves a deep impression on the girl, Utena Tenjou, leading her to become a prince herself. 

Years later, Utena attends Ootori Academy, recognized by the same rose emblem as her precious ring's. There, attracted by the scent of roses, she witnesses Anthy Himemiya tending the flowers, accompanied by the Student Council President Touga Kiryuu and Vice President Kyouichi Saionji, who seem to be arguing over Anthy. While Utena thinks nothing of the occurrence, the Student Council gathers to discuss an important matter. 

Subsequently, a misunderstanding leads to Utena being dragged into the world of Duelists—those with rings similar to her own. The Duelists fight for the ownership of the Rose Bride, Anthy Himemiya, who is said to possess great power. Wanting to prove her capabilities as a prince, and enraged that Anthy is being wronged and objectified, Utena resolves to fight against the Duelists to save her from the cruel fate.

[Written by MAL Rewrite]
",TV,39.0,Finished Airing,"Apr 2, 1997","Dec 24, 1997","TV Tokyo, Shaft, Trans Arts, Audio Tanaka","Nozomi Entertainment, Central Park Media",J.C.Staff,Original,"Comedy, Drama, Fantasy, Mystery","Mahou Shoujo, Psychological",young girl,23.0,PG-13 - Teens 13 or older,8.191,57413.0,3412.0,1041,194957,7338,1997.0
1915,Mahou Shoujo Lyrical Nanoha StrikerS,魔法少女リリカルなのはStrikerS,Magical Girl Lyrical Nanoha StrikerS,"Set 10 years after Mahou Shoujo Lyrical Nanoha A's, Nanoha, Fate, Hayate and the rest of the crew are now working full time in the Time-Space Administration Bureau. Nanoha is a combat instructor, Fate is a special investigator, and Hayate is a commanding officer. They must unite once again to save the dimensions. Introducing new characters as well: Subaru, Teana, Caro and Erio. Stand by. Ready. Set up!",TV,26.0,Finished Airing,"Apr 2, 2007","Sep 24, 2007","Geneon Universal Entertainment, A-Line, King Records",Unknown,Seven Arcs,Original,"Action, Comedy, Drama","Mahou Shoujo, Super Power",Unknown,25.0,PG-13 - Teens 13 or older,7.621,25018.0,12852.0,2698,50928,559,2007.0
36902,Mahou Shoujo Ore,魔法少女 俺,Magical Girl Ore,"Saki Uno is an average 15-year-old girl with a side hustle as a member of the exceptionally unpopular idol duo Magical Twins. Despite this, she absolutely loves the time she spends with her best friend Sakuyo Mikage as she strives to become closer with her childhood crush, Sakuyo's brother Mohiro. Her peaceful life, however, unravels when she finds a yakuza-looking thug trying to enter her house. Forced to invite him inside, Saki learns that her mother used to be a demon fighting Magical Girl, and that her brutish guest is actually a mascot named Kokoro-chan looking to recruit a replacement. Dumbfounded and skeptical, Saki is hesitant accept the request until Kokoro-chan reveals that Mohiro is a target of some cute, squirrel-tailed demons.

Rushing to his side, Saki's overwhelming desire to save Mohiro activates her Love Power, and a daring confession awakens her as a Magical Girl. However, because her body is not suitable for combat, Saki's transformation turns her into a muscle-bound man clad in a pretty dress. Now, as a fully-fledged Magical Girl, Saki must team up with Sakuyo to protect the love of her life from the fluffy, demonic menaces that run rampant in her world.

[Written by MAL Rewrite]",TV,12.0,Finished Airing,"Apr 2, 2018","Jun 18, 2018","Genco, AT-X, KlockWorx, Crunchyroll, My Theater D.D.",Discotek Media,Pierrot Plus,Web manga,"Comedy, Fantasy","Magical Sex Shift, Mahou Shoujo",Unknown,23.0,PG-13 - Teens 13 or older,6.641,24694.0,55922.0,2089,78644,140,2018.0
3845,Mahoutsukai Chappy,魔法使いチャッピー,Unknown,"Chappy's story is much like Mahou Tsukai Sally (Little Witch Sally). Chappy becoming sick of the old customs of her people, left the Land of Magic for the human world. Soon her family sees how much she has in the other realm that they decided to join her new home. Chappy is known for being the first witch to use a wand. Her special chant is ""Abura Mahariku Maharita Kabura. 

Mahou Tsukai Chappy is the fifth magical girl anime in history. 

(Source: Wikipedia)",TV,39.0,Finished Airing,"Apr 3, 1972","Dec 25, 1972",Unknown,Unknown,Toei Animation,Unknown,Adventure,Mahou Shoujo,Kids,25.0,G - All Ages,6.261,202.0,76792.0,12702,767,2,1972.0
1110,Mermaid Melody Pichi Pichi Pitch Pure,マーメイドメロディーぴちぴちピッチピュア,Unknown,"After the final battle against Gaito, Sara had given her life to remain with him. The sea world is now at peace, but only with six mermaid princesses.

While Caren, Noel, and Coco have returned to their kingdoms, it should be time for Lucia, Hanon, and Rina to do the same. After all, Mitsuki Tarou is leaving for Germany, and Doumoto Kaito is heading to Hawaii. Lucia is devestated, and when things couldn't get any worse, Kaito is lost at sea! Worst of all, a strange angel named Michel has appeared, wanting the mermaids to join him. But on the lighter side, Sara's spirit tells Lucia of Sara's successor, a young mermaid named Seira. The mermaids are in for another adventure!",TV,39.0,Finished Airing,"Apr 3, 2004","Dec 25, 2004",Synergy Japan,Unknown,"Actas, SynergySP",Manga,"Adventure, Comedy, Romance","Mahou Shoujo, Music",young girl,25.0,PG - Children,7.161,22183.0,31752.0,3004,41466,208,2004.0
25939,Mahou Shoujo Lyrical Nanoha ViVid,魔法少女リリカルなのはViVid,Unknown,"The series takes place four years after the events of Mahou Shoujo Lyrical Nanoha StrikerS, during which, magical girl Nanoha Takamachi rescued and adopted a young girl named Vivio, who is the reincarnation of the Sankt Kaiser, Olivie Segbrecht. After entering her fourth year of elementary school, Vivio is given her own intelligence device, Sacred Heart, and gains the power to transform using her adult Sankt Kaiser mode. She soon comes across a girl named Einhart Stratos who, similar to Vivio, is the descendant of another Sankt Kaiser ruler, Claus G.S. Ingvalt. As Einhart becomes determined to prove her fighting style is the strongest, Vivio befriends her and together with her friends, enters a martial arts tournament where they fight against various magical opponents and learn more about their past lives.

(Source: Wikipedia)",TV,12.0,Finished Airing,"Apr 3, 2015","Jun 19, 2015","Aniplex, Starchild Records",Unknown,A-1 Pictures,Manga,"Action, Adventure","Mahou Shoujo, Martial Arts",Unknown,25.0,PG-13 - Teens 13 or older,6.711,9265.0,52292.0,3931,24535,43,2015.0
100,Shin Shirayuki-hime Densetsu Prétear,新白雪姫伝説プリーティア,Prétear The New Legend of Snow White,"Due to her father's remarriage, robust 16-year-old Himeno Awayuki moves into a large mansion with a beautiful garden—the quintessential dream house for any girl her age. However, much to Himeno's disappointment, her new stepfamily doesn't really seem to like her, as her stepmother often occupies herself with her father, her younger stepsister Mawata ignores her, and her other stepsister—the equally aged Mayune—tries to prank her at every opportunity.

But Himeno doesn't have time to dwell into thoughts of hopelessness—her new life has now become involved with a group of seven magical boys known as the Leafe Knights, after they ask her to become a magical princess who can borrow their powers! Although Himeno accepts their request and becomes the Prétear, she feels doubtful in her abilities to protect the world and its Leafe, the source of energy for all life. Will Himeno be able to find happiness among her new family and also save the Earth from the enemy, the Princess of Disaster?

[Written by MAL Rewrite]",TV,13.0,Finished Airing,"Apr 4, 2001","Jun 27, 2001","Kadokawa Shoten, Rondo Robe","ADV Films, Funimation",Hal Film Maker,Manga,"Comedy, Drama, Fantasy, Romance","Mahou Shoujo, Reverse Harem, Super Power",young girl,23.0,PG-13 - Teens 13 or older,7.171,27571.0,31132.0,2465,59961,395,2001.0
31733,Bishoujo Senshi Sailor Moon Crystal Season III,美少女戦士セーラームーンCrystal 第３期＜デス・バスターズ編＞,Pretty Guardian Sailor Moon Crystal Season III,"Usagi Tsukino is still struggling to balance her home life with the duties of being Sailor Moon, the guardian of love and justice. Along with the other Sailor Guardians and her boyfriend Mamoru Chiba, they begin investigating cases of students from Mugen Academy, a school for the most elite students, who are being transformed into monsters. During the investigation, they meet three strange individuals: Haruka Tenou, a handsome racecar driver; Michiru Kaiou, a talented violinist; and Hotaru Tomoe, a mysterious girl with a weak constitution.

As more incidents occur, the Sailor Guardians are met with another surprise—the appearance of two new planetary protectors with motives of their own. Despite the newcomers' questionable allegiance to Usagi and her comrades, they all face a threat from a common enemy: an evil entity who calls himself Pharaoh 90.

[Written by MAL Rewrite]",TV,13.0,Finished Airing,"Apr 4, 2016","Jun 27, 2016","Starchild Records, Kodansha",VIZ Media,Toei Animation,Manga,Romance,"Mahou Shoujo, Mythology",young girl,24.0,PG-13 - Teens 13 or older,7.751,25365.0,9742.0,2599,54214,329,2016.0
604,Mahou no Stage Fancy Lala,魔法のステージ・ファンシーララ,Magical Stage Fancy Lala,"Miho Shinohara is a care-free third-grader and an aspiring manga artist. One day, she encounters Mogu and Pigu - two lost fairies disguised as stuffed animals. In exchange for staying at her home until they find a way to return to their own world, the fairies give Miho a special sketch pad and pencil that enable her to magically create real objects from what she draws. With the pen, Miho can also transform into Lala, a beautiful teenage girl created from her manga art. As Lala, she is discovered by a talent agency, and so begins her adventures from an ordinary school girl to a model to an idol singer. 

(Source: ANN)",TV,26.0,Finished Airing,"Apr 5, 1998","Sep 27, 1998","Bandai Visual, Geneon Universal Entertainment, TV Osaka, Yomiuri Advertising, TV Tokyo Music",Bandai Entertainment,Pierrot,Original,"Comedy, Drama, Romance","Idols (Female), Mahou Shoujo, Music",young girl,24.0,G - All Ages,7.141,3753.0,32712.0,5488,11018,46,1998.0
521,Mermaid Melody Pichi Pichi Pitch,マーメイドメロディー ぴちぴちピッチ,Mermaid Melody Pichi Pichi Pitch,"As the mermaid princess of the North Pacific (one of the seven mermaid kingdoms), Lucia entrusts a magical pearl to a boy who falls overboard a ship one night. Lucia must travel to the human world to reclaim her pearl and protect the mermaid kingdoms. Using the power of music Lucia is able to protect herself and the mermaid kingdoms from a growing evil force.",TV,52.0,Finished Airing,"Apr 5, 2003","Mar 27, 2004",Synergy Japan,ADV Films,"Actas, SynergySP",Manga,"Adventure, Comedy, Romance","Mahou Shoujo, Music",young girl,24.0,PG - Children,7.121,38708.0,33432.0,2166,73965,753,2003.0
687,Tokyo Mew Mew,東京ミュウミュウ,Mew Mew Power,"Ichigo Momomiya expected her date with her crush, Masaya Aoyama, to have a more romantic ending than her falling asleep after she sees a vision of a cat entering her body. Things get even stranger when, the next day, she begins displaying cat-like behaviors such as an intense craving for fish. When Masaya is attacked by a monster, she discovers that she is able to transform into the cat-eared magical girl, Mew Ichigo.

After she saves Masaya, two researchers named Ryou Shirogane and Keiichiro Akasaka approach her and reveal they had injected her with Iriomote Cat DNA in order to create a magical girl that can save the world from aliens. Ichigo is tasked with fighting these monsters, but saving the world proves to be just too much for Ichigo to handle by herself. Fortunately, she learns that there are four other girls just like her, and now, Ichigo must find them quickly before the aliens completely take over the planet.

[Written by MAL Rewrite]",TV,52.0,Finished Airing,"Apr 6, 2002","Mar 29, 2003","Kodansha, TV Aichi",4Kids Entertainment,Pierrot,Manga,"Comedy, Fantasy, Romance, Sci-Fi",Mahou Shoujo,young girl,24.0,PG-13 - Teens 13 or older,7.051,69805.0,37202.0,1381,141553,1397,2002.0
1808,Kamichama Karin,かみちゃまかりん,Unknown,"Thirteen-year-old Karin Hanazono feels like her life can't get any worse, Her parents died when she was younger, leaving her with an aunt who doesn't hesitate to call her stupid and useless over her poor grades. Her only friend, her cat named Shii-chan, passed away recently, leaving her completely alone. All she has left of her parents is a ring given to her by her mother, which she treasures dearly as the sole thing left of her past.

Kamichama Karin begins the moment her life takes a turn for the better, when she is approached by Himeka Kuujou, a cute girl who has also lost her parents, and Kazune Kuujou, her cousin who finds girls to be troublesome, both of whom are searching for a goddess. Her mother's memento ring shines brightly in their presence and fills her with its radiance, making her smarter, faster, and capable of granting wishes. It turns out that her ring allows her to become the very goddess they were looking for, and now that she has awakened that power, others will come after her for it…",TV,26.0,Finished Airing,"Apr 6, 2007","Sep 28, 2007","Broccoli, Nihon Ad Systems, Pony Canyon, Studio Kelmadick",Unknown,Satelight,Manga,"Comedy, Fantasy, Romance","Mahou Shoujo, School",young girl,24.0,PG-13 - Teens 13 or older,7.211,21342.0,29102.0,2740,49301,351,2007.0
232,Cardcaptor Sakura,カードキャプターさくら,Cardcaptor Sakura,"Ten-year-old Sakura Kinomoto is an ordinary fourth-grade student living in Tomoeda until, one day, she stumbles upon a mysterious book of cards titled ""The Clow."" Pondering over her discovery, she unintentionally causes a magical gust of wind to scatter the cards all over town.

The accident awakens the Beast of the Seal—Keroberos, nicknamed ""Kero""—who tells Sakura that she has released the mystical ""Clow Cards"" created by the sorcerer Clow Reed. Due to each Card's ability to act independently and their incredible power, Clow had sealed them away. Now that they have been set free, the Cards pose great danger to the world, and it is up to Sakura to put an end to them.

Appointing Sakura as the ""Cardcaptor"" and granting her the Sealed Key, Kero tasks her with finding and recapturing all the Clow Cards. Alongside her best friend Tomoyo Daidouji, and with Kero's guidance, Sakura must learn to balance her new secret duty with the everyday troubles as she takes flight on her magical adventures as Cardcaptor Sakura.

[Written by MAL Rewrite]
",TV,70.0,Finished Airing,"Apr 7, 1998","Mar 21, 2000","NHK, Kodansha, Sogo Vision","Nelvana, NIS America, Inc., Geneon Entertainment USA",Madhouse,Manga,"Adventure, Comedy, Drama, Fantasy, Romance","Mahou Shoujo, School",young girl,25.0,PG - Children,8.151,204530.0,3812.0,475,402046,12084,1998.0
36266,Mahou Shoujo Site,魔法少女サイト,Magical Girl Site,"Every day, Aya Asagiri thinks about killing herself. She is bullied relentlessly at school, and at home, her older brother Kaname physically abuses her to relieve the academic stress put on him by their father.

One night, as she lies awake wishing for death, a mysterious website called Magical Girl Site appears on her laptop, promising to give her magical powers. At first, she dismisses it as a creepy prank, but when she finds a magical gun in her shoe locker the next day, she doesn't know what to believe. Deciding to take it with her, she soon runs into her bullies once again. But this time, desperate for anything to save her, she uses the gun—and her assailants are transported to a nearby railroad crossing, where they are run over. 

Aya's conscience is unable to handle the fact that she murdered two of her classmates with magic, and she desperately tries to understand the situation. However, when she finds herself in trouble again, she is saved by Tsuyuno Yatsumura, a classmate who can use magic to stop time. This duo has a lot to do: not only do they have to fight alongside and against other magical girls, but they also need to uncover the truth behind the website and the apocalyptic event known as ""The Tempest"" that is soon to occur.

[Written by MAL Rewrite]",TV,12.0,Finished Airing,"Apr 7, 2018","Jun 23, 2018",Sotsu,Sentai Filmworks,production doA,Manga,"Drama, Horror, Supernatural","Gore, Mahou Shoujo, Psychological",Unknown,24.0,R - 17+ (violence & profanity),6.521,87333.0,62742.0,959,211676,1127,2018.0
42745,Machikado Mazoku: 2-choume,まちカドまぞく 2丁目,The Demon Girl Next Door 2,Second season of Machikado Mazoku.,TV,12.0,Finished Airing,"Apr 8, 2022","Jul 1, 2022","Pony Canyon, Houbunsha, Medicos Entertainment, BS11, RAY, Nichion",Sentai Filmworks,J.C.Staff,4-koma manga,"Comedy, Slice of Life",Mahou Shoujo,Unknown,24.0,PG-13 - Teens 13 or older,7.891,15550.0,7202.0,2652,52338,285,2022.0
41530,Magia Record: Mahou Shoujo Madoka☆Magica Gaiden 2nd Season - Kakusei Zenya,マギアレコード 魔法少女まどか☆マギカ外伝 2nd SEASON -覚醒前夜-,Magia Record Puella Magi Madoka Magica Side Story Season 2 - The Eve of Awakening,"After a daring escape from the Memory Museum, Sayaka Miki returns to Mitakihara City with unsettling news. Troubled by what she has learned, Sayaka reveals to Madoka Kaname and Homura Akemi the whereabouts of Mami Tomoe—but more importantly—the disturbing truth behind the existence of magical girls. Despite knowing the cruel fate that awaits them, the three quickly resolve to work together and save Mami once and for all.

Meanwhile in Kamihama City, Yachiyo Nanami hunts various ""rumors"" in search of Hotel Fendt Hope, the headquarters for the Wings of Magius. The magical girl organization is Yachiyo's only lead in finding Iroha Tamaki, whose disappearance remains shrouded in uncertainty. Determined to reunite Team Mikazuki Villa, Yachiyo swears to destroy the Wings of Magius and put a stop to their insidious plans.

Amidst the turbulent situations, a calamitous threat approaches, presenting a dire conflict set to jeopardize the entire world.

[Written by MAL Rewrite]",TV,8.0,Finished Airing,"Aug 1, 2021","Sep 26, 2021",Aniplex,Aniplex of America,Shaft,Game,"Drama, Suspense","Mahou Shoujo, Psychological",Unknown,23.0,PG-13 - Teens 13 or older,6.981,14325.0,40032.0,2622,53315,436,2021.0
721,Princess Tutu,プリンセスチュチュ,Princess Tutu,"In a fairy tale come to life, the clumsy, sweet, and gentle Ahiru (Japanese for ""duck"") seems like an unlikely protagonist. In reality, Ahiru is just as magical as the talking cats and crocodiles that inhabit her town—for Ahiru really is a duck! Transformed by the mysterious Drosselmeyer into a human girl, Ahiru soon learns the reason for her existence. Using her magical egg-shaped pendant, Ahiru can transform into Princess Tutu—a beautiful and talented ballet dancer whose dances relieve people of the turmoil in their hearts. With her newfound ability, Ahiru accepts the challenge of collecting the lost shards of her prince's heart, for long ago he had shattered it in order to seal an evil raven away for all eternity.

Princess Tutu is a tale of heroes and their struggle against fate. Their beliefs, their feelings, and ultimately their actions will determine whether this fairy tale can reach its ""happily ever after.""

[Written by MAL Rewrite]",TV,38.0,Finished Airing,"Aug 16, 2002","May 23, 2003","Memory-Tech, GANSIS, Marvelous AQL","ADV Films, Sentai Filmworks",Hal Film Maker,Original,"Comedy, Drama, Fantasy, Mystery, Romance","Mahou Shoujo, Performing Arts",Unknown,16.0,PG-13 - Teens 13 or older,8.121,61035.0,4202.0,1291,154641,4560,2002.0
48207,Misultamheomdae,미술탐험대,Art Odyssey,Unknown,TV,52.0,Finished Airing,"Aug 29, 2011","Dec 12, 2013",Unknown,Unknown,Unknown,Original,Fantasy,Mahou Shoujo,Kids,11.0,PG - Children,,,135202.0,21132,28,0,2011.0
603,Futari wa Precure,ふたりはプリキュア,Pretty Cure,"Middle school students Nagisa Misumi and Honoka Yukishiro are the epitome of dissimilarity. Popular with their classmates, Nagisa is the school's energetic star lacrosse player, while Honoka is the soft-spoken ""Queen of Intelligence.""

As unrelated as they may seem, Nagisa and Honoka live double lives as the ""emissaries of light"": Cure Black and Cure White of Pretty Cure. With the assistance of two fairies, Mipple and Mepple, the girls fight against the Dotsuku Zone—an evil force that has invaded the Garden of Light. In order to prevent the Dotsuku Zone from taking over the Garden of Rainbows as well, the pair must work together to find seven Prism Stones and restore the Prism Hopish to drive out the vile forces.

With strong foes standing in their way, Nagisa and Honoka learn to work together and harness their newfound powers in order to save the worlds from further ruin.

[Written by MAL Rewrite]
",TV,49.0,Finished Airing,"Feb 1, 2004","Jan 30, 2005","Asatsu DK, Asahi Production, Asahi Broadcasting",4Kids Entertainment,Toei Animation,Original,"Action, Comedy, Fantasy",Mahou Shoujo,young girl,24.0,G - All Ages,7.051,17357.0,36872.0,2894,44189,283,2004.0
5684,Fresh Precure!,フレッシュプリキュア！,Unknown,"Love Momozono is a 14-year-old student at Yotsuba Junior Highschool that tends to care more for others than for herself. One day she visits a show of the famous dance unit ""Trinity"" and decides to become a dancer, too. On the same event, subordinates of the Labyrinth Kingdom show up who want to collect the unhappiness of the audience. Love gets the power to change into Cure Peach and fights them. Soon after, she is joined by her good friends Miki, who is Cure Berry, and Inori, who becomes Cure Pine.

(Source: ANN)",TV,50.0,Finished Airing,"Feb 1, 2009","Jan 30, 2010",Unknown,Unknown,Toei Animation,Original,"Action, Comedy, Fantasy, Slice of Life",Mahou Shoujo,young girl,25.0,G - All Ages,7.361,5882.0,21702.0,4839,15106,147,2009.0
28669,Go! Princess Precure,Go! プリンセスプリキュア,Go! Princess Pretty Cure,"Ever since she was young, Haruka Haruno has always aspired to become a princess. Despite being mocked for this seemingly childish wish, Haruka perseveres to make her dream a reality, ultimately culminating in her acceptance into the prestigious Noble Academy—the birthplace of people's fantasies.

When Haruka arrives at her new school, a chance encounter with a pair of magical creatures influences a series of unbelievable events, and Haruka awakens as ""Cure Flora,"" the princess of blooming flowers. After two of Haruka's classmates also transform into legendary princesses, a story of self-discovery unfolds as the newfound team ""Princess Precure"" carries the responsibility of protecting everyone's dreams. Engaged in a battle between hope and despair, Haruka may find the key toward becoming the princess she has always dreamed to be.

[Written by MAL Rewrite]",TV,50.0,Finished Airing,"Feb 1, 2015","Jan 31, 2016",Unknown,Unknown,Toei Animation,Original,"Action, Comedy, Fantasy, Slice of Life","Mahou Shoujo, School",young girl,24.0,G - All Ages,7.761,5817.0,9662.0,4767,15734,288,2015.0
142,Kamikaze Kaitou Jeanne,神風怪盗ジャンヌ,Unknown,"A normal looking high school girl on the outside, Kusakabe Maron is actually the reincarnation of Jeanne d' Arc. With the help of the angel, Fin Fish, Maron works as the thief Jeanne at night to seal the demons that reside in pieces of artwork, preying upon the weak hearts of the owners. She is branded as a thief due to the fact that the artworks disappear after she seals the demons. One day, a new neighbor and classmate appears, as well as a rival in her night job, the thief Sinbad. With her own best friend being the detective's daughter, out to capture her and the appearance of her new rival, Maron's work is anything but easy.",TV,44.0,Finished Airing,"Feb 13, 1999","Jan 29, 2000",Toei Advertising,Unknown,Toei Animation,Manga,"Action, Drama, Mystery, Romance, Supernatural","Mahou Shoujo, Mythology, Reincarnation",young girl,24.0,PG-13 - Teens 13 or older,7.461,27014.0,18022.0,2641,52737,469,1999.0
