ID,Title,Japanese,English,Synopsis,Type,Episodes,Status,Start_Aired,End_Aired,Producers,Licensors,Studios,Source,Genres,Themes,Demographics,Duration_Minutes,Rating,Score,Scored_Users,Ranked,Popularity,Members,Favorites,year
37509,W'z,ウィズ,Unknown,"Yukiya, who is ""probably"" 14 years old, spends his time DJ-ing alone. Due to his father's influence, he's listened to house music since he was young, and he uploads videos online. He wants to convey something to someone. He wants to be recognized, and become important. But getting hurt is scary. One day, while trying to get more views, he does something that can't be undone. And he sees a live broadcast from ""that world."" Yukiya believes he can't do anything alone, but that he could accomplish something if he were doing it together with someone else.

(Source: ANN)",TV,13.0,Finished Airing,"Jan 6, 2019","Mar 31, 2019","Frontier Works, Mainichi Broadcasting System, Movic, Sony Music Communications, Glovision, Hakuhodo DY Music & Pictures, Medicos Entertainment, Kadokawa Media House, Sega Interactive, GOON TRAX, FABTONE",Sentai Filmworks,GoHands,Original,Action,Music,Unknown,23.0,PG-13 - Teens 13 or older,5.531,7038.0,110012.0,3942,24392,35,2019.0
39725,I★Chu: Halfway Through the Idol,アイ★チュウ HALFWAY THROUGH THE IDOL,Unknown,"School begins at Étoile Vio School, where idol-hopeful students known as ""I-Chu"" will undergo training to become full-fledged idols. However, things are off to a strange start when the new students are given a speech from their bear principal?! The I-Chu work steadily toward their goals and ask, ""What is an idol?"" Each boy will learn to shine as they struggle to find their answer.

(Source: MAL News)",TV,12.0,Finished Airing,"Jan 6, 2021","Mar 24, 2021","Half H.P Studio, Twin Engine",Muse Communication,Lay-duce,Game,"Comedy, Slice of Life","Idols (Male), Music, School",Unknown,24.0,PG-13 - Teens 13 or older,6.571,4267.0,59722.0,4875,14860,113,2021.0
30895,HaruChika: Haruta to Chika wa Seishun suru,ハルチカ ～ハルタとチカは青春する～,Haruchika Haruta & Chika,"Chika Homura begins her high school career with a goal: to develop a ""cute girl"" persona. After quitting the volleyball team despite her all-star status, Chika decides to join her school's underrated Wind Instrument Club and play the flute, believing it to be the most delicate and feminine instrument. For the first time in nine years, Chika reunites with her childhood friend and total opposite, Haruta Kamijou. Unfortunately for Chika, Haruta is not fooled by her efforts to become more endearing. But this does not deter Chika, and she develops a crush on the band instructor, Shinjirou Kusakabe—but so does Haruta!

However, Chika's high school life just won't go according to plan, as mysteries begin appearing around her and her friends. The club members must work together to solve the mysteries plaguing the school, all while trying to find more members to compete in musical competitions.

[Written by MAL Rewrite]",TV,12.0,Finished Airing,"Jan 7, 2016","Mar 24, 2016","Lantis, Glovision",Funimation,P.A. Works,Novel,"Mystery, Romance, Slice of Life","Music, School",Unknown,24.0,PG-13 - Teens 13 or older,6.341,31411.0,72842.0,1968,87330,129,2016.0
33899,IDOLiSH7,アイドリッシュセブン,IDOLiSH7,"On her first day of work at her father's small production agency, Tsumugi Takanashi was not expecting to be made the manager of the agency's new male idol group. Though shocked that her father is trusting her with such a major project so soon, Tsumugi vows to do everything she can to support the seven young boys. After seeing how well the boys work as a team, Tsumugi meets with her father and learns that her first job as manager will be to cut four boys from the group. This is because her father believes seven idols are too much to manage, and the current top group, TRIGGER, only has three members.

After holding an impromptu audition, Tsumugi returns to her father and boldly declares that she refuses to cut anyone from the group, as each member has a unique allure which collectively enhances the group's appeal. She returns to the boys and they are thrilled that none of them will get to miss out on their dreams. Together they become IDOLiSH7, and prepare to take on the fiercely competitive world of idols.

[Written by MAL Rewrite]
",TV,17.0,Finished Airing,"Jan 7, 2018","May 19, 2018","Bandai Visual, Lantis, Bandai Namco Games",Unknown,TROYCA,Game,Drama,"Idols (Male), Music",Unknown,24.0,PG-13 - Teens 13 or older,7.721,19802.0,10632.0,2491,59066,1172,2018.0
41520,Show by Rock!! Stars!!,SHOW BY ROCK!! STARS!!,Unknown,"""All stars"" season of Show by Rock!! featuring all the bands from previous seasons.",TV,12.0,Finished Airing,"Jan 7, 2021","Mar 25, 2021","Dentsu, Square Enix, Pony Canyon, Sanrio, KlockWorx, BS Fuji, 81 Produce, Tokyo MX, Hokkaido Cultural Broadcasting, Sammy, FuRyu, Sony Music Solutions",Funimation,Kinema Citrus,Game,Comedy,Music,Unknown,23.0,PG-13 - Teens 13 or older,7.081,2632.0,35602.0,5660,10160,47,2021.0
28247,Pankis! 2-jigen,ぱんきす! 2次元,Unknown,"St. Muse Academy: the place for the ""sound of the spirits."" In order for people to live pleasantly among the sound, there is an academy where people learn to balance and control sound. Now, the five failing students receive a special mission...

(Source: MAL News)",TV,24.0,Finished Airing,"Jan 8, 2015","Jun 18, 2015",Unknown,Unknown,DLE,Original,Comedy,Music,Unknown,4.0,G - All Ages,,,142022.0,13257,638,1,2015.0
31540,Sekkou Boys,石膏ボーイズ,Sekko Boys,"As luck would have it, on her first day at Holbein Entertainment Co., Miki Ishimoto is tasked with managing a brand new idol group! A recent college graduate, Ishimoto is eager to begin her career in the industry. However, her department's responsibility is...statues?!

The statues in question are the Sekkou Boys, or ""The Rockies,"" a boy band comprised of four Greco-Roman sculptures: St. George, Mars, Hermes, and Medici. These four busts are new to the entertainment scene, and it is up to Miki to ensure the Rockies' prosperity in the idol world. But will they be a stone-cold success? Or will Miki's management prove to be a rocky start to stardom?

[Written by MAL Rewrite]",TV,12.0,Finished Airing,"Jan 8, 2016","Mar 25, 2016","Kadokawa Pictures Japan, Ultra Super Pictures",Unknown,LIDENFILMS,Original,Comedy,"Anthropomorphic, Idols (Male), Music",Unknown,7.0,PG-13 - Teens 13 or older,6.261,21816.0,76952.0,2699,50921,78,2016.0
34028,Idol Jihen,アイドル事変,Idol Incidents,"Increasing income divide, creeping environmental pollution, unsolvable waste issues, childcare waiting lists being discussed without those concerned, repeated corruption… The government, smeared by vested interests, can't do a thing against the many problems and sources of discontent. It's in this situation, with Japan cornered with no way out, that idols rise up to save the day!

The Heroine Party, Sunlight Party, Starlight Party, Bishoujo Party, Wakaba Party, Subculture New Party, and SOS Party. From these seven idol political parties, the idols who have become National Diet members and representatives for each prefecture will smash through the sense of stagnation covering Japan using the power of song and dance! They'll bring back the smiling faces of the people, and wrap Japan in a glittering aura!!

(Source: Honeyfeed)",TV,12.0,Finished Airing,"Jan 8, 2017","Mar 26, 2017","BS Fuji, MAGES., Docomo Anime Store, bilibili, Crunchyroll SC Anime Fund",Unknown,"MAPPA, Studio VOLN",Original,Unknown,"Idols (Female), Music",Unknown,23.0,PG-13 - Teens 13 or older,5.671,4449.0,105212.0,5047,13545,17,2017.0
42981,Idolls!,アイドールズ!,Unknown,"Despite performing as an idol group for three years, Idolls! has failed to make its mark on the entertainment world, only boasting a meager three fans. While the girls are venting their frustrations, a small wooden statue in their room suddenly starts speaking to them and convinces them to book a venue that seats one hundred fans. The only problem is that their performance is in just nine days! Now in a race against time, the girls must prove themselves worthy of stardom or face the harsh reality of failure.

[Written by MAL Rewrite]",TV,10.0,Finished Airing,"Jan 8, 2021","Mar 12, 2021","81 Produce, RAY, Stray Cats, BS Asahi",Unknown,Shin-Ei Animation,Original,Unknown,"Idols (Female), Music",Unknown,8.0,PG-13 - Teens 13 or older,5.081,1834.0,122582.0,7935,4423,11,2021.0
43735,Cue!,CUE!,Unknown,"As a new agency, AiRBLUE's roster consists of voice actresses with absolutely no experience. Expecting to hone their skills and build courage at a gradual pace, the girls are taken aback when the head of their agency, Masaki Ootori, announces that they will be partaking in an audition for Bloomball—a popular sports manga receiving an anime adaptation. Despite all odds being stacked against them, each of the girls is now presented with a momentous chance to make their debut in the unrelenting world of voice acting. 

[Written by MAL Rewrite]",TV,24.0,Finished Airing,"Jan 8, 2022","Jun 25, 2022","Pony Canyon, APDREAM, Liber Entertainment",Unknown,"Yumeta Company, Graphinica",Game,Unknown,"Idols (Female), Music, Showbiz",Unknown,24.0,PG-13 - Teens 13 or older,6.811,6126.0,47612.0,4135,21971,150,2022.0
1655,Nerima Daikon Brothers,練馬大根ブラザーズ,Nerima Daikon Brothers,"In the town of Nerima, the boisterous Hideki and his stoic brother Ichiro run a daikon radish farm along with Mako, their bubbly but vain cousin. The three dream of raising the money needed to build their own concert hall, where their band—Nerima Daikon Brothers—would perform and hopefully rise to stardom. But their farm and Ichiro's host club job aren't raising money fast enough for their liking, leading them to resort to get-rich-quick schemes.

Their plans usually involve tracking down evil-doers and then stealing their ill-gotten gains. Yet, while they usually do put a stop to the villains, they always end the day no richer than before. However, neither these failures nor interference from the policewoman Yukika Karakuri can come between this trio and their dream! With help from gadgets provided by the rental shop owner Nabeshin, the Nerima Daikon Brothers get themselves into and out of all kinds of ridiculous situations through their boisterous singing and comedy.

[Written by MAL Rewrite]
",TV,12.0,Finished Airing,"Jan 9, 2006","Mar 27, 2006",Aniplex,"ADV Films, Funimation",Studio Hibari,Original,Comedy,Music,Unknown,24.0,R+ - Mild Nudity,7.291,3470.0,24932.0,6106,8510,68,2006.0
40763,Show By Rock!! Mashumairesh!!,SHOW BY ROCK!!ましゅまいれっしゅ!!,SHOW BY ROCK!! Mashumairesh!!,New Show by Rock!! TV Series featuring the new band Mashumairesh!!.,TV,12.0,Finished Airing,"Jan 9, 2020","Mar 26, 2020","Dentsu, Sotsu, Pony Canyon, Sanrio, KlockWorx, Polygon Pictures, 81 Produce, Tokyo MX, Hokkaido Cultural Broadcasting, Sammy, FuRyu, Sony Music Solutions",Funimation,Kinema Citrus,Game,Comedy,Music,Unknown,23.0,PG-13 - Teens 13 or older,7.001,4158.0,39452.0,5020,13711,56,2020.0
13333,Tari Tari,TARI TARI,Tari Tari,"At Shirahamazaka High School, a special recital is held every year in which music students are able to showcase their talents in front of professionals and other prestigious guests. A third year, Konatsu Miyamoto desperately wants to sing in her last high school recital, but because she screwed up the year before, the vice principal has barred her from participating.

That's when Konatsu comes up with a new plan to get involved; instead of joining the official choir, she'll form her own singing club with her friends! Unfortunately this proves to be harder than she imagined. Her friend Wakana Sakai, has given up on singing, for one, and Konatsu needs more than just two members. With only a month left until the recital, will Konatsu be able to find enough members for her club and actually be ready to sing at one of the most important events of the school year and graduate without regrets?",TV,13.0,Finished Airing,"Jul 1, 2012","Sep 23, 2012","Bandai Visual, Dentsu, Sotsu, Lantis, Pony Canyon, Showgate, Good Smile Company, Infinite",Sentai Filmworks,P.A. Works,Original,Slice of Life,"Music, School",Unknown,24.0,PG-13 - Teens 13 or older,7.291,56060.0,25102.0,1296,153576,528,2012.0
33290,Gra-P & Rodeo II,ぐらP&ろで夫II,Unknown,2nd Season of Gra-P & Rodeo.,TV,27.0,Finished Airing,"Jul 1, 2016","Dec 30, 2016",Lantis,Unknown,Pie in the sky,Original,Comedy,Music,Unknown,2.0,PG-13 - Teens 13 or older,,,181102.0,15188,360,2,2016.0
36536,Starmyu 3rd Season,高校星歌劇[スタミュ] 3rdシーズン,Unknown,"Following a successful graduation performance, Yuuta Hoshitani and the rest of the second years begin preparations for the upcoming Ayanagi Festival. This year's festival is the first time the students will be without their Kao Council mentors, giving them the creative freedom to do what they want. Hoping to perform alongside each other for once, the second years decide to put on a joint production together. The festival’s opening ceremony will also serve another purpose—to reveal next year's Kao Council candidates. 

The Kao Council announces that Team Hiiragi was selected for the opening ceremony performance, preventing them from participating in the collaboration. This shocks and enrages Hoshitani and the others, driving a rift between them and the Kao Council. In an effort to realize their dreams, the students begin to hatch a plan to ensure that all of the second years can perform together on stage.

[Written by MAL Rewrite]",TV,12.0,Finished Airing,"Jul 1, 2019","Sep 16, 2019",NBCUniversal Entertainment Japan,Unknown,C-Station,Original,Slice of Life,"Idols (Male), Music, Performing Arts, School",Unknown,23.0,PG-13 - Teens 13 or older,6.961,2740.0,40752.0,5891,9308,32,2019.0
34177,Tenshi no 3P!,天使の3P！〈スリーピース〉,Angel's 3Piece!,"Since entering high school, Kyou Nukui has not attended a single class. Instead, he spends his days locked in his bedroom composing music and posting it on the internet accompanied by his only friend's drawings, an artist with the pseudonym ""Kiriyume."" One day, Kyou hesitantly uploads his newest composition, and first departure from his typical style, TR03. Additionally, he does not upload under his usual handle ""HibikiP,"" but simply under the name ""me,"" and without a drawing from his mysterious friend.

Shortly after, Kyou receives a very polite email, not only praising his music but also somehow discerning that he is, in fact, the composer behind TR03. The e-mail also asks for a meetup in a nearby park, to which he cautiously decides to go. To his surprise, however, he finds three elementary school girls at the meeting place! Suddenly, Jun Gotou, Nozomi Momijidani, and Sora Kaneshiro ask for his help to hold a concert in their home, an old church now used as an orphanage. And though Kyou is reluctant at first, after seeing their musical abilities, he eventually decides to accept their proposal.

Based on the light novel of the same name by the award-winning Sagu Aoyama, Tenshi no 3P! follows Kyou as these three angels change his life.

[Written by MAL Rewrite]",TV,12.0,Finished Airing,"Jul 10, 2017","Sep 25, 2017","Sotsu, Lantis, AT-X, Barnum Studio, KlockWorx, GAGA, ASCII Media Works, Studio Mausu, Showgate, Happinet Pictures, Hakuhodo DY Music & Pictures",Discotek Media,Project No.9,Light novel,Slice of Life,"Music, School",Unknown,23.0,PG-13 - Teens 13 or older,6.621,21741.0,57272.0,2459,60033,95,2017.0
50999,Extreme Hearts,Extreme Hearts（エクストリームハーツ）,Unknown,"Hiyori Hayama is an aspiring singer who moved to Tokyo to make her debut. She has always loved singing and hopes to stand on stage like her favorite artist. Unfortunately, the entertainment industry is not all fun and games, as she fails her auditions one after another and struggles to sell her songs.

Finding herself still standing at the start line, Hiyori pursues her only opportunity to take the next step forward—partaking in Extreme Hearts. The popular event is a Hyper Sports tournament where participants compete in various sports using ability-enhancing gear for a chance to make their big break. Despite being athletic, however, Hiyori's lack of familiarity with Hyper Sports poses a problem for her. Fortunately, she befriends girls experienced in different sports, and they join the tournament alongside Hiyori, hoping to see her rise to the top.

Now playing under Team RISE, Hiyori and her teammates learn about the unspoken rule of Extreme Hearts—all competitors must be entertainers or aspire to be one. For the members of Team RISE, facing the competition head-on is an inspiring endeavor that paves the way to discovering newfound interests and everlasting friendships.

[Written by MAL Rewrite]
",TV,12.0,Currently Airing,"Jul 10, 2022","Sep 25, 2022",TBS,Unknown,Seven Arcs,Original,Sports,Music,Unknown,24.0,PG-13 - Teens 13 or older,6.081,1382.0,86572.0,6280,7898,17,2022.0
41169,Love Live! Superstar!!,ラブライブ！スーパースター!!,Love Live! SuperStar!!,"Everyone has a dream they strive to achieve, and so does the musically talented Kanon Shibuya. However, due to her stage fright, Kanon fails to make it into Yuigaoka Girls' High School's music program and instead ends up in the general curriculum. Even though Kanon makes the conscious decision to quit music altogether, her classmate Tang Keke rekindles Kanon's passion for music with her own: a passion for school idols.

Although Keke and Kanon try to form a school idol group, their effort meets strong objections from Ren Hazuki, the daughter of the school's director. Even so, the girls soon visit the director, who allows them to set up their school idol club under one condition—they must win first place at the Yoyogi School Idol Festival.

The resilience of these aspiring idols is put to the test as they face the challenges that come their way. Throughout their journey, the girls make new friends and meet new members that join them to become the dazzling idols others can only imagine.

[Written by MAL Rewrite]",TV,12.0,Finished Airing,"Jul 11, 2021","Oct 17, 2021","Kadokawa, Bandai Namco Arts",Funimation,Sunrise,Other,Slice of Life,"Idols (Female), Music, School",Unknown,23.0,PG-13 - Teens 13 or older,7.991,20416.0,5712.0,2539,56783,1006,2021.0
30251,Venus Project: Climax,VENUS PROJECT（ヴィーナス プロジェクト）－CLIMAX－,Venus Project Climax,"In the near future, Japan has developed sophisticated digital and image technology. People are enthusiastic for a new type of entertainment called ""FORMULA VENUS."" Abbreviated as ""F-V,"" it is a sorted live battle of the top idol performances based on the idols' power, techniques, and developed experience. The story is about the drama that happens among the girls in VENUS PROJECT as they aim for the top by concentrating on difficult battles, passion, and friendship.

(Source: MAL News)",TV,6.0,Finished Airing,"Jul 12, 2015","Sep 20, 2015",Imagine,Funimation,Nomad,Game,Action,"Idols (Female), Music",Unknown,23.0,PG-13 - Teens 13 or older,5.301,1835.0,117372.0,6657,6844,5,2015.0
39533,Given,ギヴン,Unknown,"Tightly clutching his Gibson guitar, Mafuyu Satou steps out of his dark apartment to begin another day of his high school life. While taking a nap in a quiet spot on the gymnasium staircase, he has a chance encounter with fellow student Ritsuka Uenoyama, who berates him for letting his guitar's strings rust and break. Noticing Uenoyama's knowledge of the instrument, Satou pleads for him to fix it and to teach him how to play. Uenoyama eventually agrees and invites him to sit in on a jam session with his two band mates: bassist Haruki Nakayama and drummer Akihiko Kaji.

Satou's voice is strikingly beautiful, filling Uenoyama with the determination to make Satou the lead singer of the band. Though reticent at first, Satou takes the offer after an emotional meeting with an old friend. With the support of his new friends, Satou must not only learn how to play guitar, but also come to terms with the mysterious circumstances that led him to be its owner.

[Written by MAL Rewrite]",TV,11.0,Finished Airing,"Jul 12, 2019","Sep 20, 2019","Aniplex, Dentsu, Movic, Fuji TV, Shinshokan",Unknown,Lerche,Manga,"Boys Love, Drama, Romance, Slice of Life",Music,Unknown,22.0,PG-13 - Teens 13 or older,8.341,268595.0,1982.0,380,489421,15493,2019.0
35503,Shoujo☆Kageki Revue Starlight,少女☆歌劇 レヴュースタァライト,Revue Starlight,"As preparations begin for Seishou Music Academy's yearly Seishou Festival, the girls of the 99th class are gearing up to perform their very own rendition of Starlight, the tragic tale of two goddesses drawn together by the glow of the heavens but destined to be pulled apart, never to meet again. Created to foster the next generation of theatrical talent, this girls' only school works to improve the singing, acting, and dancing skills of its students.

One student is 16-year-old Karen Aijou, an easygoing girl who has dreamed of performing on stage since she was a child. Her love for theater is further invigorated when her childhood friend Hikari Kagura transfers to Seishou Academy. Through her old friend, Karen stumbles upon a secret elevator leading to a massive theater underneath the school. Hosted by a talking giraffe, this arena serves as a battleground where her classmates participate in duels to determine who among them deserves the title of ""Top Star,"" earning them the right to play one of the lead roles in Starlight. Emboldened by the promise she made with Hikari to someday be stars together, Karen enters these mysterious battles in the hopes of making their dream a reality.

[Written by MAL Rewrite]",TV,12.0,Finished Airing,"Jul 13, 2018","Sep 28, 2018","Pony Canyon, TBS, Bushiroad, Overlap, Nelke Planning, APDREAM",Sentai Filmworks,Kinema Citrus,Original,Unknown,"Music, Performing Arts, School",Unknown,24.0,PG-13 - Teens 13 or older,7.651,26556.0,12142.0,2144,75214,1289,2018.0
50221,Shine Post,シャインポスト,Unknown,"Haru Nabatame, Rio Seibu, and Kyouka Tamaki's idol unit, TiNgS, is on the verge of disbandment. However, if they can fill all two thousand seats in their upcoming anniversary concert, their idol careers will live to see another day. This quota is seemingly impossible for a group like them, especially when the most people they have had at a show is 37. Fortunately, they are placed under a new talented manager—Naoki Hinase.

While initially reluctant due to past experiences, Naoki takes charge of TiNgS after sensing Haru's genuine passion for idols with his own remarkable ability to see the shine of someone who is lying. Despite the challenges she faces in this ambitious endeavor, Haru wants everyone in the world to love idols, even willing to become the shining guidepost—shine post—to accomplish her dream.

[Written by MAL Rewrite]
",TV,12.0,Currently Airing,"Jul 13, 2022","Oct 19, 2022","Nippon Television Network, Avex Pictures, Docomo Anime Store, Konami Digital Entertainment, Contents Seed, BS NTV, Straight Edge, Culture Entertainment, Stray Cats, ADK Emotions",Sentai Filmworks,Studio Kai,Light novel,"Slice of Life, Supernatural","Idols (Female), Music",Unknown,22.0,PG-13 - Teens 13 or older,7.121,1545.0,33632.0,5710,9948,34,2022.0
23375,Minarai Diva,みならいディーバ,Unknown,The story follows two aspiring divas who hope to become famous through a unique brand of music.,TV,10.0,Finished Airing,"Jul 14, 2014","Sep 22, 2014","NOTTV, Bouncy",Unknown,Yaoyorozu,Original,Unknown,"Idols (Female), Music",Unknown,49.0,G - All Ages,5.211,263.0,119682.0,10525,1728,4,2014.0
50203,Love Live! Superstar!! 2nd Season,ラブライブ！スーパースター!!,Unknown,"As another year begins at Yuigaoka Girls' High School, ushering in a fresh batch of students, the school idol club Liella! is excited to expand their membership. However, Liella! is extremely popular due to the astounding talent they have continuously displayed; thus, new students lack the courage to even consider approaching the club, fearing the rigorous training that might lie ahead.

Amid her worries, club leader and co-founder Kanon Shibuya meets first-year student Kinako Sakurakouji and tells her about the world of school idols. This leaves Kinako in awe, but being fairly average herself, she feels she would not be capable of matching the spirited performances of the brilliant Liella! members. Nonetheless, Kinako receives encouragement to join the group and comes to share their dream of reaching for the stars once again in the grand Love Live! Competition.

[Written by MAL Rewrite]
",TV,12.0,Currently Airing,"Jul 17, 2022","Oct 9, 2022","Bushiroad, Kadokawa, Bandai Namco Arts, Bandai Namco Filmworks, Bandai Namco Music Live",Unknown,Sunrise,Other,Slice of Life,"Idols (Female), Music, School",Unknown,23.0,PG-13 - Teens 13 or older,8.101,3136.0,4392.0,4164,21468,212,2022.0
30344,The iDOLM@STER Cinderella Girls 2nd Season,アイドルマスター シンデレラガールズ 2ndシーズン,THE IDOLM@STER CINDERELLA GIRLS 2nd SEASON,Second season of The iDOLM@STER Cinderella Girls.,TV,12.0,Finished Airing,"Jul 18, 2015","Oct 17, 2015","Aniplex, Half H.P Studio, Nippon Columbia, Bandai Namco Games, Anime Consortium Japan",Unknown,A-1 Pictures,Game,"Comedy, Drama","Idols (Female), Music",Unknown,24.0,PG-13 - Teens 13 or older,7.341,16440.0,22662.0,3344,34314,144,2015.0
