ID,Title,Japanese,English,Synopsis,Type,Episodes,Status,Start_Aired,End_Aired,Producers,Licensors,Studios,Source,Genres,Themes,Demographics,Duration_Minutes,Rating,Score,Scored_Users,Ranked,Popularity,Members,Favorites,year
1025,Kachou Ouji,課長王子,Legend of Black Heaven,"Oji Tanaka has a wife, a child and a mundane job as a salary man in Tokyo's modern society. But life wasn't dull for him to begin with; 15 years ago, he was known as ""Gabriel"", leader of a short-lived heavy metal band called Black Heaven. Oji's life gets a sudden change in direction when he is invited by a mysterious blonde woman named Layla to pick up his Gibson Flying V and once again display his ""legendary"" guitar skills, not knowing that his music generates power for a massive weapon in an intergalactic war. 

(Source: ANN)",TV,13.0,Finished Airing,"Jul 8, 1999","Oct 7, 1999",Pioneer LDC,"Discotek Media, Geneon Entertainment USA","AIC, APPP",Original,"Adventure, Comedy, Sci-Fi, Slice of Life","Music, Space",Unknown,25.0,R+ - Mild Nudity,6.971,7752.0,40342.0,3623,29097,109,1999.0
10278,The iDOLM@STER,アイドルマスター,THE IDOLM@STER,"765 Production Studio manages the unique talents of 13 professional idols as they slowly make their way to the top and become country-wide celebrities. But the girls' journey is far from just fun and games: hard work, sweat, and tears are some of the prerequisites needed to flourish in this industry—and for 765 Pro in particular, a watchful eye out for their rival, the infamous 961 Production.

As the girls' fame grows, however, their time together as a family diminishes, and now the very popularity they sought is threatening to tear them apart. A difficult balance of work and bonding must be achieved, or they risk everyone going their separate ways. The personal and professional ordeals of these idols can't be conquered alone, but with each other's loving support, any obstacle or hardship can be overcome!

[Written by MAL Rewrite] ",TV,25.0,Finished Airing,"Jul 8, 2011","Dec 23, 2011","Aniplex, TBS, Nippon Columbia, Bandai Namco Entertainment",Unknown,A-1 Pictures,Game,"Comedy, Drama","Idols (Female), Music",Unknown,24.0,PG-13 - Teens 13 or older,7.611,51509.0,13322.0,1348,145686,1589,2011.0
9906,Sue Cat,スーキャット,Unknown,"After an accident, the amnesiac Sue was taken in to live with Torao's family. She always had the urge to become a singer, but didn't know why. As it turns out, Sue is actually part of a band formed with her two twin sisters. But Sue's climb to the top of the charts is a long and hard way.

(Source: AniDB)",TV,40.0,Finished Airing,"Jun 4, 1980","Dec 28, 1980",Asatsu DK,Unknown,Knack Productions,Unknown,Adventure,Music,young girl,13.0,PG - Children,6.671,169.0,54362.0,13387,608,2,1980.0
48859,Pretty All Friends Selection,プリティーオールフレンズセレクション,Unknown,"Mirai Momoyama will be narrating the successes of past idols and stars from the Pretty series and cheer on their friends as they shine and aim for their dreams!

(Source: Pretty All Friends Wiki)",TV,16.0,Finished Airing,"Jun 6, 2021","Sep 19, 2021",Unknown,Unknown,Unknown,Game,"Comedy, Slice of Life","Idols (Female), Music",young girl,24.0,PG - Children,,,143842.0,10474,1760,20,2021.0
29435,Ongaku Sekai Ryokou,おんがく世界りょこう,Unknown,Stop-motion animation using clay and puppets follows a musician and hit cat traveling the world and learning about music in different cultures while spreading their own songs.,TV,4.0,Finished Airing,"Mar 7, 2011","Sep 19, 2014",NHK,Unknown,Unknown,Original,Unknown,Music,Kids,5.0,G - All Ages,,,140562.0,17145,222,0,2011.0
37778,Pastel Life,ぱすてるらいふ,Unknown,"A Nico Live broadcast of BanG Dream! franchise on Monday has announced a spin-off anime featuring one of the units in the franchise, Pastel*Palettes. Titled Pastel Life, the slice-of-life series is yet to announce its type and broadcast details.

(Source: MAL News)",TV,6.0,Finished Airing,"May 17, 2018","Jun 21, 2018",Unknown,Unknown,Studio A-CAT,Unknown,Slice of Life,Music,Unknown,3.0,PG-13 - Teens 13 or older,6.561,2913.0,60092.0,7184,5639,8,2018.0
35516,Dappys,ダッピィズ,Dappys,"Love trouble, friendship, busy work.
When the mind is tight and painful, you ought to shed it!
Very cute ""Dappys"" sing and dance to give encouragement.",TV,4.0,Finished Airing,"May 2, 2017","Oct 25, 2017",Unknown,Unknown,DLE,Original,Comedy,Music,Unknown,50.0,G - All Ages,5.101,221.0,122212.0,11843,1032,7,2017.0
2495,Chance Triangle Session,チャンス トライアングルセッション,Chance Pop Session,"This anime is based on a 1999 radio drama about three very different girls: Akari, Yuki and Nozomi; going to see the concert of top pop idol Reika and by going to see this concert their lives are greatly influenced by it. 

Akari was raised in a very religious background, she is bright and cheerful and a big Reika fan. Yuki is an independent girl who ran away from her home in Hakodate. She is working in the concert hall of Reika's performance. Nozomi is the daughter from a wealthy family in Kobe. She's got one of the VIP seats at the concert. 

The three girls are so inspired by Reika's performance, that they all enroll in the Akiba music school and endeavor to become pop idols themselves. 

(Source: AnimeNfo)",TV,13.0,Finished Airing,"May 21, 2001","Aug 27, 2001",Avex Entertainment,ADV Films,Madhouse,Radio,"Drama, Slice of Life","Idols (Female), Music",Unknown,24.0,PG-13 - Teens 13 or older,6.451,1876.0,66722.0,7328,5360,13,2001.0
2224,Hikari no Densetsu,光の伝説,Unknown,"Hikari is a young school girl who dreams of becoming a great champion in the sport of rhythmic gymnastics like her idol, Diliana Gueorguiva. Despite all her setbacks while performing, she works hard and with the help and support of Takaaki Oiishi (the best male gymnast of her school) soon becomes a member of the rhythmic gymnastics team in her school. She develops feelings for Oiishi, but she is not the only one—Hazuki Shiina, the best gymnast in the entire school, also has feelings for Oiishi. Soon a friendship between Hikari and Shiina develops, but also a rivalry as well in the sport and for the love of Oiishi. Hikari is also torn between her feelings for Oiishi and her conflicting feelings for Mao Natsukawa, an old childhood friend, who is also the lead singer of the band called Mr. D. He composes the music she uses while performing, and has been developing feelings for her since childhood.

(Source: ANN)",TV,19.0,Finished Airing,"May 3, 1986","Sep 20, 1986",Unknown,Unknown,Tatsunoko Production,Manga,"Romance, Sports",Music,young girl,24.0,PG - Children,6.671,1529.0,54672.0,7617,4927,13,1986.0
35517,Caribadix,Caribadix,Caribadix,"Deeky is a wolf whose wild appearance belies his pure-hearted and slightly gossipy moe nature. Carina is a squirrel whose soft and cuddly appearance hides the black and beating heart of a hard rock monster. Together they form a band to compete in a rock music competition.

(Source: Crunchyroll)",TV,46.0,Finished Airing,"May 7, 2017","Mar 25, 2018","TV Osaka, Sanrio",Unknown,Unknown,Original,Comedy,Music,Unknown,45.0,PG - Children,,,172502.0,14078,482,0,2017.0
328,Piano (TV),PIANO,Piano The Melody of a Young Girl's Heart,"When Miu was young, she was fascinated by the piano and took up lessons.

When the show opens, Miu is in middle school. She is shy, a soft-spoken girl who doesn't have a lot of confidence in herself. Her friends would describe her as ""sweet"" and ""quiet."" At this point, Miu has been taking piano lessons for some time and while people have told her that she's gotten very good over the years, Miu herself feels she's not really good at anything—including the piano. Her teacher, Mr. Shirakawa, is often frustrated with her playing. Although she plays every note exactly correct, her heart just isn't in it...

Meanwhile, Miu's come of the age when she's noticing boys and this shy young lady has noticed the handsome Kazuya Takahashi—even if he hasn't noticed her.

This is Miu's story. The story of a young girl who is on a journey to discover the melody within her own heart and the courage to express it.

(Source: RightStuf)",TV,10.0,Finished Airing,"Nov 11, 2002","Jan 13, 2003","animate Film, Kids Station, Pioneer LDC",Nozomi Entertainment,OLM,Original,"Drama, Romance, Slice of Life",Music,young girl,24.0,G - All Ages,5.991,3059.0,91222.0,6114,8474,11,2002.0
25609,Genki Genki Non-tan,げんき げんき ノンタン,Unknown,"This 3D animated series for young children is based on the adventures of perky white kitten Non-tan. With his friends, fun-loving Tanuki, strong Bear, and the pink Rabbit triplets and his rival, Pig, he teaches children positive lessons about the beauty and wonder of life.

(Source: The Anime Encyclopedia)",TV,15.0,Finished Airing,"Nov 4, 2002","Dec 4, 2002",Nippon Columbia,Unknown,Polygon Pictures,Picture book,Unknown,Music,Kids,6.0,G - All Ages,,,180282.0,16317,276,0,2002.0
3205,Cream Lemon: Lemon Angel,くりぃむレモン レモンエンジェル,Lemon Angel,"Franchise combining a real life idol trio and limited animation short stories, with their cartoon alter egos thrown into various bizarre and generally sexual situations.

(Source: AniDB)",TV,37.0,Finished Airing,"Oct 1, 1987","Dec 24, 1987",Unknown,Unknown,AIC,Other,Ecchi,"Idols (Female), Music",Unknown,3.0,R+ - Mild Nudity,5.331,815.0,116632.0,8429,3698,3,1987.0
44275,Selection Project,SELECTION PROJECT,Unknown,"Due to a weak heart, Suzune Miyama has remained bedridden for most of her childhood. However, despite her illness, she has always dreamed of becoming an idol. Eventually, her opportunity comes in the form of the seventh Selection Project—a brutal series of competitions best known as the starting point of the legendary idol Akari Amasawa.

Anxious but excited, Suzune enters the preliminary round of Selection Project. Though her singing dazzles the judges and her fellow competitors, Suzune is unfortunately overcome by her nerves and freezes up in the middle of her performance. She recovers quickly, but the stumble is great enough that she loses the winning spot and is disqualified.

Or so it seems—until Seira Kurusu, the girl Suzune lost to, announces that she plans to drop out of Selection Project, believing Suzune is a more talented singer and therefore deserves the right to compete. Suzune is caught off guard by the decision, but promises Seira that they will meet again as top idols. She prepares herself for the challenging obstacles that lie ahead.

[Written by MAL Rewrite]",TV,13.0,Finished Airing,"Oct 1, 2021","Dec 24, 2021",Kadokawa,Funimation,Doga Kobo,Mixed media,Unknown,"Idols (Female), Music",Unknown,23.0,PG-13 - Teens 13 or older,7.261,13000.0,26542.0,3191,37089,370,2021.0
4477,Nodame Cantabile: Paris-hen,のだめカンタービレ 巴里編,Unknown,"Shinichi Chiaki conquers his fear of flying, and Megumi ""Nodame"" Noda's exceptional performance at a piano competition earns her an invitation to study at the prestigious Conservatoire de Paris. The pair go to Paris together to take the next step in their careers: Chiaki as a new rising conductor under the wing of the great maestro Franz von Stresemann, and Nodame as a pupil of the esteemed piano professor Charles Auclair.

But, of course, the music world is much bigger than the two of them could have ever imagined. Chiaki and Nodame, alongside old friends and new rivals, must fight and persevere to reach the dazzling musical heights that await them while never losing sight of what matters most.

[Written by MAL Rewrite]
",TV,11.0,Finished Airing,"Oct 10, 2008","Dec 19, 2008","Dentsu, Genco, SKY Perfect Well Think, Kodansha, Fuji TV, Asmik Ace, Sony Music Entertainment",Unknown,J.C.Staff,Manga,"Comedy, Romance, Slice of Life","Adult Cast, Music",female,23.0,PG-13 - Teens 13 or older,8.141,72350.0,3982.0,1571,118667,277,2008.0
23273,Shigatsu wa Kimi no Uso,四月は君の嘘,Your Lie in April,"Kousei Arima is a child prodigy known as the ""Human Metronome"" for playing the piano with precision and perfection. Guided by a strict mother and rigorous training, Kousei dominates every competition he enters, earning the admiration of his musical peers and praise from audiences. When his mother suddenly passes away, the subsequent trauma makes him unable to hear the sound of a piano, and he never takes the stage thereafter.

Nowadays, Kousei lives a quiet and unassuming life as a junior high school student alongside his friends Tsubaki Sawabe and Ryouta Watari. While struggling to get over his mother's death, he continues to cling to music. His monochrome life turns upside down the day he encounters the eccentric violinist Kaori Miyazono, who thrusts him back into the spotlight as her accompanist. Through a little lie, these two young musicians grow closer together as Kaori tries to fill Kousei's world with color.

[Written by MAL Rewrite]
",TV,22.0,Finished Airing,"Oct 10, 2014","Mar 20, 2015","Aniplex, Dentsu, Kodansha, Fuji TV, Lawson HMV Entertainment, Kyoraku Industrial Holdings, Kansai Telecasting",Aniplex of America,A-1 Pictures,Manga,"Drama, Romance","Music, School",young boy,22.0,PG-13 - Teens 13 or older,8.661,224172.0,602.0,21,1989985,80730,2014.0
34522,"Wake Up, Girls! Shin Shou","Wake Up, Girls！新章","Wake Up, Girls! New Chapter","""Wake Up, Girls!"" is the story of growth and friendship of seven girls living in Sendai, Miyagi who form the idol group ""Wake Up, Girls! (WUG)"" and work together to become top idols.

Operating under a small production company in Sendai known as ""Green Leaves Entertainment,"" WUG overcame countless obstacles to beat national idol group ""I-1 club"" at the Idol Festival and win the event. They had suddenly become top idols... but with an idol recession going on, things weren't so easy. The days of steady and honest idol work continued for the girls.

Meanwhile, Sendai-based middle school trio Hayashi Ayumi, Morishima Otome, and Atsugi Itsuka have developed an increasing desire to become idols...

(Source: wikia.com)",TV,12.0,Finished Airing,"Oct 10, 2017","Jan 8, 2018","TV Tokyo, Sotsu, Tatsunoko Production, AT-X, Toho, KlockWorx, DIVE II Entertainment, 81 Produce, Good Smile Company, Avex Pictures, KLab, Rakuten, Epicross",Unknown,Millepensee,Original,Drama,"Idols (Female), Music",Unknown,23.0,PG-13 - Teens 13 or older,6.511,3828.0,63212.0,5166,12852,21,2017.0
15787,Backstage Idol Story,バックステージ・アイドル・ストーリー,Unknown,"BiS (Brand-new idol society) is a real idol group in Japan that gets animated!

The anime is composed of two segments. The first one is dressing room talk such as about what to do with rambunctious fans and how annoying it is to have to deal with worn out underwear and menstruation. The second one is composed of an ad-lib talk round-table talk with an invited guest. ",TV,8.0,Finished Airing,"Oct 11, 2012","Nov 29, 2012",Unknown,Unknown,Unknown,Unknown,Unknown,"Idols (Female), Music",Unknown,10.0,PG-13 - Teens 13 or older,,,169642.0,12796,744,1,2012.0
31573,Brave Beats,ブレイブビーツ,Brave Beats,"Hibiki Kazaguruma, a sixth grader, meets an amusing little robot named Bureikin while coming home from school one day. Bureikin, a dancer from an alternate-dimension dance world, challenged the dance king for the throne and lost. He has been deprived of Dance Stones (the stones of dance power) and sent to the human world. To restore his power, Bureikin must collect all the Dance Stones scattered around Earth.

(Source: ANN)",TV,22.0,Finished Airing,"Oct 11, 2015","Mar 27, 2016",Unknown,Unknown,Bandai Namco Pictures,Original,Adventure,Music,Unknown,23.0,G - All Ages,6.421,1672.0,68362.0,7952,4392,18,2015.0
51293,Eternal Boys,永久少年 Eternal Boys,Eternal Boys,"The story follows six middle-aged men who have experienced success and failures in their lives. One day, they decide to become an idol group and overcome such barriers as their age and their physical condition.

(Source: MAL News)",TV,24.0,Not yet aired,"Oct 11, 2022",Unknown,Unknown,Unknown,LIDENFILMS,Original,Unknown,"Idols (Male), Music",Unknown,15.0,PG-13 - Teens 13 or older,,,,7376,5284,13,2022.0
39609,Ochikobore Fruit Tart,おちこぼれフルーツタルト,Dropout Idol Fruit Tart,"Ino Sakura has just moved to Tokyo to join the newly formed Fruit Tart, an idol group composed of three members besides herself—Roko Sekino, a washed-up child actor; Hayu Nukui, a failed musician; and Nina Maehara, a model who is still waiting for her first gig. They soon begin their new life together in their dormitory, the Mouse House. But there is no time to get settled as the girls awaken to a shocking reality: Fruit Tart is in a deep debt of one hundred million yen and has not even started yet!

With the possibility of Fruit Tart breaking up and the Mouse House being torn down if they cannot repay the money, the girls must work their way up from the bottom of idol society by making a name for themselves and writing their own songs. Luckily, Hemo Midori, an experienced idol, is a huge fan of Sakura and decides to join the group. With smiles on their faces, Sakura and the other girls work hard to become popular idols while making sure that each day is as fun as the last.

[Written by MAL Rewrite]
",TV,12.0,Finished Airing,"Oct 12, 2020","Dec 28, 2020","Studio Mausu, Kadokawa",Funimation,feel.,4-koma manga,Slice of Life,"Idols (Female), Music",Unknown,23.0,PG-13 - Teens 13 or older,6.761,10194.0,49872.0,3311,34978,84,2020.0
1397,Macross 7,マクロス７,Unknown,"35 years have passed since Lynn Minmay had brought peace between the Zentradi and the humans in the events of Macross. Nekki Basara is a guitarist and a singer of the band Fire Bomber. Living in a less-developed part of the flying colony City 7 which is looking for a habitable planet, he composes and sings songs in the belief that music holds a greater power.

During its flight, an unknown alien race appeared and started laying siege upon City 7. However, its attacks are not conventional -- instead of trying to destroy them, they steal what is known as ""spiritia"", rendering victims unresponsive and zombie-like. During these battles, Basara always goes out into the middle of the warzone, singing his songs and expecting friend and foe to listen and be moved by his music.

(Source: ANN)",TV,49.0,Finished Airing,"Oct 16, 1994","Sep 24, 1995","Mainichi Broadcasting System, Big West",Nozomi Entertainment,Production Reed,Original,"Action, Adventure, Comedy, Drama, Romance, Sci-Fi","Mecha, Military, Music, Space",young boy,25.0,PG-13 - Teens 13 or older,7.131,11109.0,33182.0,3664,28456,243,1994.0
39918,Shining Star,샤이닝스타,Shining Star,"At the prestigious Shining Star School, every girl dreams of becoming the best idol, called ""Muse"". Nara, an ordinary girl, decides to attend the school in order to fulfill her dream.

(Source: Shining Star Wiki)",TV,52.0,Finished Airing,"Oct 16, 2017","Dec 3, 2018",Unknown,Unknown,Maro Studio,Original,Unknown,"Idols (Female), Music",Kids,21.0,PG - Children,6.571,179.0,59912.0,12955,712,4,2017.0
27521,Gra-P & Rodeo,ぐらＰ＆ろで夫,Unknown,"Rodeo is a normal high school boy who aims to be like GRANRODEO. Gra-P, a self-proclaimed music producer who comes from the future, tries to help him.",TV,61.0,Finished Airing,"Oct 19, 2014","Dec 29, 2015",Lantis,Unknown,Pie in the sky,Original,Comedy,Music,Unknown,2.0,PG-13 - Teens 13 or older,,,181092.0,14769,398,0,2014.0
23799,Dango San Kyoudai Attoiuma Gekijou,だんご3兄弟あっという間劇場,Unknown,The hit Danga San Kyoudai song was adapted into shorts that aired on NHK during commercial breaks in Okaasan to Issho's timeslot. The cheery series about three dango brothers was meant to give children quick lessons about sharing and humbleness.,TV,50.0,Finished Airing,Oct 1999,Mar 2004,NHK,Unknown,Unknown,Unknown,Unknown,Music,Kids,3.0,G - All Ages,,,175682.0,16427,269,0,1999.0
1579,Kiniro no Corda: Primo Passo,金色のコルダ ～primo passo～,La corda d'oro primo passo,"Seiso Academy is a prestigious high school that sorts students into two majors: General Studies, characterized by distinct grey uniforms, and Music Studies, characterized by pristine white uniforms. While rushing to class one morning, General Studies student Kahoko Hino has a chance encounter with Lili, a small fairy searching for someone with the ability to see her. Lili flies away, and Kahoko, puzzled by their meeting, continues on her way.

Later that day, the participants of a school-wide music competition are announced, and all of them are, unsurprisingly, Music Studies students—at least until Kahoko's name is read out. Immediately tracking down Lili, the small fairy gifts Kahoko a magical violin and convinces her to participate in the competition.

Kiniro no Corda: Primo Passo follows Kahoko's endeavors alongside Lili, as the young student must now face the challenges of competition and go head-to-head against her competitors while navigating a new world of classical music.

[Written by MAL Rewrite]",TV,25.0,Finished Airing,"Oct 2, 2006","Mar 26, 2007","Aniplex, Hakusensha, Koei, TYO",Sentai Filmworks,Yumeta Company,Visual novel,"Comedy, Drama, Romance","Music, Reverse Harem, School",young girl,24.0,PG-13 - Teens 13 or older,7.431,47784.0,19282.0,1882,94220,863,2006.0
25615,Genki Genki Non-tan (2006),げんき げんき ノンタン,Unknown,Direct continuation of the second season. Also labeled as episode 26-35.,TV,10.0,Finished Airing,"Oct 2, 2006","Oct 13, 2006",Nippon Columbia,Unknown,Polygon Pictures,Picture book,Unknown,Music,Kids,6.0,G - All Ages,,,180302.0,16833,240,0,2006.0
20033,Miss Monochrome The Animation,ミス・モノクローム -The Animation-,Unknown,"Miss Monochrome is an android powered by a single AA battery. She lives with her only friend, a robot vacuum named Ruu-chan. With hopes of one day meeting the idol Kikuko, whom she has bizarre recurring dreams about, Miss Monochrome sets foot on the path to stardom. However, she experiences difficulties and struggles to make her own debut as an idol. Though Miss Monochrome's methods seem bizarre, such as recruiting her manager from a convenience store, somehow her dedication always results in her standing out from the crowd and shining in the spotlight.

[Written by MAL Rewrite]",TV,13.0,Finished Airing,"Oct 2, 2013","Dec 25, 2013","TV Tokyo, Starchild Records",Crunchyroll,"SANZIGEN, LIDENFILMS",Original,"Comedy, Slice of Life","Idols (Female), Music",Unknown,4.0,G - All Ages,6.381,21635.0,70712.0,2786,47517,51,2013.0
31560,Miss Monochrome The Animation 3,ミス・モノクローム -The Animation- 3,Unknown,Third season of Miss Monochrome: The Animation.,TV,13.0,Finished Airing,"Oct 2, 2015","Dec 25, 2015","Starchild Records, Magic Capsule",Crunchyroll,"SANZIGEN, LIDENFILMS",Original,"Comedy, Slice of Life","Idols (Female), Music",Unknown,7.0,G - All Ages,6.521,6778.0,62792.0,4941,14337,5,2015.0
32038,Show By Rock!! #,SHOW BY ROCK!! ＃,Show By Rock!! 2,"Metropolis of music, MIDICITY. A kitty girl wearing gothic lolita clothing named Cyan is scouted by Maple Arisugawa, the president of a music agency. From there, she meets Chuchu (a pun off of the sound that rabbits make) the honor student rabbit girl, a net geek dog girl named Retoree (from ""Retriever""), and an alien sheep (?) girl named Moa. Together, they form the band named ""Plasmagica,"" and aim for the top of the world.

However, the path there is long and tough, and keeping in high spirits is important. By battling against other strange bands, Plasmagica slowly grows toward a top-grade band. In the end, they'll be a band that becomes the driving force of MIDICITY's music industry... Maybe?

Gonna be a music millionaire!

(Source: Sanrio)",TV,12.0,Finished Airing,"Oct 2, 2016","Dec 18, 2016","Shochiku, Pony Canyon, Sanrio, Studio GOONEYS",Funimation,Bones,Game,Comedy,"Isekai, Music",Unknown,23.0,PG-13 - Teens 13 or older,7.041,10159.0,37392.0,3637,28905,69,2016.0
31178,Uta no☆Prince-sama♪ Maji Love Legend Star,うたの☆プリンスさまっ♪マジLOVE レジェンドスター,Uta no Prince Sama Legend Star,"The anime's story will start where the third season left off, at the competition for who will open the Triple S international sporting event. Raging Entertainment's HE★VENS idol group had hijacked the competition between QUARTET NIGHT and ST☆RISH, causing chaos. However, after the QUARTET NIGHT members suggest a certain idea, the three groups aim toward a new stage, with HE★VENS swearing to get their revenge on the other two groups.

(Source: ANN)",TV,13.0,Finished Airing,"Oct 2, 2016","Dec 25, 2016","Broccoli, Movic, MAGES., Hakuhodo DY Music & Pictures, King Records",Sentai Filmworks,A-1 Pictures,Visual novel,"Comedy, Romance","Idols (Male), Music, Reverse Harem",young girl,24.0,PG-13 - Teens 13 or older,7.151,14037.0,32242.0,3112,39224,211,2016.0
