ID,Title,Japanese,English,Synopsis,Type,Episodes,Status,Start_Aired,End_Aired,Producers,Licensors,Studios,Source,Genres,Themes,Demographics,Duration_Minutes,Rating,Score,Scored_Users,Ranked,Popularity,Members,Favorites,year
36735,Capsule Samurai,カプセル侍,The Capsule Samurai,"A series of shorts shown on the NHK's channel Eigo-rian, which taught children English.",TV,40.0,Finished Airing,2004,2005,NHK,Unknown,Unknown,Original,Comedy,"Music, Samurai",Unknown,40.0,G - All Ages,,,172462.0,18057,169,0,2004.0
44363,Hong Mao Lan Tu MTV,虹猫蓝兔MTV,Unknown,Unknown,TV,65.0,Finished Airing,2005,Unknown,Unknown,Unknown,Unknown,Unknown,Fantasy,Music,Kids,2.0,PG - Children,,,184542.0,20833,32,0,2005.0
39127,Hong Mao Lan Tu: Shuimo Donghua,虹猫蓝兔水墨动画,Unknown,Unknown,TV,42.0,Finished Airing,2005,Unknown,Unknown,Unknown,Unknown,Unknown,Unknown,"Historical, Music",Unknown,1.0,G - All Ages,,,184712.0,19157,99,0,2005.0
27453,Pororo-wa Noraehaeyo,뽀로로와 노래해요,Sing-A-Long with Pororo,Sing-A-Long with Pororo and his friends. The series features both stage singing and in-story singing similar to that of Disney films.,TV,14.0,Finished Airing,2006,Not Available,Unknown,Unknown,Unknown,Unknown,Unknown,"Music, Performing Arts",Kids,3.0,G - All Ages,5.641,121.0,106002.0,15949,302,0,2006.0
35962,Papan Ga Panda!,パパンがパンダ！,Papan Ga Panda!,"A series of shorts broadcasted on Kids Station. The star a Panda (with other animals present) as they do quick skits usually revolving around singing, dancing, and exercise.",TV,,Currently Airing,2012,Unknown,Unknown,Unknown,Unknown,Original,Unknown,Music,Kids,30.0,G - All Ages,,,142272.0,17980,173,0,2012.0
27461,Pororo's English Show,뽀로로 잉글리시쇼,Pororo's English Show,A musical style season like Pororo-wa Noraehaeyo but the cast speaks entirely English with the original English dub cast as a way to teach English to native Korean Children.,TV,13.0,Finished Airing,2013,Not Available,Unknown,Unknown,Unknown,Unknown,Unknown,"Educational, Music, Performing Arts",Kids,5.0,G - All Ages,,,143672.0,16687,249,1,2013.0
51956,Paradox Live the Animation,Paradox Live THE ANIMATION,Unknown,"The Phantom Live movement was reborn in the near future as a result of the incredible saturation of hip-hop culture. Rappers wear accessories made of Phantom Metal, a metallic substance. They create illusions linked to their emotions through chemical reactions with their own DNA, driving young people insane with spectacular stage shows.

At the Paradox Live event, held at the legendary Club Paradox, four teams competed for supremacy: BAE, The Cat's Whiskers, cozmez, and Akanyatsura. Although cozmez won, the intensity of the battle won the hearts of legendary rappers Buraikan, sparking the start of a new event.

Buraikan then traveled throughout Japan to spread the word about the new event: ""This event will determine who will become the next legendary artist. There is only one requirement for participation: you must be a Phantom Rapper. Your position and title are irrelevant. Let's go, everyone.""

Beginning with this message, many intensely skilled contestants approached Buraikan, inspired by this message. Eight teams were chosen from among the best candidates. The fight is heating up, and the momentum will undoubtedly propel Phantom Live to new heights. Who will be the next iconic artist?

(Source: MAL News)
",TV,,Not yet aired,2023,Unknown,Unknown,Unknown,Unknown,Mixed media,Unknown,Music,Unknown,,None,,,,9427,2527,64,2023.0
42385,The iDOLM@STER Million Live!,THE iDOLM@STER MILLION LIVE!,Unknown,Unknown,TV,,Not yet aired,2023,Unknown,Unknown,Unknown,Shirogumi,Game,Unknown,"Idols (Female), Music",Unknown,,PG-13 - Teens 13 or older,,,,8397,3748,8,2023.0
51536,The IDOLM@STER Cinderella Girls: U149,アイドルマスター シンデレラガールズ U149,Unknown,"It's time to pull back the curtain on a new Cinderella Girls story! Hardworking girls and up-and-coming producers team up to shoot for the stars and become the next big idol! Between their gorgeous outfits, electrifying performances, and distractingly handsome princes, these aspiring idols have a lot to deal with.

(Source: MAL News)",TV,,Not yet aired,2023,Unknown,Unknown,Unknown,CygamesPictures,Web manga,Unknown,"Idols (Female), Music",Unknown,,None,,,,10153,1957,6,2023.0
37653,Caribadix 2nd Season,ディッキー&カリーナ 2ndシーズン,Caribadix 2nd Season,Unknown,TV,39.0,Finished Airing,"Apr 1, 2018","Jan 6, 2019",Unknown,Unknown,Unknown,Original,Comedy,Music,Unknown,45.0,PG - Children,,,172522.0,15907,304,0,2018.0
30602,Great Hunt,Great Hunt (グレートハント),Unknown,"Great Hunt is a mysterious amalgamation of heavy Toyama accents, music, and absurdest humor!
",TV,19.0,Finished Airing,"Apr 10, 2008",2008,Unknown,Unknown,Fanworks,Unknown,Comedy,Music,Unknown,4.0,PG-13 - Teens 13 or older,,,181142.0,16997,230,0,2008.0
31370,Tonkatsu DJ Agetarou,とんかつDJアゲ太郎,Unknown,"Tonkatsu chef by day, professional DJ by night—this is the aspiration of Agetarou Katsumata, whose family owns a small tonkatsu shop in Shibuya.

One night, Agetarou delivers an order to a staff member at a nightclub and gets invited inside as a token of thanks. Although nervous at first, he soon finds himself absorbed by the atmosphere, falling in love with the dancing girls, flashing lights, and groovy music. Agetarou starts visiting the club regularly until a certain night leads him to a chance encounter with a legendary American DJ: Big Master Fly. Putting on a spectacular show, the DJ sparks an epiphany in Agetarou—the groove of mixing music appears to be strikingly similar to the rhythm of preparing tonkatsu. Thenceforth Agetarou sets his sights on becoming a master of both disciplines.

With the help of his neighborhood friends and his mentor DJ Oily, Agetarou pursues his dream all the while dealing with familial problems, love issues, and many other kinds of trouble. Tonkatsu DJ Agetarou is a hilarious tale about an impulsive young boy trying to find his own path in life, while still fulfilling his familial and social responsibilities.

[Written by MAL Rewrite]",TV,12.0,Finished Airing,"Apr 10, 2016","Jun 26, 2016","Yomiuri Telecasting, DAX Production, Shueisha, Yomiuri TV Enterprise",Unknown,Studio Deen,Manga,Comedy,Music,young boy,9.0,PG-13 - Teens 13 or older,7.131,6138.0,33382.0,5062,13454,100,2016.0
3176,Nessa no Haou Gandalla,熱沙の覇王ガンダーラ,Gandalla The King of Burning Desert,A dispute between young band members and an unfortunate choice of melody inadverdently draws them all into the demonic horror known as  the desert-god Gandalla. ,TV,26.0,Finished Airing,"Apr 11, 1998","Oct 17, 1998",Big West,Unknown,Production Reed,Original,"Adventure, Drama, Fantasy, Horror, Sci-Fi, Supernatural",Music,Unknown,22.0,PG-13 - Teens 13 or older,5.781,211.0,100122.0,10516,1733,1,1998.0
33203,Fukumenkei Noise,覆面系ノイズ,Anonymous Noise,"Every day, a young girl wearing a mask stands by the beach and sings a nostalgic melody. After experiencing two sudden heart-wrenching partings when she was only a child, Nino Arisugawa has been singing her songs to the ocean, bound by a promise made with her two childhood friends—her first love, Momo Sakaki, and a boy who composed music, Kanade ""Yuzu"" Yuzuriha. Having never met each other, the boys both individually promised that if Nino was ever separated from them, her voice would be the beacon to reunite them once again.

After six long years, destiny has finally placed Nino, Momo, and Yuzu in the same high school. However, the passage of time has changed many things in their lives—while Nino relentlessly attempts to fulfill her childhood promise with the boys, Yuzu's feelings for her from the past resurface, and Momo goes to great lengths to prevent a reunion with Nino. Through music, will they be able to mend their friendship and overcome all the feelings involved in this complicated love triangle?

[Written by MAL Rewrite]",TV,12.0,Finished Airing,"Apr 11, 2017","Jun 27, 2017","Shogakukan-Shueisha Productions, Nihon Ad Systems, Hakusensha, Warner Bros. Japan, KlockWorx, BS Fuji, Kansai Telecasting",Sentai Filmworks,Brain's Base,Manga,"Drama, Romance","Music, School",young girl,23.0,PG-13 - Teens 13 or older,6.971,45868.0,40272.0,1631,113304,604,2017.0
39031,B Rappers Street,Bラッパーズ ストリート,Unknown,"A multimedia project collaboration between Shogakukan, Sony Interactive Entertainment, Sony Music Entertainment, and Sony Music Communications, and features a theme of rap and hip-hop.

The story follows Yo!Hey, a boy who raps to the beat of his farts.

The anime will air withing the Ota-Suta (""Good Morning Star"") children's television program and the manga counterpart will be published in March.

(Source: ANN)",TV,50.0,Finished Airing,"Apr 11, 2019","Mar 26, 2020","Sony Music Communications, Sony Music Entertainment, Shogakukan, Sony Interactive Entertainment",Unknown,Pie in the sky,Original,Comedy,Music,Unknown,2.0,G - All Ages,,,169542.0,13358,615,2,2019.0
37435,Carole & Tuesday,キャロル&チューズデイ,Carole & Tuesday,"It has been 50 years since mankind began its migration to the terraformed Mars, where they live in comfort due to advancements in AI. Carole lives in the metropolis of Alba City, working part-time by day and playing keyboard by night. Tuesday has run away from her home in Hershell City to escape the grip of her wealthy family, and instead hopes to pursue music with her acoustic guitar.

After a fateful encounter, the two decide to perform music together. Up against the AI singers that dominate the music world, the two of them believe that together they can convey their feelings through their songs. Will hard work and luck be enough for the duo to create the biggest miracle that Mars has ever seen?

[Written by MAL Rewrite]",TV,24.0,Finished Airing,"Apr 11, 2019","Oct 3, 2019","Fuji TV, flying DOG, BS Fuji, Hakuhodo DY Music & Pictures, Hakuhodo DY Media Partners",Unknown,Bones,Original,"Drama, Sci-Fi",Music,Unknown,22.0,PG-13 - Teens 13 or older,7.881,131127.0,7352.0,674,299663,2796,2019.0
40677,Argonavis from BanG Dream!,アルゴナビス from BanG Dream!,Unknown,"Ren Nanahoshi has been chasing a certain thrill he once experienced at a live festival when he was a child. Now, as a first-year university student, he avoids making friends and practices singing by himself, hoping to find that adrenaline once more. A fateful encounter at a karaoke bar allows Nanahoshi to meet Yuuto Goryou and Wataru Matoba—both of whom are impressed by his voice. The two have been searching for band members, and they want Nanahoshi to be their vocalist.  

Nanahoshi initially rejects their constant pestering but relents after attending their live show and performing alongside them. Joined by the carefree Rio Kikyou and passionate Banri Shiroishi, the five boys form ""Argonavis"" and set their sights on headlining the Destiny Rock Festival. As they begin to work together as a band, they come across the trials and tribulations that come with pursuing stardom.

[Written by MAL Rewrite]
",TV,13.0,Finished Airing,"Apr 11, 2020","Jul 4, 2020",Bushiroad,Unknown,SANZIGEN,Mixed media,Drama,Music,Unknown,24.0,PG-13 - Teens 13 or older,6.761,3244.0,50062.0,5556,10594,77,2020.0
12531,Sakamichi no Apollon,坂道のアポロン,Kids on the Slope,"Introverted classical pianist and top student Kaoru Nishimi has just arrived in Kyushu for his first year of high school. Having constantly moved from place to place since his childhood, he abandons all hope of fitting in, preparing himself for another lonely, meaningless year. That is, until he encounters the notorious delinquent Sentarou Kawabuchi.

Sentarou's immeasurable love for jazz music inspires Kaoru to learn more about the genre, and as a result, he slowly starts to break out of his shell, making his very first friend. Kaoru begins playing the piano at after-school jazz sessions, located in the basement of fellow student Ritsuko Mukae's family-owned record shop. As he discovers the immense joy of using his musical talents to bring enjoyment to himself and others, Kaoru's summer might just crescendo into one that he will remember forever.

Sakamichi no Apollon is a heartwarming story of friendship, music, and love that follows three unique individuals brought together by their mutual appreciation for jazz.

[Written by MAL Rewrite]",TV,12.0,Finished Airing,"Apr 13, 2012","Jun 29, 2012","Dentsu, Fuji TV, Toho, DAX Production, Sony Music Entertainment",Sentai Filmworks,"Tezuka Productions, MAPPA",Manga,"Drama, Romance","Love Polygon, Music, School",female,22.0,PG-13 - Teens 13 or older,8.321,159861.0,2142.0,553,352765,6676,2012.0
39699,King of Prism: Shiny Seven Stars,KING OF PRISM -Shiny Seven Stars-,Unknown,TV version of the King of Prism -Shiny Seven Stars- movies.,TV,12.0,Finished Airing,"Apr 16, 2019","Jul 2, 2019",Unknown,Unknown,Tatsunoko Production,Original,Sports,"Idols (Male), Music",young boy,24.0,PG-13 - Teens 13 or older,6.431,1169.0,68012.0,7570,5025,21,2019.0
32977,Aggressive Retsuko,アグレッシブ烈子,Aggretsuko,"Whether it be facing misogynistic remarks from her boss or being pressured by condescending co-workers, stress is just another part of the job for 25-year-old red panda Retsuko. Despite being one of the most diligent workers at her office, her diminutiveness and modesty often lead her to be exploited by her colleagues. However, when her irritation hits the limit, Retsuko brings forth her unique brand of letting off steam: aggressive death metal karaoke bashing the idiocy and hypocrisy of her co-workers' actions and work life. Although this venting only takes place in her mind, it gives her an outlet to counter her frustration in a world where hierarchy and appearances reign supreme.

[Written by MAL Rewrite] ",TV,100.0,Finished Airing,"Apr 2, 2016","Mar 31, 2018",Sanrio,Unknown,Fanworks,Other,"Comedy, Slice of Life","Anthropomorphic, Music, Workplace",Unknown,1.0,PG-13 - Teens 13 or older,7.621,46650.0,13022.0,1812,98728,572,2016.0
42068,Utau Soccer Panda Mifanda,歌うサッカーパンダ ミファンダ,Unknown,Short anime based on Mifanda from MIFA (Music Interact Football for All).,TV,12.0,Finished Airing,"Apr 2, 2021","Sep 9, 2021",Unknown,Unknown,Unknown,Other,Slice of Life,Music,Unknown,7.0,G - All Ages,,,158552.0,14847,392,1,2021.0
48916,Love Live! Nijigasaki Gakuen School Idol Doukoukai 2nd Season,ラブライブ! 虹ヶ咲学園スクールアイドル同好会,Love Live! Nijigasaki High School Idol Club Season 2,"The Nijigasaki High School Idol Club continues to gain popularity as its reputation grows, even catching the attention of aspiring school idol Zhong Lanzhu. However, when Lanzhu visits the club and interacts with its members, she realizes that their ideals differ from her own. This sparks the beginning of a rivalry between Lanzhu and the club members, as she challenges them to see who can captivate a larger audience at the upcoming School Idol Festival. 

Thus, the school idol club starts a new chapter in its quest to achieve idol stardom. Being more united than ever before, the girls continue to practice for the festival—wanting to show Lanzhu what it truly means to be a school idol.

[Written by MAL Rewrite]",TV,13.0,Finished Airing,"Apr 2, 2022","Jun 25, 2022","Lantis, Bushiroad, Sunrise Music, Kadokawa, Bandai Namco Filmworks, Bandai Namco Music Live",Unknown,Sunrise,Other,Slice of Life,"Idols (Female), Music, School",Unknown,24.0,PG-13 - Teens 13 or older,7.731,10077.0,10272.0,3601,29444,367,2022.0
1021,Kaikan Phrase,快感 フレーズ,Unknown,"After the break up of their old band, guitarist Yuki & drummer Santa decide to form a new one. They recruit bass player Towa, young guitarist Atsuro, and after much persuasion, vocalist Sakuya. Together they form Lucifer and they struggle to make it in the music business, and also to stay together. As well, they have to deal with personal issues, such as parental objections, and watching their old bands succeed ahead of them. Sakuya is the most troubled band member, as he has to deal with his tragic past, and his relationship with teenaged lyricist Aine.
",TV,44.0,Finished Airing,"Apr 20, 1999","Mar 26, 2000","TV Tokyo, Shogakukan-Shueisha Productions",Unknown,Studio Hibari,Manga,"Drama, Romance","Music, Showbiz",young girl,24.0,PG-13 - Teens 13 or older,7.341,3914.0,22912.0,5180,12773,110,1999.0
25611,Genki Genki Non-tan (2004),げんき げんき ノンタン,Unknown,Direct continuation of the first season. Also labeled as episode 16-25.,TV,10.0,Finished Airing,"Apr 20, 2004","May 3, 2004",Nippon Columbia,Unknown,Polygon Pictures,Picture book,Unknown,Music,Kids,6.0,G - All Ages,,,180292.0,16700,248,0,2004.0
51614,Ao no Orchestra,青のオーケストラ,Unknown,"Hajime Aono was a prodigy violinist until he grew jaded with playing the violin due to personal reasons. Now in his third year of middle school, he struggles to decide on his academic path. One day in school, he meets Ritsuko Akine, a hotheaded novice violinist who wants to enroll in a high school with a distinguished orchestra club. When he finds himself getting closer to Ritsuko and being brought back to the world of violinists, time starts moving again for him.

This is the beginning of a youthful drama where sounds and hearts alike resound in harmony. 

(Source: MU, edited)",TV,,Not yet aired,Apr 2023,Unknown,Unknown,Unknown,Unknown,Web manga,Drama,"Music, School",Unknown,,None,,,,9461,2498,4,2023.0
12149,AKB0048,AKB0048,AKB0048,"After an interplanetary war at the beginning of the 21st century, planet Earth has been left in ruins, with much of its ecosystem completely destroyed. Because it was no longer possible to live a normal life on this planet, the inhabitants are forced to move on to other planets where life will, hopefully, be more comfortable.

The Deep Galactic Trade Organization, a totalitarian government that affects many of the newly inhabited planets, has somehow come to the conclusion that music is a source of evil, and that it must be banned and destroyed for good. The talent group AKB0048 is soon formed, based on the original AKB48 members that once lived on Earth. Even though their music is now considered universally illegal, they make it their mission to bring their music back to life by travelling from one planet to another and holding as many concerts as they possibly can. They must undergo a whole new set of training methods in order to become the best that they can possibly be, while also avoiding the constant danger of being arrested because of their music. Join interplanetary popstars AKB0048 as they try to save the world－with music!",TV,13.0,Finished Airing,"Apr 29, 2012","Jul 22, 2012","Starchild Records, Magic Capsule, GANSIS",Sentai Filmworks,Satelight,Original,Sci-Fi,"Idols (Female), Music",Unknown,23.0,PG-13 - Teens 13 or older,7.361,27367.0,21602.0,2486,59191,652,2012.0
29738,Konchuu Monogatari Tentoumu Chu! to Mitsubachi Hatsu Chu!,昆虫物語 てんとうむChu!とみつばちハッChu!,Unknown,"An animated program featuring members of AKB48, SKE48, NMB48, and HKT48.",TV,10.0,Finished Airing,"Apr 29, 2014","Jul 8, 2014","VAP, Nippon Television Network, Opera House",Unknown,Tatsunoko Production,Unknown,Unknown,"Idols (Female), Music",Unknown,2.0,G - All Ages,,,193032.0,15691,319,0,2014.0
2938,Idol Densetsu Eriko,アイドル伝説えり子,Legendary Idol Eriko,"Eriko Tamura is Kousuke Tamura, the chairman of Tamura Productions (reknown music company) and Minako Tamura's (former famous idol singer) only daughter. Having talent for singing since birth, she has always loved her parent's media world. Then one day tragedy strikes when her parents get into a horrible car accident, which kills her father and leaves her mother in coma. She is left in her father's best friend, Mr. Uchida's care. Now Eriko must take the path of singing, a path her parents did not want her to pursue. Then her uncle is out to destroy her career. But in spite of all the hardship, she becomes an idol and wins hearts all over Japan.

(Source: ANN)",TV,51.0,Finished Airing,"Apr 3, 1989","Mar 26, 1990","Big West, TV Setouchi",Unknown,Production Reed,Original,Unknown,"Idols (Female), Music",Unknown,22.0,PG-13 - Teens 13 or older,6.871,1515.0,44672.0,7433,5200,8,1989.0
1110,Mermaid Melody Pichi Pichi Pitch Pure,マーメイドメロディーぴちぴちピッチピュア,Unknown,"After the final battle against Gaito, Sara had given her life to remain with him. The sea world is now at peace, but only with six mermaid princesses.

While Caren, Noel, and Coco have returned to their kingdoms, it should be time for Lucia, Hanon, and Rina to do the same. After all, Mitsuki Tarou is leaving for Germany, and Doumoto Kaito is heading to Hawaii. Lucia is devestated, and when things couldn't get any worse, Kaito is lost at sea! Worst of all, a strange angel named Michel has appeared, wanting the mermaids to join him. But on the lighter side, Sara's spirit tells Lucia of Sara's successor, a young mermaid named Seira. The mermaids are in for another adventure!",TV,39.0,Finished Airing,"Apr 3, 2004","Dec 25, 2004",Synergy Japan,Unknown,"Actas, SynergySP",Manga,"Adventure, Comedy, Romance","Mahou Shoujo, Music",young girl,25.0,PG - Children,7.161,22183.0,31752.0,3004,41466,208,2004.0
5680,K-On!,けいおん!,K-ON!,"A fresh high school year always means much to come, and one of those things is joining a club. Being in a dilemma about which club to join, Yui Hirasawa stumbles upon and applies for the Light Music Club, which she misinterprets to be about playing simple instruments, such as castanets. Unable to play an instrument, she decides to visit to apologize and quit.

Meanwhile, the Light Music Club faces disbandment due to a lack of members. This causes the club members to offer anything, from food to slacking off during club time, in order to convince Yui to join. Despite their efforts, Yui insists on leaving due to her lack of musical experience. As a last resort, they play a piece for Yui, which sparks her fiery passion and finally convinces her to join the club.

From then onward, it's just plain messing around with bits and pieces of practice. The members of the Light Music Club are ready to make their time together a delightful one!

[Written by MAL Rewrite]",TV,13.0,Finished Airing,"Apr 3, 2009","Jun 26, 2009","Pony Canyon, TBS, Movic, Rakuonsha, Animation Do","Bandai Entertainment, Sentai Filmworks",Kyoto Animation,4-koma manga,Comedy,"CGDCT, Music, School",Unknown,24.0,PG-13 - Teens 13 or older,7.851,532051.0,7902.0,133,968973,22294,2009.0
28013,Macross Δ,マクロスΔ（デルタ）,Macross Delta,"Eight years after the events of Macross F, a mysterious phenomenon known as the Var Syndrome is gradually consuming the galaxy. It's up to a new generation of highly capable Valkyrie pilots to deal with this universal menace. And if they didn't have enough on their plate already, the Aerial Knights Valkyrie fighter team from the Kingdom of Wind have come to challenge the Delta Squadron.",TV,26.0,Finished Airing,"Apr 3, 2016","Sep 25, 2016","Bandai Visual, Big West, flying DOG, Techno Sound",Nozomi Entertainment,Satelight,Original,"Action, Romance, Sci-Fi","Mecha, Military, Music, Space",Unknown,23.0,PG-13 - Teens 13 or older,7.271,24949.0,26222.0,2212,71917,491,2016.0
35372,Otoppe,オトッペ,Unknown,"The series follows a young girl named Shina who hopes to become the world's best DJ, and is interested in new sounds. Shina explores a mysterious world filled with Otoppe, strange creatures capable of unique sounds.",TV,,Currently Airing,"Apr 3, 2017",Unknown,NHK,Unknown,Unknown,Original,Fantasy,Music,Kids,3.0,G - All Ages,,,141492.0,16133,290,0,2017.0
46095,Vivy: Fluorite Eye's Song,Vivy -Fluorite Eye's Song- (ヴィヴィ -フローライトアイズソング-),Vivy -Fluorite Eye's Song-,"When highly evolved AIs set out to eradicate mankind, the carnage that ensues fills the air with the stench of fresh blood and burning bodies. In a desperate bid to prevent the calamity from ever occurring, a scientist bets everything on a remnant from the past.

Turning the clock back a hundred years, AIs are already an integral part of human society, programmed with specific missions meant to be carried out for their entire course of operation. Vivy, the first ever autonomous AI, is a songstress tasked with spreading happiness through her voice. In a theme park where she hardly ever gets a proper audience, she strives to pour her heart out into her performances, bound to repeat it day after day—that is, until an advanced AI from the future appears before her and enlists her help in stopping a devastating war a hundred years in the making. With no time to process the revelation that flips her world upside down, Vivy is catapulted into a century-long journey to avert the violent history yet to come.

[Written by MAL Rewrite]",TV,13.0,Finished Airing,"Apr 3, 2021","Jun 19, 2021",Aniplex,Aniplex of America,Wit Studio,Original,"Action, Sci-Fi, Suspense","Music, Time Travel",Unknown,24.0,R - 17+ (violence & profanity),8.431,201231.0,1522.0,425,445297,9332,2021.0
