ID,Title,Japanese,English,Synopsis,Type,Episodes,Status,Start_Aired,End_Aired,Producers,Licensors,Studios,Source,Genres,Themes,Demographics,Duration_Minutes,Rating,Score,Scored_Users,Ranked,Popularity,Members,Favorites,year
10080,Kami nomi zo Shiru Sekai II,神のみぞ知るセカイ II,The World God Only Knows II,"Keima Katsuragi, the ""God of Conquest,"" returns to his quest of expelling runaway spirits that have possessed the hearts of women. Still stuck in his contract with the demon Elsie, he must continue to utilize the knowledge he has gained from mastering multitudes of dating simulators and chase out the phantoms that reside within by capturing the hearts of that which he hates most: three-dimensional girls.

However, the God of Conquest has his work cut out for him. From exorcising karate practitioners and student teachers to the arrival of Elsie's best friend from Hell, he is up against a wide array of girls that will test his wit and may even take him by surprise. Though he would much rather stick to the world of 2D, he is trapped in lousy reality, and so Keima must trudge forward in his conquest of love.

[Written by MAL Rewrite]",TV,12.0,Finished Airing,"Apr 12, 2011","Jun 28, 2011","TV Tokyo, Geneon Universal Entertainment",Sentai Filmworks,Manglobe,Manga,"Comedy, Romance, Supernatural","Harem, Otaku Culture",young boy,23.0,PG-13 - Teens 13 or older,7.891,229421.0,7312.0,519,368881,966,2011.0
35968,Wotaku ni Koi wa Muzukashii,ヲタクに恋は難しい,Wotakoi Love is Hard for Otaku,"Having slept through all four of her alarms, the energetic Narumi Momose finds herself running late for her first day of work at a new office. As she races to catch her train, she makes a promise to herself that none of her coworkers will find out about her dark secret: that she is an otaku and a fujoshi. Her plan goes instantly awry, though, when she runs into Hirotaka Nifuji, an old friend from middle school. Although she tries to keep her secret by inviting him out for drinks after work, her cover is blown when he casually asks her whether or not she will be attending the upcoming Summer Comiket. Luckily for her, the only witnesses—Hanako Koyanagi and Tarou Kabakura—are otaku as well.

Later that night, the pair go out for drinks so that they can catch up after all the years apart. After Narumi complains about her previous boyfriend breaking up with her because he refused to date a fujoshi, Hirotaka suggests that she try dating a fellow otaku, specifically himself. He makes a solemn promise to always be there for her, to support her, and to help her farm for rare drops in Monster Hunter. Blown away by the proposal, Narumi agrees immediately. Thus the two otaku start dating, and their adorably awkward romance begins.

[Written by MAL Rewrite]",TV,11.0,Finished Airing,"Apr 13, 2018","Jun 22, 2018","Aniplex, Dentsu, Fuji TV, Half H.P Studio, Ichijinsha, Kanetsu Investment, Christmas Holly",Unknown,A-1 Pictures,Web manga,Romance,"Adult Cast, Otaku Culture, Workplace",Unknown,22.0,PG-13 - Teens 13 or older,7.951,457713.0,6282.0,165,851171,10291,2018.0
30727,Saenai Heroine no Sodatekata ♭,冴えない彼女〈ヒロイン〉の育てかた♭,Saekano How to Raise a Boring Girlfriend .flat,"After finally completing the first route of his visual novel, Blessing Software's producer Tomoya Aki is optimistic about the future of his team and achieving their goal of creating the best game of the season.

However, they still have a long way to go. For one, Megumi Katou still has an incredibly flat personality and is unable to fit the role of Tomoya's ideal heroine. The other members of Blessing Software, Eriri Spencer Sawamura, Utaha Kasumigaoka, and Michiru Hyoudou, often forget she is even there due to her lack of presence and character. 

Throughout the development of their game, Blessing Software learns the struggles of working in an industry where deadlines must be met and edits are made constantly, and the hardships of working in a group setting.

[Written by MAL Rewrite]",TV,11.0,Finished Airing,"Apr 14, 2017","Jun 23, 2017","Aniplex, Dentsu, Fuji TV, Cospa, Good Smile Company, Kansai Telecasting, Fujimi Shobo",Unknown,A-1 Pictures,Light novel,"Comedy, Romance, Ecchi","Harem, Otaku Culture, School",Unknown,22.0,PG-13 - Teens 13 or older,7.771,170071.0,9512.0,602,330562,1621,2017.0
289,Comic Party,こみっくパーティー,Comic Party,"Destiny or delusion? It's a hilarious rollercoaster of laughter and confusion when Taishi, the ultimate otaku, drags his friend Kazuki into the swirling world of ambition, hatred, and love—the world of fan comics! Poor clueless Kazuki must sink or swim when he's dumped straight into the middle of a massive comic convention. Lost amidst hoards of buyers, sellers, and cosplayers, Kazuki is about to be baptized by fire, all in order to lead him toward his true calling: to take over the world through fan comics!

Meanwhile, Kazuki's childhood friend Mizuki isn't about to let him be dragged from his normal life without a fight! But will she be able to stop the addictive draw of the new world that lies before Kazuki? Little by little, Kazuki is slipping down the path towards destiny—and Taishi is shoving him every step of the way! 

(Source: RightStuf)",TV,13.0,Finished Airing,"Apr 2, 2001","Jun 25, 2001",KSS,"Nozomi Entertainment, Discotek Media",OLM,Visual novel,"Comedy, Drama",Otaku Culture,Unknown,24.0,PG-13 - Teens 13 or older,6.571,7681.0,59602.0,4452,18618,33,2001.0
40716,Kakushigoto,かくしごと,Kakushigoto,"Kakushi Gotou is a somewhat popular manga artist whose works are known for inappropriate content. Because of this raunchiness, when his daughter Hime was born, he vowed to keep his profession hidden from her, believing that she will be disillusioned if she finds out. 

This paranoia-induced belief leads Kakushi into hectic situations. Despite being a single father, he does his best and often resorts to extreme ends just to protect his secret, such as guising as a salaryman every day or holding emergency drills in case Hime somehow finds her way to his workplace.

Kakushigoto tells the story of a father and daughter living side by side, maintaining their peaceful existence as the father attempts to preserve the status quo. However, there is a saying: ""there are no secrets that time cannot reveal."" In time, Hime must learn the reality behind the things she took for granted as she grew up.

[Written by MAL Rewrite]",TV,12.0,Finished Airing,"Apr 2, 2020","Jun 18, 2020","Dentsu, Marvelous, Kodansha, AT-X, Studio Mausu, Tokyo MX, Avex Pictures, A-Sketch",Funimation,Ajia-Do,Manga,Comedy,"Childcare, Gag Humor, Otaku Culture",young boy,23.0,PG-13 - Teens 13 or older,8.001,125866.0,5662.0,688,295509,1983,2020.0
29067,Danna ga Nani wo Itteiru ka Wakaranai Ken 2 Sure-me,旦那が何を言っているかわからない件2スレ目,I Can't Understand What My Husband Is Saying 2nd Thread,"The Tsunashi couple is as lively and offbeat as ever. Hardcore otaku shut-in Hajime and workaholic office lady Kaoru still get themselves into hilarious situations thanks to both their own eccentric natures and the bizarre group of friends surrounding them.

After learning about Kaoru's pregnancy, Hajime works harder than ever to become a good husband and a worthy father. Meanwhile, Kaoru reflects on their relationship and remembers all of the trials and tribulations that brought them closer. The two of them continue to put their best foot forward in their lives and their marriage—all for the sake of long-lasting, selfless love.

[Written by MAL Rewrite]
",TV,13.0,Finished Airing,"Apr 3, 2015","Jun 26, 2015","DAX Production, Dream Creation",Unknown,Seven,4-koma manga,"Comedy, Romance","Adult Cast, Otaku Culture",teenager,3.0,PG-13 - Teens 13 or older,7.331,113528.0,23012.0,1087,185425,188,2015.0
706,Comic Party Revolution,こみっくパーティー Revolution,Unknown,"Sendo Kazuki, failed the entrance exam for the art college he was applying to, His childhood friend, Kuhonbutsu Taishi forced Kazuki to enter the doujin (private publishing) world. 

(Source: AnimeNfo)",TV,13.0,Finished Airing,"Apr 4, 2005","Jun 27, 2005",AQUAPLUS,"ADV Films, Funimation","Radix, Chaos Project",Visual novel,"Comedy, Drama",Otaku Culture,Unknown,24.0,PG-13 - Teens 13 or older,6.481,3856.0,65112.0,5894,9290,6,2005.0
29589,Denpa Kyoushi,電波教師,Ultimate Otaku Teacher,"Junichirou Kagami is a young published physicist, a genius, and a hopeless otaku. At the mercy of YD, a self-diagnosed illness which causes him to only be able to do what he ""Yearns to Do,"" Junichirou foregoes his scientific career to maintain and improve his anime blog. However, when he gets hired as a high school physics teacher; his sister Suzune, no longer willing to tolerate his NEET lifestyle, forces him to take the position. 

Despite the fact that Junichirou has no motivation to teach the standard curriculum, he may still have something of value to teach his students outside of academics. With his class in tow, Junichirou embarks on an unlikely journey filled with life lessons such as acceptance of others, how to make lasting friends, and what it means to live a better life by doing what you yearn to do.

[Written by MAL Rewrite]",TV,24.0,Finished Airing,"Apr 4, 2015","Sep 26, 2015","Yomiuri Telecasting, Shogakukan",Funimation,A-1 Pictures,Manga,"Comedy, Romance","Otaku Culture, School",young boy,23.0,PG-13 - Teens 13 or older,6.881,66584.0,44282.0,1340,147196,298,2015.0
35756,Comic Girls,こみっくがーるず,Unknown,"Kaoruko ""Chaos"" Moeta is a young manga artist who is down on her luck. She wants to draw manga about high school girls, but her storyboards are bland, her art uninspired, and her premises weak. Her concerned, exasperated editor comes up with an idea: push Chaos to be more social. So, by her recommendation, Chaos moves into a dormitory for female manga artists. She soon meets the other residents: Tsubasa Katsuki, a shounen manga artist; Ruki Irokawa, who draws erotic manga popular with women; and Koyume Koizuka, a shoujo artist who, like Chaos, has yet to be serialized. Quickly striking up a friendship with these girls, Chaos finds new inspiration for her manga and continues to grow her creativity.

Comic Girls is a showcase of the daily lives of these manga artists. Will Chaos finally be able to make her debut and become serialized? None of the girls know, but they will all do their best to help each other become the best artists they can be.

[Written by MAL Rewrite]",TV,12.0,Finished Airing,"Apr 5, 2018","Jun 21, 2018","Sony Pictures Entertainment, Frontier Works, Sotsu, Houbunsha, Chugai Mining, Kansai Telecasting, BS11, My Theater D.D., Good Smile Film",Unknown,Nexus,4-koma manga,"Comedy, Slice of Life","CGDCT, Otaku Culture",Unknown,23.0,PG-13 - Teens 13 or older,7.381,56082.0,20852.0,1433,133938,643,2018.0
13659,Ore no Imouto ga Konnani Kawaii Wake ga Nai.,俺の妹がこんなに可愛いわけがない。,Oreimo 2,"The diehard otaku Kirino Kousaka has returned and settled back into life in Japan with her friends and family. Despite what her older brother Kyousuke has previously done for her, Kirino continues to give him the cold shoulder, much to his frustration. He is worried that his persuasion for Kirino to drop her track and field training in America and return home may have severely strained his relationship with her. On top of that, Kyousuke now also has to decode a bold and cryptic message from Ruri ""Kuroneko"" Gokou, his junior at school as well as Kirino's friend.

As the ties between the two siblings and their friends deepen, Kirino and Kyousuke will soon have to figure out how they want to deal with these relationships, helping each other realize their own feelings in the process. In spite of that, Kirino still manages to find time to satisfy her otaku needs with the company of her brother.

[Written by MAL Rewrite]
",TV,13.0,Finished Airing,"Apr 7, 2013","Jun 30, 2013",Aniplex,Aniplex of America,A-1 Pictures,Light novel,"Comedy, Romance",Otaku Culture,Unknown,24.0,PG-13 - Teens 13 or older,6.951,251929.0,41132.0,462,413025,1206,2013.0
1887,Lucky☆Star,らき☆すた,Lucky☆Star,"Lucky☆Star follows the daily lives of four cute high school girls—Konata Izumi, the lazy otaku; the Hiiragi twins, Tsukasa and Kagami (sugar and spice, respectively); and the smart and well-mannered Miyuki Takara.

As they go about their lives at school and beyond, they develop their eccentric and lively friendship and making humorous observations about the world around them. Be it Japanese tradition, the intricacies of otaku culture, academics, or the correct way of preparing and eating various foods—no subject is safe from their musings.

[Written by MAL Rewrite]",TV,24.0,Finished Airing,"Apr 8, 2007","Sep 17, 2007","Lantis, Rakuonsha, Lucky Paradise","Funimation, Bandai Entertainment, Kadokawa Pictures USA",Kyoto Animation,4-koma manga,Comedy,"CGDCT, Gag Humor, Otaku Culture, School",Unknown,24.0,PG-13 - Teens 13 or older,7.741,304606.0,9972.0,288,609468,11352,2007.0
37890,Oshi ga Budoukan Ittekuretara Shinu,推しが武道館いってくれたら死ぬ,"If My Favorite Pop Idol Made It to the Budokan, I Would Die","A girl is obsessed with her favorite idol, a minor member of a less popular group, enough that she says she'd die to see her play at Budoukan. ",TV,12.0,Finished Airing,"Jan 10, 2020","Mar 27, 2020","Pony Canyon, TBS, Movic, Tokuma Shoten",Funimation,8bit,Manga,"Comedy, Girls Love, Slice of Life","Idols (Female), Music, Otaku Culture",teenager,24.0,PG-13 - Teens 13 or older,7.421,16379.0,19362.0,3156,38198,274,2020.0
44055,Sasaki to Miyano,佐々木と宮野,Sasaki and Miyano,"Yoshikazu Miyano's troubles first start one hot summer day when Shuumei Sasaki steps into his life. Sasaki saves Miyano's classmate from a group of bullies, and after that, Miyano cannot seem to shake off his eccentric upperclassman. His silent admiration for Sasaki gradually sours into annoyance each time the so-called delinquent refuses to leave him alone. Constantly being called by cute nicknames and having his boundaries ignored, Miyano wonders why Sasaki wants to get close to him.

The shy and easily flustered Miyano harbors an embarrassing secret—he is a ""fudanshi,"" a boy who likes boys' love (BL) manga. The last thing he wants is for other students to find out, but through a slip of the tongue, he reveals the truth to Sasaki. Intrigued, the clueless Sasaki asks to borrow a book to read, which he is given very reluctantly. To Miyano's surprise, Sasaki enjoys the BL that he receives and asks for more, marking a shift in their strange dynamic.

Although Sasaki appears to possess some personal agenda, his feelings for Miyano become complicated the more time they spend together. As they now share a common interest, their relationship is poised to change and further develop.

[Written by MAL Rewrite]
",TV,12.0,Finished Airing,"Jan 10, 2022","Mar 28, 2022","Nippon Columbia, Sound Team Don Juan, Kadokawa",Unknown,Studio Deen,Web manga,"Boys Love, Slice of Life","Otaku Culture, School",Unknown,23.0,PG-13 - Teens 13 or older,8.251,53292.0,2802.0,1416,136677,3552,2022.0
23277,Saenai Heroine no Sodatekata,冴えない彼女〈ヒロイン〉の育てかた,Saekano How to Raise a Boring Girlfriend,"Tomoya Aki, an otaku, has been obsessed with collecting anime and light novels for years, attaching himself to various series with captivating stories and characters. Now, he wants to have a chance of providing the same experience for others by creating his own game, but unfortunately, Tomoya cannot do this task by himself.

He successfully recruits childhood friend Eriri Spencer Sawamura to illustrate and literary elitist Utaha Kasumigaoka to write the script for his visual novel, while he directs. Super-group now in hand, Tomoya only needs an inspiration to base his project on, and luckily meets the beautiful, docile Megumi Katou, who he then models his main character after.

Using what knowledge he has, Tomoya creates a new doujin circle with hopes to touch the hearts of those who play their game. What he does not realize, is that to invoke these emotions, the creators have had to experience the same feelings in their own lives.

[Written by MAL Rewrite]",TV,12.0,Finished Airing,"Jan 16, 2015","Mar 27, 2015","Aniplex, Dentsu, Fuji TV, Half H.P Studio, Cospa, Fujipacific Music, Good Smile Company, Kyoraku Industrial Holdings, Kansai Telecasting, Fujimi Shobo",Aniplex of America,A-1 Pictures,Light novel,"Comedy, Romance, Ecchi","Harem, Otaku Culture, School",Unknown,23.0,PG-13 - Teens 13 or older,7.491,289295.0,17112.0,298,599004,4093,2015.0
14045,Mangirl!,まんがーる!,Unknown,"""We're going to launch a manga magazine!"" 

A team of girls with zero experience in manga editing are off and running toward their dream of creating the biggest manga magazine in Japan! They seem to do nothing but run into problems and failures... But still they're working hard every day!

(Source: Crunchyroll)",TV,13.0,Finished Airing,"Jan 3, 2013","Mar 28, 2013",Earth Star Entertainment,Unknown,Doga Kobo,Manga,"Comedy, Slice of Life","CGDCT, Otaku Culture",Unknown,3.0,PG-13 - Teens 13 or older,5.811,13986.0,98882.0,3475,31381,17,2013.0
34051,Akiba's Trip The Animation,AKIBA'S TRIP THE ANIMATION,Akiba's Trip The Animation,"Otaku siblings Tamotsu and Niwaka Denkigai are shopping in Akihabara when it is overrun by vampiric cosplaying monsters! These creatures, known as ""Bugged Ones,"" can possess anyone they bite and soon they begin causing mayhem across the city. As Tamotsu finds himself at the mercy of one of these creatures, he is rescued by the mysterious baseball bat-wielding Matome Mayonaka. Together, they fight through several more encounters with the Bugged Ones, but before long, Tamotsu is fatally wounded protecting Matome. With no other choice, she revives him as a high level Bugged One—just like her! 

Tamotsu and Matome, along with excitable otaku cosplayer Arisa Ahokainen, make up the group ""The Electric Mayonnaise"" and they begin dispatching the Bugged Ones in the only way they know how: by ripping off their clothes and exposing them to sunlight!

[Written by MAL Rewrite]",TV,13.0,Finished Airing,"Jan 4, 2017","Mar 29, 2017","AT-X, DLE, Studio Mausu, BS Fuji, Tokyo MX, Evil Line Records, Docomo Anime Store, bilibili, DMM.com, Sotsu Music Publishing, Exa International",Funimation,Gonzo,Game,"Action, Comedy, Supernatural, Ecchi",Otaku Culture,Unknown,23.0,PG-13 - Teens 13 or older,6.511,57484.0,63272.0,1404,138039,275,2017.0
39792,Eizouken ni wa Te wo Dasu na!,映像研には手を出すな!,Keep Your Hands Off Eizouken!,"Midori Asakusa sees the world a bit differently. Always having her nose in a sketchbook, Asakusa draws detailed landscapes and backgrounds of both the world around her and the one within her boundless imagination. Even the simple act of doodling on a wall evolves into an emergency repair on the outer hull of her spaceship. She is only brought back to reality by her best friend Sayaka Kanamori. The pair are stark opposites, with Asakusa's childlike wonder contrasted by Kanamori's calculated approach to life. 

After a chance encounter where the two ""save"" the young model Tsubame Misuzaki from her overprotective bodyguard, a connection instantly sparks between Asakusa and Misuzaki, as both share an intense passion for art and animation. Whereas Asakusa is interested in backgrounds and settings, Misuzaki loves drawing the human form. Sensing a money-making opportunity, Kanamori suggests that they start an animation club, which they disguise as a motion picture club since the school already has an anime club. Thus begins the trio's journey of producing animation that will awe the world. 

From the brilliant mind of Masaaki Yuasa, Eizouken ni wa Te wo Dasu na! is a love letter to animation, wildly creative in its approach, and a testament to the potential of the medium.

[Written by MAL Rewrite]",TV,12.0,Finished Airing,"Jan 6, 2020","Mar 23, 2020","Warner Bros. Japan, Warner Music Japan, Shogakukan, NHK Enterprises",Crunchyroll,Science SARU,Manga,"Adventure, Comedy","Otaku Culture, School",teenager,25.0,PG-13 - Teens 13 or older,8.141,124044.0,3922.0,672,300486,3620,2020.0
48736,Sono Bisque Doll wa Koi wo Suru,その着せ替え人形は恋をする,My Dress-Up Darling,"High school student Wakana Gojou spends his days perfecting the art of making hina dolls, hoping to eventually reach his grandfather's level of expertise. While his fellow teenagers busy themselves with pop culture, Gojou finds bliss in sewing clothes for his dolls. Nonetheless, he goes to great lengths to keep his unique hobby a secret, as he believes that he would be ridiculed were it revealed. 

Enter Marin Kitagawa, an extraordinarily pretty girl whose confidence and poise are in stark contrast to Gojou's meekness. It would defy common sense for the friendless Gojou to mix with the likes of Kitagawa, who is always surrounded by her peers. However, the unimaginable happens when Kitagawa discovers Gojou's prowess with a sewing machine and brightly confesses to him about her own hobby: cosplay. Because her sewing skills are pitiable, she decides to enlist his help.

As Gojou and Kitagawa work together on one cosplay outfit after another, they cannot help but grow close—even though their lives are worlds apart.

[Written by MAL Rewrite]
",TV,12.0,Finished Airing,"Jan 9, 2022","Mar 27, 2022","Aniplex, Square Enix, Movic, Studio Mausu, Tokyo MX",Unknown,CloverWorks,Manga,"Romance, Slice of Life","Otaku Culture, School",teenager,23.0,PG-13 - Teens 13 or older,8.311,454250.0,2302.0,200,762970,16633,2022.0
1210,NHK ni Youkoso!,N・H・Kにようこそ！,Welcome to the N.H.K.,"Twenty-two-year-old college dropout Tatsuhiro Satou has been a hikikomori for almost four years now. In his isolation, he has come to believe in many obscure conspiracy theories, but there is one in particular which he holds unshakable faith in: the theory that the evil conspirator behind his shut-in NEET (Not in Employment, Education or Training) status is the Nihon Hikikomori Kyokai (NHK)—an evil and secret organization dedicated to fostering the spread of hikikomori culture.

NHK ni Youkoso! is a psychological dramedy that follows Tatsuhiro as he strives to escape from the NHK's wicked machinations and the disease of self-wrought isolation, while struggling to even just leave his apartment and find a job. His unexpected encounter with the mysterious Misaki Nakahara might signal a reversal of fortune for Tatsuhiro, but with this meeting comes the inevitable cost of having to face his greatest fear—society.

[Written by MAL Rewrite]",TV,24.0,Finished Airing,"Jul 10, 2006","Dec 18, 2006","NHK, Victor Entertainment","ADV Films, Funimation",Gonzo,Novel,"Comedy, Drama, Romance","Otaku Culture, Psychological",Unknown,24.0,R+ - Mild Nudity,8.321,306832.0,2112.0,246,669385,24138,2006.0
34914,New Game!!,NEW GAME!!,New Game!!,"​It has been a year since Aoba Suzukaze started working at the Eagle Jump game company. In that time, she and her eccentric coworkers in the character design department have worked hard to release the company's newest game: Fairies Story 3. With their latest title now complete, a new project must begin—starting with a contest to decide the character designs for the upcoming game. Through hard work, dedication, and some guidance from the previous character designer, Kou Yagami, Aoba wins the contest and begins her new role as lead character designer.

However, her new job is not an easy one. In addition to having extra work and longer hours, Aoba questions whether she is the right fit for the job. New Game!! continues as Aoba overcomes her inexperience with the help of her friends and coworkers, willing to face any challenge to make Eagle Jump's newest creation, a cutesy game called Peco.

[Written by MAL Rewrite]",TV,12.0,Finished Airing,"Jul 11, 2017","Sep 26, 2017","Frontier Works, Media Factory, Movic, AT-X, Sony Music Communications, Houbunsha, MAGES., Lawson","Funimation, Crunchyroll",Doga Kobo,4-koma manga,Comedy,"CGDCT, Otaku Culture, Workplace",Unknown,24.0,PG-13 - Teens 13 or older,7.711,123178.0,10912.0,851,240389,869,2017.0
34280,Gamers!,ゲーマーズ！,Gamers!,"Keita Amano is a typical high school gamer living out an average student's life. One day, however, he has an unexpected meeting with the cutest girl in school that makes him want to disappear without a trace! 

This girl, Karen Tendou, is an exemplary student who is proclaimed to be the school's idol. She discovers that Amano is a gamer, and this newfound knowledge incites a passionate desire within her to recruit him into the game club. Upon visiting the club, Amano is forcefully made aware of a side to gaming wildly different than the one he loves so dearly. 

Tendou's interest in Amano begins shaking up what was once an uneventful life, filling it with spontaneity, awkwardness, and a little bit of mayhem. As a result, every day becomes a comical battle for Amano's sanity as he tries to adapt to these wild, unexpected changes.

[Written by MAL Rewrite]",TV,12.0,Finished Airing,"Jul 13, 2017","Sep 28, 2017","Sony Pictures Entertainment, Frontier Works, Sotsu, Kadokawa Shoten, AT-X, NBCUniversal Entertainment Japan, Tokyo MX, i0+, Chugai Mining, BS11",Funimation,Pine Jam,Light novel,"Comedy, Romance","Otaku Culture, School, Video Game",Unknown,24.0,PG-13 - Teens 13 or older,6.781,344014.0,49222.0,301,596266,2068,2017.0
