ID,Title,Japanese,English,Synopsis,Type,Episodes,Status,Start_Aired,End_Aired,Producers,Licensors,Studios,Source,Genres,Themes,Demographics,Duration_Minutes,Rating,Score,Scored_Users,Ranked,Popularity,Members,Favorites,year
42203,Re:Zero kara Hajimeru Isekai Seikatsu 2nd Season Part 2,Re：ゼロから始める異世界生活,ReZERO -Starting Life in Another World- Season 2 Part 2,"After a stern yet compelling speech by Otto Suwen, Subaru Natsuki solemnly swears that he will successfully make it through this timeline and save everyone he can along the way. The first step toward achieving this goal is to help Emilia work through her past; however, that is easier said than done. Feeling as if she has been lied to by everyone around her, it will be difficult for Emilia to trust anyone, even Subaru, her self-proclaimed knight.

Re:Zero kara Hajimeru Isekai Seikatsu 2nd Season Part 2 presents the culmination of Subaru's experiences with the Sanctuary and its people, along with his unwillingness to give up hope on saving them.

[Written by MAL Rewrite]",TV,12.0,Finished Airing,"Jan 6, 2021","Mar 24, 2021","AT-X, Memory-Tech, Hakuhodo DY Music & Pictures, Kadokawa Media House, Kadokawa",Unknown,White Fox,Light novel,"Drama, Fantasy, Suspense","Isekai, Psychological, Time Travel",Unknown,28.0,R - 17+ (violence & profanity),8.471,424371.0,1262.0,221,736092,11363,2021.0
31043,Boku dake ga Inai Machi,僕だけがいない街,ERASED,"When tragedy is about to strike, Satoru Fujinuma finds himself sent back several minutes before the accident occurs. The detached, 29-year-old manga artist has taken advantage of this powerful yet mysterious phenomenon, which he calls ""Revival,"" to save many lives.

However, when he is wrongfully accused of murdering someone close to him, Satoru is sent back to the past once again, but this time to 1988, 18 years in the past. Soon, he realizes that the murder may be connected to the abduction and killing of one of his classmates, the solitary and mysterious Kayo Hinazuki, that took place when he was a child. This is his chance to make things right.

Boku dake ga Inai Machi follows Satoru in his mission to uncover what truly transpired 18 years ago and prevent the death of his classmate while protecting those he cares about in the present.

[Written by MAL Rewrite]",TV,12.0,Finished Airing,"Jan 8, 2016","Mar 25, 2016","Aniplex, Dentsu, Kadokawa Shoten, Fuji TV, DAX Production, Kyoraku Industrial Holdings, Kansai Telecasting, Lawson, Kanetsu Investment, C-one",Aniplex of America,A-1 Pictures,Manga,Mystery,"Psychological, Time Travel",teenager,23.0,R - 17+ (violence & profanity),8.311,232902.0,2262.0,30,1879761,44620,2016.0
34209,Meiji Tokyo Renka,明治東亰恋伽,Unknown,"Mei Ayazuki is just your ordinary, everyday high-school girl. That is until one night, when the moon is full and red, she’s transported through time to the Meiji Period by Charlie, a self-proclaimed magician.

She ends up in a strange, Meiji-era ‘Tokyo’ where the existence of ghosts is accepted. Led by Charlie, she finally arrives at the Rokumeikan. There, waiting for her to arrive, are the historical figures Ougai Mori, Shunsou Hishida, Otojirou Kawakami, Kyouka Izumi, Gorou Fujita, Yakumo Koizumi, and Tousuke Iwasaki.

Whilst interacting with these men, she discovers she is a Tamayori - someone who can see ghosts - a skill that is highly valued in the Meiji Period. Due to these powers, her relationship with the men begins to change… As she gets to know these handsome men in a new era she just can’t get used to, a love begins to grow within her.

Will Mei be able to return to her time? What will become of her love - a love that crosses the boundaries of time and space? 

(Source: Honey's Anime)",TV,12.0,Finished Airing,"Jan 9, 2019","Mar 27, 2019","BS Fuji, MAGES., Tokyo MX, TV Aichi",Funimation,TMS Entertainment,Visual novel,"Romance, Supernatural","Historical, Reverse Harem, Time Travel",young girl,23.0,PG-13 - Teens 13 or older,7.021,18341.0,38142.0,2779,47763,223,2019.0
33012,Island,ISLAND,Island,"On a remote island far from the mainland named Urashima, a man washes ashore, with no recollection of his name or homeland. What he does recall, however, is that he is a time traveler with a mission: to save a certain girl from harm. As nightfall arrives, he meets Rinne Ohara, a girl who sings a tune that reminds him of a specific name—Setsuna—and decides to use it as his own.

Knowing another ""Setsuna"" herself, Rinne takes him to her household as a servant, hoping that he is the same one she remembers. On the other hand, Setsuna continues to learn more about Urashima, desiring to identify his lost past. He comes to know about the island's folklore, its three great families, and the endemic disease that prevents anyone afflicted from stepping out into the daylight. 

As the mysteries of his missing memories and Urashima itself unfold, Setsuna must remember his purpose and fulfill his mission as soon as possible. But, as he witnesses the myriad of troubles plaguing the island, Setsuna begins to question—is his temporal displacement merely an effort to change a single girl's fate?

[Written by MAL Rewrite]",TV,12.0,Finished Airing,"Jul 1, 2018","Sep 16, 2018","MAGES., Crunchyroll, Yomiuri TV Enterprise, Top Marshal, Front Wing",Funimation,feel.,Visual novel,"Drama, Sci-Fi",Time Travel,Unknown,23.0,PG-13 - Teens 13 or older,6.321,50645.0,73732.0,1519,123718,343,2018.0
24135,Nobunaga Concerto,信長協奏曲〈コンツェルト〉,Unknown,"""Who cares about what happened in Japan's past? It has nothing to do with my life.""

With these words, carefree high school student Saburou finds himself unceremoniously thrown back in time to the Sengoku Era, landing directly in front of the legendary general Nobunaga Oda. Nobunaga, on the run from his retainers and wishing to rest due to his frailty, beseeches Saburou to take his place, as the two bear an uncanny resemblance. Although Saburou is still confused by his surroundings, Nobunaga hurriedly provides the boy with the necessary items to prove that he is the bona fide feudal lord and makes a hasty getaway.

Now a stand-in for someone he doesn't even know all that much about—though his modern experiences and knowledge are sure to help him—Saburou begins his unexpected quest to pose as the man who attempted to unite all of Japan.

[Written by MAL Rewrite]",TV,10.0,Finished Airing,"Jul 12, 2014","Sep 20, 2014",Pony Canyon,Unknown,Fuji TV,Manga,"Comedy, Romance","Historical, Time Travel",young boy,22.0,PG-13 - Teens 13 or older,7.551,22015.0,14932.0,2571,55431,282,2014.0
40904,Bokutachi no Remake,ぼくたちのリメイク,Remake Our Life!,"Life is not going well for 28-year-old Kyouya Hashiba. Having left his office job to pursue a career in the video game industry, his internship at a popular game studio abruptly ends, leaving him unemployed and forcing him to move back in with his parents. Additionally, his jealousy toward the success of the ""Platinum Generation""—a group of similarly-aged creators—has caused him to regret his decision to attend a traditional university instead of an arts college. Even though he believes there are no second chances in life, Kyouya is suddenly given one when he wakes up one day and finds himself 10 years in the past.

Instead of choosing business school like he originally had, Kyouya decides to pursue his passions and attends the Oonaka University of Art. There, he meets classmate Eiko Kawasegawa, the woman who had hired him as an intern in the present, alongside his new housemates and future Platinum Generation members: underachieving artist Aki Shino, aspiring singer and actress Nanako Kogure, and naturally-gifted writer Tsurayuki Rokuonji.

With each project they complete together, Kyouya and his friends venture closer to discovering their true potential as creators and remaking their lives into the ideal versions they desire.

[Written by MAL Rewrite]",TV,12.0,Finished Airing,"Jul 3, 2021","Sep 25, 2021","Studio Mausu, bilibili, Bushiroad Music, DMM pictures, Front Wing, Bushiroad Move",Unknown,feel.,Light novel,"Drama, Romance, Slice of Life",Time Travel,Unknown,25.0,PG-13 - Teens 13 or older,7.431,127886.0,19112.0,731,279666,2188,2021.0
32729,Orange,orange（オレンジ）,Orange,"Naho Takamiya's first day of her sophomore year of high school is off to an uneasy start. After waking up late, she receives a strange letter addressed to her. However, the letter is from herself—10 years in the future! At first, Naho is skeptical of the note; yet, after witnessing several events described to take place, she realizes the letter really is from her 26-year-old self.

The note details that Naho's future life is filled with regrets, and she hopes that her younger self can correct the mistakes that were made in the past. The letter also warns her to keep a close eye on the new transfer student, Kakeru Naruse. Naho must be especially careful in making decisions involving him, as Kakeru is not around in the future. With the letter as her guide, Naho now has the power to protect Kakeru before she comes to regret it once more.

[Written by MAL Rewrite]",TV,13.0,Finished Airing,"Jul 4, 2016","Sep 26, 2016","TMS Entertainment, DAX Production, TOHO animation, Lawson, ABC Animation, MediaLink Entertainment Limited","Funimation, Crunchyroll",Telecom Animation Film,Manga,"Drama, Romance, Sci-Fi","Love Polygon, School, Time Travel",young girl,24.0,PG-13 - Teens 13 or older,7.621,361321.0,12892.0,213,745661,6402,2016.0
38691,Dr. Stone,ドクターストーン,Dr. Stone,"After five years of harboring unspoken feelings, high-schooler Taiju Ooki is finally ready to confess his love to Yuzuriha Ogawa. Just when Taiju begins his confession however, a blinding green light strikes the Earth and petrifies mankind around the world—turning every single human into stone.

Several millennia later, Taiju awakens to find the modern world completely nonexistent, as nature has flourished in the years humanity stood still. Among a stone world of statues, Taiju encounters one other living human: his science-loving friend Senkuu, who has been active for a few months. Taiju learns that Senkuu has developed a grand scheme—to launch the complete revival of civilization with science. Taiju's brawn and Senkuu's brains combine to forge a formidable partnership, and they soon uncover a method to revive those petrified.

However, Senkuu's master plan is threatened when his ideologies are challenged by those who awaken. All the while, the reason for mankind's petrification remains unknown.

[Written by MAL Rewrite]",TV,24.0,Finished Airing,"Jul 5, 2019","Dec 13, 2019","TOHO animation, Shueisha, 8PAN","Funimation, Crunchyroll",TMS Entertainment,Manga,"Adventure, Comedy, Sci-Fi","Survival, Time Travel",young boy,24.0,PG-13 - Teens 13 or older,8.291,910653.0,2432.0,56,1497995,24984,2019.0
6974,Seikimatsu Occult Gakuin,世紀末オカルト学院,Occult Academy,"The story revolves around Maya, the daughter of the former Headmaster of Waldstein Academy, and a time traveling agent Fumiaki Uchida. In the year 2012, the world had been invaded by aliens and time travelers were sent back to the year 1999 in order to find and destroy the Nostradamus Key, which Nostradamus Prophecy foretold as what would bring about the apocalypse. The series then turns to the year 1999, where Maya returns to the Academy with the intention of destroying the Academy by superseding her late father's position as the principal. Her plan was interrupted when she meets Fumiaki and learns of the forthcoming destruction. Despite being distrusting towards Fumiaki, they form a pact to look for the Nostradamus Key.

In order to find the Nostradamus Key, time agents were provided with specially created cell phones. When a user finds an object of interest, by thinking of destroying it and taking a photo, and if the resulting image is that of a peaceful world, then the subject is the Nostradamus Key. Conversely, if the subject is not the Nostradamus Key, then the photo displays destruction. By using the phone, Maya and Fumiaki investigates occult occurrences as they occur in the town.

(Source: Wikipedia)",TV,13.0,Finished Airing,"Jul 6, 2010","Sep 28, 2010","Aniplex, Xebec, TV Tokyo Music","NIS America, Inc.",A-1 Pictures,Original,"Comedy, Mystery, Sci-Fi, Supernatural","School, Time Travel",Unknown,24.0,R - 17+ (violence & profanity),7.051,41592.0,37082.0,1813,98692,179,2010.0
39587,Re:Zero kara Hajimeru Isekai Seikatsu 2nd Season,Re：ゼロから始める異世界生活,ReZERO -Starting Life in Another World- Season 2,"A reunion that was supposed to spell the arrival of peaceful times is quickly shattered when Subaru Natsuki and Emilia return to Irlam village. Witnessing the devastation left behind by the calamities known as Sin Archbishops, Subaru sinks into the depths of despair as his ability to redo proves futile.

As the group makes their way to the Sanctuary in search of answers, Subaru has an unexpected encounter with the Witch of Greed—Echidna. Subjected to her untamed rhythm, he is forced to dive into the spirals of the past and future. At the same time, several mysterious threats set their sights on the Sanctuary, heralding a horrific fate for the hapless people trapped within.

Everlasting contracts, past sins, and unrequited love will clash and submerge into a river of blood in the second season of Re:Zero kara Hajimeru Isekai Seikatsu. Pushed to the brink of hopelessness, how long will Subaru's resolve to save his loved ones last?

[Written by MAL Rewrite]",TV,13.0,Finished Airing,"Jul 8, 2020","Sep 30, 2020","AT-X, Memory-Tech, Hakuhodo DY Music & Pictures, Kadokawa Media House, Kadokawa",Unknown,White Fox,Light novel,"Drama, Fantasy, Suspense","Isekai, Psychological, Time Travel",Unknown,27.0,R - 17+ (violence & profanity),8.361,553962.0,1912.0,136,965283,10962,2020.0
11933,Oda Nobuna no Yabou,織田信奈の野望,The Ambition of Oda Nobuna,"High school student Yoshiharu Sagara wakes up and finds himself in the middle of a raging Sengoku period battle. He is saved by the legendary Hideyoshi Toyotomi, but at the cost of the hero's life. With his dying breath, the warrior pleads for Yoshiharu to become a feudal lord in his place. Now that the course of history has been changed, Yoshiharu pledges to keep the timeline from diverging any further. Yet, after rescuing Nobuna Oda—whom he discovers is actually the fabled Nobunaga Oda's female counterpart—Yoshiharu realizes he has been transported to an alternate reality where most of Japan's historical warlords are now cute girls!

To set things right and find a way back home, Yoshiharu agrees to become one of Nobuna's retainers and assist her in a conquest of Japan. As Nobuna initiates her campaign, Yoshiharu discovers that the history he learned from playing the video game ""Nobunaga's Ambition"" allows him to predict future events and turn the tide of war. Using this invaluable gift to aid the Oda clan's beautiful generals, Yoshiharu hopes to help his new lord fulfill her dream and win the hearts of women everywhere.

[Written by MAL Rewrite]",TV,12.0,Finished Airing,"Jul 9, 2012","Sep 24, 2012","Pony Canyon, AT-X, KlockWorx, SoftBank Creative",Sentai Filmworks,"Madhouse, Studio Gokumi",Light novel,"Comedy, Romance","Historical, Time Travel",Unknown,24.0,PG-13 - Teens 13 or older,7.391,139598.0,20552.0,735,278308,1117,2012.0
33341,Time Travel Shoujo: Mari Waka to 8-nin no Kagakusha-tachi,タイムトラベル少女～マリ・ワカと8人の科学者たち～,Time Travel Girl,Time Travel Shoujo is based on a 1983 book titled Jishaku to Denki no Hatsumei Hakken Monogatari by Japanese educator Kiyonobu Itakura. It is part of the Hatsumei Hakken Monogatari Zenshuu series which describes the story of various scientific discoveries and inventions throughout history. The 1983 book focuses on discoveries related to magnetism and electricity.,TV,12.0,Finished Airing,"Jul 9, 2016","Sep 24, 2016","TV Tokyo, Studio Mausu",Funimation,WAO World,Book,"Adventure, Sci-Fi",Time Travel,Unknown,24.0,PG - Children,6.491,5539.0,64612.0,4758,15830,8,2016.0
648,Tsuki wa Higashi ni Hi wa Nishi ni: Operation Sanctuary,月は東に日は西に〜Operation Sanctuary〜,Unknown,"Naoki Kuzumi, a junior in high school, had lost his parents in an accident five years ago, and is living with his aunt, uncle, and cousin Matsuri. He always thought his life was ordinary, besides the fact that he can't remember what happened in his youth. One sunny day as he is taking a nap on a bench, a redheaded girl -- Mikoto -- literally falls on him from the sky. For some reason, she thinks he's her younger brother. Naoki's time period is a temporal shelter for those in the future, when many are suffering from an incurable disease. When she heard her younger brother Yuusuke had been taken to Naoki's time, Mikoto herself had gone back in time.

(Source: ANN)",TV,13.0,Finished Airing,"Jun 30, 2004","Sep 22, 2004",Unknown,Unknown,Radix,Visual novel,"Comedy, Drama, Romance, Sci-Fi","Harem, Time Travel",Unknown,12.0,PG-13 - Teens 13 or older,6.121,2725.0,84692.0,6349,7749,5,2004.0
610,Popotan,ぽぽたん,Unknown,"Beautiful sisters Ai, Mai, Mii, their android maid Mea and slippery pet ferret Unagi make an amazing journey together through time and space without ever leaving their beloved mansion behind! Following the clues of the strange dandelion-like ""Popotan,"" the girls are theoretically seeking the person who has the answers to their most personal questions, but they seem to have more than enough time to take side trips, meet new friends, visit hot springs and occasionally operate the X-mas shop they keep in the house along the way!

Yet, the girls' ultimate destiny holds more than a few surprises of its own, and not every moment is filled with hilarity, as moving through time means having to leave friends behind as well.

(Source: RightStuf)",TV,12.0,Finished Airing,"Mar 18, 2003","Oct 3, 2003",Bandai Visual,"Sentai Filmworks, Geneon Entertainment USA",Shaft,Visual novel,"Comedy, Drama, Supernatural, Ecchi",Time Travel,Unknown,24.0,R+ - Mild Nudity,6.271,9555.0,76622.0,4052,22996,54,2003.0
2281,Jikuu Tantei Genshi-kun,時空探偵ゲンシクン,Flint the Time Detective,"It is the 25th century. The dark lord has 'infected' history with time-devices that could damage history beyond repair. Genshi and his father lived in the prehistorics when they got turned into fossiles. They are discovered and Genshi gets turned back to his original state. With the help of his father, a boy Tony and a girl Sara he has to travel trough time to bring the time-devices back to the land of time so history will be saved.

(Source: ANN)",TV,39.0,Finished Airing,"Oct 1, 1998","Jun 24, 1999","Nihon Ad Systems, Sanrio",Saban Entertainment,Group TAC,Original,"Adventure, Comedy, Fantasy, Mystery, Sci-Fi",Time Travel,young boy,25.0,PG - Children,6.341,4538.0,72862.0,5982,8937,16,1998.0
249,InuYasha,犬夜叉,InuYasha,"Kagome Higurashi's 15th birthday takes a sudden turn when she is forcefully pulled by a demon into the old well of her family's shrine. Brought to the past, when demons were a common sight in feudal Japan, Kagome finds herself persistently hunted by these vile creatures, all yearning for an item she unknowingly carries: the Shikon Jewel, a small sphere holding extraordinary power. 

Amid such a predicament, Kagome encounters a half-demon boy named Inuyasha who mistakes her for Kikyou, a shrine maiden he seems to resent. Because of her resemblance to Kikyou, Inuyasha takes a violent dislike to Kagome. However, after realizing the dire circumstances they are both in, he sets aside his hostility and lends her a hand. 

Unfortunately, during a fight for the Shikon Jewel, the miraculous object ends up shattered into pieces and scattered across the land. Fearing the disastrous consequences of this accident, Kagome and Inuyasha set out on a challenging quest to recover the shards before they fall into the wrong hands.

[Written by MAL Rewrite]
",TV,167.0,Finished Airing,"Oct 16, 2000","Sep 13, 2004","Yomiuri Telecasting, Shogakukan",VIZ Media,Sunrise,Manga,"Action, Adventure, Comedy, Fantasy, Romance, Supernatural","Historical, Mythology, Time Travel",young boy,24.0,PG-13 - Teens 13 or older,7.851,362813.0,7882.0,226,728628,17036,2000.0
48505,Hanyou no Yashahime: Sengoku Otogizoushi - Ni no Shou,半妖の夜叉姫 -戦国御伽草子- 弐の章,Yashahime Princess Half-Demon The Second Act,Second season of Hanyou no Yashahime: Sengoku Otogizoushi.,TV,24.0,Finished Airing,"Oct 2, 2021","Mar 26, 2022",Unknown,VIZ Media,Sunrise,Original,"Adventure, Comedy, Fantasy, Supernatural","Historical, Mythology, Time Travel",Unknown,24.0,PG-13 - Teens 13 or older,7.091,9778.0,35182.0,3283,35409,318,2021.0
41911,Hanyou no Yashahime: Sengoku Otogizoushi,半妖の夜叉姫 -戦国御伽草子-,Yashahime Princess Half-Demon,"Half-demon twins Towa and Setsuna were always together, living happily in Feudal Japan. But their joyous days come to an end when a forest fire separates them and Towa is thrown through a portal to modern-day Japan. There, she is found by Souta Higurashi, who raises her as his daughter after Towa finds herself unable to return to her time.

Ten years later, 14-year-old Towa is a relatively well-adjusted student, despite the fact that she often gets into fights. However, unexpected trouble arrives on her doorstep in the form of three visitors from Feudal Japan; Moroha, a bounty hunter; Setsuna, a demon slayer and Towa's long-lost twin sister; and Mistress Three-Eyes, a demon seeking a mystical object. Working together, the girls defeat their foe, but in the process, Towa discovers to her horror that Setsuna has no memory of her at all. Hanyou no Yashahime: Sengoku Otogizoushi follows the three girls as they endeavor to remedy Setsuna's memory loss, as well as discover the truth about their linked destinies.

[Written by MAL Rewrite]",TV,24.0,Finished Airing,"Oct 3, 2020","Mar 20, 2021","Shogakukan, Yomiuri TV Enterprise",VIZ Media,Sunrise,Original,"Action, Adventure, Comedy, Fantasy, Supernatural","Historical, Mythology, Time Travel",Unknown,24.0,PG-13 - Teens 13 or older,6.711,31657.0,52692.0,1666,110731,607,2020.0
6811,InuYasha: Kanketsu-hen,犬夜叉 完結編,InuYasha The Final Act,"Thwarted again by Naraku, Inuyasha, Kagome Higurashi, and their friends must continue their hunt for the few remaining Shikon Jewel shards, lest they fully form into a corrupted jewel at the hands of Naraku. But Naraku has plans of his own to acquire them, and will destroy anyone and anything standing in his way—even his own underlings.

The persistent, unyielding danger posed by Naraku forces Sango and Miroku to decide what is most important to them—each other or their duty in battle. Meanwhile, Inuyasha must decide whether his heart lies with Kikyou or Kagome, before fate decides for him. Amid the race to find the shards, Inuyasha and his brother Sesshoumaru must also resolve their feud and cooperate for their final confrontation with Naraku, as it is a battle they must win in order to put a stop to his evil and cruelty once and for all.

[Written by MAL Rewrite]",TV,26.0,Finished Airing,"Oct 4, 2009","Mar 30, 2010","Yomiuri Telecasting, Shogakukan",VIZ Media,Sunrise,Manga,"Action, Adventure, Comedy, Fantasy, Romance, Supernatural","Historical, Mythology, Time Travel",young boy,24.0,PG-13 - Teens 13 or older,8.201,132024.0,3272.0,789,259799,2039,2009.0
21845,Ushinawareta Mirai wo Motomete,失われた未来を求めて,In Search of the Lost Future,"Kaori Sasaki—a member of Uchihama Academy's Astronomy Club—confesses to Sou Akiyama, but later that evening, she dies in a tragic road accident. Her friends and fellow club members mourn her death in a local hospital. Yet she shows up to school the following day, and no one senses anything amiss.

The day finishes without any unusual incidents, and the group of friends plans for the upcoming cultural festival. Suddenly, the room is shaken by an unnatural earthquake. Everyone splits up to investigate—except for Nagisa Hanamiya, who stays behind. As everyone leaves, Nagisa notices that the odd relic-like cube that she was toying with starts emitting a strange blue light. Meanwhile, Sou stumbles upon an unconscious, naked girl lying in a pool of water.

Ushinawareta Mirai wo Motomete follows the Astronomy Club's increasingly bizarre adventures—from dealing with ghosts to quelling unrests between student clubs. All the while, they unravel the circumstances behind the sudden appearance of a new transfer student.

[Written by MAL Rewrite]",TV,12.0,Finished Airing,"Oct 4, 2014","Dec 20, 2014","Starchild Records, GANSIS",Funimation,feel.,Visual novel,"Drama, Romance, Sci-Fi","School, Time Travel",Unknown,23.0,PG-13 - Teens 13 or older,6.741,32560.0,50942.0,1964,87823,173,2014.0
6712,Natsu no Arashi! Akinaichuu,夏のあらし!春夏冬中,Summer Storm! Open for Business,"The summer of a man's boyhood memories continue. Still on the cusp between childhood and being a man, he has linked with the ghost of a young woman from the World War 2 era. She, and the ghosts of other young ladies from that time, continue adventures alongside their linked partners, learning more about each other and travelling through time via their supernatural connection. While he struggles to see his crush on her come to fruition, meanwhile his friend—a girl his age, pretending to be a boy—seeks his attention as well.

(Source: ANN)",TV,13.0,Finished Airing,"Oct 5, 2009","Dec 28, 2009","TV Tokyo Music, GANSIS",Unknown,Shaft,Manga,"Comedy, Romance, Supernatural",Time Travel,Unknown,24.0,PG-13 - Teens 13 or older,7.281,7514.0,25522.0,4346,19652,12,2009.0
