ID,Title,Japanese,English,Synopsis,Type,Episodes,Status,Start_Aired,End_Aired,Producers,Licensors,Studios,Source,Genres,Themes,Demographics,Duration_Minutes,Rating,Score,Scored_Users,Ranked,Popularity,Members,Favorites,year
247,Harukanaru Toki no Naka de: Hachiyou Shou,遙かなる時空の中で〜八葉抄〜,Haruka Beyond the Stream of Time – A Tale of the Eight Guardians,"Akane Motomiya and her friends Tenma and Shimon are pulled by a demon into another world, where Akane becomes the Priestess of the Dragon God. The people of this world tell her that she is the only one who can stop the demons from taking over; meanwhile, the demons want to use her power for their own ends. Luckily, Akane has the Hachiyou, eight men with powers of their own who are sworn to protect the Dragon Priestess.

(Source: ANN)",TV,26.0,Finished Airing,"Oct 6, 2004","Mar 30, 2005",Unknown,Bandai Visual USA,Yumeta Company,Visual novel,"Fantasy, Supernatural","Historical, Isekai, Mythology, Reverse Harem, Time Travel",young girl,24.0,PG-13 - Teens 13 or older,7.001,7417.0,39142.0,4031,23237,107,2004.0
37497,Irozuku Sekai no Ashita kara,色づく世界の明日から,Iroduku The World in Colors,"Despite the kaleidoscopic magic ingrained in everyday life, Hitomi Tsukishiro's monochrome world is deprived of emotion and feeling. On a night as black and white as any other, amidst the fireworks spreading across the sky, Hitomi's grandmother Kohaku conjures a spell, for which she has been harnessing the moon's light for 60 years, to send Hitomi back in time to the year 2018 when Kohaku was in high school.

Hitomi's mission seems unclear, but her grandmother assures her that she will know when she gets there. Following a trip through time aboard a train driven by a strange yellow creature, Hitomi finds herself in stoic artist Yuito Aoi's room, and his drawings flood her world with color. What is Hitomi's purpose there, and why do Yuito's drawings return such breathtaking color to her drab world?

[Written by MAL Rewrite]",TV,13.0,Finished Airing,"Oct 6, 2018","Dec 29, 2018","Sotsu, NBCUniversal Entertainment Japan, Infinite",Sentai Filmworks,P.A. Works,Original,"Drama, Romance","Love Polygon, School, Time Travel, Visual Arts",Unknown,24.0,PG-13 - Teens 13 or older,7.521,117948.0,16132.0,676,299500,1994,2018.0
563,DNA²,Ｄ・Ｎ・Ａ² ～何処かで失くしたあいつのアイツ～,DNA²,"Karin, a DNA operator from the future, is on a mission to change the course of History by stopping Junta Momonari from becoming the Mega-Playboy who fathered 100 children and led to the overpopulation of the world. But Junta is no playboy; in fact he is allergic to girls. But when Karin shoots him with the wrong DNA-altering bullet, he starts sporadically becoming the Mega-Playboy capable of charming any woman. Karin must try to restore the situation to normal before the change to Mega-Playboy becomes irreversible. 

(Source: ANN)",TV,12.0,Finished Airing,"Oct 7, 1994","Dec 23, 1994","Starchild Records, Movic, Nippon Television Network","Central Park Media, Discotek Media","Madhouse, Studio Deen",Manga,"Comedy, Romance, Sci-Fi",Time Travel,Unknown,23.0,PG-13 - Teens 13 or older,6.641,19669.0,56222.0,3041,40810,97,1994.0
1022,Generator Gawl,ジェネレイターガウル,Unknown,"Ryo, Gawl and Koji are 3 young boys who travel back into the past with only 1 objective: change history. In their time they discover that their country, Kubere, uses genetically enhanced persons called generators as a military tool. These generators are the cause for the Third War which kills most of the human population. Now Koji, Ryo and Gawl are there to change all the events. 

(Source: ANN) ",TV,12.0,Finished Airing,"Oct 7, 1998","Dec 23, 1998",Unknown,ADV Films,Tatsunoko Production,Original,"Action, Adventure, Comedy, Drama, Sci-Fi",Time Travel,young boy,24.0,PG-13 - Teens 13 or older,6.881,3384.0,44342.0,5940,9099,27,1998.0
29,Zipang,ジパング,Unknown,"Mirai, an improved Kongou-class Aegis guided missile destroyer, is one of the newest and most advanced ships in the entire Japanese Self Defense Force (SDF). Her crew, also one of the newest, is lead by Capt. Umezu Saburo and Executive Officer Kadomatsu Yosuke. While running scheduled training exercises one day, Mirai encounters a fierce storm that throws their navigation systems into temporary disarray. After a few minutes of recovery, the crew is shocked to discover that they've been transported back in time to June 4, 1942—The Battle of Midway, during World War II. Letting history take its course for this battle, they manage to avoid the conflict firsthand and make a vow to remain anonymous, changing history as little as possible. However, when the crew comes across the dying Lt. Commander Kusaka Takumi, XO. Kadomatsu's instincts to save lives takes over, changing the course of history more than he could've imagined.

(Source: ANN)",TV,26.0,Finished Airing,"Oct 8, 2004","Apr 1, 2005","Marvelous, TBS",Geneon Entertainment USA,Studio Deen,Manga,"Action, Drama, Sci-Fi","Adult Cast, Historical, Military, Time Travel",teenager,24.0,PG-13 - Teens 13 or older,7.491,6903.0,17042.0,4301,19964,169,2004.0
41946,Shuumatsu no Harem,終末のハーレム,World's End Harem,"Reito Mizuhara is a medical student at the National Advanced Medical School in Tokyo who contracts a rare, lethal disease called cellular sclerosis. In order to be treated, he is put into cryogenic sleep for five years. Upon awakening, he learns that a year into his slumber, a worldwide pandemic broke out, caused by the novel Male Killer (MK) virus which exclusively afflicts males and has killed all other men on Earth. 

Fortunately, Reito and four other men were spared during their cryosleep and are now immune to the virus. As the only men left in the world, they are thus tasked with mating with as many women as possible to repopulate the planet. However, Reito is committed to his childhood friend and sole love interest, Elisa Tachibana—only to learn that she went missing three years ago. While the other male survivors adapt accordingly to this new world, Reito instead chooses to pursue Elisa, fight never-ending temptation, and investigate this mysterious virus. 

[Written by MAL Rewrite]",TV,11.0,Finished Airing,"Oct 8, 2021","Mar 18, 2022","AT-X, Nippon Columbia, Toranoana, NBCUniversal Entertainment Japan, Office Nobu, Shueisha, Yomiuri TV Enterprise, Global Solutions, Mirai-Kojo",Unknown,"Studio Gokumi, AXsiZ",Manga,"Sci-Fi, Ecchi","Harem, Time Travel",young boy,24.0,R+ - Mild Nudity,6.001,74044.0,90612.0,1003,203229,1871,2021.0
