ID,Title,Japanese,English,Synopsis,Type,Episodes,Status,Start_Aired,End_Aired,Producers,Licensors,Studios,Source,Genres,Themes,Demographics,Duration_Minutes,Rating,Score,Scored_Users,Ranked,Popularity,Members,Favorites,year
37490,"Gyakuten Saiban: Sono ""Shinjitsu"", Igi Ari! Season 2",逆転裁判 ～その「真実」、異議あり！～ Season 2,Ace Attorney Season 2,"Defense attorney Ryuuichi Naruhodou is still hard at work defending the falsely accused with his knack for last-minute turnabouts. With his trusty assistant and medium-in-training Mayoi Ayasato in tow, Ryuuichi's fame as a champion for the innocent steadily grows. But this newfound success attracts the attention of the coffee-loving, masked Godot⁠—a mysterious rookie prosecutor who bears an inexplicable grudge against Ryuuichi.

With the help of their allies, Ryuuichi and Mayoi take this new challenger head-on and search for the reason behind his appearance. But before long, the first two cases from the career of Mayoi's late sister Chihiro Ayasato become critical to solving a fantastical murder mystery, continuing the bloody saga of the tumultuous Ayasato clan. Will Ryuuichi once again be able to overcome the odds and find the truths hidden within the web of lies?

[Written by MAL Rewrite]",TV,23.0,Finished Airing,"Oct 6, 2018","Mar 30, 2019","Aniplex, Capcom",Funimation,CloverWorks,Game,"Comedy, Drama, Mystery","Detective, Workplace",Unknown,24.0,PG-13 - Teens 13 or older,7.161,14512.0,31652.0,3262,35742,118,2018.0
40423,Taeko no Nichijou,耐え子の日常,Unknown,"A short anime about Taeko Shinbou who is an office worker that is patient with everything and greets everything that comes her way with cheer. An announcement was made that a ""regular person"" from Kantou will voice Taeko rather than an industry professional.

(Source: ANN)",TV,26.0,Finished Airing,"Oct 6, 2019","Mar 29, 2020","Tokyo MX, Asahi Broadcasting",Unknown,DLE,Manga,Slice of Life,Workplace,Unknown,5.0,G - All Ages,,,153672.0,14014,495,1,2019.0
22147,Amagi Brilliant Park,甘城ブリリアントパーク,Amagi Brilliant Park,"Seiya Kanie, a smart and extremely narcissistic high school student, believes that the beautiful but reserved Isuzu Sento has invited him on a date at an amusement park called Amagi Brilliant Park. Much to his chagrin, not only is the location a run-down facility, the supposed date is merely a recruitment tour where Sento and Princess Latifa Fleuranza, the owner of the theme park, ask him to become the park's new manager. Their cause for desperation? As stipulated in a land-use contract, Amagi has less than three months to meet a quota of 500,000 guests, or the park will be closed for good and the land redeveloped by a greedy real-estate company.

Seiya is won over by the revelation that Amagi is no ordinary amusement park; many of its employees are Maple Landers—mysterious magical beings who live in the human world and are nourished by the energy created by people having fun. Entrusted with the hopes and dreams of this far-off enchanted land, Seiya must now use his many skills to bring Amagi back on its feet, or watch it crumble before his eyes.

[Written by MAL Rewrite]",TV,13.0,Finished Airing,"Oct 7, 2014","Dec 26, 2014","Avex Entertainment, TBS, DAX Production, flying DOG, Mobcast",Sentai Filmworks,Kyoto Animation,Light novel,"Comedy, Drama, Fantasy",Workplace,Unknown,24.0,PG-13 - Teens 13 or older,7.471,329625.0,17702.0,295,604859,2503,2014.0
39590,Africa no Salaryman (TV),アフリカのサラリーマン (TV),Africa Salaryman,"Africa no Salaryman is a slapstick workplace comedy that follows the adventures of kind Lion, jaded Lizard, and perverted Toucan, as they trudge through office life while also becoming caught up in antics no regular office worker should. 

Of course, most of these are the fault of Toucan, whose selfish actions and lack of filter still haven't gotten him fired. It's up to Lizard and Lion to keep themselves out of trouble and hang on to their jobs at the office. But trouble is never too far away from these savannah-treading folk.

[Written by MAL Rewrite]",TV,12.0,Finished Airing,"Oct 7, 2019","Dec 23, 2019","Pony Canyon, Movic, Bandai Namco Live Creative, Ai Addiction, Sammy, Kadokawa Media House, Kadokawa, pH Studio",Funimation,HOTZIPANG,Web manga,"Comedy, Slice of Life","Anthropomorphic, Workplace",Unknown,23.0,PG-13 - Teens 13 or older,6.561,8609.0,60342.0,3938,24437,65,2019.0
34618,Blend S,ブレンド・S,BLEND-S,"Wishing to be independent, 16-year-old Maika Sakuranomiya is desperate to nail down a part-time job so that she can afford to study abroad. Unfortunately, her applications are constantly rejected due to the menacing look she unintentionally makes whenever she smiles, despite her otherwise cheerful disposition.

After yet another failed interview, she chances upon Café Stile, a coffee shop where the servers interact with the customers while roleplaying distinctive characteristics. The Italian store manager, Dino, becomes infatuated with Maika's cuteness at first sight, and offers her a job as a waitress with a sadistic nature. Coupled with her inherent clumsiness, she successfully manages to serve a pair of masochistic customers in accordance with her new, ruthless persona. Alongside Kaho Hinata as the tsundere and Mafuyu Hoshikawa as the younger sister, Maika decides to make the most out of her unique quirk and cements her position in the cafe with merciless cruelty!

[Written by MAL Rewrite]",TV,12.0,Finished Airing,"Oct 8, 2017","Dec 24, 2017","Aniplex, Houbunsha, Kansai Telecasting, Lawson, Contents Seed, Kinoshita Group Holdings, Drecom",Aniplex of America,A-1 Pictures,4-koma manga,Comedy,Workplace,Unknown,23.0,PG-13 - Teens 13 or older,7.291,341558.0,25242.0,294,605799,2884,2017.0
36317,Gaikotsu Shotenin Honda-san,ガイコツ書店員本田さん,Skull-face Bookseller Honda-san,"Honda is a skeleton, but more importantly, he is a bookseller. And he'll tell you from firsthand experience that the job of a bookstore employee is more challenging than it may seem to the average customer.

Alongside his equally eccentric coworkers, Honda constantly deals with the stressful requirements of the bookselling industry. From the drama of receiving new titles without their bonus material to the struggle of providing quality service to customers who speak a different language, the work of a skeleton bookseller never ends.

Nevertheless, despite the hardships he faces, Honda thoroughly enjoys his job and strives to bring the best book selections and service to his customers.

[Written by MAL Rewrite]",TV,12.0,Finished Airing,"Oct 8, 2018","Dec 24, 2018","Lantis, Half H.P Studio, Encourage Films, Radio Osaka, Kadokawa, Muse Communication, Bandai Namco Arts",Discotek Media,DLE,Web manga,"Comedy, Slice of Life","Otaku Culture, Workplace",Unknown,11.0,PG-13 - Teens 13 or older,7.291,44493.0,25312.0,1723,106364,361,2018.0
25835,Shirobako,SHIROBAKO,Shirobako,"It all started in Kaminoyama High School, when five best friends—Aoi Miyamori, Ema Yasuhara, Midori Imai, Shizuka Sakaki, and Misa Toudou—discovered their collective love for all things anime and formed the animation club. After making their first amateur anime together and showcasing it at the culture festival, the group vows to pursue careers in the industry, aiming to one day work together and create their own mainstream show.

Two and a half years later, Aoi and Ema have managed to land jobs at the illustrious Musashino Animation production company. The others, however, are finding it difficult to get their dream jobs. Shizuka is feeling the weight of not being recognized as a capable voice actor, Misa has a secure yet unsatisfying career designing 3D models for a car company, and Midori is a university student intent on pursuing her dream as a story writer. These five girls will learn that the path to success is one with many diversions, but dreams can still be achieved through perseverance and a touch of eccentric creativity.

[Written by MAL Rewrite]",TV,24.0,Finished Airing,"Oct 9, 2014","Mar 26, 2015","Sotsu, Movic, Warner Bros. Japan, KlockWorx, Showgate, Infinite, Imagine",Sentai Filmworks,P.A. Works,Original,"Comedy, Drama","Adult Cast, Otaku Culture, Workplace",Unknown,24.0,PG-13 - Teens 13 or older,8.291,134533.0,2492.0,459,415277,6139,2014.0
